,uuid,user_name,text_clean,mentions_name
280408,1044637075363864686, peepee ,i hope you re sterile fr,['Subutai']
280409,1044637082049597460, peepee ,weirdo,
280410,1044637091620986950, xDeeds ,,
280411,1044637102236778516, mik ,,
280412,1044637108544999596, Alatar ,Depends on the child,['Subutai']
280413,1044637201746636800, Pusherman ,,
280414,1044637333019971674, s76.Petunia , peepee hey bbg lipbite ,['peepee']
280415,1044637540403130428, Pusherman ,Mik and deeds weren t here when I posted the first time. Gotta make sure you re providing tailored posts to your audience thinkthink ,['Augustus Octavian Caesar']
280416,1044637771496693820, Pusherman ,,
280417,1044637851687604236, xDeeds ,I d go,
280418,1044637926501384293, xDeeds ,Of the tiny monkeys ,
280419,1044637946864742520, xDeeds ,Shit flinging,
280420,1044637993966772336, xDeeds ,Nah they reach my knee,
280421,1044638059716681891, xDeeds ,Yeah he got a stripy shirt,
280422,1044638065588719707, xDeeds ,Harmless,
280423,1044638071909519470, Subutai , ,['peepee']
280424,1044638248158367804, s76.Petunia , ,
280425,1044638542984396892, Rowow ,ima make this happen on my floating island,['Pusherman']
280426,1044638547489075201, Subutai ,Buncha rainbow supporting weed smoking casual drinkers,
280427,1044638654607413268, Subutai ,Bro Ik u think ur smart,
280428,1044638704523821107, Subutai ,Sorry to break it to you but u ain t,
280429,1044638739642712105, Rowow ,teach have you studied yet,
280430,1044638764540108840, Subutai ,You just got a buncha brain washed yes men here,
280431,1044638785717141545, Subutai ,Who are inflating ur ego,
280432,1044638806445391973, Pusherman ,Subutai you better chill out before peepee DMs you a picture of Muhammad,
280433,1044638928919068692, Subutai ,Lol says u ur a bati boi,
280434,1044638952218443798, Rowow ,yall ganging up on subatai,
280435,1044639010573783172, Rowow ,scared of his powerfull religion,
280436,1044639084368363540, Rowow ,cause hes a sand n,
280437,1044639159173779466, Subutai ,Karen femanists,
280438,1044639168925540412, Subutai ,Calm down,
280439,1044639234637697064, xDeeds ,I m pretty neutral tbh,
280440,1044639325901574214, Subutai ,U man are the furthest thing from neutral,
280441,1044639362807246858, xDeeds ,Your religion can be the flying spaghetti monster and it wouldn t change my life the slightest,
280442,1044639578411253770, Rowow ,teach get off discord,
280443,1044639592822870026, Rowow ,ur being the new ryan,
280444,1044639630152179732, Rowow ,I need help on my farm,
280445,1044639649135607919, PP ,Why are porta potties always so nasty,
280446,1044639661991149638, PP ,I just gotta shit man,
280447,1044639671109550090, Subutai ,Stop snorting crack u druggies,
280448,1044639725874577459, Rowow ,stop asking me if we can go hunt snakes and instead actually plan a time to do it,
280449,1044639742660186214, ParoleBot ,Done. That felt good.,
280450,1044639761580687381, Rowow ,I dont like to larp and pretend shit,
280451,1044639817016819772, Rowow ,I do too,
280452,1044639835157188659, Rowow ,nows the best time to hunt snakes,
280453,1044639848482488320, PP ,Why,
280454,1044639882825441280, PP ,It s cold don t snakes hibernate or some shit,
280455,1044639884880650260, Rowow ,its not too cold and too warm so the snakes like to chill on the roads for warmth,
280456,1044639917034197082, PP ,Aren t you in Florida,
280457,1044639921811501166, Subutai ,You told me u were a heavy drinker on the past Augustus Octavian Caesar,['Augustus Octavian Caesar']
280458,1044639922545504256, Rowow ,you can drive around in rural areas and fine snakes on the road,
280459,1044639965050585180, Rowow ,ok so when are u flying to florida,
280460,1044639984713486406, Subutai ,You bloated peace of lard,
280461,1044640083308982352, PP , PepeDed ,
280462,1044640154322743387, Subutai ,Do u live In London,['Augustus Octavian Caesar']
280463,1044640170701508689, Rowow ,thats never gonna happen,
280464,1044640178955890779, PP ,Anyone who actually has intention and capability of hurting someone don t make threats,
280465,1044640184387506187, Subutai ,Back up ur words,
280466,1044640192998416384, PP ,They just do it,
280467,1044640261642399825, PP ,This is sad,
280468,1044640301362454528, peepee , kekw ,
280469,1044640334564564994, BonezMC , ,
280470,1044640344215662683, peepee ,e fighting is more entertaining than e dating fr,
280471,1044640349303345233, EskamoLoki ,whats pig butchering,
280472,1044640360036581446, EskamoLoki ,I want it,
280473,1044640376234975282, Subutai ,Lol why u getting so mad if you want to fight and ur in London dm me,
280474,1044640378025947157, PP ,I m a tough guy no I m a tough guy no you re not I m a tough guy,
280475,1044640422879842375, peepee ,you two should kiss,['Subutai']
280476,1044640484917776434, Thatskindawild ,Someone make me breakfast,
280477,1044640530249822260, BonezMC ,Bro is from london he will show up with 10 people and stab you,
280478,1044640560528490637, tonie ,how would you like your egg,
280479,1044640585417510982, Subutai ,Ok then prove it don t just be some words,
280480,1044640651091923004, peepee ,no you hang up first peepoblush no you hang up ,['P P ']
280481,1044640729131122749, Subutai ,Ur in turkeyyy lOoooool ,
280482,1044640732620791918, peepee ,isn t fighting haram bro,
280483,1044640765780963419, peepee ,u better watch or allah will come smite ur fruity ass,
280484,1044640783195717714, Bordeaux Papa Quant Doctah ,I dropped a door on my toe,
280485,1044640783569014845, EskamoLoki , i never wanna see you and i never wanna meet you again ,
280486,1044640791999553616, Bordeaux Papa Quant Doctah ,and fucked it up,
280487,1044640806851584131, Bordeaux Papa Quant Doctah ,bled everywhere,
280488,1044640824400556042, PP ,Hallahl,
280489,1044640838950592522, EskamoLoki ,id bite off the nail imo,['Bordeaux Papa Quant Doctah']
280490,1044640843098771466, Bordeaux Papa Quant Doctah ,0 10,
280491,1044640900200022167, Subutai ,Turky is mostly a Muslim country,
280492,1044640918898221187, Subutai ,And u hate Muslims,
280493,1044640944730947605, PP ,Shoulda been wearing them there steel toed boots my boy,['Bordeaux Papa Quant Doctah']
280494,1044640954927300608, Bordeaux Papa Quant Doctah ,I washed it used alcohol to clean and then wrapped it in gauze,
280495,1044640982420959343, xDeeds ,I just found this new workout routine that an influencer recommended I m not sure if I m doing it right. Can you guys check ,
280496,1044640991031873596, xDeeds , ,
280497,1044641037513129994, Bordeaux Papa Quant Doctah ,if I was wearing literally any shoes it would ve helped lol,['P P ']
280498,1044641041157984287, Subutai ,Ahh ur people would kick u out so quick,
280499,1044641076637605988, PP ,Training for when your step sis gets stuck ,['xDeeds']
280500,1044641088343912500, BonezMC ,Never skip hang yourself day,['xDeeds']
280501,1044641099236524083, Bordeaux Papa Quant Doctah ,my shower door came off,
280502,1044641126658867301, Bordeaux Papa Quant Doctah ,and i was trying to put it back on,
280503,1044641135567573022, Bordeaux Papa Quant Doctah ,it slipped,
280504,1044641198410842132, PP ,London is a shithole,
280505,1044641214017847296, Subutai ,Ur defo only acting up and saying this typa stuff on discord,
280506,1044641236746784868, Subutai ,Cus u can t irl,
280507,1044641249791066202, Bordeaux Papa Quant Doctah ,like a 1 2 inch of skin from my big toe got sheared off,
280508,1044641277045649468, Bordeaux Papa Quant Doctah ,and I bled EVERYWHERE,
280509,1044641289196552262, PP ,Yeah you know typa,
280510,1044641303415246879, xDeeds ,JESUS FUCK,['Bordeaux Papa Quant Doctah']
280511,1044641323266883594, Bordeaux Papa Quant Doctah ,bleeding stopped after like 15 minutes though,
280512,1044641340346073149, peepee ,oof that s awful,['Bordeaux Papa Quant Doctah']
280513,1044641342833311744, PP ,I m finna typa buncha shit mane,
280514,1044641383576768542, Subutai ,Accusations of what,
280515,1044641388840624270, Bordeaux Papa Quant Doctah ,yeah 0 10,['peepee']
280516,1044641391579516938, xDeeds ,Hey atleast the door didn t explode,
280517,1044641394632962048, BonezMC ,Why don t you exchange instagram and stop acting tough on discord,
280518,1044641395530539119, mushu ,What does dakek mean ,['elrizzabeth']
280519,1044641405110341723, PP ,Headass,
280520,1044641418083307540, Bordeaux Papa Quant Doctah ,first covid and now my toe s fucked up,
280521,1044641436970274926, Rowow ,toes fingers are great at healing slap on a bandage or wrap in ducktape and youll be back to normal in a month,['Bordeaux Papa Quant Doctah']
280522,1044641456226324551, Subutai ,Crack ,
280523,1044641466196172910, PP ,A MONTH,
280524,1044641479647305748, Calibre39 , KICK OFF IN 10 MINUTES MEXICO VS. POLAND STREAMING NOW IN WallStreetBets voice ,
280525,1044641529836343357, PP ,I d have that mug healed lickity split yerrr,
280526,1044641539177070662, peepee ,now this mf talking about ass cracks eyesHyper ,['Subutai']
280527,1044641593065476176, Subutai ,Yeah we got druggies here peeps even said it them selves,
280528,1044641644206641233, PP ,You lalalalalalalove is my drug,
280529,1044641684048322750, Pusherman ,Taking a fat shit rn,
280530,1044641747432648754, Subutai ,Many people here are addicted to drugs,
280531,1044641783746936895, PP , ,
280532,1044641812368855161, Bordeaux Papa Quant Doctah ,i cleaned it with alcohol and neosporin,['Rowow']
280533,1044641838247706634, Bordeaux Papa Quant Doctah ,wrapped with sterile gauze,
280534,1044641860028743690, Subutai ,If u say so,['Augustus Octavian Caesar']
280535,1044641881881063495, Rowow ,have fun with a infection,['Bordeaux Papa Quant Doctah']
280536,1044641909710278726, Subutai ,You ve exposed nothing thus far,
280537,1044642013951299704, Bordeaux Papa Quant Doctah ,it s sterile gauze,['Rowow']
280538,1044642028190961666, Bordeaux Papa Quant Doctah ,like from a packet,
280539,1044642102589530182, master oogway ,When is Ukraine vs Russia match weirdkekw ,
280540,1044642126404780032, Subutai ,Do u have Muslims in ur own family,
280541,1044642169006338078, Subutai ,Seeming as tho ur in turky,
280542,1044642194214113340, Subutai ,And u hate Muslims,
280543,1044642256180744274, PP , ,
280544,1044642290091708509, Rowow ,doesnt matter unless ur in a hospital sterile enviorment shits gonna get in and rapidly overgrow if you left it as is and air dried your good bacteria microbiome wouldve protected you now you have a wet open sore thats gonna take much longer to heal,['Bordeaux Papa Quant Doctah']
280545,1044642309523902514, Subutai ,What did ur family do to you,
280546,1044642393070260224, PP ,They didn t teach the importance of giving all glory to god,['Subutai']
280547,1044642437517279323, PP ,Alhamdulilah,
280548,1044642450997780491, Subutai ,I mean ur said u were drinking heavy before u hate all religions yet u have Muslims in ur family,
280549,1044642496661159996, Bordeaux Papa Quant Doctah ,hospitals are not as sterile as you think they are lol,['Rowow']
280550,1044642528005206126, Subutai ,Why du u hate ur own family,
280551,1044642587748876410, Bordeaux Papa Quant Doctah ,with proper handwashing and cleaning of the affected surface it s about as sterile,
280552,1044642631663231008, Subutai , Ur too funny Augustus,
280553,1044642702643437578, master oogway ,teach knight,
280554,1044642718695039008, PP ,Soap water and air is all you need to heal,
280555,1044642732108419252, Swolsby ,Not even,['master oogway']
280556,1044642771203543080, Subutai ,Now u don t hate after saying u hate all religions,['Augustus Octavian Caesar']
280557,1044642785183158273, Rowow ,I stopped using bandages after I realized I always got puss with one never had a issue with air drying and always get terrible contaminated cuts unless your hospital is a farm I doubt its less clean than getting cuts in rabbit chicken pig feces,['Bordeaux Papa Quant Doctah']
280558,1044642813784105093, xDeeds ,Just had a huge cut on my knee I just rinced it with hexaklorin and left it in open air til it got a layer of dried blood. Didn t get infected,
280559,1044642817802240030, BonezMC ,,
280560,1044642869601894471, Swolsby ,Knight is in his own league i miss that fucker,
280561,1044642895078117476, Subutai ,But you ve got Muslims in ur family,
280562,1044642944898048040, Bordeaux Papa Quant Doctah ,I have literally never had a wound infected,['Rowow']
280563,1044642980994240532, Subutai ,So u hate the Muslim members of ur family,
280564,1044642987176628334, Swolsby ,Teach is teach,
280565,1044642987642196019, xDeeds ,isn t he in s o ,['Swolsby']
280566,1044643036749103124, Subutai ,Or the part of them they call Muslims,
280567,1044643064473460798, xDeeds ,teach is AOC,
280568,1044643068617429083, Rowow ,fun fact saliva is naturally antiseptic and also helps with healing cuts if you dont wanna lick your wounds like a animal spitting on it helps actual scientific studies prove this. Rowow always right,
280569,1044643074409766994, BonezMC ,It s funny how we have 3 different convos in this chat,
280570,1044643089702207528, Swolsby ,Naw i mean schizo knight,['xDeeds']
280571,1044643132307939368, xDeeds ,Thought they were the same LOL ,['Swolsby']
280572,1044643165270966332, Swolsby ,Naw,
280573,1044643182148862112, Subutai ,Did u tell ur family ur gay Augustus Octavian Caesar,['Augustus Octavian Caesar']
280574,1044643329977098250, xDeeds ,27 noooo ,
280575,1044643347287003206, brokecowboy ,Morning babe,['elrizzabeth']
280576,1044643358494171226, Subutai ,Don t get pressed,
280577,1044643423468130364, brokecowboy ,We re the same age 30,
280578,1044643450584318043, Subutai ,Am 22,
280579,1044643497162063912, xDeeds ,Just before meta launch smart,['Stupidisco']
280580,1044643603290521731, Rowow ,fun fact saliva is naturally antiseptic and also helps with healing cuts if you dont wanna lick your wounds like a animal spitting on it helps. actual scientific studies prove this. Rowow always right,
280581,1044643617605693500, Rowow ,shit internet,
280582,1044643655715127347, Subutai ,No way my guy probs gets roasted by his Turkish fam,
280583,1044643706503962757, Subutai ,For being a religion hater,
280584,1044643810489143416, BonezMC ,Bruh most turks arent that religious,
280585,1044643881054109776, Subutai ,All the ones Ik are,['BonezMC']
280586,1044643894354264226, brokecowboy ,Most Turks are godless,
280587,1044644033349288077, BonezMC ,The most I know smoke drink and fuck on weekends,['Subutai']
280588,1044644074726109194, Subutai ,99 of turkey is Muslim no way,
280589,1044644094200266792, BonezMC ,We call them hobby moslems,
280590,1044644128987820073, jforge ,No way he s got controlling share. Maybe stepping down from meta and going back to Facebook,['Stupidisco']
280591,1044644253478965318, Subutai ,Ik some who live that kinda life but they aren t too open about it cuz of shame,['BonezMC']
280592,1044644442402988122, Subutai ,Why u lyin,['Augustus Octavian Caesar']
280593,1044644577467965490, Subutai ,Dud u are a self hating turk,
280594,1044644761656643626, brokecowboy ,Anime girls pedofillia,
280595,1044644799501848698, Subutai ,I m mixed raced,
280596,1044644943492292638, xDeeds ,Fuckboy died ,
280597,1044644964925186153, xDeeds ,No idea sry,
280598,1044644995560390727, Subutai ,It s not a race thing it s just surprising the way u think given the country u grew up in is Turkey,
280599,1044645049356529724, mik ,half an hour ago,
280600,1044645071674408990, Subutai ,It s kinda snakey tbh,
280601,1044645124019322930, Calibre39 ,damn cant even pressf to fuckboy because he ded,
280602,1044645184463458385, ParoleBot ,Pong.,
280603,1044645200011739186, Swolsby , jerry ,['Calibre39']
280604,1044645238809034752, ParoleBot , pepehandsup Fuckboy,['Fuckboy']
280605,1044645247403180052, Calibre39 ,Im not a muslim,
280606,1044645270366986241, ParoleBot , Calibre39 is 8 sus feelsneutralman ,['Calibre39']
280607,1044645306077290546, Subutai ,There s mosques everywhere here in London,
280608,1044645306983252062, Calibre39 ,see,
280609,1044645320556040232, ParoleBot , Swolsby Conceited ,['Swolsby']
280610,1044645346204201080, xDeeds ,o no,
280611,1044645365070188595, xDeeds , conceited ,
280612,1044645375019065425, xDeeds ,tf,
280613,1044645395827015780, BonezMC ,Isnt london like 60 arabs and 40 indians ,
280614,1044645493088718988, xDeeds ,,
280615,1044645501745774613, Subutai ,Why u so agi,
280616,1044645552769478666, Calibre39 ,and yuppy whitekids that dress like homeless and poor black kids that stab you,['BonezMC']
280617,1044645743857770526, Subutai ,Name the hyrpocricy,
280618,1044646008157646858, xDeeds , ,
280619,1044646375478014033, BonezMC ,Can we rant about americans next,
280620,1044646410609496154, dizzy ,gm lads ,
280621,1044646437029421146, BonezMC ,Gm,
280622,1044646442989535294, mushu ,Gm,
280623,1044646493174382723, peepee ,i m good at this,['BonezMC']
280624,1044646509490225212, ,Or bri ish people,['BonezMC']
280625,1044646547159265321, xDeeds ,gm,
280626,1044646550233677895, dizzy ,FOMC minute tomorrow. should be fun.,
280627,1044646579589619792, mushu , ,['BonezMC']
280628,1044646757369380987, peepee ,,['mushu']
280629,1044646811383636028, BonezMC ,,
280630,1044646817972891779, peepee ,embrace thicc pepe,
280631,1044646836432015421, peepee ,reject religion,
280632,1044646858888315010, mushu , ,['peepee']
280633,1044646876345012325, dizzy ,God fearing women in America show their hair and eat bacon.,
280634,1044647047325818941, mushu ,Why do we need to fear god ,['dizzy']
280635,1044647252423086130, mushu , put the fear of god in.... Sounds kind of silly,
280636,1044647265148600341, xDeeds ,Doesn t matter,
280637,1044647283830042736, xDeeds ,worst case it goes to shit,
280638,1044647288196321431, dizzy ,you don t. because you re already perfect Mushu.,['mushu']
280639,1044647468568170526, dizzy ,the rest of us heathens.. different story.,
280640,1044647597945671742, mushu ,I mean in general. Why would god want us to fear him her,['dizzy']
280641,1044647745073459293, xDeeds ,He wouldn t humans are just so narcissistic,
280642,1044647777164087420, ScottieRippen ,hi dizzy,['dizzy']
280643,1044648029275312188, PP ,Taking a mean shit rn AMA,
280644,1044648050355880006, dizzy ,anything that can travel to other dimensions to me is pretty terrifying. idk.,['mushu']
280645,1044648106622468096, Augustus Octavian Caesar ,bruh,
280646,1044648155968454786, master oogway ,he does peeposcreech peeposcreech peeposcreech peeposcreech ,
280647,1044648167880265779, dizzy , ,['ScottieRippen']
280648,1044648179548835850, ScottieRippen ,why would god have to travel anywhere,['dizzy']
280649,1044648215519178803, Augustus Octavian Caesar , kekw ,
280650,1044648267541135420, xDeeds ,He d commute like the rest of us,
280651,1044648327091859578, dizzy ,where does he hang out outside of places humans can reach then ,['ScottieRippen']
280652,1044648331751735367, ScottieRippen ,tsa would finger him for explosives,
280653,1044648343378350262, mushu ,That doesn t answer my question though. Emphasis on want . How we feel about god is irrelevant to how god wants us to feel about him,['dizzy']
280654,1044648374680440852, Subutai ,You ve lost the plot,['Augustus Octavian Caesar']
280655,1044648402593529907, Augustus Octavian Caesar , ,
280656,1044648484835438652, Subutai ,Ur living in lala land,
280657,1044648520315064390, mushu ,People tried to control other people with fear i suppose. So yeah narcissism,['xDeeds']
280658,1044648524735860826, xDeeds ,Now that s funny,
280659,1044648664930451487, Subutai ,Sounds as if you think ur in some Sci fi world in ur head Augustus,
280660,1044648669447725157, xDeeds ,Just the fact that you think some all mighty dude would want to watch every little stupid thing you do is pretty narcissistic hehe,['mushu']
280661,1044648727589179462, dizzy ,1. does God want anything 2. is there a God to want anything. 3. if yes there s an objective truth to it. 4. if there is a God. and if he wants anything. I m sure it s justified. dusts off hands ,['mushu']
280662,1044648735608688640, ScottieRippen ,the universe is not locally real so there isn t a god until it is observed,['dizzy']
280663,1044648853628010606, mushu ,Yeah if god was that powerful he d probably wouldn t give a shit about us kekw ,['xDeeds']
280664,1044648884309348434, Subutai ,do u have autism There s nothing wrong with saying u do.,
280665,1044648887815786607, xDeeds ,Eeexactly hahah,['mushu']
280666,1044648904785920031, Pusherman , ,
280667,1044648922745933914, ScottieRippen ,capitalizing G in god will not absolve you of your sins,
280668,1044648965141962762, Alatar ,Main is so interesting today,
280669,1044648965548806194, Pusherman ,BUG BURGERS,
280670,1044649054614847580, Subutai ,What are u on about,
280671,1044649102354432070, ScottieRippen ,in the United States we have doors with sensors that open automatically,
280672,1044649136353456208, Subutai ,You went from cyborgs to automatic doors,
280673,1044649138832277595, Pusherman ,,
280674,1044649182218174554, Augustus Octavian Caesar ,we went from caves to automatic doors,
280675,1044649192502599731, mushu ,So why through fear of him That s such a human way to interpret this,['dizzy']
280676,1044649195577020517, ScottieRippen ,he s mid eastern they do this kind of shit,['Subutai']
280677,1044649226354839595, Augustus Octavian Caesar , pepecheers ,
280678,1044649324648345660, ScottieRippen ,mostly rant complain about other cultures god and miscellaneous,
280679,1044649334232330312, Augustus Octavian Caesar ,subutai thnks they are scifi,
280680,1044649345984774184, Augustus Octavian Caesar ,lala land,
280681,1044649370735349850, Augustus Octavian Caesar ,progress is not real for subutai,
280682,1044649418395234444, Augustus Octavian Caesar ,we evolved with automatic doors,
280683,1044649450439708702, Augustus Octavian Caesar ,what is tech and progression right,
280684,1044649460032077834, Augustus Octavian Caesar ,subutai,
280685,1044649475853000765, Subutai ,Genuinely do u have autism,
280686,1044649485625737226, Augustus Octavian Caesar ,not real,
280687,1044649503493476472, Augustus Octavian Caesar , kekw ,
280688,1044649627682615356, Augustus Octavian Caesar ,i wont pee in that,
280689,1044649630161440838, Augustus Octavian Caesar ,tbh,
280690,1044649649107124274, Augustus Octavian Caesar ,would be creeped out,
280691,1044649665364238456, Augustus Octavian Caesar ,mofo might sniff,
280692,1044649987449036860, ScottieRippen , ,
280693,1044650045154275428, Augustus Octavian Caesar ,someone woke with a dick in his ass today,
280694,1044650053320593509, Subutai ,Augustus listen if I said anything rude to you I take it back. Ur a star,
280695,1044650058437636136, Augustus Octavian Caesar ,how are you scottie,
280696,1044650122937639022, Augustus Octavian Caesar ,are you feeling anything back there scottie,
280697,1044650150066405407, Augustus Octavian Caesar , pepecheers ,
280698,1044650404031512677, Subutai ,Go on champ u are the real Ceaser,
280699,1044650470330859530, Subutai ,Don t let anyone tell u otherwise,
280700,1044650489817604156, Augustus Octavian Caesar , kekw ,
280701,1044650505625931876, leash ,gm teach,
280702,1044650523581743176, Augustus Octavian Caesar ,gm honey,
280703,1044650547589939260, leash , weirdkekw ,
280704,1044650599670632510, Augustus Octavian Caesar , pepejuice ,
280705,1044650629513085038, ScottieRippen ,new pfp leash ,['leash']
280706,1044650646181257276, Swolsby ,Fuckboi ded,
280707,1044650661259771925, leash ,Yes Scottie.,['ScottieRippen']
280708,1044650729169747998, ScottieRippen ,very good,
280709,1044650752825638922, leash ,Going to give my stylist a heart attack and tell her I wanna go brunette again,
280710,1044650824950890516, Augustus Octavian Caesar ,she wont care,
280711,1044650834706845878, Augustus Octavian Caesar ,as long as you pay,
280712,1044650843414220860, bubu ,Why,['leash']
280713,1044650843682639962, ScottieRippen ,she likes money,
280714,1044650873604821083, Augustus Octavian Caesar ,you might farm some fake reactions,
280715,1044650876284964934, Augustus Octavian Caesar ,tho,
280716,1044650917649199185, ScottieRippen ,indeed teach indeed,
280717,1044651101741404160, Swolsby ,Go red leash,
280718,1044651124885573834, Swolsby ,Stand out be red,
280719,1044651128270372894, Augustus Octavian Caesar ,she wont,
280720,1044651142652641320, Augustus Octavian Caesar ,i told her before,
280721,1044651144640729169, Swolsby , degenkek ,
280722,1044651153310359653, Augustus Octavian Caesar ,she said no,
280723,1044651234864406559, skrvio ,Does Calibre39 stream keep cutting up,['Calibre39']
280724,1044651259690504222, Swolsby ,Imagine how on fire you look sticking out in red,
280725,1044651273774964757, Swolsby , degenkek ,
280726,1044651397825704088, Augustus Octavian Caesar ,you must be able to carry the red,
280727,1044651415303356456, Augustus Octavian Caesar ,its not just color,
280728,1044651437067620362, Calibre39 ,DONT YOU FUCKING DARE,['leash']
280729,1044651480768073808, Subutai ,Red is a colour for a target,
280730,1044651486535233607, leash ,Brunette is a winter thing,['      bubu']
280731,1044651516751007784, Calibre39 ,OR GO SHOVE CHEESE UP YOUR ARSE LIKE SWOLSBY,
280732,1044651580839972964, leash ,She makes more with me as a blonde.,['Augustus Octavian Caesar']
280733,1044651602579050616, Subutai ,Red devil,
280734,1044651627430293514, Augustus Octavian Caesar ,well you are damaging your hairs,
280735,1044651637018464349, Augustus Octavian Caesar ,more you do,
280736,1044651654231896135, Augustus Octavian Caesar ,more you have to go for care,
280737,1044651658044526632, Augustus Octavian Caesar ,so,
280738,1044651666332450947, Augustus Octavian Caesar ,she will do more,
280739,1044651682883186790, Calibre39 ,Leash don t need red for that we all know she s satan anyway,
280740,1044651686565793852, Augustus Octavian Caesar ,unrelated to color,
280741,1044651689329827911, leash ,IM NOT A PACKER ree ree ,
