,uuid,user_name,text_clean,mentions_name
426785,1053925858945028106, SnoopDOGGE ,there have been a lot of outbreaks lately,
426786,1053925862904430672, NickJ ,masks are for cucks,
426787,1053925866368946277, Thatskindawild ,I can t even smoke dope,
426788,1053925880415662110, Thatskindawild ,It hurty,
426789,1053925915232579617, leash ,one of the stores did get a recent outbreak and are masking up again,
426790,1053925931191906374, uatemycookie ,Im bad at keeping my hands away from my face. dunno how i havent gotten it yet. and i live in texas,
426791,1053925935658827838, Thatskindawild ,Maybe me covid mommy Me sick ,
426792,1053925984375668776, Thatskindawild ,Me need vaccine mommy,
426793,1053926000804773889, elrizzabeth ,the dude i was around wednesday said he s bad sick,
426794,1053926018999660594, AOTnoob ,i havent gotten vaccinated yet,
426795,1053926024469041242, MotoMana , elrizzabeth hmm ,['elrizzabeth']
426796,1053926042647138345, elrizzabeth ,i feel fine idk it s literally like the fucking flu,
426797,1053926057763418162, Thatskindawild ,Why were you around him,['elrizzabeth']
426798,1053926061370515548, leash ,i was never vaccinated,
426799,1053926075761180712, SnoopDOGGE , ,['elrizzabeth']
426800,1053926080442015830, elrizzabeth ,just don t be fat,
426801,1053926134682746891, Hey ,Texans don t care about covid grow up,['elrizzabeth']
426802,1053926151040552960, Thatskindawild ,Babe that s not how it works,['elrizzabeth']
426803,1053926207906906122, elrizzabeth ,specifically fat people have more complications,
426804,1053926220930240594, MotoMana ,ELIZABETH REEEE ,['elrizzabeth']
426805,1053926245328490567, uatemycookie , HUGERS ,['leash']
426806,1053926250055487519, Thatskindawild , gh0st ,
426807,1053926285765787658, AOTnoob ,im 5 4 200 lbs,
426808,1053926299405660210, NickJ ,I guess towelie must be obese since it almost killed him lmao,
426809,1053926300454244362, leash ,my choice. its fine kekw ,['uatemycookie']
426810,1053926302048079912, elrizzabeth , kekw ,
426811,1053926355412197386, AOTnoob ,im gonna make my own vaccine,
426812,1053926362274070569, elrizzabeth ,200 pounds kekw ,
426813,1053926381525942473, AOTnoob ,i dont trust the goberment,
426814,1053926415306866809, leash ,well good luck.,
426815,1053926424932798514, Hey ,Proud of you happi ,['leash']
426816,1053926428166602852, uatemycookie ,I dont trust you mfer,['AOTnoob']
426817,1053926447472967740, SnoopDOGGE ,honestly... if you had my symptoms and you were older or had a pre existing condition i think it is pretty likely that you could die,
426818,1053926500405088256, elrizzabeth ,yes and cancer kills as well,
426819,1053926503722790932, Thatskindawild ,Damn,
426820,1053926507313102898, AOTnoob ,the vaccine just for me nibblet,['uatemycookie']
426821,1053926514883842088, Neshtan ,irs,
426822,1053926515403915294, leash ,it effects everyone differently.,
426823,1053926533552689222, SnoopDOGGE ,heart rate of 120 at rest for 2.5 days is deadly,
426824,1053926550057271366, Thatskindawild ,Moderna jus found the cure for cancerrr,
426825,1053926581032206376, elrizzabeth ,calls on merderner,
426826,1053926586174418984, Thatskindawild ,Jeez bro what did u do,['SnoopDOGGE']
426827,1053926590146424902, uatemycookie ,I had a covid vaccine but no booster,
426828,1053926685734621204, leash ,i thought moderna had less than satisfactory results,
426829,1053926698145562664, AOTnoob ,puts cuz less money gonna be spent on cancer treatment,['Thatskindawild']
426830,1053926726725541938, leash ,and wasnt it skin cancer ,
426831,1053926766609182720, elrizzabeth ,the one shot i got in 2020 will keep me safe,
426832,1053926795226914857, elrizzabeth , kekw ,
426833,1053926821403570216, AOTnoob ,ye shud be good,['elrizzabeth']
426834,1053926864567160872, uatemycookie ,damn i think they came out in december 2020 though are u thinking 2021,['elrizzabeth']
426835,1053926905126068265, uatemycookie ,and they only released them to old people,
426836,1053926966392262656, elrizzabeth ,i don t wanna have any retarded eggs and yes i got mine in 2020 idk why thats what my card says,['AOTnoob']
426837,1053927008343707690, SnoopDOGGE ,im thinking maybe i should go get a booster,
426838,1053927011845951548, Thatskindawild ,Can sir Sir can,['AOTnoob']
426839,1053927031483666454, NickJ ,,
426840,1053927066015379456, uatemycookie ,Ayo liz got her vaccine before it even came out,
426841,1053927074320109568, uatemycookie , peepohmm ,
426842,1053927094352085012, SnoopDOGGE ,although i should have some sort of natural immunity to it now i would think ththinking ,
426843,1053927120134479902, elrizzabeth ,wait,
426844,1053927125163450420, leash ,theyre digital trading cards peeposcreech ,
426845,1053927149318451251, AOTnoob ,lizz got some dodgy vaccine lol,['uatemycookie']
426846,1053927152296402944, elrizzabeth ,it wasn t out in 2020 ,
426847,1053927180855410749, elrizzabeth ,fuck me,
426848,1053927211884888074, Thatskindawild ,Damn you got that downtown homeless shelter vaxx The strong kind ,
426849,1053927225336004648, elrizzabeth ,that mustve been hep b,
426850,1053927265244815390, . ,he s not can confirm,['NickJ']
426851,1053927310463619142, AOTnoob ,is there a vaccine for stds ,
426852,1053927329937768509, AOTnoob , conceited ,
426853,1053927333070909460, Hey , weirdcringe ,['. ']
426854,1053927345662205962, elrizzabeth ,no you dummy for pregnancy,
426855,1053927361504092230, Neshtan ,I am glad you are ok but this topic is so old,['SnoopDOGGE']
426856,1053927403698782260, elrizzabeth ,wait,
426857,1053927416587894804, . ,neither are u,['Hey']
426858,1053927430332612678, elrizzabeth ,IDK WTF IT WAS,
426859,1053927441711767592, elrizzabeth ,it was a shot,
426860,1053927458681925724, SnoopDOGGE ,well its still kind of unclear,
426861,1053927499748356176, elrizzabeth ,what if i never got a vaccine kekw ,
426862,1053927512557752351, SnoopDOGGE , leash says she caught it 4 times,['leash']
426863,1053927568878870580, NickJ ,how can you confirm ,['. ']
426864,1053927576214708265, leash ,the last two times were mild.,['SnoopDOGGE']
426865,1053927577670123560, uatemycookie ,I don t typically use medication other than symptom relief for illnesses. this makes my immune system strong at all times gigachad ,
426866,1053927598842986556, Hey ,Shut up weirdo,['. ']
426867,1053927607164481567, elrizzabeth ,ive seen towelie as well he aint fat,
426868,1053927660620894239, Ziffy ,who,
426869,1053927691579052052, leash ,wb ziffy.,
426870,1053927739800965140, SnoopDOGGE ,i got the first vaccine but no booster,
426871,1053927746570551387, uatemycookie ,I think my blood is immune to covid. should have gotten it by now,
426872,1053927773904850994, zet ,no u,
426873,1053927781563650089, elrizzabeth ,ive had it once,['uatemycookie']
426874,1053927783379779616, uatemycookie ,did u ever catch it ,['SnoopDOGGE']
426875,1053927792783401031, echelon ,That means it s working,['SnoopDOGGE']
426876,1053927799620108298, elrizzabeth ,supposedly,
426877,1053927809711603802, leash ,some people are asymptomatic,['uatemycookie']
426878,1053927819446595604, SnoopDOGGE ,not until now,
426879,1053927914233659432, uatemycookie ,on the other hand ive never tested for it kekw ,['leash']
426880,1053927930595639327, elrizzabeth ,honestly it s just a damn flu and i never got the flu shot and i didn t get the flu,
426881,1053927947154763866, elrizzabeth ,so why covid,
426882,1053927974283530270, uatemycookie ,i forget can asymptomatic people spread covid ,
426883,1053927975323701340, leash ,yeah unless you can test for antibodies you ll never know ,
426884,1053927992390340728, leash ,yes.,
426885,1053928003320696832, SnoopDOGGE ,that was not the flu,
426886,1053928023876980786, leash ,maybe youre just a carrier.,
426887,1053928041786642492, elrizzabeth ,probably but its their fault for having shitty genes,
426888,1053928117258965102, Some Fucking New Yorker ,you guys know it was just a cold virus right,
426889,1053928173127086100, uatemycookie ,Do asymptomatic people test negative ,
426890,1053928196736827483, NickJ ,no,['uatemycookie']
426891,1053928215334354945, Neshtan ,when I did a wrong move to get the shitty genes,['elrizzabeth']
426892,1053928215892213810, leash ,not showing signs of illness is shitty genes wat ,
426893,1053928255524179978, leash ,covid topic bores me.,
426894,1053928333953474630, SnoopDOGGE ,all im saying is resting heart rate of 120 for 2.5 days could be deadly on a lot of people,
426895,1053928384876519457, NickJ ,asymptomatic is literally just having something without displaying symptoms,
426896,1053928404023517194, elrizzabeth ,i mean i ve never been a sickly person. i always pretended gigachad ,['Neshtan']
426897,1053928409878765568, NickJ ,really not complex,
426898,1053928452924915723, Neshtan , sadge ,
426899,1053928482717040681, Neshtan ,u miss 40 of life,
426900,1053928502132473886, leash ,which also in a way makes their genes superior.,
426901,1053928542456516608, elrizzabeth ,no so i could like get out of school and shit,['Neshtan']
426902,1053928616792166420, Some Fucking New Yorker ,From what I remembered reading the fears of covid spreading asymptomatically like via children that didn t even know they had it was debunked. It was a concern early on but it was found not to be true you can t spread it unless you are coughing and shedding the virus and asymptomatic people don t although that argument is still used time and time again demonstrating the power of misinformation.,['uatemycookie']
426903,1053928626992713748, echelon ,,
426904,1053928715677089812, elrizzabeth ,golly her make up should be made down,['echelon']
426905,1053928744194150450, NickJ ,is that boxxy lmao,
426906,1053928755946606682, xLucifer ,,
426907,1053928787328368690, uatemycookie ,More words isnt gonna make your argument more verifiable than leash s but thanks,['Some Fucking New Yorker']
426908,1053928790918709299, leash ,is icelandic towelie ,
426909,1053928843779518465, NickJ ,it d make sense,['leash']
426910,1053928849458597908, uatemycookie , bobo ,
426911,1053928874527961118, Neshtan ,watch Resident Evil and think again LOL ,['xLucifer    ']
426912,1053928956690178048, uatemycookie , wholesome ,
426913,1053928979767230474, SnoopDOGGE ,i have a lot of elderly friends at church though,
426914,1053929035652141086, NickJ ,based and christpilled,['SnoopDOGGE']
426915,1053929037380194354, xLucifer , kekw ,['Neshtan']
426916,1053929077888786474, leash ,even if youre asymptotic you CAN spread covid which is why it was dangerous,
426917,1053929108347830302, SnoopDOGGE ,so i gotta make sure i dont spread it to any of them,
426918,1053929143022141480, Jinxy ,You re not putting as much out without coughing but droplets spread while speaking,['Some Fucking New Yorker']
426919,1053929190891716698, uatemycookie ,Do it Evil ,['SnoopDOGGE']
426920,1053929212748255293, elrizzabeth ,lets all just stay home,
426921,1053929235561074718, uatemycookie ,that s why masks are so important,
426922,1053929238400606229, elrizzabeth , pepeclap ,
426923,1053929253693030471, leash ,its not like it hits an asymptomatic person and the virus is just like oh theyre not displaying symptoms im going to die now ,
426924,1053929281941671967, elrizzabeth ,no i will not wear a mask,
426925,1053929308021858316, slushy ,ya keep maskin,
426926,1053929312031604776, slushy ,sheep,
426927,1053929316574048306, uatemycookie ,Masks arent for your own protection,
426928,1053929327986745415, elrizzabeth ,there is an amendment that protects me from having to do that,
426929,1053929344537464832, elrizzabeth , hmm ,
426930,1053929351260942336, uatemycookie ,A mask aint gonna protect me,
426931,1053929372660273162, slushy ,dude idgaf if u want me t o mask u gotta pay me,
426932,1053929392444813322, slushy ,we arent in a communist society,
426933,1053929406067900446, AOTnoob ,im gonna try to catch covid and spread it to the masses,
426934,1053929408886480916, uatemycookie ,But its gonna protect the people i work with i hope,
426935,1053929430201929770, Neshtan ,YAS lets make second round of baby booms,['elrizzabeth']
426936,1053929436631797770, slushy ,i aint doin shit just to benefit other ppl,
426937,1053929462128984124, elrizzabeth ,im down,['Neshtan']
426938,1053929503480627270, slushy ,i owe other ppl nothin,
426939,1053929510774513674, slushy , conceited ,
426940,1053929522178830357, elrizzabeth ,amen,
426941,1053929537504825355, elrizzabeth ,plus i can t breathe,
426942,1053929569398292570, Jinxy ,Keeping those in your community well and not sick benefits you,['slushy']
426943,1053929588872466442, elrizzabeth ,if i wear one i m just gonna pull it under my nose,
426944,1053929592089493514, NickJ ,you people are retarded lol,
426945,1053929673060515850, Jinxy ,Then pointless,['elrizzabeth']
426946,1053929681721761862, leash ,ive had enough of this convo y all keep fighting about masks.,
426947,1053929688969527386, uatemycookie ,Liz you can only choose 1. Mass death Masks Hyperinflation or Deep recession,
426948,1053929701862821938, elrizzabeth ,ik so i don t ear one,
426949,1053929707609014322, elrizzabeth ,wear,
426950,1053929715674665053, slushy ,i just go everywhere maskless idgaf,
426951,1053929728324665467, elrizzabeth ,mass death,
426952,1053929742023270501, slushy ,pointless,
426953,1053929761124130846, slushy ,wtf were the vaccines for,
426954,1053929765461037097, Neshtan ,When your panties will stop the fart then the mask will stop the virus LOL ,['elrizzabeth']
426955,1053929771119169536, slushy , goober ,
426956,1053929800542199848, saawant ,,
426957,1053929813448069120, slushy ,all blown out of proportion,
426958,1053929831387115570, elrizzabeth ,so fucking true,['Neshtan']
426959,1053929839033319464, Jinxy ,Different size particles for one,['Neshtan']
426960,1053929900878348329, NickJ ,why are people even still talking about covid,
426961,1053929916405657620, NickJ ,its dumb lmao,
426962,1053929920830652506, Some Fucking New Yorker ,Why don t you just ask chatGPT about it like a fucking man pussy.,['uatemycookie']
426963,1053929976078024744, uatemycookie ,chatgpt is trained on human data,
426964,1053929999197012058, saawant ,Discussing covid in 2022 is like talking about your ex,
426965,1053930017169612891, Some Fucking New Yorker ,train on this dick,
426966,1053930019866550344, SnoopDOGGE ,i just wanted to share that i caught it and that it sucked,
426967,1053930023289098240, NickJ ,no one is changing anyones mind,
426968,1053930042935222292, NickJ ,literally a waste of time,
426969,1053930078523891722, elrizzabeth ,and i m so sorry,['SnoopDOGGE']
426970,1053930084727267399, slushy ,people wearing masks just virtue signallin,
426971,1053930108303462500, SnoopDOGGE ,im not trying to change anybodys mind,
426972,1053930127114895471, Some Fucking New Yorker ,actually Nick I used to like Canadians but you changed my mind,
426973,1053930143640457306, SnoopDOGGE ,i really dont give a shit what you think,
426974,1053930169053753434, elrizzabeth ,puts on lancome,
426975,1053930169791959061, SnoopDOGGE ,never have never will,
426976,1053930204021657601, saawant ,Masks help if you ugly,
426977,1053930216055111752, Jinxy ,We had it in the fall and it was terrible,
426978,1053930217024012318, NickJ ,cool sounds like a you problem,['Some Fucking New Yorker']
426979,1053930254722408458, saawant ,And want to avoid any social interaction,
426980,1053930294253735956, elrizzabeth ,speaking of,
426981,1053930309101568061, slushy ,keep virtue signallinnnnnnnnnnnnn,
426982,1053930319222407239, uatemycookie ,HEY There are a few things we learned from 2020 1. Americans lost the responsibility for others that they used to have 90 years ago,
426983,1053930330811281478, elrizzabeth ,i may get a mask for certain people irl,
426984,1053930340978270248, Hey , weirdcringe ,
426985,1053930377661653033, Pusherman ,,
426986,1053930383152001144, slushy ,only reason to wear a mask is if u wanna hide the fact u arent smilin,
426987,1053930393419649104, slushy , kekw ,
426988,1053930443080216676, NickJ ,,['Pusherman']
426989,1053930495114743878, Pusherman ,,['NickJ']
426990,1053930597359304714, NickJ ,warning its loud,['Pusherman']
426991,1053930665692909608, uatemycookie ,There s a bunch of irony that we could belittle ourselves because of covid but the real important lesson learned was that it s harder to tell Americans to do something than defeating a pandemic,
426992,1053930737071571024, saawant ,,
426993,1053930844013731840, NickJ ,,
426994,1053930931825688636, Pusherman ,,
426995,1053930943578112050, Neshtan ,some ALABAMA jokes,['saawant']
426996,1053930947986325524, AOTnoob ,only reason to wear a mask is if ur ugly,
426997,1053931055205326918, slushy ,dude that makes no sense,['uatemycookie']
426998,1053931128500793375, saawant ,Masks are basically face condoms,
426999,1053931133047427132, slushy ,why europe still have covid ,
427000,1053931154429984768, slushy ,they aint american,
427001,1053931177532207145, slushy ,so did korea,
427002,1053931184347951194, slushy ,and japan,
427003,1053931211409596436, slushy ,all had outbreaks continuously,
427004,1053931218011430952, elrizzabeth ,wait didn t china go crazy,
427005,1053931236818681958, uatemycookie ,Because Europe has airports,
427006,1053931253226803210, saawant ,Fake numbers,['elrizzabeth']
427007,1053931256108298281, elrizzabeth ,like went bad,
427008,1053931302547632158, elrizzabeth ,fake numbers ahhhhhh,
427009,1053931309065568267, saawant ,Fake lockdown,
427010,1053931325163307088, elrizzabeth ,gotcha bitch,
427011,1053931352455651328, SnoopDOGGE ,fake news,
427012,1053931379546656808, elrizzabeth ,CHYNA,
427013,1053931434244587551, Gene ,when s someone gonna bop Jeremey Clarkson in the face for being an arsehole ,
427014,1053931474786721883, saawant ,She a chinese spy 100 ,['elrizzabeth']
427015,1053931519888064532, SnoopDOGGE , ,
427016,1053931528587055124, uatemycookie ,the only solution americans agreed with was the staying at home thing for a year but now that s causing a shithole in our economy,
427017,1053931537986490448, Gene ,So its like Ohio ,['Chet']
427018,1053931538158469170, saawant ,Bitch have literally chyna in her name,
427019,1053931619490205696, elrizzabeth ,no i love trump but lets not go there,['saawant']
427020,1053931659185098763, Gene ,Government drones are real,['Chet']
427021,1053931681402327050, uatemycookie ,We all liked staying at home right no one disputed it like we did to masks and vaccines,
427022,1053931692655644704, saawant ,Liz a trump supporter,
427023,1053931701505642507, saawant , weirdkekw ,
427024,1053931740579774545, elrizzabeth ,and this isn t facebook so i can say it kekw ,
427025,1053931776042598420, uatemycookie ,The real question is if she voted for abbott,
427026,1053931798469562398, elrizzabeth ,i vote all red,
427027,1053931837963112448, elrizzabeth , gigachad ,
427028,1053931917868802098, n. ,,
427029,1053931935417782332, uatemycookie ,Liz do you prefer an extreme red or a moderate red,
427030,1053931961011425290, elrizzabeth ,moderate,['uatemycookie']
427031,1053931974479331328, slushy ,i didnt vote,
427032,1053931992191869019, uatemycookie ,All the moderates have been kicked out of Texas office btw,
427033,1053931993487921152, n. , weirdcringe ,
427034,1053932011812818944, n. ,,
427035,1053932021849796658, saawant ,Because you re 5,['slushy']
427036,1053932026513854544, slushy ,wastin time its all rigged,
427037,1053932031119200277, saawant , kekw ,
427038,1053932032482365480, elrizzabeth ,well not by me,
427039,1053932035460321362, n. , weirdcringe ,
427040,1053932082172280854, n. , weirdkekw ,
427041,1053932094868426813, slushy ,fbi n DNC been tellin twitter who to ban,
427042,1053932105534537768, n. , weirdcringe ,
427043,1053932135431557130, slushy ,all rigg3d,
427044,1053932141022560336, n. , weirdcringe ,
427045,1053932166263885864, n. , pepetp ,
427046,1053932187185053716, n. , weirdcringe ,
427047,1053932187520602162, elrizzabeth ,i m a registered republican not a donky,
427048,1053932219078553700, Lovelace ,i mean it helped for a lil bit,['uatemycookie']
427049,1053932244005302284, n. , pepenotes ,
427050,1053932273533198336, n. , pepetp ,
427051,1053932295578468363, n. , weirdcringe ,
427052,1053932379477123082, xLucifer , weirdcringe ,
427053,1053932393418997780, Lovelace ,i refuse to register for either party,
427054,1053932415296483338, Lovelace ,i hate it,
427055,1053932541213671514, NickJ ,,
427056,1053932616870539326, Lovelace ,pizzagate,
427057,1053932790191755324, uatemycookie ,What would be the republican s version of a covid vaccine ,
427058,1053932809070325770, saawant ,She a trump supporter,['NickJ']
427059,1053932822081060874, saawant , trumpsalute ,
427060,1053932949193625620, NickJ ,wym ,['uatemycookie']
427061,1053932958425301053, Some Fucking New Yorker ,what the fuck kind of nick is n.,
427062,1053933043460612258, uatemycookie ,Vaccines heavily praised by leftists but opposed by reps,['NickJ']
427063,1053933089576976404, uatemycookie ,what would be a solution to covid,
427064,1053933094681444373, Some Fucking New Yorker ,herd immunity,['uatemycookie']
427065,1053933098158530590, Lovelace ,nra membership ,['uatemycookie']
427066,1053933127174725642, uatemycookie ,but only supported by reps,
427067,1053933218753163316, Some Fucking New Yorker ,there was no vaccine booster shots aren t a vaccine,
427068,1053933258158645288, Swolsby ,The funny part is someone came up with this idea and posted it,['NickJ']
427069,1053933282678554664, uatemycookie ,Vaccines really need a new word for them,
427070,1053933355516842034, Some Fucking New Yorker ,fauci ouchies,
427071,1053933367751622656, uatemycookie ,Why can FTX rebrand themselves out of a PR disaster but vaccines cant ,
427072,1053933462006005860, Some Fucking New Yorker ,because vaccines stole money from americans but FTX stole money from american politicians,
427073,1053933465680216064, uatemycookie ,if we could just give them a new name kekw ,
427074,1053933519782543360, slushy ,fauci ouchies fauci ouchies fauci ouchies fauci ouchies fauci ouchies,
427075,1053933561851412480, Some Fucking New Yorker ,shut the fuck up slushy,
427076,1053933613051297822, Yellow Monkie Man ,How lame of a team name is the mean greens ,
427077,1053933647222292495, AOTnoob ,,
427078,1053933650430931004, uatemycookie ,dude thats my school,['Yellow Monkie Man']
427079,1053933666084081704, Yellow Monkie Man ,It rhymes with green beans ,
427080,1053933677622595634, saawant ,,
427081,1053933731943038986, Some Fucking New Yorker ,hoes will literally suck an entire dick and then want dinner,
427082,1053933771721805834, uatemycookie ,i didnt knew my school played the kind of football yall are watching,
427083,1053933782664740894, Yellow Monkie Man ,Well ur QB sucks,['uatemycookie']
427084,1053933789723758642, NickJ ,,
427085,1053933821915054130, Yellow Monkie Man ,I was there,['uatemycookie']
427086,1053933834497949736, uatemycookie ,Yeah probably lol,['Yellow Monkie Man']
427087,1053933898490458172, uatemycookie ,i hope my school gets their ass beaten,
427088,1053933915297022012, Yellow Monkie Man ,Why,
427089,1053933944757833738, uatemycookie ,because idc about football,
427090,1053933954383761469, Rowow ,,
427091,1053934053029589064, Rowow ,,
427092,1053934056561192980, Yellow Monkie Man ,Apparently so does ur entire school cuz the team sucks,['uatemycookie']
427093,1053934060646440970, Rowow ,,
427094,1053934122214625340, Yellow Monkie Man ,Dude those are hairy legs,['Rowow']
427095,1053934124622172160, saawant ,Woah crazy Rowow little jealous,['Rowow']
427096,1053934158017220618, saawant ,Bruh get some puss today Rowow,['Rowow']
427097,1053934161196494908, Rowow ,No they arnt,['Yellow Monkie Man']
427098,1053934185359876118, Rowow ,,
427099,1053934189134757949, Rowow ,Idk why it looks like that,
427100,1053934210617982997, uatemycookie ,Not inaccurate,['Yellow Monkie Man']
427101,1053934277684891659, saawant ,Take one of em back home,['Rowow']
427102,1053934286358716476, saawant , ,
427103,1053934298593497138, uatemycookie , Rowow why are there so many hot chicks there,['Rowow']
427104,1053934312472457236, uatemycookie ,Anime chicks,
427105,1053934330826735616, Yellow Monkie Man ,School that is for studying and not sports gigachad ,['uatemycookie']
427106,1053934338875609109, uatemycookie ,it s a weeb s dream come trye,
427107,1053934382857072660, saawant ,Its a anime rave,['uatemycookie']
427108,1053934389991583795, uatemycookie ,terrible in both,['Yellow Monkie Man']
427109,1053934415182573619, xLucifer , ,
427110,1053934424540065822, slushy ,this looks like ur in a gay bdsm,
427111,1053934431934619718, Rowow ,Cause to have the self confidence to cosplay and go out in public requires a lot of self appreciation,['uatemycookie']
427112,1053934435516567632, slushy , kekw ,
427113,1053934686486933547, Rowow ,,
427114,1053934746993950750, saawant ,Charge your phone,
427115,1053934763255267348, Rowow ,I am,
427116,1053934771220254810, lakai ,is that the cuddle puddle,
427117,1053934772788940800, uatemycookie ,dude ur literally arguing with a stranger on discord while ur mouth is less than a foot away from a petite girl s pussy,['Rowow']
427118,1053934829659496518, Rowow ,A human pyramid,['lakai']
427119,1053934852279390248, xLucifer ,What up boys like my new dp ,
427120,1053934872932143154, Rowow ,I m waiting for my uber,['uatemycookie']
427121,1053934891189948476, saawant ,Crazyyy,['Rowow']
427122,1053934896625762304, Rowow ,Got a girls Snapchat,
427123,1053934896801914910, uatemycookie ,WTF,
427124,1053934919665061958, uatemycookie ,SHE WAS ON UR SHOULDESS,
427125,1053934934617763910, uatemycookie ,SHE WANTED TO FUK,
427126,1053934935423078452, saawant ,TELL ME YOU AINT GOING ALONE,['Rowow']
427127,1053934962887368784, saawant ,SO MANY GIRLS AND YOU GOT SNAP,
427128,1053934971728973934, Rowow ,Ur slow,['uatemycookie']
427129,1053934977944928266, saawant ,TAKE EM HOME,
