,uuid,user_name,text_clean,mentions_name
277473,1044402240078741514, CAPT T. FRAUD ,The point of having friends is if you need to contact them not because you actually do,['leash']
277474,1044402745630785536, Fuckboy ,That command is disabled.,
277475,1044402749166583929, ParoleBot ,Done. That felt good.,
277476,1044403137164869732, leash ,I opened my dms instead.,['CAPT T. FRAUD']
277477,1044403196216496138, CAPT T. FRAUD ,Now you ll just get dickpics,['leash']
277478,1044403241624027146, leash ,They go to spam,
277479,1044403275954401321, CAPT T. FRAUD , everyone leash womyn has open dm,['leash']
277480,1044403305486483527, leash , pepeannoyed ,
277481,1044403601830838313, leash , mik,['mik']
277482,1044403624043876432, Pusherman , ,
277483,1044403630318559253, Pusherman , dead ,
277484,1044403776221614130, peepee ,how do i filter only dick pics to my dms,['konakona']
277485,1044403857784057966, Rowow , ,
277486,1044403861848346754, Fuel the fire ,Sorta reminds me of hava,['Pusherman']
277487,1044403895297904640, mik ,what,
277488,1044403988214333480, james2 ,Mik knows all,
277489,1044403993083912322, Fuel the fire ,Hava nice day lmao gottem,['mik']
277490,1044404077586567268, Fuckboy ,That command is disabled.,
277491,1044404081806020658, ParoleBot ,Done. That felt good.,
277492,1044404133098176512, Pusherman ,ty sir or madame i dont want to assume ,
277493,1044404222004838450, Rowow ,ill never thank a woman,
277494,1044404253076238366, Rowow ,they brought me into this shitty world,
277495,1044404256175816784, christuhfur ,ayo,
277496,1044404290774642728, Rowow , emo ,
277497,1044404292481720320, Swolsby , catsmirk ,
277498,1044404336643559537, james2 ,Did not know that a bot can get banned,
277499,1044404349448749056, imbagholding11.56 ,she prolly wishes she didn t,['Rowow']
277500,1044404677267169340, Gott , EAH,
277501,1044404824487251968, Pusherman ,FUCK AUBURN. IT S AUBURN HATE WEEK BITCHES,
277502,1044404852903653406, james2 ,Rowow can you sell me pork belly love to BBQ it food of the gods,
277503,1044404926962466877, Lenny Quantum Dev ,Anyone want to hop on wizzard 101 ,
277504,1044405010638831677, Rowow ,jokes aside my mom loves me and always brags how im the best kid ever,['imbagholding11.56']
277505,1044405054381232218, Rowow ,and every other parent always says they wish they had me as a kid,
277506,1044405114229772350, Rowow ,me shitposting on discord irl,
277507,1044405171058393208, james2 ,My son want some candy,
277508,1044405207620145193, Rowow ,I dont run around yelling at people calling them npc s to buy corn and that im the main character,
277509,1044405210895876157, Dashie , ping ,
277510,1044405232010006588, Rowow ,soon,['james2   ']
277511,1044405255623933952, Rowow ,raising some pigs to butcher,
277512,1044405271893651506, CAPT T. FRAUD ,Your mom s schizo,
277513,1044405483626303530, Rowow , pepecringe ,
277514,1044405549959221268, Rowow ,stay salty your mom hates you,
277515,1044405569940885505, james2 ,He s just jealous of your independence,
277516,1044405715810385940, Rowow ,parents hate kids who take care of them financially at the age of 19,
277517,1044405759095603250, ,give him a free GME stock,['james2   ']
277518,1044405765206720582, CAPT T. FRAUD ,I pissed a circle around his house it s mine now,['james2   ']
277519,1044405803228069968, CAPT T. FRAUD ,Try 32,['Rowow']
277520,1044405842352558140, CAPT T. FRAUD , gigachad ,
277521,1044405843128496128, Fuckboy ,Too slow ,
277522,1044405868340465704, ,23,
277523,1044405902016520222, peepee ,i thought it was 22,
277524,1044405916939857961, peepee ,quik mafs,
277525,1044406049576329317, CAPT T. FRAUD ,Rowow still hasn t posted welds,
277526,1044406095092908072, imbagholding11.56 ,,
277527,1044406108988641332, imbagholding11.56 ,this is funny right,
277528,1044406170699452416, CAPT T. FRAUD ,I don t understand,
277529,1044406277972967424, imbagholding11.56 ,see this is why i have others proof read my autism,
277530,1044406357199171624, peepee ,hit her w a spongebob joke she will def appreciate it,['imbagholding11.56']
277531,1044406431811637308, imbagholding11.56 , ,
277532,1044406447330558022, imbagholding11.56 ,such as,
277533,1044406449087983696, ThetaGang ,Wow the sportsbook limited my account after I cleaned them out last night,
277534,1044406561671491615, peepee ,ion know i don t use the internet to get bitches,['imbagholding11.56']
277535,1044406572597649448, peepee ,i do it irl,
277536,1044406757855858758, Boogie ,S h e e s h,
277537,1044406800906190948, Boogie ,That man peepees going in,
277538,1044406965863981096, imbagholding11.56 ,that means ur winning,['ThetaGang']
277539,1044406993286336563, imbagholding11.56 ,move to a new book and do it again,
277540,1044407060462305310, imbagholding11.56 , ThetaGang or find an off shore book,['ThetaGang']
277541,1044407098815029291, imbagholding11.56 ,most are no limit,
277542,1044407105597210684, ThetaGang ,That was an offshore book. Bovada,
277543,1044407123951493181, imbagholding11.56 ,oh,
277544,1044407129848688722, ThetaGang ,Time to move over to BetOnline,
277545,1044407150593724467, ThetaGang ,Today s bet ,
277546,1044407220344987709, Rowow ,what isnt this illegal ,['ThetaGang']
277547,1044407297360806008, Rowow ,how the fuck can they take away money you won,
277548,1044407298673610853, imbagholding11.56 ,no it s definitely in the terms and conditions section,['Rowow']
277549,1044407329048772698, Rowow , wat ,
277550,1044407329782767698, imbagholding11.56 ,they didn t,
277551,1044407352469762188, imbagholding11.56 ,they changed how much he can bet,
277552,1044407388926660638, Rowow ,ooooh my bad thanks,
277553,1044407401182408815, ThetaGang ,They didnt take my money away from me. I just cant bet five figures anymore,
277554,1044407800241082448, imbagholding11.56 ,you do sports analytics or just know the game ,['ThetaGang']
277555,1044407821124513942, Pusherman ,you bet on the Cardinals.....................,['ThetaGang']
277556,1044407836748288062, Boogie ,Loll,
277557,1044407997583077497, ant ,really good idea for WSB secret santa,
277558,1044408205297602631, peepee ,does it come w games on it already,['ant']
277559,1044408238369673357, Rowow ,why not just use your phone,['ant']
277560,1044408358976897095, ant ,I think its one of those mall kiosk game consoles with mario and tetris on it,['peepee']
277561,1044408436441489419, ScottieRippen , Rowow you do realize when China invades USA coastal territories will be hit first and the invaded. What are you doing to fortify your farm of little piggies and high value inventions ,['Rowow']
277562,1044408439591415928, peepee ,i had a cool emulator on my phone that could do pok mon and stuff,
277563,1044408482729836574, peepee ,played a few spyro games on it too,
277564,1044408493102338138, peepee ,was fwee,
277565,1044408521816543325, ant ,bootleg ps5,
277566,1044408637868752968, Pusherman ,Get a SouljaStation,
277567,1044408652271988747, peepee ,aliexpress is wild,
277568,1044408707657760828, Rowow ,you do realize that florida is on the opposite coast right china is in the pacific not atlantic ocean,['ScottieRippen']
277569,1044408710103060490, ant ,yeah this website is lit,
277570,1044408842424963083, ScottieRippen ,doesn t matter they would invade all coastal fronts,
277571,1044408843825844244, Rowow , av out ,['ant']
277572,1044408873571856494, Rowow ,who has a av plug in their tv,
277573,1044408892316209212, peepee ,i ve got a bunch of stuff off there before usually takes a month or so to show up but it s all been really good,['ant']
277574,1044408892827914270, ant ,I saw that kekw ,['Rowow']
277575,1044408964634398760, ant ,im watching a review on the bootleg ps5,
277576,1044409103079964812, Rowow ,my mom bought me one of thse when I was young was cool but your smartphone can do all that but better bluetooth connected devices that allow you to do the same thing but use the phone as the consol would be better for the modern age,
277577,1044409266120970300, ant ,Theres no shoulder buttons on the controller,
277578,1044409521910591589, peepee ,pretty sure you can use nintendo joycons on phone and ipad and stuff for games,['Rowow']
277579,1044409545851686962, peepee ,pretty cool D,
277580,1044409739221671966, Hey , Mona ,
277581,1044410541520728204, Rowow ,this feels like sarcasm,['peepee']
277582,1044410585372172358, Rowow ,im autist1c so I cant tell,
277583,1044410701910900756, SixFigures ,im artistic and its not,
277584,1044410901551386734, Rowow ,ur ret rded,
277585,1044410954399613009, Hey , gasp ,
277586,1044411361347776584, ScottieRippen ,i m not autiztic and you re both regarded,
277587,1044411483590758401, Rowow ,automatic rachet belts are the best thing china has been able to bring the price down on,
277588,1044411503849246751, Rowow ,cheap and sexy as fuck,
277589,1044411559440568341, peepee ,,
277590,1044411573076242432, Rowow ,had to buy another one cause my belt from over 5 years ago finally wore out,
277591,1044411601433923584, peepee ,why can t i talk about my own ass having autiism,
277592,1044411613702271076, Rowow ,the buckle is fine just the leather belt wore out,
277593,1044411648099766463, Rowow ,ikr discrimination,['peepee']
277594,1044411652222750820, chromeowl ,can you say I have autism ,
277595,1044411655259439144, Rowow , ,
277596,1044411660082880563, ScottieRippen ,Wait till China invades your pig farm and steals your fecal matter inventions,
277597,1044411671428485203, CHICKENHEAD123 ,Automatic ratchet belt ,
277598,1044411678370045952, CHICKENHEAD123 , ,
277599,1044411702361477202, Rowow ,google it,['CHICKENHEAD123']
277600,1044411717830049853, Rowow ,itll change your life,
277601,1044411724557725747, ScottieRippen ,bet you won t be praising ratchet belts then,
277602,1044411752433074196, Rowow ,you can get one for like 10,
277603,1044411776567103539, chromeowl ,I guess the ic is like the r word now,
277604,1044411796519391373, chromeowl ,just say you have the disease,
277605,1044411824294076437, CHICKENHEAD123 ,Will do,['Rowow']
277606,1044411872344019014, ScottieRippen ,dick ,['chromeowl']
277607,1044411911732723742, ScottieRippen ,wtf is r word,
277608,1044411922696654898, peepee ,not very progressive or inclusive of discord boboscreech ,['Rowow']
277609,1044411987523805214, ScottieRippen ,N,
277610,1044411991776825344, chromeowl ,idk if you saw before it went awy,
277611,1044412006465294458, Hey ,Retard,
277612,1044412017676656650, chromeowl ,so wait we can say the n word,
277613,1044412021652865064, Yellow Monkie Man ,Wat,['Rowow']
277614,1044412050312544287, ScottieRippen ,Retard,
277615,1044412060404031570, chromeowl ,I can say hard r,
277616,1044412077101568041, ScottieRippen ,RetardEd,
277617,1044412079177740500, chromeowl ,but not retarded,
277618,1044412107841601586, chromeowl ,oh well,
277619,1044412135578533898, chromeowl ,i guess its fair,
277620,1044412169653067806, ScottieRippen ,the filter is off because it s a conversation about retard,
277621,1044412187218825246, ScottieRippen ,you retard,
277622,1044412205677953104, Hey ,Lol,
277623,1044412229900046377, peepee ,retard,
277624,1044412256810709103, ScottieRippen ,retard,
277625,1044412310132887653, peepee ,i can use the slur word to describe autists but can t actually say autistiic,
277626,1044412318890598440, chromeowl ,i guess we have free speach,
277627,1044412323399471174, ScottieRippen , SpongeBobSquarePepe ,
277628,1044412328583643198, peepee ,classic,
277629,1044412328596222072, chromeowl ,congrats,
277630,1044412368249176074, Yellow Monkie Man ,Retardd,
277631,1044412417200881746, peepee ,weetard,
277632,1044412486868271165, Hey , fetterman ,
277633,1044412501921636493, pyth ,Pee,
277634,1044412525518782514, Rowow ,google it,['Yellow Monkie Man']
277635,1044412552773390457, Rowow ,trust me itll change ur life,
277636,1044412596150861865, dizzy ,Buffalo NY ,
277637,1044412632356106240, SixFigures ,whoaaaa,['dizzy']
277638,1044412635015295046, Yellow Monkie Man ,Things I ve learned today from rowow 1,['Rowow']
277639,1044412637871607909, Hey ,Yeet,
277640,1044412666329964574, peepee ,i can t drive but ion think u can park there,['dizzy']
277641,1044412692066209893, Rowow ,ebay.com itm 224752392004 var 523610857724 Yellow Monkie Man CHICKENHEAD123 heres the one I bought,"['Yellow Monkie Man', 'CHICKENHEAD123']"
277642,1044412922820042752, CAPT T. FRAUD ,Can t have hit in ne York. Niggas jacked the whip,['dizzy']
277643,1044413115661549578, dizzy ,it s on the other side from NYC. they got lots of snow.,['CAPT T. FRAUD']
277644,1044413192450887690, Skit ,You can trade spy 24 7 now lol,
277645,1044413198780072016, CAPT T. FRAUD ,Yes and what state is it ,['dizzy']
277646,1044413329399099402, dizzy ,new york,['CAPT T. FRAUD']
277647,1044413417894719510, CAPT T. FRAUD ,Oh,
277648,1044414074349432952, Fuckboy , You need to wait 0 hours 42 minutes and 59 seconds until you can give reputation again ,
277649,1044414093429321778, LavaRocks , REEEE ,
277650,1044414264384966676, CAPT T. FRAUD ,My boogers are black,
277651,1044414321104523284, ant ,Bro chill,['CAPT T. FRAUD']
277652,1044414394601312267, Rowow ,did you know that 2 apples have the same amount of sugar as a can of coke,
277653,1044414488474034246, Rowow ,sugar is fine when its in a balanced diet with lots of fiber etc,
277654,1044414498297098290, ant ,a kit kat has almost as much sugar as an apple,['Rowow']
277655,1044414537115390032, Rowow ,nothing wrong with corn fructose too much of anything is bad,
277656,1044414556597932032, Yellow Monkie Man ,arent those different sugars,['Rowow']
277657,1044414573551308943, Rowow ,what size kitkat,['ant']
277658,1044414574062993488, ant ,exactly,
277659,1044414662906753054, ant ,I never thought of that,['Rowow']
277660,1044414670615879690, Rowow ,a little but the health issues is due to the lack of fiber,['Yellow Monkie Man']
277661,1044414715213910086, SaintMaldent ,one as big as ur mom s puss,['Rowow']
277662,1044414747015139408, CAPT T. FRAUD ,They ve been black for 3 months now.,['ant']
277663,1044414751100375092, Rowow ,fiber limits your sugar intake and makes your stomach have to work more,
277664,1044414822676172912, SixFigures , ,
277665,1044414830599213066, Rowow ,idk how small that is I was delivered via c section,['SaintMaldent']
277666,1044414888396726442, ant ,Never really been a fan of kit kat,
277667,1044414937340051516, ant ,Its a candy thats going through an identity crisis,
277668,1044415024275406970, wildboarz ,Toblerone only,
277669,1044415187014406195, CAPT T. FRAUD ,Symptoms of lung cancer,
277670,1044415210691235991, Rowow ,I think all candy is bad now,
277671,1044415220535275610, CAPT T. FRAUD ,Or lung aids,
277672,1044415247232012320, Rowow ,they changed the recipe and are adding more fake bullshit,
277673,1044415265519173692, Rowow ,candy used to be good,
277674,1044415287379906571, ant ,ill break you off a piece of my kit kat dancee ,['elrizzabeth']
277675,1044415298704527380, Rowow ,try candy from other countries like brazil,
277676,1044415321617997824, Rowow ,russian candy is lit too,
277677,1044415353553436682, Rowow ,but its also being americanized ,
277678,1044415387359518791, Rowow ,hard to find good russian candy anymore,
277679,1044415407840313374, Rowow ,brazilian is my favorite,
277680,1044415426584649879, Rowow ,they come up with the best shit,
277681,1044415433048068156, chromeowl ,rowow you filthy communist traitor,
277682,1044415470339620944, Rowow ,am I a commie today,
277683,1044415476828229642, chromeowl ,get the fuck out of my country and take your corn with you,
277684,1044415500299534466, Rowow ,yesterday people were calling me a nazi,
277685,1044415549205131294, Rowow , makeamericagreatagain,
277686,1044415560156463164, chromeowl ,german blood is strong you are a dirty slav,
277687,1044415572181516288, Rowow , bringbackcaptalism,
277688,1044415578154213477, wildboarz ,Good Russian candy easy to spot because it glows in the dark from Chernobyl,
277689,1044415595782885436, CAPT T. FRAUD ,I hate slav,['chromeowl']
277690,1044415596957278208, Rowow ,thats not how that works,['chromeowl']
277691,1044415690221813800, Rowow ,cringe americans talking about nazis communists,
277692,1044415719787483136, Spear ,Chernobyl a nicer place than Qatar or Iran,
277693,1044415729790885989, Rowow ,while never experiencing or knowing anything about them,
277694,1044415752150728724, Rowow ,nazi s and communists dont mix,
277695,1044415796652281877, Rowow ,thats like calling someone a n word kkk member,
277696,1044415833998381056, Rowow ,double negative makes no sense,
277697,1044415836951171193, chromeowl ,I am saying you are not strong enough to be of german decent,
277698,1044415864990085130, chromeowl ,you are a fithy orthodox pig,
277699,1044415879259115541, Rowow ,oh,
277700,1044415904341049344, chromeowl ,yes,
277701,1044415906471743548, Rowow ,cope,
277702,1044416017415282699, S T K ,fok lakeland fok that place fok u,
277703,1044416097421627393, Rowow ,now I want brazilian candy,
277704,1044416117835309196, Rowow ,where do I buy,
277705,1044416127029219359, Rowow , REEEE ,
277706,1044416428360618075, sake ,Earth is flat,
277707,1044416617553088512, Boogie , hesright ,
277708,1044416684162830406, ScottieRippen ,ebay,['Rowow']
277709,1044416685999935569, Boogie ,From our angle it s round,
277710,1044416705587331212, ScottieRippen ,search used candy ,
277711,1044416773736374332, Boogie , hehe ,
277712,1044416801058066452, Rowow ,holy shit so expensive,['ScottieRippen']
277713,1044416820276367381, Rowow , 70 shipping,
277714,1044416871983759370, ScottieRippen ,it s worth it,
277715,1044416873246228480, Rowow ,found a brazilian store in tampa,
277716,1044416890832961567, Rowow ,gonna check it out when I drive there,
277717,1044416907559829544, Boogie ,Loll,['S T K']
277718,1044416947523162132, sake ,I need to see evidence,['Boogie']
277719,1044416960588419112, Rowow ,I agree but I think itll be cheaper in person,['ScottieRippen']
277720,1044416965726453820, ScottieRippen ,you know some listings on ebay are codes for something else right ,['Rowow']
277721,1044416989294243891, Rowow ,plus wont get melted in shipping,
277722,1044417010878140466, Rowow , weirdkekw ,['ScottieRippen']
277723,1044417094680334376, Rowow ,I wanna buy some overpriced shit and see what I get,
277724,1044417133414731887, ScottieRippen ,they ban the sale of a lot of illegal items or services naturally but people use other products as code,
277725,1044417139618103318, Rowow ,or do I have to message them a secret code to recieve the fake item,
277726,1044417200955592775, Rowow ,and if I dont they will send me the advertised shit,
277727,1044417225999794248, ScottieRippen ,so you might have a seller with an obscure item ie used brazillian candy,
277728,1044417255380897802, ScottieRippen ,might be code for ,
277729,1044417297164554300, ScottieRippen ,used brazillian human,
277730,1044417332996485150, Rowow ,I was thinking cocaine,
277731,1044417364638310463, ScottieRippen ,think bigger,
277732,1044417369084276737, Rowow ,what human can u buy for 200,
277733,1044417433387139113, Rowow ,I understand the closet shit that costs 50k being kidnapping,
277734,1044417444225232897, burney ,Prostitute,
277735,1044417459681239111, Rowow ,but the smaller ones,
277736,1044417682243596298, Boogie ,F,
277737,1044417734236184576, ThickGary Dell Abate G.E.D. ,its rent but sure,['burney']
277738,1044417801076613160, ThickGary Dell Abate G.E.D. ,never rent to own a hooker,
277739,1044417812136992869, Boogie ,A midget,
277740,1044417968622272535, Rowow ,thats what dating is,[' ThickGary Dell Abate G.E.D.']
277741,1044417973265383578, burney ,Owning a hooker is a horrible idea ,[' ThickGary Dell Abate G.E.D.']
277742,1044418035970211940, Rowow ,why ,
277743,1044418065019973673, Boogie ,Just go to a third world country and buy nuns,
277744,1044418086587084924, burney ,You have to feed it and listen to it complain,
277745,1044418125090783314, Rowow ,no you dont,
277746,1044418129918447636, ThickGary Dell Abate G.E.D. ,i want to find some non hookers though and fix them up,
277747,1044418137707270224, Rowow ,tahts the point of owning it,
277748,1044418160381657170, ThickGary Dell Abate G.E.D. ,make them hit the gym hard and eat right,
277749,1044418184125612083, ThickGary Dell Abate G.E.D. ,then set them free,
277750,1044418211166310400, Boogie ,Loll,
277751,1044418213112447116, ThickGary Dell Abate G.E.D. ,move on to the next,
277752,1044418245387636796, Boogie ,Catch and release,
277753,1044418250034925608, burney ,Read any pimp book and you ll learn that owning a hooker is the same as marrying one,['Rowow']
277754,1044418273086812221, ThickGary Dell Abate G.E.D. ,basically,['Boogie']
277755,1044418290149249084, ThickGary Dell Abate G.E.D. ,give them worth make them hot,
277756,1044418307723366440, ThickGary Dell Abate G.E.D. ,move on,
277757,1044418328820719686, Boogie ,Loll,
277758,1044418386504986654, Rowow ,im not saying to own a hooker to pimp her out Im saying to own a hooker to fuck,['burney']
277759,1044418418125852772, AyyLamo ,Anyone making a banna lime pie for Thanksgiving,
277760,1044418438719881336, Boogie ,I m in the red if i don t trade her,
277761,1044418518344544337, burney ,Damn u dumb,['Rowow']
277762,1044418559209644093, Rowow , wat ,
277763,1044418568000901131, 69backshotking ,I see you You see me How pleasant This feeling The moment You hold me I missed you I m sorry I ve given What I have I showed you I m growing The ashes Fall slowly As your voice Consoles me,
277764,1044418932800495646, leash , lakai is both the knife and the riot shield,['lakai']
277765,1044419189147959366, imbagholding11.56 ,not expected from user 69backshotking,['69backshotking']
277766,1044419255023702077, 69backshotking ,im awildant dummy imbagholding11.56,['imbagholding11.56']
277767,1044419304541650947, imbagholding11.56 ,oh,
277768,1044419366655119450, 69backshotking ,you still have those red shoes,
277769,1044419377044406342, imbagholding11.56 ,sup g,
277770,1044419384661262506, 69backshotking ,LMFAOOOOOOO,
277771,1044419424553275442, imbagholding11.56 ,what red shoes,
277772,1044419434166636654, 69backshotking ,or was that buy drugs idk,
277773,1044419454202806334, 69backshotking ,its been so long,
277774,1044419490613559306, imbagholding11.56 ,yeah that might have been drugs,
277775,1044419533986869299, 69backshotking ,what ever happened to him ,
277776,1044419760357650534, imbagholding11.56 ,started his own server,
277777,1044420181138620496, Teddy , ,['69backshotking']
277778,1044420835491983390, CAPT T. FRAUD ,So I was fucking this bitch,
277779,1044420905641713725, Rowow ,So I was fucking this bitch,
277780,1044420911249490030, Trojanknight ,Gm,
277781,1044420976860999810, peepee ,So I was fucking this bitch,
277782,1044421104661442570, Rowow ,why does peepee get the chad emote but not us,
277783,1044421108885098556, Rowow ,simp,
277784,1044421519712993340, peepee ,simp,
277785,1044421960165245028, RighteousandWrath22 ,Gm,['Trojanknight']
277786,1044422111206326292, ThetaGang ,Cardinals 10.0,
277787,1044422427196801064, Trojanknight ,Savior,['RighteousandWrath22']
277788,1044422478992248872, chromeowl ,what was that website to find a hooker again ThickGary Dell Abate G.E.D.,[' ThickGary Dell Abate G.E.D.']
277789,1044422495001903164, chromeowl ,I think imma treat myself,
277790,1044422544008155136, Fuckboy , Ranking Statistics for elrizzabeth ,['elrizzabeth']
277791,1044422608868868096, ant ,lol,
277792,1044422695485460511, chromeowl ,woman moment,['elrizzabeth']
277793,1044422763307335732, ant , finger ,['elrizzabeth']
277794,1044422903518724237, ThickGary Dell Abate G.E.D. ,depends on the quality,['chromeowl']
277795,1044422919884914718, n. , zyzz zyzz zyzz zyzz zyzz zyzz dancee aliendance dancee zyzz zyzz dancee typing dancee zyzz zyzz dancee aliendance dancee zyzz zyzz zyzz zyzz zyzz zyzz ,
277796,1044422927132676136, AyyLamo ,Tell me more,['Rowow']
277797,1044422945809911919, ThickGary Dell Abate G.E.D. ,listcrawler is okay but you have to find the bots,
277798,1044422955951722586, AyyLamo ,I love rowsexytime,
277799,1044422981599895563, ThickGary Dell Abate G.E.D. ,callescorts dot org isnt bad,
277800,1044422991011926137, Pusherman , ,
277801,1044423007457792050, ThickGary Dell Abate G.E.D. ,it really depends on your location,
277802,1044423053209247814, ThickGary Dell Abate G.E.D. ,california vegas is hooker central,
277803,1044423156192006284, ThickGary Dell Abate G.E.D. ,girls who came out here to make it big but now they re in big debt,
277804,1044423202119614554, chromeowl , pepenotes ,
277805,1044423213909815296, ThickGary Dell Abate G.E.D. ,yes but id say over 60 are bots,['elrizzabeth']
277806,1044423345569017890, ThickGary Dell Abate G.E.D. ,depends on the area but 150 250 a half hour,
277807,1044423379630960640, ThickGary Dell Abate G.E.D. ,thats robbery though,
277808,1044423380981526620, AyyLamo ,My do girls Want the sex more right before their periods,
277809,1044423464171339796, AyyLamo ,Yeah why,
277810,1044423575928582256, ThickGary Dell Abate G.E.D. ,boobas are bigger near the period,
277811,1044423600725315634, ThickGary Dell Abate G.E.D. ,they be watching me,
277812,1044423635588370452, ant ,the red week ,['elrizzabeth']
277813,1044423687358652446, ant ,gross,
277814,1044423749367246988, ThickGary Dell Abate G.E.D. ,ill fuck you on the first day,
277815,1044423758821208115, ThickGary Dell Abate G.E.D. ,maybe the 2nd,
277816,1044423760775749732, ant ,Terf loves talking about it,
277817,1044423781906649229, ThickGary Dell Abate G.E.D. ,but anything after looks like a murder scene,
277818,1044423837401497650, ThickGary Dell Abate G.E.D. ,blood everywhere,
277819,1044423941810290688, bubu ,,
277820,1044423993077268551, ThickGary Dell Abate G.E.D. ,the train would not stop,
277821,1044424012807274586, ThickGary Dell Abate G.E.D. ,OH IT WOULDNT SLOWW DOWN,
