,uuid,user_name,text_clean,mentions_name
143510,1035627279222579252, ThickGary Dell Abate G.E.D. ,the military breeds sociopaths that turn into narcissists or just me,
143511,1035627302127669308, Alatar ,Also you talk down about yourself because what your doing violates some code that you ve heard in your life,
143512,1035627331768823879, ThickGary Dell Abate G.E.D. ,correct,
143513,1035627398936416336, Alatar ,A therapist would prob tell you to go towards more radical acceptance of yourself,
143514,1035627399561351198, wafflesource , Calibre39 I ve decided I m gonna have to pull up on u this weekend,['Calibre39']
143515,1035627413205434491, ThickGary Dell Abate G.E.D. ,i recently took a personality test and im not sure the results were great,
143516,1035627426748825652, Alatar ,You can skip the shrink and drop mushrooms though,
143517,1035627458248060999, wafflesource ,I m being bullied into stalking you to london,
143518,1035627464040390736, Richard A. BottomFeeder ,another piece of general advice that is 100 facts is dont argue.. just ask pointed questions,
143519,1035627484730888223, ThickGary Dell Abate G.E.D. ,i did the therapy weekly for a year,
143520,1035627516129448007, ThickGary Dell Abate G.E.D. ,now im just aware im an asshole,
143521,1035627521103888477, Alatar ,Male or Female,
143522,1035627534378860654, ThickGary Dell Abate G.E.D. ,male,
143523,1035627535167401984, Alatar ,lmfao,
143524,1035627614943064084, Trojanknight ,Isn t everyone,[' ThickGary Dell Abate G.E.D.']
143525,1035627640859668560, Alatar ,My advice not that it matters is to do what you want,
143526,1035627644408057907, ThickGary Dell Abate G.E.D. ,but there was too much fucked up shit so i couldnt tell him everthing,
143527,1035627664020602993, Alatar ,For the long term,
143528,1035627709029683330, Alatar ,Like I hate going to the gym I still go everyday,
143529,1035627719897124935, ThickGary Dell Abate G.E.D. ,yeah its all about me,
143530,1035627742139535370, ThickGary Dell Abate G.E.D. ,im in the gym rn,
143531,1035627747097194507, Alatar ,Becuase I like how I feel when I walk around shirtless and see myself in teh mirro,
143532,1035627800335499306, ThickGary Dell Abate G.E.D. ,im getting nice definition,
143533,1035627815162359881, ThickGary Dell Abate G.E.D. ,im going to look like khodz,
143534,1035627834464534538, ThickGary Dell Abate G.E.D. , kekw ,
143535,1035627843104804925, Alatar ,Isn t Khodz fat,
143536,1035627886352289914, ThickGary Dell Abate G.E.D. ,no,
143537,1035627904102563900, ThickGary Dell Abate G.E.D. ,i dont think so,
143538,1035627908296888370, Alatar ,Power lifter ,
143539,1035627912956739604, ThickGary Dell Abate G.E.D. ,i mean he ould be,
143540,1035627944854442075, ThickGary Dell Abate G.E.D. ,we all could be liars,
143541,1035627953050107984, ThickGary Dell Abate G.E.D. ,but that would be lame,
143542,1035627963078676491, Alatar ,I see everyone here as a larp,
143543,1035627997421641758, Alatar , I m up 37k in trading ,
143544,1035628081110589600, Alatar , Why would you ask me to show myself your new here ,
143545,1035628092267434126, ThickGary Dell Abate G.E.D. ,i made 20k once but i got lucky,
143546,1035628102665109564, ThickGary Dell Abate G.E.D. ,gme gang,
143547,1035628121040355358, ThickGary Dell Abate G.E.D. ,other than that im down,
143548,1035628140837478462, ThickGary Dell Abate G.E.D. ,but im up,
143549,1035628147938435202, Alatar ,I m up on the whole,
143550,1035628173611761704, Alatar ,I trade way less than everyone though,
143551,1035628201910751343, ThickGary Dell Abate G.E.D. ,therapy hours,
143552,1035628211075293225, ThickGary Dell Abate G.E.D. ,let it all out,
143553,1035628278951710810, Alatar ,My side piece has been telling me I m an asshole,
143554,1035628287227088977, ThickGary Dell Abate G.E.D. ,eth is back to 1500 my bags looking better,
143555,1035628315286978610, Alatar ,Might not get laid tonight,
143556,1035628343808229426, Alatar , FeelsStrongMan ,
143557,1035628381703778394, ThickGary Dell Abate G.E.D. ,im supposed to fuck my sb in public soon but she never has time,
143558,1035628430290587759, ThickGary Dell Abate G.E.D. ,wear that skirt pls,
143559,1035628457624862812, Alatar ,Depending on Tuesday communication I might deploy capital on tech indexes,
143560,1035628481830195312, ThickGary Dell Abate G.E.D. ,stay away from single moms,
143561,1035628484908814398, Calibre39 ,if you re up 37k on a trade you re ever taking dumb risk hit a fat lick or you re lakai,
143562,1035628593734238328, Alatar ,the thing is Lakai s so good with opsec he coul dhave lost everythign and you still wouldn t know,
143563,1035628692740784208, Alatar ,honestly the reason I made this alt is to model how I ve seen him conduct himself online,
143564,1035628753495281804, Calibre39 ,lakai is a smart man,
143565,1035628771644018822, Alatar ,I like him,
143566,1035628881694171156, Alatar ,right back at you dumbass,[' ThickGary Dell Abate G.E.D.']
143567,1035628900648243240, Alatar , kekw ,
143568,1035628944369655808, ThickGary Dell Abate G.E.D. ,exactly my point,['Alatar']
143569,1035629021402255400, ThickGary Dell Abate G.E.D. ,she so hot though,
143570,1035629071733882880, Alatar ,Dumb fuck like you won t rap it or pull out,
143571,1035629102784335942, ThickGary Dell Abate G.E.D. ,the trick is to date single moms of only one kid their body should still be ,
143572,1035629110363435008, Alatar ,And less than 3 kids they gonna take you for everythign,
143573,1035629134535204966, ThickGary Dell Abate G.E.D. ,she wont let me fuck raw i asked,
143574,1035629184753602701, Alatar ,If you re gonna have multiple baby moms and hcild support,
143575,1035629190394937394, ThickGary Dell Abate G.E.D. ,plan b gang,
143576,1035629203774783599, Alatar ,might as well have over 3 kids,
143577,1035629228047220837, ThickGary Dell Abate G.E.D. ,i do in some countrie,
143578,1035629233478844437, ThickGary Dell Abate G.E.D. ,s,
143579,1035629272557162526, ThickGary Dell Abate G.E.D. ,wonder how theyre doing,
143580,1035629346276253697, Alatar ,Nice,
143581,1035629374923354243, Alatar ,Alright I ve got some work to finish before EOW,
143582,1035629406087037008, Fuckboy ,Alatar s balance is 100 636 WSBux,
143583,1035629444859187310, Alatar ,My work is WSB Black jack.,
143584,1035629465407078511, HardHustle84 ,WHERES NANCY ,
143585,1035629510235803708, ThickGary Dell Abate G.E.D. ,if a woman has two kids that when the body starts to go,
143586,1035629541386899516, ThickGary Dell Abate G.E.D. ,but thats anecdotal i think,
143587,1035629821646082069, Alatar , weirdkekw ,['HardHustle84']
143588,1035629835827028098, Fuckboy ,Alatar s balance is 101 636 WSBux,
143589,1035629897797877850, Alatar ,I will increase bets to 1k at 150k I think,
143590,1035629910414348360, ThickGary Dell Abate G.E.D. ,you know too much who are u,
143591,1035629940479111258, ThickGary Dell Abate G.E.D. ,or are you a shadow,
143592,1035629963220627476, Alatar ,Not going to say,
143593,1035630005352411217, ThickGary Dell Abate G.E.D. ,i found you bhoodly,
143594,1035630037011013712, Alatar ,I keep telling Towelie I m digit,
143595,1035630091369197688, Griff ,WHERES NANCY ,['HardHustle84']
143596,1035630102484107414, Alatar ,I m gonna stop that though it seems to really mess with him,
143597,1035630151528091700, mik ,beating up her husband,
143598,1035630210277707799, ab tract ,,
143599,1035630217596764160, HardHustle84 ,HAMMER TIME ,
143600,1035630239054835792, Alatar ,she could beat me up with those calcium cannons any day,
143601,1035630298509082634, Griff ,so you re saying this homeless dude is the fall guy ,['mik']
143602,1035630427580411935, ThickGary Dell Abate G.E.D. ,pelosi probably had great tits,
143603,1035630502650052638, Market Junkie ,Well they brand new she just had them installed,
143604,1035630534405136444, ThickGary Dell Abate G.E.D. ,youre right,
143605,1035630570203521124, Market Junkie ,Go with her brand new facelift,
143606,1035630576419471451, ThickGary Dell Abate G.E.D. ,but that last pic looked saggy on the beach,
143607,1035630622737178745, Market Junkie ,100 ,
143608,1035630745164718150, Market Junkie ,Wait till February when she gets her ass implants installed,
143609,1035630770057916447, Griff ,ain t nothin wrong with some natural hangers,
143610,1035630783320309771, Griff , CatLick ,
143611,1035630849896493076, Alatar ,If I m going to do a 500 trading challenge account is WeBull or Robinhood better for that,
143612,1035630899091492945, Alatar ,Webull doesn t do fractional,
143613,1035630934663377086, Alatar ,But charting better I gues,
143614,1035631128381493350, ThickGary Dell Abate G.E.D. ,i remember watching you eat the chip on vc,
143615,1035631139672567848, ThickGary Dell Abate G.E.D. ,good times,
143616,1035631345197658163, Fuckboy , ThickGary Dell Abate G.E.D. s Candy Bag ,[' ThickGary Dell Abate G.E.D.']
143617,1035631366789931049, Fuckboy , Alatar s Candy Bag ,['Alatar']
143618,1035631382338211872, Fuckboy ,You make a meal of 1 star. You feel great Sickness has been reset ,[' ThickGary Dell Abate G.E.D.']
143619,1035631395382513664, Alatar , ThickGary Dell Abate G.E.D. teach me candies,[' ThickGary Dell Abate G.E.D.']
143620,1035631441352085554, Alatar ,trick or treat,
143621,1035631442971082872, Fuckboy ,Out this late at night ,['Alatar']
143622,1035631504807698512, Fuckboy , Alatar You received 19 ,['Alatar']
143623,1035631526362218546, Fuckboy ,Alatar s balance is 101 636 WSBux,
143624,1035631575641108622, ThickGary Dell Abate G.E.D. ,try to get to zero eat 96,['Alatar']
143625,1035631633396682833, ThickGary Dell Abate G.E.D. ,but below 40 sickness you cant see the sickness anymore,
143626,1035631750065430622, ThickGary Dell Abate G.E.D. ,so use chocolate or lollipop to get there and talking incessantly,
143627,1035631835801190462, ThickGary Dell Abate G.E.D. ,trick or treat every two hours for max candy,
143628,1035631836879147058, Fuckboy ,The thought of candy right now doesn t really sound like a good idea.,[' ThickGary Dell Abate G.E.D.']
143629,1035631961936502926, Market Junkie ,He did good leave him alone,
143630,1035632208234430524, BOOnewyears ,maybe it was his boyfriend who came over while Nancy was away with congress,['coolbeans']
143631,1035632293349441617, Market Junkie ,Yeah did you ever think about that,
143632,1035632323040919604, Market Junkie ,Makes sense to me,
143633,1035632426950590575, Market Junkie ,So what,
143634,1035632529606180894, Griff ,based ,['coolbeans']
143635,1035632560161697904, BOOnewyears ,also they said the cops showed up and found them fighting over the hammer ,
143636,1035632597545529345, BOOnewyears ,Who has to fight a 80 year old for a hammer ,
143637,1035632617489436683, Market Junkie ,Was he white ,
143638,1035632691007193219, mik ,pepe s razor. the funniest explanation is most often the correct explanation,['towelie']
143639,1035632731247362198, BOOnewyears ,I legit don t know apparently his name is David DaPepe but that soudns fake AF,['Market Junkie']
143640,1035632758376116254, Griff , pepe s razor degenkek ,
143641,1035632809433378946, Market Junkie ,Yeah sounds like an alias,['BOOnewyears  ']
143642,1035632855918845964, SixFigures ,trick or treat,
143643,1035632857097441391, Fuckboy ,The wind howls through the trees. Does it seem darker all of a sudden ,['SixFigures']
143644,1035632890270187622, Fuckboy , SixFigures s Candy Bag ,['SixFigures']
143645,1035632915045961768, Griff , David DaPepe either this is the funniest coincidence i ve ever seen or politicians are finally shitposting on the entire American populace,
143646,1035632931516973128, BOOnewyears ,apparently they get their faster than it takes an adult to kill an old skeleton,['coolbeans']
143647,1035632948050923630, Market Junkie ,We know it could not have been pyth she s too skinny,
143648,1035633026417311864, Lovelace ,that d be amazing,
143649,1035633069111119994, Lovelace ,david pepe probably has a facebook page too,
143650,1035633074995724380, ThickGary Dell Abate G.E.D. ,pyth,
143651,1035633101189156984, BOOnewyears ,maybe it was the cop who arrested him for his DUI,
143652,1035633116649357432, BOOnewyears ,and I assume fired,
143653,1035633174660776037, Alatar ,oh that s actually probably how they got his info,
143654,1035633206361329704, Alatar ,public record of the arrest and home address,
143655,1035633222496817294, Market Junkie ,It couldn t of been Rowow he was busy milking his pigs,
143656,1035633227307683953, Alatar ,and he was prob home because of the DUI,
143657,1035633278939574292, BOOnewyears ,if you own a home it s public info,['Alatar']
143658,1035633291597979739, Griff ,BREAKING NEWS THE PRESS HAS RELEASED PICTURES OF SAID ATTACKER AND HE FITS OUR WORST EXPECTATIONS,
143659,1035633320861642812, Alatar ,ya county clerks etc,['BOOnewyears  ']
143660,1035633322220593222, Griff ,,
143661,1035633346144899092, BOOnewyears ,if you own a house I can find where you live with your name and city,
143662,1035633361462497362, BOOnewyears ,for free anyone can,
143663,1035633413534781510, Alatar ,Ya,
143664,1035633447819026452, Market Junkie ,What if I rent with an option to buy,['BOOnewyears  ']
143665,1035633456153100368, Griff ,lmfao i m just shitposting a narrative kekw ,['towelie']
143666,1035633499513819287, Alatar ,You need to do cash sublet in order to stay under the radar,
143667,1035633522406338580, Alatar ,Dread Pirate Roberts did it well,
143668,1035633547890921602, BOOnewyears ,uhhh idk I m talking about normal people. You can also buy with an LLC,['Market Junkie']
143669,1035633592023392407, Alatar ,I think the only way you can stay anon legally is with Corporation,
143670,1035633627377184778, Market Junkie ,Whose Normal these days,['BOOnewyears  ']
143671,1035633664794562590, Richard A. BottomFeeder ,Only in Delaware LLcs,['Alatar']
143672,1035633674265301173, Alatar ,that s how a lot of real estate is owned through a corp for every building,
143673,1035633744570236948, Alatar ,tbh i don t know nearly as much about corporate structuring and sales agreements for law,
143674,1035633756750499891, BOOnewyears ,what if I m squattin on Indian land Can yer county clerks find me with their computas then ,
143675,1035633772055515217, Alatar ,i would have to pull stuff on the intdernet,
143676,1035633784416120942, Dashie , feelsbadman ,
143677,1035633795694612531, Market Junkie ,I buy it under my pets names,
143678,1035633872840429598, Alatar ,When I was on a res for non taxed cigarettes in college,['BOOnewyears  ']
143679,1035633873469575278, Griff ,no but the indian who s cranked on speed might come find you instead,['BOOnewyears  ']
143680,1035633898572497027, Richard A. BottomFeeder ,This only works in a handful of states Most require you to have a name on file with the LLc that is public,['Alatar']
143681,1035633915324543101, Alatar ,All the old drunk natives were talking about murdering white boys,
143682,1035633973507932161, Alatar ,I took the hint kept the gun under my leg while I drove off,
143683,1035633989618249758, Griff , drunk natives kind of repetitive innit ,
143684,1035634001987256430, Market Junkie ,Another LLC can own that LLC,['Richard A. BottomFeeder']
143685,1035634010606538792, BOOnewyears ,yeah dude they live off selling cigarates and fireworks to tourists,['Alatar']
143686,1035634058153185381, Market Junkie ,And booze,['BOOnewyears  ']
143687,1035634075748282438, Richard A. BottomFeeder ,Same deal you can just find a name on that LLC,['Market Junkie']
143688,1035634097294430339, BOOnewyears ,that fuels them,['Market Junkie']
143689,1035634103007059968, Alatar ,And they do not like the tourists,['BOOnewyears  ']
143690,1035634138067247275, Market Junkie ,Not if you have an offshore company owning the LLC,['Richard A. BottomFeeder']
143691,1035634162079633428, BOOnewyears ,No one likes tourists they just like their money,['Alatar']
143692,1035634185655828540, Griff ,some people needlessly form too many entities tho i ve seen that too many times in my profession,['towelie']
143693,1035634205247414392, Alatar ,Exactly,['BOOnewyears  ']
143694,1035634214692978708, mik ,do they still use bows,
143695,1035634222100140062, Richard A. BottomFeeder ,Yeah so we re talking about 1 of 1 ,['Market Junkie']
143696,1035634240764776509, Alatar ,No they strapped Mik,
143697,1035634264332574841, Alatar ,They got all the big guns,
143698,1035634294107947083, BOOnewyears ,in a lot of places you can bow hunt with way bigger limits,['mik']
143699,1035634298168029194, Griff ,no we don t. it s usually a flat fee,['towelie']
143700,1035634342568935504, BOOnewyears ,it s basically a challenge from the fish and game department,
143701,1035634342849953833, Market Junkie ,The ones who need to know know how to do it brother,['Richard A. BottomFeeder']
143702,1035634380850348102, mik ,nono i mean do they still primarily use bows. cause if they do we can just take over the res,
143703,1035634445086113903, james2 ,Trick or treat,
143704,1035634450379325520, Richard A. BottomFeeder ,Yeah I m not arguing that I m just saying that it s like super unlikely for an avg person,['Market Junkie']
143705,1035634459380305920, BOOnewyears ,no but they sell made in China ones,['mik']
143706,1035634460814737480, Fuckboy ,The house you were approaching just turned the light off.,['james2   ']
143707,1035634463864016956, Alatar ,I think if you vac seal and then mylar seal a gun after wiping it down you can t get caught by gun powder dogs,
143708,1035634467919908956, Griff ,charging by form is dumb. we charge based off budgeted hours for a return,['towelie']
143709,1035634513751052429, Alatar ,but none of my stuff is illegal,
143710,1035634538975596634, Alatar ,But that s how you do it for drugs,
143711,1035634665383526460, Griff ,they don t. we just look based off how complicated the return is how much input K 1 Sch C Sch F Sch E etc etc ,['towelie']
143712,1035634675999313944, james2 ,Griffinator Capitulation,
143713,1035634738733535293, BOOnewyears ,they stole that first scare shot for shot from blare witch,['coolbeans']
143714,1035634756529950721, Griff ,i don t want to take over the res. the res is a shithole i just want their government checks,['mik']
143715,1035634768739577907, Richard A. BottomFeeder ,Numb numb numb numb numb numb numb numb numb numb numb numb numb numb numb numb numb numb numb numb numb numb numb numb numb numb numb numb numb numb numb numb numb numb numb numb numb numb numb and Nanana Nana Nam Nam Nam Nam Nam Nam Nam Nam Nam Nam Nam Nam,
143716,1035634821495537674, Alatar ,Apparently in NYC you can have a conceal carry now assuming you pass a gun safety course,
143717,1035634858506072104, Alatar ,And don t take it into private establishments wihtout express permission,
143718,1035634858887757955, LevissimusRyan ,,
143719,1035634874465407006, Richard A. BottomFeeder ,NYC is a shit hole I ve lived here for two years,['Alatar']
143720,1035634921127030966, Alatar ,Where in the city ,['Richard A. BottomFeeder']
143721,1035634937698730064, chapo ,henlo,
143722,1035634955121864726, LevissimusRyan ,gm,
143723,1035634975766237275, Alatar ,Nice,
143724,1035634979406884966, mik ,gm,
143725,1035634996179910696, Alatar ,That place is a cash cow for my family,
143726,1035635005629673502, Griff , gm ,
143727,1035635068359671858, james2 ,Yea but ya can eat anytime a restaurant is open,
143728,1035635118896861287, Richard A. BottomFeeder ,Selling soon the apartment fees HOA are absurd,['Alatar']
143729,1035635128325644298, Alatar ,House s used to be like a 7 unit Brownstone for 79k,
143730,1035635161137676400, Alatar ,Now go for 7.8 Mil,
143731,1035635244818243634, chapo , Levissimus Ryan thumbsup ,['Levissimus Ryan ']
143732,1035635261100527766, Richard A. BottomFeeder ,The best setup was to buy in a building with commercial space on the ground fooor,['Alatar']
143733,1035635282445357145, Alatar ,Neighbors around the properties are UPS drivers that have 20m in assets,
143734,1035635323067191336, Alatar ,Do you know how CofO s work ,['Richard A. BottomFeeder']
143735,1035635358202871838, Alatar ,Or renting agreements for busineses ,
143736,1035635420307923004, Alatar ,Sales are also different in Manhattan than in other parts of the country,
143737,1035635480445857843, Griff ,mfw my state has open carry,
143738,1035635489077743686, Alatar ,And understanding the bueracracy is the only way you can make it in the market,
143739,1035635523122905180, chapo , sadKEK ,['xLucifer    ']
143740,1035635534527213678, Alatar ,NYC Real Estate is cut throat,
143741,1035635581432123513, oxlithiumxo ,Trick or treat dawg,
143742,1035635582765903873, Fuckboy ,Well I think this is the last of it. Go ahead and take it.,['oxlithiumxo']
143743,1035635621991026748, xLucifer ,,
143744,1035635641196744794, Fuckboy , oxlithiumxo You received 13 ,['oxlithiumxo']
143745,1035635676349206558, Fuckboy , oxlithiumxo s Candy Bag ,['oxlithiumxo']
143746,1035635687908712478, Fuckboy ,You found 459 ,['chapo']
143747,1035635709018640404, chapo ,Trick or treat,
143748,1035635710427930695, Fuckboy ,Go ahead take a few.,['chapo']
143749,1035635745295175771, Fuckboy ,You monstrously pig out on 1 star. You feel great Sickness has been reset ,['oxlithiumxo']
143750,1035635754900148366, LevissimusRyan , thumbsup ,['chapo']
143751,1035635772264550521, Fuckboy ,You eat 87 candies. Total eaten 1 621 ,['oxlithiumxo']
143752,1035635777536798760, Fuckboy , chapo You received 10 BONUS 2 ,['chapo']
143753,1035635834529001603, Richard A. BottomFeeder ,You fucking idiots dpammming random shit pisses me off,
143754,1035635870121865307, Fuckboy , ThickGary Dell Abate G.E.D. s Candy Bag ,[' ThickGary Dell Abate G.E.D.']
143755,1035635871476613240, Fuckboy , L for your information I dont care L ,
143756,1035635883107430434, Fuckboy ,,
143757,1035635884302794883, Fuckboy ,You found 123 ,
143758,1035635894784376913, LevissimusRyan ,trick or treat,
143759,1035635896730521731, Fuckboy ,Aww look at you. Here take this.,['Levissimus Ryan ']
143760,1035635904791974022, ThickGary Dell Abate G.E.D. ,we had a trick or treat channel,
143761,1035635926006767676, xLucifer ,,
143762,1035635930620502077, Fuckboy ,You stole 70 from Swolsby 7196 ,
143763,1035635974773936168, Fuckboy , Levissimus Ryan You received 19 BONUS 2 BONUS 2 ,['Levissimus Ryan ']
143764,1035635984890613760, Fuckboy , Levissimus Ryan s Candy Bag ,['Levissimus Ryan ']
143765,1035636007388844084, ThickGary Dell Abate G.E.D. ,i dont think so either,['towelie']
143766,1035636018445037649, Alatar ,idk how to work the trick or treat,
143767,1035636023004237874, Alatar ,but whatever,
143768,1035636034085593208, Fuckboy , chapo s Candy Bag ,['chapo']
143769,1035636050229465188, Alatar ,i also lost 6k in black jack,
143770,1035636072752873482, Alatar ,only up 90k toda,
143771,1035636074044731518, chapo ,You say trick or treat,['Alatar']
143772,1035636100565315655, Alatar ,trick or treat,['chapo']
143773,1035636101773279302, Fuckboy ,It s starting to get late.,['Alatar']
143774,1035636136049119323, Fuckboy , Alatar s Candy Bag ,['Alatar']
143775,1035636188645695499, Alatar ,Gary gave me instructions but i don t understnd them,
143776,1035636248775237723, LevissimusRyan ,anyone else see that,
143777,1035636333001068614, Alatar ,Levissimus now yt names,
143778,1035636355620933684, Alatar ,1 of us,
143779,1035636408758566962, LevissimusRyan ,wrong wsb diamondhands is light gray,
143780,1035636458821800066, Alatar ,How do you get that one ,
143781,1035636461678121120, LevissimusRyan ,also what is this,
143782,1035636532461183047, Alatar ,idk man you spend way more time here,
143783,1035636570155384913, LevissimusRyan ,apparently not,
143784,1035636634760249474, Alatar ,watch your mouth or get bonked,
143785,1035636656079904850, Alatar , bonk ,
143786,1035636666792165446, chapo , Levissimus Ryan what s your shoesize,['Levissimus Ryan ']
143787,1035636680520126474, LevissimusRyan ,besides you created your accounted 24 days ago been here for 6 of which I was gone for most of it,
143788,1035636694118039642, LevissimusRyan ,so who are you,
143789,1035636745515049030, Alatar ,I am Legion,
143790,1035636772492816505, LevissimusRyan ,good talk,
143791,1035636796496822352, LevissimusRyan ,lemme check,['chapo']
143792,1035636806047244328, Alatar ,Splendid Discourse,
143793,1035636913320775780, Alatar ,killas in the jungle,
143794,1035637122633310229, RighteousandWrath22 ,Trick or treat,
143795,1035637124294246421, Fuckboy , I hear the next door neighbors have some pretty good candy too this year. ,['RighteousandWrath22']
143796,1035637190023184496, Fuckboy , RighteousandWrath22 You received 16 BONUS 5 BONUS 2 ,['RighteousandWrath22']
143797,1035637190937554994, Dashie ,Money money,
143798,1035637196297883688, Dashie , feelsbadman ,
143799,1035637224412287126, Fuckboy ,You found 17 ,['RighteousandWrath22']
143800,1035637696560894042, Fuckboy ,You found 70 ,['SixFigures']
143801,1035637766496731146, LevissimusRyan ,the ones I have with me are 44 idk about my other shoes I m not home,['chapo']
143802,1035637773215989781, LevissimusRyan ,why,
143803,1035637823514103848, LevissimusRyan , 44 europe ,
143804,1035637838978494494, LevissimusRyan ,Idk what that is in burger,
143805,1035638213919899739, chapo ,damn,['Levissimus Ryan ']
143806,1035638226955800666, chapo ,im 42.5,
143807,1035638246979420202, chapo ,you know what they say,
143808,1035638277304221766, chapo ,long foot long dong,
143809,1035638366152167534, LevissimusRyan ,not wrong peepoclassy ,
143810,1035638426898276432, wildboarz ,Oh shit a Canadian tried to kill Pelosi,
143811,1035638614878588978, ScottieRippen ,what s this shit about anti semen,
143812,1035638817593491559, Fuckboy ,You snuck around for a while but didn t find anything.,
143813,1035638856432758855, Fuckboy ,You found 38 ,['Miss Mu k']
143814,1035638878675157042, Miss Mu k ,trick or treat,
143815,1035638883838349422, Fuckboy ,Oh hello. What a cute costume. Here have some candy.,['Miss Mu k']
