,uuid,user_name,text_clean,mentions_name
428511,1054033690348503081, NickJ ,thats why I specifically tagged TM,['CollinFerr9']
428512,1054033729162584134, Gene ,you need shots to go to public school ,
428513,1054033754663956611, Gene ,pretty sure that s always been a thing.,
428514,1054033758338154557, CollinFerr9 ,He s 70 ,['NickJ']
428515,1054033832321486909, NickJ ,he d appreciate it,['CollinFerr9']
428516,1054033868077944914, Barclays , ,['Gene']
428517,1054033946452709416, CollinFerr9 ,There are some shots you already have to take for school and work,
428518,1054033966505664612, CollinFerr9 ,Like HBV,
428519,1054033978782384201, Barclays , ,
428520,1054033987414261840, Gene ,yeah people saying mah religion prevents this doesn t extend to spreading biohazard material to everyone... if your religion allows you to spread a plague which Christianity doesn t then your religion is wrong.,
428521,1054034049615806494, Gene ,no one gives a shit you ve already needed many shots to get into school,['Barclays']
428522,1054034113457295370, Gene ,,
428523,1054034149326983229, CollinFerr9 ,We already have mandatory shots we have to take for school work military,
428524,1054034225080307842, Gene ,yeah but this covidiot thinks his virus is special,
428525,1054034325231898714, CollinFerr9 ,When there s a virus that caused a pandemic like covid did then of course they re going to make it mandatory,
428526,1054034391610970202, Stupidisco ,,
428527,1054034392030400613, CollinFerr9 ,I just don t like mRNA vax,
428528,1054034453980258465, Gene ,if you don t like it you don t have to use public services.,
428529,1054034466215055410, CollinFerr9 ,Make your immune cell attack your own healthy cells,
428530,1054034531616817213, Gene ,i think that s misinformation tho,
428531,1054034558498119680, CollinFerr9 ,Come up with a safer vax and I ll take it,
428532,1054034595533828187, CollinFerr9 ,You re questioning science now ,
428533,1054034634108850207, Stupidisco ,,
428534,1054034700840214568, Gene , what science ,['CollinFerr9']
428535,1054034759254294528, Gene ,show me a .gov link where it shows it attacks your own healthy cells ,
428536,1054034760051195964, CollinFerr9 ,Do you not know how mRNA vax work ,['Gene']
428537,1054034794381594654, Stupidisco ,,
428538,1054034810315739156, CollinFerr9 ,Oh my god.,
428539,1054034855702302721, Stupidisco ,why would they need blood thinning meds for kids if the vaxx was good ,
428540,1054034873016393868, CollinFerr9 ,Don t tell me you didn t read up on mRNA vax before you took it,
428541,1054034893409091584, CollinFerr9 , kekw ,
428542,1054034958634733651, Gene ,you think reading your highschool level blogs about shit is gonna inform you ,['CollinFerr9']
428543,1054034985746702396, Gene , An mRNA vaccine is a type of vaccine that uses a copy of a molecule called messenger RNA mRNA to produce an immune response.,
428544,1054034994718318652, Stupidisco ,the covid vaxxes was one of the biggest psyops to ever be conducted.,
428545,1054035021977092137, Gene , The vaccine delivers molecules of antigen encoding mRNA into immune cells which use the designed mRNA as a blueprint to build foreign protein that would normally be produced by a pathogen such as a virus or by a cancer cell. These protein molecules stimulate an adaptive immune response that teaches the body to identify and destroy the corresponding pathogen or cancer cells,
428546,1054035022375551017, CollinFerr9 ,You idiot. Go look up peer reviewed articles,['Gene']
428547,1054035062619902043, Gene ,i have you big dummy they were all open sourced.,['CollinFerr9']
428548,1054035100532215869, CollinFerr9 ,Into immune cells ,['Gene']
428549,1054035116286029884, CollinFerr9 ,HAHAHAHAHHAHAHAHAHHA,
428550,1054035123265359932, Gene ,And not a single one of them said herp derp mrna attacks healthy cells ,
428551,1054035167402012683, Stupidisco , ,
428552,1054035182941917354, CollinFerr9 ,Oh that s great,
428553,1054035235366514749, CollinFerr9 ,You read that shit from Facebook,
428554,1054035253318127667, CollinFerr9 ,From an unknown source,
428555,1054035282409832538, Gene ,,
428556,1054035390069223434, Gene ,sounds like you re the one sourcing your arguments from facebook honestly.,['CollinFerr9']
428557,1054035414224228423, CollinFerr9 ,mRNA vax don t deliver mRNA to immune cells you idiot,
428558,1054035455638781962, CollinFerr9 ,If you learned immunology 101 you would know that,
428559,1054035496281587752, MySpaceTom ,I love when scientists argue,
428560,1054035555756806175, Stupidisco ,mRNA reprograms your cells to produce the vaccine ,
428561,1054035584064172032, Gene , However peptides often suffer from suboptimal immune activation due to the short length of amino acid sequences providing epitopes to the immune cells.,
428562,1054035630843244645, Stupidisco ,now this vaccine neither stops transmission nor does it give you immunity.,
428563,1054035658538229770, Stupidisco ,So fuck the vaxx,
428564,1054035742889869372, Pusherman ,,
428565,1054035778663088209, Gene , Myth The mRNA vaccines change your DNA and could cause cancer. Truth None of the vaccines interact with or alter your DNA in any way and therefore cannot cause cancer. Messenger RNA mRNA is not the same as DNA and cannot be combined with DNA to change your genetic code.,
428566,1054035806349697134, CollinFerr9 ,It delivers mRNA to healthy cells,['Gene']
428567,1054035827673530459, CollinFerr9 ,Go back to high school,
428568,1054035911379259523, Gene ,go back to facebook dude,
428569,1054036006795476992, MySpaceTom ,High school Facebook,
428570,1054036026668097616, Gene , MYTH COVID 19 vaccines can alter my DNA. FACT COVID 19 vaccines do not change or interact with your DNA in any way.,
428571,1054036034826022983, CollinFerr9 ,Bruh I worked in the industry,
428572,1054036039485886544, Gene ,Both messenger RNA mRNA and viral vector COVID 19 vaccines work by delivering instructions genetic material to our cells to start building protection against the virus that causes COVID 19. After the body produces an immune response it discards all the vaccine ingredients just as it would discard any information that cells no longer need. This process is a part of normal body functioning. The genetic material delivered by mRNA vaccines never enters the nucleus of your cells which is where your DNA is kept. Viral vector COVID 19 vaccines deliver genetic material to the cell nucleus to allow our cells to build protection against COVID 19. However the vector virus does not have the machinery needed to integrate its genetic material into our DNA so it cannot alter our DNA.,
428573,1054036047387959386, CollinFerr9 ,I know my shit,
428574,1054036085593866251, Gene ,no one cares what the janitor thinks,
428575,1054036163939278858, CollinFerr9 ,You re such an idiot Thanks for making my morning,
428576,1054036178904551424, CollinFerr9 , kekw ,
428577,1054036209216794755, CollinFerr9 ,mRNA into immune cells,
428578,1054036221128605746, CollinFerr9 ,AHHAHAHAHAHAHHAHAHA,
428579,1054036277734932510, Gene ,Hey when you die of covid it ll be funny because I told you so ,
428580,1054036345347112990, CollinFerr9 ,Doesn t even know that LNPs they have mostly targets liver,
428581,1054036364745777233, CollinFerr9 ,AHHAHAHAHHAHAHAHAHHAHA,
428582,1054036384802951179, CollinFerr9 , kekw ,
428583,1054036408161022035, Gene ,Anti vaxers dumb,
428584,1054036411596144711, Gene , ,
428585,1054036447210000584, Gene ,your IQ is no larger than your shoe size,
428586,1054036483692040192, CollinFerr9 ,Main reason why many current LNP therapies target liver,
428587,1054036520417378435, CollinFerr9 ,Facebook kid thinks he knows more than a scientist,
428588,1054036530332708877, CollinFerr9 , kekw ,
428589,1054036548808622210, Gene ,i d argue that facebook has reverted into middle school,['MySpaceTom']
428590,1054036588138602577, CollinFerr9 ,Thanks I needed that laugh,
428591,1054036661706694737, Gene ,oh yeah i d love to hear about your theoretical degree of medicine,['CollinFerr9']
428592,1054036961364557835, CollinFerr9 ,Here s a pop quiz how do immune cells get primed ,['Gene']
428593,1054037018956529735, Gene ,here s a pop quiz how are you this fucking stupid ,['CollinFerr9']
428594,1054037076301070388, CollinFerr9 ,It s a simple question you claim to know science,['Gene']
428595,1054037132844474478, Gene ,Go on show me your theoretical degree,['CollinFerr9']
428596,1054037176289067038, CollinFerr9 ,No please go on Dr. Facebook,
428597,1054037176997916725, Fuckboy ,Correct You got 155002 WSBux ,
428598,1054037189614383164, Gene ,24,
428599,1054037208799121500, CollinFerr9 ,How do immune cells get primed ,
428600,1054037234518605884, Gene ,oh so you were making up bullshit nice.,['CollinFerr9']
428601,1054037261903208488, CollinFerr9 ,That s what I though,
428602,1054037279284400259, Barclays ,,
428603,1054037299542884462, CollinFerr9 ,Don t know Jack shit spreading Facebook misinformation,
428604,1054037310620041216, Gene ,Look at this kid with his theoretical degree in medicine.,
428605,1054037355293593620, CollinFerr9 , MRNA GOES INTO IMMUNE CELLS ,
428606,1054037359693418548, Gene ,you also wear your pants on your head... so not a big deal,['CollinFerr9']
428607,1054037367343816815, CollinFerr9 ,HAHAHAHAHHAHAHAHAHHAHAHA,
428608,1054037382279741491, CollinFerr9 , kekw ,
428609,1054037438730875050, s76.Petunia ,Y all still talking about the vaccine ,
428610,1054037483396018298, CollinFerr9 ,I m here with dr Facebook,
428611,1054037511816609875, CollinFerr9 ,He s posting random shit on here,
428612,1054037517093060689, s76.Petunia ,There s more important things at hand rn,
428613,1054037530951041075, s76.Petunia ,Like,
428614,1054037577302278174, Gene , Adjuvants trigger PRRs on adaptive immune cells and depending on which type of PRR an adjuvant aims to activate different routes of immune responses are elicited.,
428615,1054037595560095785, s76.Petunia ,How many pieces on a slice of pizza is perfect,
428616,1054037615810195606, s76.Petunia ,I think 8,
428617,1054037624760844430, Gene ,depends on the size of pizza,['s76.Petunia']
428618,1054037626052689981, CollinFerr9 ,8,['s76.Petunia']
428619,1054037629999521862, s76.Petunia , valid ,
428620,1054037692079419483, mik ,this is a psyop don t let her distract you,['s76.Petunia']
428621,1054037695850090546, Gene ,if you have an 8 pizza that s fewer slicers than a 30 pizza,['s76.Petunia']
428622,1054037725659013272, CollinFerr9 ,Yes keep looking through Facebook you will find the answer to my pop quiz Q,['Gene']
428623,1054037739709939753, CollinFerr9 , kekw ,
428624,1054037797205450832, s76.Petunia , peeposcreech I will lick your toes Mikky,['mik']
428625,1054037815320641596, mik ,gross,
428626,1054037819238121552, Gene ,you really love your fake degree don t you ,['CollinFerr9']
428627,1054037854566764564, s76.Petunia ,Is there math to this ,['Gene']
428628,1054037880898588723, MySpaceTom ,Agree. I prefer a pizza that ass tho,['s76.Petunia']
428629,1054037887416541275, CollinFerr9 ,What was that Dr Facebook ,['Gene']
428630,1054037897831006308, CollinFerr9 , kekw ,
428631,1054037899559047219, Gene ,there could be.,['s76.Petunia']
428632,1054037950989611098, s76.Petunia ,Pepperonis should be proportional to the slice,
428633,1054037963341828187, s76.Petunia , LETSFUCKINGO ,
428634,1054038005079343106, s76.Petunia , ,['Gene']
428635,1054038008686444624, Gene ,it s amazing because i haven t logged into facebook in like 2 3 years and even that was for a grand total of 10 hours. Before that in the past decade about 0 hours total ,['CollinFerr9']
428636,1054038038952546424, Pusherman , NickJ update on the guy who got his cylinder stuck in an m m bottle,['NickJ']
428637,1054038049442508831, CollinFerr9 ,I d prefer more meat than veggies on my pizza,
428638,1054038059458494478, Gene ,but go on projecting about your feelings Mr. Facebook man.,
428639,1054038065749966849, Fuckboy , You have just given mik a reputation point ,['mik']
428640,1054038070976069642, s76.Petunia ,Tom love kekw ,['MySpaceTom']
428641,1054038087317078016, CollinFerr9 ,Disproportionately,
428642,1054038111409160192, Fuckboy , You have just given leash a reputation point ,['leash']
428643,1054038130329669642, Gene ,it s funny you project your knowledge coming from facebook instead of actual academia.,['CollinFerr9']
428644,1054038151133401168, CollinFerr9 ,Go waste time spreading your Facebook knowledge else where Dr. Facebook,['Gene']
428645,1054038152530112563, Fuckboy ,,
428646,1054038163846336542, Gene ,so far you ve provided zero actual academic knowledge ,
428647,1054038168602681386, Fuckboy ,Your fortune is ,
428648,1054038168753672252, mushu ,None I like to eat my pizza like a cookie,['s76.Petunia']
428649,1054038169961644072, Fuckboy ,Lucky numbers Lotto 34 38 01 07 40 06 Daily numbers Pick3 707,
428650,1054038175024152638, CollinFerr9 ,Nobody buys your misinformation,
428651,1054038185568649246, CollinFerr9 , kekw ,
428652,1054038190169796618, Gene ,get covid and die fucker,['CollinFerr9']
428653,1054038229009047653, MySpaceTom ,Why are there so many scientists here today ,
428654,1054038247682093126, leash ,811,
428655,1054038274781499403, s76.Petunia , Hmm ,['mushu']
428656,1054038277209985076, CollinFerr9 ,All you ve done is copy and paste random shit,['Gene']
428657,1054038280741593169, Pusherman ,8 11,
428658,1054038283216236675, Gene ,there s not it s just an anti vaxer troll,['MySpaceTom']
428659,1054038287154696254, Pusherman , prayge ,
428660,1054038319241121934, s76.Petunia ,Gm Aunty cozypepe ,['leash']
428661,1054038344968970311, CollinFerr9 ,And claimed mRNA goes into immune cells like an idiot,
428662,1054038358927626261, CollinFerr9 , kekw ,
428663,1054038397263556618, Gene , The vaccine delivers molecules of antigen encoding mRNA into immune cells,
428664,1054038409011810384, leash ,gm sweetie cozypepe ,['s76.Petunia']
428665,1054038531837804564, CollinFerr9 ,AHHAHAHAHAHHAHAHA,['Gene']
428666,1054038565278982194, Gene , Indeed TFH cells have been identified as a critical population of immune cells that vaccines must activate in order to generate potent and long lived neutralizing antibody responses particularly against viruses that evade humoral immunity,
428667,1054038619855274104, ChiefEagly , stocks and options is currently recruiting serious traders. Invitations are by walk in and bullying has been toned down for two weeks to help you adjust. We are serious like minded traders and look forward to your insights. It s a tough market out there but together we can prosper. The Gae Baers Only rule has been lifted and We are also welcoming females and lgbtqia for the first time. stocks and options,
428668,1054038641111998525, Gene , mRNA vaccines a new era in vaccinology,
428669,1054038667531923516, Stupidisco ,,
428670,1054038697571516466, Gene ,Pardi N. Hogan M. Porter F. et al. mRNA vaccines a new era in vaccinology. Nat Rev Drug Discov 17 261 279 2018 . doi.org 10.1038 nrd.2017.243,
428671,1054038738113679420, CollinFerr9 ,2018,
428672,1054038744388358307, Gene ,fuck the uk,['ChiefEagly']
428673,1054038757461999616, CollinFerr9 ,AHHAHAHAHHAHAHAHAH,
428674,1054038767712878692, CollinFerr9 , kekw ,
428675,1054038786717253712, Gene ,i need you to go suck on my left nut,['CollinFerr9']
428676,1054038825619439706, master oogway ,Daily meter. Energy prices here are getting ridiculous,
428677,1054038859870126120, CollinFerr9 ,Dr. Facebook check on my nuts,['Gene']
428678,1054038872297840690, Gene ,Come on your theoretical degree holder.,
428679,1054038880585777174, CollinFerr9 ,While I cough,
428680,1054038893609095228, Gene ,suck on my nut ,['CollinFerr9']
428681,1054038898570973284, NickJ ,,['Pusherman']
428682,1054038935933820990, CollinFerr9 , mRNA does into immune cells ,
428683,1054038953210155078, CollinFerr9 ,HAHAHAHAHHAHAHAHHA,
428684,1054038967181377677, Gene ,you don t want science you don t want evidence you just want to be an anti vaxing idiot.,
428685,1054039018637115442, Pusherman ,hes gonna have to come back from like 50 0 on his last game as redemption,['NickJ']
428686,1054039101965340762, Gene , TFH cells have been identified as a critical population of immune cells that vaccines must activate in order to generate potent and long lived neutralizing antibody responses Pardi N. Hogan M. Porter F. et al. mRNA vaccines a new era in vaccinology. Nat Rev Drug Discov 17 261 279 2018 . doi.org 10.1038 nrd.2017.243,['CollinFerr9']
428687,1054039104314163200, CollinFerr9 ,Yes you want Facebook,['Gene']
428688,1054039119438819398, NickJ , ,['Pusherman']
428689,1054039170873565327, Gene ,dude fuck off you keep using stupid ass lame insults like facebook when obviously you re the one on facebook,['CollinFerr9']
428690,1054039200330174484, Gene ,you gotta get off social media and pick up a research paper dude,
428691,1054039214037155872, CollinFerr9 ,He thinks vaccines directly activate immune cells,['Gene']
428692,1054039229728039004, CollinFerr9 ,AHHAHAHAHAHHAHAHAHHA,
428693,1054039249214783578, Gene ,if it s not sourced with a digital object identifier you re a fucking idiot,
428694,1054039261051113542, NickJ ,why are you guys fighting over covid vaccines in 2022,
428695,1054039284920897566, NickJ ,no one gives a fuck,
428696,1054039296807546931, NickJ ,shut up lmao,
428697,1054039309935706253, CollinFerr9 ,You re such an idiot who thinks mRNA goes into immune cells,
428698,1054039318555004978, Gene ,he s an anti vaxer idiot.,
428699,1054039350972792853, CollinFerr9 ,And can t even explain simply how immune cells get primed,
428700,1054039370564370442, Jimmy booba ,christmas just a week away ,
428701,1054039372099497995, MySpaceTom ,Yeah please scientist just shut up,
428702,1054039373974351892, Gene ,he legit thinks he s smarter than all the doctors in the world.,
428703,1054039400415244378, CollinFerr9 ,Dr. Facebook stfu,
428704,1054039432468123648, NickJ ,cool let him do his shit,
428705,1054039451204063292, s76.Petunia , NickJ You like pepperoni pizza ,['NickJ']
428706,1054039457646518422, CollinFerr9 ,That s all you copying pasting desperately,['Gene']
428707,1054039460259569705, NickJ ,youre not going to change his mind,
428708,1054039470971813930, Gene ,let anti vaxers be idiots ,
428709,1054039516966572043, NickJ ,yeah who doesnt ,['s76.Petunia']
428710,1054039518753325136, Pusherman , mik found ur twitter acct ,['mik']
428711,1054039553343762495, Gene ,i guess that s kinda a self solving problem aint it ,
428712,1054039577737838703, Gene ,anti vaxers don t get vaccines they die off ezpz win.,
428713,1054039598491246622, CollinFerr9 ,Says the idiot who can t even explain how immune cells get primed,['Gene']
428714,1054039608867950633, TM17 ,Same,['NickJ']
428715,1054039610117857360, CollinFerr9 , kekw ,
428716,1054039663855272018, s76.Petunia ,Okay so what s a good amount of pepperonis on a slice of pizza ,['NickJ']
428717,1054039672155803698, Jimmy booba ,when it comes to vaccines i generally just trust the scientists,
428718,1054039679692963912, Jimmy booba ,that being said,
428719,1054039695782314044, Gene ,my wife picks the pepperonis off the pizza.,['NickJ']
428720,1054039699599142962, Finalwoes ,italians,['NickJ']
428721,1054039722672017518, NickJ ,depends on the size,['s76.Petunia']
428722,1054039722894295051, Jimmy booba ,i can t be asked to get the flu shot every year when it doesn t work most of the time,
428723,1054039743714832435, MySpaceTom ,I like my pizza the way I like my women. Pepperoni nipples,
428724,1054039758428454982, Finalwoes ,zero,['s76.Petunia']
428725,1054039770931675209, NickJ ,its not a specific number id say its a percent game,
428726,1054039781924946002, s76.Petunia ,Ban,[' Finalwoes ']
428727,1054039795065704560, Gene ,flu shot prevents you from getting sick 6 different times.,['Jimmy booba']
428728,1054039823905738822, Jimmy booba ,i m starting to grow boobs a little,['MySpaceTom']
428729,1054039840938807336, CollinFerr9 ,Just give me more meat than veggies on mine,
428730,1054039841249181736, s76.Petunia ,True I agree valid ,['NickJ']
428731,1054039860018683956, Jimmy booba ,ok well it also makes my arm hurt so,['Gene']
428732,1054039877362130984, Finalwoes ,0 works too,
428733,1054039908240609342, MySpaceTom ,Nice keep Up the good work,['Jimmy booba']
428734,1054039908437741659, Gene ,don t rub your arm after the injection.,
428735,1054039914716598383, Gene ,move it around your entire arm around.,
428736,1054039964909838427, NickJ ,italians are just french people with spaghetti,[' Finalwoes ']
428737,1054039977723445249, Jimmy booba ,i unfortunately can t have pizza anymore,['MySpaceTom']
428738,1054039979409539152, CollinFerr9 ,Great more Dr. Facebook speech,
428739,1054039981565423687, NickJ ,literally irrelevant,
428740,1054039996329361491, Jimmy booba ,not good pizza,
428741,1054040035927805953, Jimmy booba ,i could theoretically have pizza with fake cheese,
428742,1054040056098209842, Jimmy booba ,but nobody wants that ,
428743,1054040086896967700, Gene ,man you love sucking on Zucc s nuts don t you facebook lives in your head rent free... where zucc is there fucking your mom,['CollinFerr9']
428744,1054040098716520519, CollinFerr9 ,That s a travesty,
428745,1054040109286166628, Finalwoes ,people have been sent to jail for less,['NickJ']
428746,1054040122510803005, s76.Petunia ,I think we need to figure out the math for a perfect pizza at all sizes LETSFUCKINGO ,
428747,1054040123647467520, CollinFerr9 ,Fake cheese should be banned,
428748,1054040125518135410, MySpaceTom ,Oh do u have that dairy allergy,
428749,1054040144023400450, Jimmy booba ,yeah,['MySpaceTom']
428750,1054040160553144451, Gene ,why ,['s76.Petunia']
428751,1054040192287260813, CollinFerr9 ,Depends on your preference,['s76.Petunia']
428752,1054040207286075465, s76.Petunia ,More important than vaccine talk,['Gene']
428753,1054040215846650028, s76.Petunia , santakek ,
428754,1054040217369198722, Jimmy booba ,and also eating disorder that makes me not want to eat meat or most vegetables,
428755,1054040234385485834, CollinFerr9 ,I d say let everyone decide what perfect pizza is,
428756,1054040273761607720, jpow ,Pineapple pizza,['CollinFerr9']
428757,1054040284998139955, Augustus Octavian Caesar ,math for perfect pizza is elementary geometry,['s76.Petunia']
428758,1054040286709424291, MySpaceTom ,I like deep dish,
428759,1054040294569558066, Jimmy booba ,in other words i have a typical tran knee diet,
428760,1054040304459722802, Augustus Octavian Caesar , ,
428761,1054040324621733888, Finalwoes ,murrica food culture is literally the bottom of the barrel specially pizza wise.,
428762,1054040333878571038, Gene ,hmm. you just need a pretty simple formula to take the entire area of the pizza and figure out how much you want in a slice,['s76.Petunia']
428763,1054040362341105675, s76.Petunia ,I like Alfredo pizza,['MySpaceTom']
428764,1054040371123998800, CollinFerr9 ,Dr. Facebook please copy and paste more random useless facts you know nothing about,['Gene']
428765,1054040385317515384, CollinFerr9 , kekw ,
428766,1054040407924822107, Gene ,So many folks think 2x 12 pizzas are larger than an 18 pizza,
428767,1054040408033857546, mik ,pineapple and sriracha,
428768,1054040424551026758, MySpaceTom ,Yup. Saucy,['s76.Petunia']
428769,1054040478057758781, s76.Petunia ,I still need to try this,['mik']
428770,1054040502489591829, Gene , useless facts confirmed that you love his nuts.,['CollinFerr9']
428771,1054040506209939486, CollinFerr9 ,You re a pineapple pizza eater ,['mik']
428772,1054040508139311215, Augustus Octavian Caesar ,eggplant pizza pineapple pizza,
428773,1054040532797632514, MySpaceTom ,Hot take dominos is trash,
428774,1054040537595904010, NickJ , why ,['s76.Petunia']
428775,1054040596806914108, Gene , define fact noun. something that has actual existence a matter of objective reality.,
428776,1054040605250039858, s76.Petunia ,Just bc you cum on a pizza doesn t make it a sauce,['Augustus Octavian Caesar']
428777,1054040641581105242, Jimmy booba ,maybe when i actually have significant boobage i ll start selling pics or something,['MySpaceTom']
428778,1054040642260566018, CollinFerr9 ,Meat and mush room pineapple,
428779,1054040648979861564, s76.Petunia , Why not ,['NickJ']
428780,1054040669510971412, NickJ ,dont,['s76.Petunia']
428781,1054040676867776532, Barclays ,,
428782,1054040687290618006, NickJ ,dont make pizza horny,
428783,1054040694924263536, s76.Petunia , pepeevil ,['NickJ']
428784,1054040696258056242, Finalwoes ,you cum on your eggplant pizzas ,['s76.Petunia']
428785,1054040752793075763, CollinFerr9 ,You could,
428786,1054040776423780443, s76.Petunia ,Of course,[' Finalwoes ']
428787,1054040789396770846, CollinFerr9 ,Doesn t mean you should,
428788,1054040792525709362, s76.Petunia ,All the time,
428789,1054040800197083157, s76.Petunia , LOL ,
428790,1054040819100815521, CollinFerr9 ,You disgust me.,
428791,1054040832979775488, Finalwoes , xdd ,
428792,1054040844849664010, Finalwoes , snazz ,
428793,1054040862637690961, s76.Petunia , snazz ,['CollinFerr9']
428794,1054040911597805578, MySpaceTom ,Id fuck a pizza. Give a whole new meaning to stuffed crust,
428795,1054040923656437791, s76.Petunia ,Welp imma go make some tea,
428796,1054040937787048057, s76.Petunia , cozypepe ,
428797,1054040944443392041, NickJ ,,
428798,1054040957919694922, Finalwoes ,dont cum on the tea pls,
428799,1054040969969926184, Augustus Octavian Caesar ,wife material,['s76.Petunia']
428800,1054040974218760202, Gene ,coffeeee,['s76.Petunia']
428801,1054040989750272091, Finalwoes ,use milk instead,
428802,1054040991360893029, Augustus Octavian Caesar ,stfu gene,
428803,1054041000022114314, Augustus Octavian Caesar ,you fucking loser,
428804,1054041018925846570, s76.Petunia , ,
428805,1054041024617529446, Gene ,you re mad,['Augustus Octavian Caesar']
428806,1054041043454152795, Augustus Octavian Caesar , ,
