,uuid,user_name,text_clean,mentions_name
138059,1035342158300987432, mushu ,Those are just burner covers to prevent things from getting dirty,['towelie']
138060,1035342204274749450, mushu ,You can buy them from amazon,
138061,1035342213074407445, NickJ ,Did you make them ,['mushu']
138062,1035342285132546098, mushu ,Eh it was simpler to buy them,['towelie']
138063,1035342340476371004, mushu ,No bought them on amazon,['NickJ']
138064,1035342369387728930, NickJ ,Based,['mushu']
138065,1035342434273603684, mushu ,Twice but since it s coconut flour its flaky either way. I didn t have regular flour,['leash']
138066,1035342593774583908, mushu ,Bruh I have a toothbrush and a pretty good one what are you talking about kekw ,['towelie']
138067,1035342755834105898, christuhfur ,i brush my teeth after every meal,
138068,1035342821030379570, mushu ,Dude I have a UV light in my shower where it goes,['towelie']
138069,1035342959643729982, mushu ,This was my last stream if you want to watch ,['leash']
138070,1035343171502231683, mushu ,You mean the burner covers No I replace them when they get dirty,['leash']
138071,1035343310128164894, mushu ,I bought a pack of 50 for less than 10 bucks,
138072,1035343507369496708, mushu ,Are you looking for a hill to die on towelie LOL ,
138073,1035343521613361223, NickJ ,Did Rowow hack Towelie ,
138074,1035343957745471528, NickJ ,Really ,
138075,1035343959385444423, skrvio , ,
138076,1035343997541031956, NickJ ,We have drive thru beer stores for Christ sake,
138077,1035344123659554926, NickJ ,Smh slacking,
138078,1035344276671971388, NickJ ,I hate drive thrus tbh,
138079,1035344322951905421, NickJ ,Epitome of laziness,
138080,1035344327796346960, james2 ,Jealous Envy Malcontents Haters Mushu they have nothing on ya you are more than ok,
138081,1035344399191789698, NickJ ,Yes so much ice in Texas,['leash']
138082,1035344494767382589, NickJ , trump ,
138083,1035344573687418951, Fuckboy ,Your fortune is ,
138084,1035344574815670283, Fuckboy ,Lucky numbers Lotto 46 37 35 11 25 31 Daily numbers Pick3 188,
138085,1035344583200100353, MotoMana ,Insure the booty prayge ,['leash']
138086,1035344640485883944, NickJ ,Nothing to insure,['MotoMana']
138087,1035344710069407764, james2 ,A man of taste,
138088,1035344776603652246, MotoMana ,Arica doesn t have a Tonka truck ,['NickJ']
138089,1035344814927003648, MotoMana , dogekek ,
138090,1035344825983184956, james2 ,Ravens,
138091,1035344843091746816, NickJ , conceited ,['MotoMana']
138092,1035344912335507506, james2 , . Ravens,
138093,1035345049833177169, james2 ,Bucks just don t have it,
138094,1035345061472387153, MotoMana ,Hit the squat rack typing zyzz ,['leash']
138095,1035345107395805224, ThickGary Dell Abate G.E.D. ,trick or treat,
138096,1035345108213694574, Fuckboy ,You take a moment to count your candy before moving on.,[' ThickGary Dell Abate G.E.D.']
138097,1035345145048072212, Fuckboy , ThickGary Dell Abate G.E.D. s Candy Bag ,[' ThickGary Dell Abate G.E.D.']
138098,1035345177147084902, mushu ,Minus the pizza this time I forgor,['leash']
138099,1035345197246185542, Fuckboy ,You take the time to savor 10 chocolates. You feel slightly better Sickness has gone down by 100 ,[' ThickGary Dell Abate G.E.D.']
138100,1035345212106616902, james2 ,Trick or treat,
138101,1035345214396715038, Fuckboy ,Here you go.,['james2   ']
138102,1035345232222507060, Fuckboy , ThickGary Dell Abate G.E.D. s Candy Bag ,[' ThickGary Dell Abate G.E.D.']
138103,1035345297695580240, Fuckboy , james2 You received 2 BONUS 4 ,['james2   ']
138104,1035345315080970241, ThickGary Dell Abate G.E.D. ,i dont think its at 0,
138105,1035345329689735248, james2 ,Wow Ty,
138106,1035345338376130682, ThickGary Dell Abate G.E.D. ,i have to chat fek,
138107,1035345391983525959, ThickGary Dell Abate G.E.D. , DuckDance ,
138108,1035345431615520830, Fuckboy ,You found 72 ,['Lovelace']
138109,1035345463488032769, ThickGary Dell Abate G.E.D. ,hmmm,
138110,1035345464255578172, NickJ , leash,['leash']
138111,1035345481921998858, Fuckboy ,You toss your candies on the ground in disgust. 1434 candies are left behind ,[' ThickGary Dell Abate G.E.D.']
138112,1035345488414781552, Lovelace ,trick or treat,
138113,1035345490998480966, Fuckboy ,Here s a little something for you.,['Lovelace']
138114,1035345495020806185, ThickGary Dell Abate G.E.D. ,damn it,
138115,1035345535785246770, Fuckboy ,You found 218 ,[' ThickGary Dell Abate G.E.D.']
138116,1035345560682635264, Fuckboy , Lovelace You received 3 ,['Lovelace']
138117,1035345592509005855, NickJ ,It was lol,['leash']
138118,1035345627959275553, Fuckboy , ThickGary Dell Abate G.E.D. s Candy Bag ,[' ThickGary Dell Abate G.E.D.']
138119,1035345700860465183, mushu ,I made the dressing and batter with indian mango pickle this time,['leash']
138120,1035345748226756680, NickJ ,Wasn t there like 150 on the plane,['leash']
138121,1035345868947210280, james2 ,Might have to open up a restaurant in NY,
138122,1035345881995694120, yungin ,i have a problem,
138123,1035345922508476497, yungin ,i ve seem to have run out of whiskey,
138124,1035345939147280395, yungin , crypeepo ,
138125,1035345958394937435, james2 ,Balls itch,
138126,1035346027408015451, mushu ,It s more relaxing and enjoyable to be a streamer,['james2   ']
138127,1035346029710671922, NickJ ,It s probably even higher than that if you count all the people that OD d on his meth,['leash']
138128,1035346032499904592, james2 ,Drink sterno,
138129,1035346116285308979, NickJ ,BB,
138130,1035346132869578903, mushu ,What ,['towelie']
138131,1035346154780631090, mushu ,Oh,
138132,1035346161764155402, mushu , kekw ,
138133,1035346196887244860, NickJ ,White,
138134,1035346267473199184, NickJ ,Whitman is the author,
138135,1035346396859080734, NickJ ,No Walt Whitman is a poet referenced in Breaking Bad,
138136,1035346680230453278, NickJ ,I rewatch it every Christmas with my mom,
138137,1035346739026202695, NickJ ,She loves it lmao,
138138,1035346791618596904, NickJ ,Same,
138139,1035346874921656330, NickJ ,God I love shameless,
138140,1035346930890440794, NickJ ,I can t wait to die in the middle of the night,
138141,1035346941627871272, NickJ , wiggle ,
138142,1035346962368704514, CA H COW ,maybe or maybe an inside job,['towelie']
138143,1035346980551012422, CA H COW , pepeevil ,
138144,1035347006773792868, NickJ ,No,['leash']
138145,1035347084964020275, NickJ ,,
138146,1035347220968525885, NickJ ,Dude what ,['leash']
138147,1035347257446371348, AyyLamo ,my girlfriend wants to work for the SEC. I am sad,
138148,1035347263783976980, NickJ ,LOL MUFFD PUNT,
138149,1035347304007336006, NickJ ,DUDE MUFF D IT AT THE 6 YARD LMAO,
138150,1035347439277834271, NickJ ,Oh man what a brutal play,
138151,1035347480415572028, mushu ,Thanks aricia Glad you enjoyed watching ,['leash']
138152,1035347528180314114, Fuckboy ,You sigh in contentment after eating 1 star. You feel great Sickness has been reset ,['theta']
138153,1035347539706269696, Fuckboy ,You monstrously pig out on 96 candies. Total eaten 2 454 ,['theta']
138154,1035347556894511194, Fuckboy ,The thought of candy right now doesn t really sound like a good idea.,['theta']
138155,1035347610510303303, Fuckboy , NickJ s Candy Bag ,['NickJ']
138156,1035347634505924649, Fuckboy ,You sigh in contentment after eating 1 star. You feel great Sickness has been reset ,['NickJ']
138157,1035347637836185630, Fuckboy ,The thought of candy right now doesn t really sound like a good idea.,['theta']
138158,1035347657562009751, Fuckboy ,You gobble up 96 candies. Total eaten 843 ,['NickJ']
138159,1035347751925469254, NickJ ,When we watching peripherals leash,['leash']
138160,1035347782921367572, Fuckboy ,,
138161,1035347852412596415, NickJ ,It s like a westworld kinda thing ,['towelie']
138162,1035347882968088617, NickJ ,Same producer or w.e,
138163,1035347933337489508, NickJ ,I m down to start after football,['leash']
138164,1035348040258695248, NickJ ,Hopefully I don t fall asleep lol,
138165,1035348164498169947, NickJ ,I sat down at 8 last night and woke up at 5am,
138166,1035348177592778773, james2 ,towelie Ya going down 3 ravens,
138167,1035348594095562873, Fuckboy , Swolsby s Candy Bag ,['Swolsby']
138168,1035348635753398302, Swolsby ,Trick or treat,
138169,1035348636940378143, Fuckboy ,Look at that costume. Here you go.,['Swolsby']
138170,1035348694301683784, Fuckboy , Swolsby You received 19 ,['Swolsby']
138171,1035348701918539826, Gene ,what is up with you and the bootlicking the last 2 days ,['towelie']
138172,1035348733052866631, Gene ,or do you just lick boots all day everyday ,
138173,1035348840926158868, Gene ,idk following and idolizing rich idiots,
138174,1035348866666594315, Swolsby ,Gene you are a bootlicker,
138175,1035348910987821077, ThickGary Dell Abate G.E.D. ,trick or treat,
138176,1035348912933961761, Fuckboy ,Well I think this is the last of it. Go ahead and take it.,[' ThickGary Dell Abate G.E.D.']
138177,1035348921226109029, Gene ,oh i don t know how to define it for you,['towelie']
138178,1035348929216262224, NickJ ,Too late,['leash']
138179,1035348930503905350, ThickGary Dell Abate G.E.D. ,STARS,
138180,1035348971348049950, Fuckboy , NickJ ,
138181,1035348981187874907, Gene ,because if i have to start defining words then it means you can retreat into definitional retreat when you can be like words don t mean that ,
138182,1035348987219284029, Fuckboy , ThickGary Dell Abate G.E.D. You received 19 ,[' ThickGary Dell Abate G.E.D.']
138183,1035349001869988010, NickJ ,,
138184,1035349014876520499, ThickGary Dell Abate G.E.D. ,CHEAP BITCH,
138185,1035349017065951262, james2 ,We need a intervention,
138186,1035349065250132040, Fuckboy , ThickGary Dell Abate G.E.D. s Candy Bag ,[' ThickGary Dell Abate G.E.D.']
138187,1035349234167332955, james2 ,NickJ that is a good idea.,
138188,1035349295739699281, NickJ ,For legal reasons I did not recommend this,['james2   ']
138189,1035349301456556152, Swolsby ,I would snatch all that up good for chicken fajitas,['NickJ']
138190,1035349335937925243, n. , aliendance aliendance sheeesh aliendance aliendance aliendance sheeesh aliendance sheeesh aliendance sheeesh aliendance typing aliendance sheeesh aliendance sheeesh aliendance sheeesh aliendance aliendance aliendance sheeesh aliendance aliendance ,
138191,1035349532818554921, james2 ,Gary ya can eat 10 stars,
138192,1035349550954709032, n. ,Fuck babies,['towelie']
138193,1035349677857587262, n. ,Disregard overpopulation Embrace less traffic Support abortions,
138194,1035349700775256084, n. , typing ,
138195,1035349822372315166, Swolsby , typing ,
138196,1035349847215177778, n. ,Bro the weirdest thing about that screenshot isn t what I said,
138197,1035349878961885264, n. ,But the fact that you use light mode,
138198,1035349893591613510, n. , LOL ,
138199,1035349893755174933, ThickGary Dell Abate G.E.D. ,who would eat 10 stars,['n.']
138200,1035349984754802749, n. , typing ,
138201,1035350008502964305, Swolsby , typing ,
138202,1035350017176784987, james2 ,Ya can,
138203,1035350091231399997, n. ,That s my president,['towelie']
138204,1035350136265638039, n. ,I want a hot bitch for prez 2020,
138205,1035350193601785856, bubu ,Trick or treat,
138206,1035350195506003988, Fuckboy , I hear the next door neighbors have some pretty good candy too this year. ,['      bubu']
138207,1035350195736678470, james2 ,Eat the stars ya wont be sick but cured for a while,
138208,1035350202695041024, n. ,Gimme some chief executive titties nom sayin,
138209,1035350218834718740, n. , trumpsalute ,
138210,1035350257061605426, Fuckboy , bubu You received 21 BONUS 1 BONUS 3 ,['      bubu']
138211,1035350288686649454, bubu , pogcandy ,['Fuckboy']
138212,1035350296882315385, ThickGary Dell Abate G.E.D. ,3 stars cheater,
138213,1035350311377838140, Fuckboy , bubu s Candy Bag ,['      bubu']
138214,1035350359155167242, Fuckboy ,You leisurely enjoy 1 chocolate. You feel slightly better Sickness has gone down by 10 ,['      bubu']
138215,1035350380684513331, Fuckboy ,You scarf down 10 candies. Total eaten 2 864 ,['      bubu']
138216,1035350393766543391, Fuckboy , leash s Candy Bag ,['leash']
138217,1035350428583469146, Fuckboy ,It s starting to get late.,['towelie']
138218,1035350429376188507, Fuckboy , n. s Candy Bag ,['n.']
138219,1035350430458322986, Fuckboy , Error in command pickup . Check your console or logs for details. ,
138220,1035350446635745313, n. , typing ,
138221,1035350457142489088, james2 ,Ya can take them to the troth still they don t drink,
138222,1035350460539883550, Fuckboy , towelie s Candy Bag ,['towelie']
138223,1035350651103879229, james2 ,Ya all got attitude sin dromedaries,
138224,1035350658695581748, ,Maybe if they don t that s how,['Miss Mu k']
138225,1035350830699778159, Fuckboy , Miss Mu k s Candy Bag ,['Miss Mu k']
138226,1035350855437787146, ,the moment we understand we become like her and I don t want to be like her,['s76.Petunia']
138227,1035350858403168346, Fuckboy ,You hastily chomp down on 50 candies. Total eaten 2 045 ,['Miss Mu k']
138228,1035350881580896337, Fuckboy , Miss Mu k s Candy Bag ,['Miss Mu k']
138229,1035350916058058832, Fuckboy ,You toss your candies on the ground in disgust. 533 candies are left behind ,['Miss Mu k']
138230,1035350945783095296, Miss Mu k ,shit,
138231,1035350965332754462, Miss Mu k ,i meant to eat the star,
138232,1035350985482182717, ,Ok that I can see if he doesn t wash his dick,[' ThickGary Dell Abate G.E.D.']
138233,1035350987981996073, NickJ ,Then eat,
138234,1035350992771883130, james2 ,Did I miss a episode here in which they all turned on each other,
138235,1035351026213064794, NickJ ,OH NO KANYE HACKED THETA,['theta']
138236,1035351089538666546, s76.Petunia ,Me either prayge ,['       ']
138237,1035351143519367259, Miss Mu k ,i hate nazi,['theta']
138238,1035351175756783726, ,Amen,['s76.Petunia']
138239,1035351186351587358, NickJ ,Sounds like a great way to get pinkeye,['       ']
138240,1035351221483081811, james2 ,Tampa bay bucks made a lucky touch down,
138241,1035351253712109609, ThickGary Dell Abate G.E.D. ,motley crew would put their dicks inside burritos before they went home to their gfs,['       ']
138242,1035351285467197521, ,Could be,['NickJ']
138243,1035351359211450458, Fuckboy ,There was nothing in Miss Mu k 6969 s pockets so you looked around again... you saw wake and bake 5427 in the distance but you didn t think you could catch up...,['Lovelace']
138244,1035351372079570964, ThickGary Dell Abate G.E.D. ,it was probably hot though not sure why they didnt just wash it,
138245,1035351448256512080, ,Yeah see if my dude dick smelled like burrito id kick him to the curb,[' ThickGary Dell Abate G.E.D.']
138246,1035351456649318400, Fuckboy , Lovelace s Candy Bag ,['Lovelace']
138247,1035351521132548207, Fuckboy ,You take the time to savor 2 chocolates. You feel slightly better Sickness has gone down by 20 ,['Lovelace']
138248,1035351546399035504, ThickGary Dell Abate G.E.D. ,now you know what to look out for,
138249,1035351562308038706, Fuckboy ,You toss your candies on the ground in disgust. 792 candies are left behind ,['Lovelace']
138250,1035351564015112214, xLucifer ,She d never know if he is. Haha.,['       ']
138251,1035351605358362694, Lovelace ,dawg what,
138252,1035351639361605712, ThickGary Dell Abate G.E.D. ,eat the extra candy to ensure youre at 0 sickness,
138253,1035351640473088030, Lovelace ,they must have changed the rules,
138254,1035351676674129940, Lovelace ,I DID,
138255,1035351707309309982, ThickGary Dell Abate G.E.D. ,you were probably at like single digit sickness,
138256,1035351793812656218, ThickGary Dell Abate G.E.D. ,sickness can go over 100 also,
138257,1035351818009579520, ThickGary Dell Abate G.E.D. ,its dumb,
138258,1035351818361913354, Lovelace ,IF IT DOESNT SAY ANYTHINF IT MEANS YOURE BELOW 20,
138259,1035351831364239491, james2 ,Suck on my candy,
138260,1035351831880151061, ,If she smelled enough he knows how his balls smell,['xLucifer    ']
138261,1035351850133762078, ThickGary Dell Abate G.E.D. ,40,
138262,1035351882727698534, ThickGary Dell Abate G.E.D. ,so like 39,
138263,1035351889535049759, ThickGary Dell Abate G.E.D. ,or below,
138264,1035351891657371699, Lovelace ,FUCK,
138265,1035351910565285888, ThickGary Dell Abate G.E.D. ,it wont say,
138266,1035351913924923453, NickJ ,40 and under it doesn t say anything,
138267,1035351916672200715, Lovelace ,miscalculation,
138268,1035351925077577769, Fuckboy , s Candy Bag ,['       ']
138269,1035351949370982420, Lovelace ,i thought it was 20 and under,
138270,1035351966425042964, Lovelace ,i need a doover,
138271,1035351973253349466, CAPT T. FRAUD ,I just took the fattest puss,
138272,1035351978743709836, ThickGary Dell Abate G.E.D. ,yeah i miscalculated earlier,
138273,1035351981017006140, CAPT T. FRAUD ,God damb,
138274,1035351983642656788, NickJ ,Nope 40 and under,
138275,1035351996141670400, ThickGary Dell Abate G.E.D. ,i set a timer for trick or treats,
138276,1035352008221270066, ThickGary Dell Abate G.E.D. ,im going hard,
138277,1035352013480923177, Fuckboy ,You make a meal of 1 lollipop. You feel slightly better Sickness has gone down by 20 ,['       ']
138278,1035352020179226726, Lovelace ,MODS HELP,
138279,1035352027791884459, Lovelace ,MILK,
138280,1035352044011257866, Lovelace ,LAKAI,
138281,1035352065456750672, Lovelace ,ITS NOT FAIR,
138282,1035352086893838408, ThickGary Dell Abate G.E.D. ,at least this year is kinda fair,
138283,1035352125712125962, blackscholes ,Cuban bruno mars,['towelie']
138284,1035352138836099195, NickJ ,41 to 55 56 to 70 71 to 85 86 to 100 100 ,
138285,1035352150517227550, Lovelace ,Yeah i gave up last yeah,
138286,1035352161120440340, james2 ,Buy nitro help will came,
138287,1035352231475687444, Lovelace ,MILK LAKAI,
138288,1035352265734750358, ThickGary Dell Abate G.E.D. ,wsbaby would be smoking us all in candy,
138289,1035352292171452516, ThickGary Dell Abate G.E.D. , pepemeltdown ,
138290,1035352313507889206, Fuckboy ,You stole 59 from notaricia 3435 ,
138291,1035352456319742144, Lovelace ,his name is milk,
138292,1035352494492106752, xLucifer ,That s kinda hot lol,['       ']
138293,1035352743134638080, blackscholes ,Lakai is filipino ,
138294,1035352772394090506, Swolsby ,Need a freak to suck on my ballz after a leg sesh,['xLucifer    ']
138295,1035352839750434876, blackscholes ,Lakai is filipino right ,
138296,1035352880728784957, blackscholes ,Tristian alt confirmed,
138297,1035352945132314654, xLucifer ,Hahahah that s what s up ,['Swolsby']
138298,1035353043182563398, Swolsby ,Suck the sweat and stank off,
138299,1035353067819905044, Swolsby , lipbite ,
138300,1035353088854335519, blackscholes ,I touch my balls and smell hands to see if it s stinky enough. That s how Inknow I have worked enough,
138301,1035353096550879232, Gene ,it s gonna be fun on a bun when people are posting twits here every single day like 50x a day,
138302,1035353169947013141, Fuckboy , L for your information I dont care L ,
138303,1035353257847037982, NickJ ,,
138304,1035353341204631622, Fuckboy , NickJ ,
138305,1035353569437700126, iiconic. ,,
138306,1035353582410670174, Fuckboy , CuMMieS CuMMieS CuMMieS CuMMieS ,
138307,1035353740535922819, christuhfur ,took the money and ran,['iiconic.']
138308,1035353785402400818, christuhfur ,exactly what i would do kekw ,
138309,1035353967099641936, Swolsby ,And they all just made millions in executive parachute contract shit lol,['iiconic.']
138310,1035354113988382730, NickJ ,,
138311,1035354444503719996, mushu , towelie happy now Have I satisfied your ocd curiosity ,['towelie']
138312,1035354943038693488, ThetaGang ,TWTR takeover has officially been completed .,
138313,1035354988936970360, ThetaGang ,CEO and CFO has been fired,
138314,1035355049867616306, xLucifer ,BlackRock INC printingggg,
138315,1035355344832057345, Swolsby , towelie how hard are you right now that elon musk is in charge of twitter .,['towelie']
138316,1035355503657758803, mushu ,I think he s harder from my toothbrush pic,['Swolsby']
138317,1035355796957040650, Swolsby , degenkek ,['mushu']
138318,1035356083184730212, mushu ,do you not have feeling in your mouth ,['towelie']
138319,1035356315859566722, mushu ,You wanna get me one You can satisfy your itch that way,['towelie']
138320,1035356441940332614, mushu ,My health is fine,['towelie']
138321,1035356505488232468, Swolsby ,Yall both bitches cant even use a normal brush,
138322,1035356580654350336, Swolsby ,You both love having a robot dick in your mouth,
138323,1035356605975367770, mushu , ,['Swolsby']
138324,1035356607925731429, Swolsby , degenkek ,
138325,1035356645846433812, MotoMana ,What s a good SPo2,
138326,1035356657041027122, MotoMana , Hmm ,
138327,1035356657049411654, mushu , degenkek ,
138328,1035356698484940850, mushu , Hmm ,
138329,1035356705120333904, Swolsby ,Does the dick tickle you while its in ur mouth ,['towelie']
138330,1035356716767912038, christuhfur , LOL ,['Swolsby']
138331,1035356844782268446, TM17 , leash bruins winning,['leash']
138332,1035356880861671484, NickJ ,Pooins,
138333,1035356926411812956, Swolsby , lipbite ,['towelie']
138334,1035356966647762974, NickJ ,2 1,['leash']
138335,1035357003779940413, Fuckboy , finger MotoMana fingered Swolsby.,"['Swolsby', 'MotoMana']"
138336,1035357019688935454, xLucifer , mushu you still cooking bro ,['mushu']
138337,1035357025162502216, Fuckboy , MotoMana wants to blow blow Swolsby,"['Swolsby', 'MotoMana']"
138338,1035357026873782342, Swolsby , nopo ,
138339,1035357038613639219, mushu ,Mine is still a sonic toothbrush,['towelie']
138340,1035357041591586856, Fuckboy , MotoMana wants to bang you Swolsby give consent ,"['Swolsby', 'MotoMana']"
138341,1035357072113553418, TM17 ,2 1,['leash']
138342,1035357109149245500, Swolsby , nopo ,
138343,1035357120146718790, mushu ,No I ended like an hour ago,['xLucifer    ']
138344,1035357163410964480, xLucifer ,Where s the pic lol,['mushu']
138345,1035357294189363311, Fuckboy ,They took too long. Try again later please. You didn t lose any contentment. ,
138346,1035357323583041536, mushu ,Damn I forgor again. First the pizza and now this. This is the replay tho ,['xLucifer    ']
138347,1035357411889905835, xLucifer ,Aw right sweet dude.,['mushu']
138348,1035357412879781999, NickJ ,Get a standing desk,['SnoopDOGGE']
138349,1035357535613485146, mushu ,I actually had no idea what I was gonna do heading into this stream everything was just made up on the spot kekw ,['xLucifer    ']
138350,1035357561626570792, TM17 ,go clean the top of my fridge,['leash']
138351,1035357716627079178, TM17 ,clean it again,['leash']
138352,1035357810248142868, xLucifer ,Aw right hahaha that s algood though man sometimes spontaneous videos are the best content yeah.,['mushu']
138353,1035357949708750940, CAPT T. FRAUD ,I haven t jerked off in like 2 years,
138354,1035357988610904156, Pusherman ,was napping,['leash']
138355,1035357995703468052, christuhfur ,,
138356,1035357997104386048, Pusherman ,you ,
138357,1035358114549084220, TM17 ,step stools,['leash']
138358,1035358149248565328, xLucifer ,,
138359,1035358162066362379, Pusherman ,That wasn t the intent but.....maybe.,['leash']
138360,1035358207394197555, NickJ ,,
138361,1035358242433409146, Pusherman ,you get your power stuff all started ,
138362,1035358252394881114, Pusherman ,what show ,
138363,1035358271588012052, Pusherman ,peripheral ,
138364,1035358287811596338, xLucifer ,,
138365,1035358305717071902, TM17 , NickJ The rat has his second goal,['NickJ']
138366,1035358338889814046, Teddy , ,
138367,1035358355738341416, Swolsby , agonylmfaoo ,['xLucifer    ']
138368,1035358356468158494, Teddy , ,
138369,1035358394082672720, Pusherman ,true,['leash']
138370,1035358413384859658, Pusherman , prayge ,['leash']
138371,1035358463200608257, xLucifer ,Hahhahaha was made in Dellas.,['Swolsby']
138372,1035358519345561660, Teddy ,time to unban kanye and jones,
138373,1035358539918622720, Swolsby ,Follow me on twitter,['xLucifer    ']
138374,1035358599221882940, NickJ ,Fuck Brad Marchand,['TM17']
138375,1035358652258848818, CAPT T. FRAUD ,I just remembered her name,
138376,1035358656998412340, TM17 , leash 4 2 smd,"['NickJ', 'leash']"
138377,1035358676048937030, CAPT T. FRAUD , Amburr,['Amburr']
138378,1035358741131956325, Pusherman , thinkass ,
138379,1035358762711662663, CAPT T. FRAUD ,From the convo we had like 2 weeks ago,
138380,1035358774610907237, xLucifer ,,
138381,1035358788045258814, CAPT T. FRAUD ,On the old e girls,
138382,1035358905053757490, Pusherman , ,
138383,1035358971512500224, christuhfur ,HUH,['Pusherman']
138384,1035358997785620521, christuhfur ,what in tarnation,
138385,1035359126244577361, NickJ ,Pretty fair tbh,['Pusherman']
138386,1035359237418786856, Pusherman ,,
138387,1035359302564708432, TM17 ,5 1 leash,['leash']
138388,1035359311251120148, Pusherman , ,['coolbeans']
138389,1035359554264903731, christuhfur ,LMFAOOOOO,
138390,1035359647122595840, CAPT T. FRAUD ,Elon firing the brownies,
138391,1035359683327832155, CAPT T. FRAUD ,Stink smell down 12000 ,
138392,1035359915776151582, mushu , towelie I used to have a sonicare so yes I do know how it feels. But that one broke. My current one is not too different from it. They re both sonic toothbrushes but my current one was around 25 when I bought it,['towelie']
138393,1035360192872845353, mushu ,,
138394,1035360217648594954, mushu ,TWTR,
138395,1035360536499593287, elrizzabeth ,No more furrys,
138396,1035360707786580039, christuhfur ,Twitter s cybersecurity is garbage,
138397,1035360725511712778, mushu ,Current one is similar to this one ,['towelie']
138398,1035360779655991336, mushu ,But it didn t come with a case,
138399,1035360845032591360, mushu ,yes,['coolbeans']
138400,1035360890813427834, mushu ,It works well,['towelie']
138401,1035361050591248467, christuhfur ,im never getting married,['xLucifer    ']
138402,1035361092366516277, christuhfur ,the bitch aint taking half my shit,
