,raw,timestamp,user,message,file_ind
0,"[11:37] <Seveas> miguel_, vfat knows nothing about permissions, use mount options",11:37,Seveas," miguel_, vfat knows nothing about permissions, use mount options",0
1,"[11:37] <coNP> miguel_: fat32 fs cannot handle permissions, so you can change them when you mount them",11:37,coNP," miguel_: fat32 fs cannot handle permissions, so you can change them when you mount them",1
2,[11:37] <gnomefreak> did bk find out how to get to #gentoo yet?,11:37,gnomefreak, did bk find out how to get to #gentoo yet?,2
3,[11:37] <flodine> i tryed starting in a terminal but say i dont have root privileges,11:37,flodine, i tryed starting in a terminal but say i dont have root privileges,3
4,"[11:37] <gnomefreak> flodine, sudo firestarter",11:37,gnomefreak," flodine, sudo firestarter",4
5,[11:37] <Seveas> at least he found his way out of here (I helped him a bit :)),11:37,Seveas, at least he found his way out of here (I helped him a bit :)),5
6,[11:37] <gnomefreak> lol Seveas  ty,11:37,gnomefreak, lol Seveas  ty,6
7,"[11:37] <cafuego> gnomefreak: I hope not, he's got no business running that if he can't even figure out hwo to change channels on irc.",11:37,cafuego," gnomefreak: I hope not, he's got no business running that if he can't even figure out hwo to change channels on irc.",7
8,"[11:37] <mebaran151> mwe, really?  So in FAT everything is 777?",11:37,mebaran151," mwe, really?  So in FAT everything is 777?",8
9,[11:37] <freddie> can someone help me with video codes on internet when 1 try too veiw them it closes firefox,11:37,freddie, can someone help me with video codes on internet when 1 try too veiw them it closes firefox,9
10,[11:37] <mwe> mebaran151: right,11:37,mwe, mebaran151: right,10
11,[11:38] <nalioth> mebaran151: there are no perms in fat*,11:38,nalioth, mebaran151: there are no perms in fat*,11
12,[11:38] <mwe> mebaran151: but you can mount it read only if you like,11:38,mwe, mebaran151: but you can mount it read only if you like,12
13,"[11:38] <gnomefreak> freddie, i gave you the codecs info already",11:38,gnomefreak," freddie, i gave you the codecs info already",13
14,[11:38] <ompaul> I thought #gentoo was second door on the left after you leave this channe,11:38,ompaul, I thought #gentoo was second door on the left after you leave this channe,14
15,"[11:38] <mebaran151> mwe, or mount it noexec",11:38,mebaran151," mwe, or mount it noexec",15
16,[11:38] <coNP> gnomefreak: bk seems to ask questions on #gentoo,11:38,coNP, gnomefreak: bk seems to ask questions on #gentoo,16
17,[11:38] <flodine> gnomefreak if i close the terminal then firestarter closes to,11:38,flodine, gnomefreak if i close the terminal then firestarter closes to,17
18,[11:38] <gnomefreak> ubotu tell freddie about codecs,11:38,gnomefreak, ubotu tell freddie about codecs,18
19,"[11:38] <psusi> mebaran151: no, in fact there ARE no permissions... so linux has to fake it... you can tell it what fake values to use when you mount it",11:38,psusi," mebaran151: no, in fact there ARE no permissions... so linux has to fake it... you can tell it what fake values to use when you mount it",19
20,"[11:38] <Seveas> ompaul, third",11:38,Seveas," ompaul, third",20
21,=== fraggsta [n=jrw6@82-32-117-167.cable.ubr03.hawk.blueyonder.co.uk]  has joined #ubuntu,,,,21
22,[11:38] <mwe> mebaran151: yeah,11:38,mwe, mebaran151: yeah,22
23,"[11:38] <gnomefreak> flodine, yes",11:38,gnomefreak," flodine, yes",23
24,[11:38] <ompaul> DOH!,11:38,ompaul, DOH!,24
25,"[11:38] <cafuego> ompaul: You can only reach it via the trap door in the corner, after you get decapitated here.",11:38,cafuego," ompaul: You can only reach it via the trap door in the corner, after you get decapitated here.",25
26,"[11:38] <gnomefreak> flodine, anything you open with terminal will close when terminal is closed",11:38,gnomefreak," flodine, anything you open with terminal will close when terminal is closed",26
27,"[11:39] <ompaul> cafuego, ahhh",11:39,ompaul," cafuego, ahhh",27
28,[11:39] <fraggsta> does anyone know how to boot the Ubuntu LiveCD on an old (blue&white) ibook? I'm stuck at the yaboot prompt,11:39,fraggsta, does anyone know how to boot the Ubuntu LiveCD on an old (blue&white) ibook? I'm stuck at the yaboot prompt,28
29,[11:39] <mwe> mebaran151: fmask=0111 under options iirc,11:39,mwe, mebaran151: fmask=0111 under options iirc,29
30,"[11:39] <Seveas> cafuego, and only if USE doesn't feature brain :)",11:39,Seveas," cafuego, and only if USE doesn't feature brain :)",30
31,[11:39] <freddie> gnomefreak it maks no sence to me,11:39,freddie, gnomefreak it maks no sence to me,31
32,[11:39] <cafuego> fraggsta: Just hit return (in theory),11:39,cafuego, fraggsta: Just hit return (in theory),32
33,"[11:39] <gnomefreak> flodine,  you can make a launcher for it on your menu bar so you dont have to use terminal",11:39,gnomefreak," flodine,  you can make a launcher for it on your menu bar so you dont have to use terminal",33
34,[11:39] <visik7> will mountlo be added on next ubuntu ?,11:39,visik7, will mountlo be added on next ubuntu ?,34
35,"[11:39] <synmoo> mebaran151: I've tried known good batteries, the bluetooh mouse works ok for a second, then disconnects for what would seem to be no reason",11:39,synmoo," mebaran151: I've tried known good batteries, the bluetooh mouse works ok for a second, then disconnects for what would seem to be no reason",35
36,[11:39] <nalioth> fraggsta: i think you're doing all that can be done,11:39,nalioth, fraggsta: i think you're doing all that can be done,36
37,[11:39] <cafuego> Seveas: (hence the decapitation),11:39,cafuego, Seveas: (hence the decapitation),37
38,[11:39] <rabbit> mwe:  should I enable source repositories too?,11:39,rabbit, mwe:  should I enable source repositories too?,38
39,[11:39] <Seveas> hehe,11:39,Seveas, hehe,39
40,"[11:39] <fraggsta> cafuego: in theory yes, but in practice I get errors :(",11:39,fraggsta," cafuego: in theory yes, but in practice I get errors :(",40
41,"[11:39] <miguel_> yes I have made the ubuntu install and the devices mount was made during this install. The permissions are rwxr-xr-x and even when I try chmod while I am root, I can't change the permissions to get write permissions on that partition",11:39,miguel_," yes I have made the ubuntu install and the devices mount was made during this install. The permissions are rwxr-xr-x and even when I try chmod while I am root, I can't change the permissions to get write permissions on that partition",41
42,"[11:39] <mebaran151> synmoo, but in the end",11:39,mebaran151," synmoo, but in the end",42
43,[11:39] <mebaran151> it's a USB device right,11:39,mebaran151, it's a USB device right,43
44,[11:39] <mebaran151> as in,11:39,mebaran151, as in,44
45,[11:39] <mebaran151> you have a little thing that plugs in your USB port,11:39,mebaran151, you have a little thing that plugs in your USB port,45
46,[11:39] <mwe> rabbit: only if you need it. it wont hurt to have them in any cas thouhg,11:39,mwe, rabbit: only if you need it. it wont hurt to have them in any cas thouhg,46
47,=== scaine [n=scaine@82-41-57-187.cable.ubr08.edin.blueyonder.co.uk]  has joined #ubuntu,,,,47
48,[11:40] <mebaran151> in that case you'll want to reset your mouse and your base station,11:40,mebaran151, in that case you'll want to reset your mouse and your base station,48
49,[11:40] <gnomefreak> ubotu tell rabbit about repos,11:40,gnomefreak, ubotu tell rabbit about repos,49
50,[11:40] <rabbit> mwe:  what about multiverse?,11:40,rabbit, mwe:  what about multiverse?,50
51,[11:40] <mebaran151> when is the open source flash going to be anygood,11:40,mebaran151, when is the open source flash going to be anygood,51
52,[11:40] <mwe> rabbit: that's the one you need,11:40,mwe, rabbit: that's the one you need,52
53,"[11:40] <synmoo> mebaran151:No usb dongle. It's actually built in to the laptop. However, it may be internally connected via usb. I have no way of easily determining that.",11:40,synmoo," mebaran151:No usb dongle. It's actually built in to the laptop. However, it may be internally connected via usb. I have no way of easily determining that.",53
54,[11:40] <server_newbie> coNP: I have reloaded averthing and now I get: * Starting web server (Apache2)...                                                                                           apache2: could not open document config file /etc/apache2/apache2.conf,11:40,server_newbie, coNP: I have reloaded averthing and now I get: * Starting web server (Apache2)...                                                                                           apache2: could not open document config file /etc/apache2/apache2.conf,54
55,[11:40] <server_newbie>                                                                                                                        [fail],11:40,server_newbie,                                                                                                                        [fail],55
56,[11:40] <mwe> rabbit: no sorry,11:40,mwe, rabbit: no sorry,56
57,[11:40] <mwe> rabbit: universe,11:40,mwe, rabbit: universe,57
58,[11:40] <visik7> miguel_: is ntfs your FS ?,11:40,visik7, miguel_: is ntfs your FS ?,58
59,=== cafuego remembers why 256K dsl is painful,,,,59
60,"[11:40] <mebaran151> synmoo, if it is built in the laptop",11:40,mebaran151," synmoo, if it is built in the laptop",60
61,"[11:40] <gnomefreak> server_newbie, please dont paste in channle use pastebin",11:40,gnomefreak," server_newbie, please dont paste in channle use pastebin",61
62,[11:40] <mebaran151> then you have the little problems,11:40,mebaran151, then you have the little problems,62
63,[11:40] <rabbit> mwe: what's multiverse for?,11:40,rabbit, mwe: what's multiverse for?,63
64,[11:40] <mwe> rabbit: but multiverse has lots of useful stuff too,11:40,mwe, rabbit: but multiverse has lots of useful stuff too,64
65,=== pozdiy [n=pozdiy@138.26.54.178]  has joined #ubuntu,,,,65
66,[11:41] <mebaran151> because there's no translation layer,11:41,mebaran151, because there's no translation layer,66
67,[11:41] <miguel_> No it is a FAT32,11:41,miguel_, No it is a FAT32,67
68,[11:41] <rabbit> mwe: should add it then?,11:41,rabbit, mwe: should add it then?,68
69,=== b_e_n_z [n=Mercedes@pcd259124.netvigator.com]  has joined #ubuntu,,,,69
70,"[11:41] <fraggsta> cafuego: a mysterious ""unknown or corrupt filesystem"" error when it first boots, then it stops at the yaboot prompt, looks like it doesn't understand something inside this ibook",11:41,fraggsta," cafuego: a mysterious ""unknown or corrupt filesystem"" error when it first boots, then it stops at the yaboot prompt, looks like it doesn't understand something inside this ibook",70
71,[11:41] <server_newbie> Sorry for the past,11:41,server_newbie, Sorry for the past,71
72,[11:41] <rabbit> mwe: doesn't hurt?,11:41,rabbit, mwe: doesn't hurt?,72
73,[11:41] <mebaran151> and bluetooh is harder to work with then,11:41,mebaran151, and bluetooh is harder to work with then,73
74,[11:41] <mwe> rabbit: if you like fancy software,11:41,mwe, rabbit: if you like fancy software,74
75,"[11:41] <visik7> miguel_: set in fstab noauto,users in the options and mount using your user",11:41,visik7," miguel_: set in fstab noauto,users in the options and mount using your user",75
76,"[11:41] <gnomefreak> mwe,  get him to go to source-o-matic he can get all of them :(",11:41,gnomefreak," mwe,  get him to go to source-o-matic he can get all of them :(",76
77,[11:41] <freddie> can someone help me with video codes on internet when 1 try too veiw them it closes firefox plz ill give u a cookie,11:41,freddie, can someone help me with video codes on internet when 1 try too veiw them it closes firefox plz ill give u a cookie,77
78,[11:41] <cafuego> fraggsta: Did you burn the livecd yourself?,11:41,cafuego, fraggsta: Did you burn the livecd yourself?,78
79,[11:41] <rabbit> mwe: does doing this just give me access to more programs to download?,11:41,rabbit, mwe: does doing this just give me access to more programs to download?,79
80,[11:41] <fraggsta> cafuego: yes,11:41,fraggsta, cafuego: yes,80
81,[11:41] <mwe> rabbit: which is not oficially supported though,11:41,mwe, rabbit: which is not oficially supported though,81
82,[11:41] <mwe> rabbit: right,11:41,mwe, rabbit: right,82
83,"[11:41] <gnomefreak> freddie, did you read the pm ubotu sent you?",11:41,gnomefreak," freddie, did you read the pm ubotu sent you?",83
84,[11:42] <mwe> rabbit: that's what it's all about,11:42,mwe, rabbit: that's what it's all about,84
85,[11:42] <freddie> yes,11:42,freddie, yes,85
86,"[11:42] <rabbit> mwe: k, thanks",11:42,rabbit," mwe: k, thanks",86
87,"[11:42] <gnomefreak> freddie, did it give you any hints?",11:42,gnomefreak," freddie, did it give you any hints?",87
88,[11:42] <flodine> help is there a way to run firestarter without having a terminal always open,11:42,flodine, help is there a way to run firestarter without having a terminal always open,88
89,[11:42] <freddie> nope,11:42,freddie, nope,89
90,=== SmartUnix [i=LinuxHer@62.215.25.61]  has joined #ubuntu,,,,90
91,"[11:42] <gnomefreak> flodine, make a launcher for it",11:42,gnomefreak," flodine, make a launcher for it",91
92,"[11:42] <fraggsta> cafuego: I didn't have any trouble browsing this CD on the target iBook in MacOS 9, so I think that's not the problem",11:42,fraggsta," cafuego: I didn't have any trouble browsing this CD on the target iBook in MacOS 9, so I think that's not the problem",92
93,[11:43] <nalioth> flodine: alt-f2 > gksudo firestarter,11:43,nalioth, gksudo firestarter,93
94,[11:43] <mwe> gnomefreak: I don't know source-o-matic. sounds funky though,11:43,mwe, gnomefreak: I don't know source-o-matic. sounds funky though,94
95,[11:43] <SmartUnix> where i can found smart link modem drives for gcc4 ?,11:43,SmartUnix, where i can found smart link modem drives for gcc4 ?,95
96,[11:43] <gnomefreak> !sources,11:43,gnomefreak, !sources,96
97,[11:43] <ubotu> A list of official repositories can be found at http://paste.ubuntulinux.nl/969 (Hoary) or http://paste.ubuntu-nl.org/6047 (Breezy) - Create your own sources.list at http://ubuntulinux.nl/source-o-matic,11:43,ubotu, A list of official repositories can be found at http://paste.ubuntulinux.nl/969 (Hoary) or http://paste.ubuntu-nl.org/6047 (Breezy) - Create your own sources.list at http://ubuntulinux.nl/source-o-matic,97
98,=== juan__ [n=juan@83.165.73.25]  has joined #ubuntu,,,,98
99,[11:43] <navarone> flodine...Firestarter should be on your Applications/SystemTools menu,11:43,navarone, flodine...Firestarter should be on your Applications/SystemTools menu,99
100,[11:43] <rabbit> mwe:  the Update repositories aren't checked off,11:43,rabbit, mwe:  the Update repositories aren't checked off,100
101,"[11:43] <gnomefreak> navarone,  depending on what he is running",11:43,gnomefreak," navarone,  depending on what he is running",101
102,"=== juan__ [n=juan@83.165.73.25]  has left #ubuntu [""Leaving""]",,,,102
103,"[11:43] <cafuego> fraggsta: Well, if the ramdisk image on the cd is busted you can still *see* the fioles, just not access them.",11:43,cafuego," fraggsta: Well, if the ramdisk image on the cd is busted you can still *see* the fioles, just not access them.",103
104,[11:44] <navarone> flodine...Firestarter should be on your Applications/SystemTools menu if you are using gnome...<s>,11:44,navarone,,104
105,=== pawel_ [i=host3@82-70-216-78.dsl.in-addr.zen.co.uk]  has joined #ubuntu,,,,105
106,[11:44] <freddie> can someone help me with video codes on internet when 1 try too veiw them it closes firefox,11:44,freddie, can someone help me with video codes on internet when 1 try too veiw them it closes firefox,106
107,[11:45] <gnomefreak> !video,11:45,gnomefreak, !video,107
108,"[11:45] <ubotu> Not a clue, gnomefreak",11:45,ubotu," Not a clue, gnomefreak",108
109,[11:45] <fraggsta> cafuego: I don't really know how I can test that,11:45,fraggsta, cafuego: I don't really know how I can test that,109
110,=== ubuntu [n=ubuntu@N882P027.adsl.highway.telekom.at]  has joined #ubuntu,,,,110
111,"=== ubuntu [n=ubuntu@N882P027.adsl.highway.telekom.at]  has left #ubuntu [""Leaving""]",,,,111
112,=== elvirolo [n=elvirolo@lns-bzn-3-82-250-70-11.adsl.proxad.net]  has joined #ubuntu,,,,112
113,[11:45] <elvirolo> hi all,11:45,elvirolo, hi all,113
114,=== HurricaneJ [n=frank@c-66-176-209-252.hsd1.fl.comcast.net]  has joined #ubuntu,,,,114
115,=== HP_Administrator [n=chatzill@12-208-127-42.client.insightBB.com]  has joined #ubuntu,,,,115
116,=== brice_ [n=brice@acs-24-154-33-156.zoominternet.net]  has joined #ubuntu,,,,116
117,=== mifritscher- [n=michael@p54AA1C69.dip0.t-ipconnect.de]  has joined #ubuntu,,,,117
118,=== N3m [n=nem@M753P029.adsl.highway.telekom.at]  has joined #ubuntu,,,,118
119,[11:46] <HurricaneJ> i just downloaded gnome art and installed a theme i want to install a log in screen but i cant what else do i need to download?,11:46,HurricaneJ, i just downloaded gnome art and installed a theme i want to install a log in screen but i cant what else do i need to download?,119
120,"=== N3m [n=nem@M753P029.adsl.highway.telekom.at]  has left #ubuntu [""Leaving""]",,,,120
121,"[11:46] <gnomefreak> HurricaneJ, nothing",11:46,gnomefreak," HurricaneJ, nothing",121
122,=== Demian_Hesse [n=Pavlovsk@200-85-198-241.bk3-dsl.surnet.cl]  has joined #ubuntu,,,,122
123,[11:46] <rabbit> mwe:  multiverse isn't free?,11:46,rabbit, mwe:  multiverse isn't free?,123
124,"=== Demian_Hesse [n=Pavlovsk@200-85-198-241.bk3-dsl.surnet.cl]  has left #ubuntu [""Abandonando""]",,,,124
125,[11:46] <HurricaneJ> when i go to log ins the option to install is not there only download,11:46,HurricaneJ, when i go to log ins the option to install is not there only download,125
126,=== crooksey [n=crooksey@host86-141-102-62.range86-141.btcentralplus.com]  has joined #ubuntu,,,,126
127,"[11:46] <gnomefreak> HurricaneJ,  if you install a login screen pic than open your login screen setup and install it",11:46,gnomefreak," HurricaneJ,  if you install a login screen pic than open your login screen setup and install it",127
128,[11:46] <HurricaneJ> what folder do i have to put the log in?,11:46,HurricaneJ, what folder do i have to put the log in?,128
129,[11:46] <gnomefreak> system>admin,11:46,gnomefreak,admin,129
130,[11:46] <elvirolo> i've got a machine (running breezy) which doesn't have access to the internet ... and I need the OOo.org french translation files ... but can't find them,11:46,elvirolo, i've got a machine (running breezy) which doesn't have access to the internet ... and I need the OOo.org french translation files ... but can't find them,130
131,[11:47] <HP_Administrator> could someone direct me to a place where you can find printable cd/dvd disc labels for ubuntu?,11:47,HP_Administrator, could someone direct me to a place where you can find printable cd/dvd disc labels for ubuntu?,131
132,[11:47] <mwe> rabbit: free as in you don't have to pay anything at least,11:47,mwe, rabbit: free as in you don't have to pay anything at least,132
133,[11:47] <crooksey> www.ubuntu.org/download,11:47,crooksey, www.ubuntu.org/download,133
134,[11:47] <freddie> can someone help me with video codes on internet when 1 try too veiw them it closes firefox,11:47,freddie, can someone help me with video codes on internet when 1 try too veiw them it closes firefox,134
135,[11:47] <coNP> rabbit: could you install mail notification?,11:47,coNP, rabbit: could you install mail notification?,135
136,[11:47] <flodine> nalioth thxs for the info,11:47,flodine, nalioth thxs for the info,136
137,[11:47] <EddieDaMan> sudo apt-get install firestarter,11:47,EddieDaMan, sudo apt-get install firestarter,137
138,"[11:48] <EddieDaMan> woosp, wrong box",11:48,EddieDaMan," woosp, wrong box",138
139,[11:48] <HurricaneJ> and i downloaded airsport sniffer i think is the name--it installed but i dont see where i can open the program,11:48,HurricaneJ, and i downloaded airsport sniffer i think is the name--it installed but i dont see where i can open the program,139
140,"[11:48] <elvirolo> so, can anyone help me?",11:48,elvirolo," so, can anyone help me?",140
141,[11:48] <gnomefreak> !someone,11:48,gnomefreak, !someone,141
142,"[11:48] <ubotu> probably 90% of the first questions asked in this channel start with ""Does anyone/anybody...""  Why not ask your next question (the real one) and YOU decide? <hint>",11:48,ubotu,,142
143,[11:48] <mwe> gnomefreak: that source-o-matic looks cool. it pointed me to new oo.org debs,11:48,mwe, gnomefreak: that source-o-matic looks cool. it pointed me to new oo.org debs,143
144,=== shackan [n=mep@host76-144.pool873.interbusiness.it]  has left #ubuntu [],,,,144
145,"[11:48] <gnomefreak> mwe,  yep it is thank Seveas  for it :)",11:48,gnomefreak," mwe,  yep it is thank Seveas  for it :)",145
146,=== Trackilizer [n=gsg@p54AED526.dip.t-dialin.net]  has joined #ubuntu,,,,146
147,[11:48] <HP_Administrator> i see the iso images but i dont see graphics for disc labels,11:48,HP_Administrator, i see the iso images but i dont see graphics for disc labels,147
148,[11:48] <gnomefreak> hes got everything but my java repo on there,11:48,gnomefreak, hes got everything but my java repo on there,148
149,[11:48] <rabbit> coNP: I just added the universe/ multiverse repositories,11:48,rabbit, coNP: I just added the universe/ multiverse repositories,149
150,[11:49] <fraggsta> well all I can think of is to try a PPC debian net install disc :(,11:49,fraggsta, well all I can think of is to try a PPC debian net install disc :(,150
151,[11:49] <gnomefreak> mine in sence i use it,11:49,gnomefreak, mine in sence i use it,151
152,[11:49] <crooksey> i hate no root login,11:49,crooksey, i hate no root login,152
153,[11:49] <boa-chan> then use it,11:49,boa-chan, then use it,153
154,[11:49] <ompaul> https://wiki.ubuntu.com/UbuntuArtwork,11:49,ompaul, https://wiki.ubuntu.com/UbuntuArtwork,154
155,[11:49] <apokryphos> crooksey: why?,11:49,apokryphos, crooksey: why?,155
156,=== seth_k|lappy [n=seth@ubuntu/member/sethkinast]  has joined #ubuntu,,,,156
157,[11:49] <HP_Administrator> thank you very much :),11:49,HP_Administrator, thank you very much :),157
158,[11:49] <rabbit> coNP: does mail notficiation work like gmail notifier on windows?  it has a taskbar like icon??,11:49,rabbit, coNP: does mail notficiation work like gmail notifier on windows?  it has a taskbar like icon??,158
159,"[11:49] <crooksey> just sudo shit, pissses me off",11:49,crooksey," just sudo shit, pissses me off",159
160,[11:49] <mwe> gnomefreak: ok. Seveas made it?,11:49,mwe, gnomefreak: ok. Seveas made it?,160
161,"[11:49] <ompaul> crooksey, language",11:49,ompaul," crooksey, language",161
162,[11:49] <gnomefreak> im pretty sure its his,11:49,gnomefreak, im pretty sure its his,162
163,[11:49] <synmoo> mebaran151: I am able to transfer files back and forth between my cellphone via bluetooth. I have also determined that the built in bluetooth is internally connected via usb,11:49,synmoo, mebaran151: I am able to transfer files back and forth between my cellphone via bluetooth. I have also determined that the built in bluetooth is internally connected via usb,163
164,[11:49] <gnomefreak> atleast part of it is,11:49,gnomefreak, atleast part of it is,164
165,[11:49] <crooksey> sorry,11:49,crooksey, sorry,165
166,"[11:49] <fraggsta> on the plus side, since my cable just got upgraded..4 Mb/sec = :D",11:49,fraggsta," on the plus side, since my cable just got upgraded..4 Mb/sec = :D",166
167,[11:49] <freddie> can someone help me with video codes on internet when 1 try too veiw them it closes firefox,11:49,freddie, can someone help me with video codes on internet when 1 try too veiw them it closes firefox,167
168,[11:50] <janoli> lsusb recognize my phaser printer as a samsung printer ... any help??,11:50,janoli, lsusb recognize my phaser printer as a samsung printer ... any help??,168
169,[11:50] <mwe> yeah. it pretty cool at least,11:50,mwe, yeah. it pretty cool at least,169
170,"[11:50] <coNP> rabbit: yes it appears on the notification area, if you have new mail",11:50,coNP," rabbit: yes it appears on the notification area, if you have new mail",170
171,[11:50] <janoli> as a samsung something...,11:50,janoli, as a samsung something...,171
172,"[11:50] <ompaul> crooksey, read the sudo page, if you don't like it you can do it yourself",11:50,ompaul," crooksey, read the sudo page, if you don't like it you can do it yourself",172
173,"[11:50] <mebaran151> synmoo, but you have to make it a bluetooth HID device",11:50,mebaran151," synmoo, but you have to make it a bluetooth HID device",173
174,=== [FeiM] Swoop|Away [i=Ask@0x55516c79.adsl.cybercity.dk]  has joined #ubuntu,,,,174
175,=== Tackleberry [n=martin@h89n1c1o1032.bredband.skanova.com]  has joined #ubuntu,,,,175
176,=== pm [n=pm@80.48.60.10]  has joined #ubuntu,,,,176
177,[11:50] <janoli> lsusb recognize my xerox phaser printer as a samsung xomething ... any help??,11:50,janoli, lsusb recognize my xerox phaser printer as a samsung xomething ... any help??,177
178,"[11:50] <crooksey> ompual, ok off now",11:50,crooksey," ompual, ok off now",178
179,=== albacker [n=eni@customer-side2-telecomalbania.atnet.com.al]  has joined #ubuntu,,,,179
180,[11:50] <gnomefreak> someone mute him please? ive tried everything to give to him and he doesnt understand i guess and he doesnt understand what ubotu means by someone,11:50,gnomefreak, someone mute him please? ive tried everything to give to him and he doesnt understand i guess and he doesnt understand what ubotu means by someone,180
181,[11:50] <freddie> swerw it im going back to windows,11:50,freddie, swerw it im going back to windows,181
182,"[11:50] <synmoo> mebaran151: I've used sudo hidd --search, had it find, and connect the mouse. It works briefly, then disconnects.",11:50,synmoo," mebaran151: I've used sudo hidd --search, had it find, and connect the mouse. It works briefly, then disconnects.",182
