,raw,timestamp,user,message
624,[14:53] <martian> Mountaingod: does it freeze before showing the shutdown options?,14:53,martian,Mountaingod: does it freeze before showing the shutdown options?
625,"[14:53] <Mountaingod> No, I click the top-right button, it comes up with all the options (hibernate, etc.), I click shut down, screen goes blank, and that's it. It restarts fine",14:53,Mountaingod,"No, I click the top-right button, it comes up with all the options (hibernate, etc.), I click shut down, screen goes blank, and that's it. It restarts fine"
626,[14:53] <vonderer> hallo there!,14:53,vonderer,hallo there!
627,"[14:54] <LjL> robertfisk: is the bouncer running on your *own* machine? (if not, then why would you connect to localhost? is it a reverse SSH tunnel?)",14:54,LjL,"robertfisk: is the bouncer running on your *own* machine? (if not, then why would you connect to localhost? is it a reverse SSH tunnel?)"
628,"[14:54] <godzirra> Anyone have any issues with Gutsy since release?  After a few hours of working, my wireless network stops working and can't reconnect, I can't run anything with sudo, and opening a terminal window won't work.  It worked fine in Feisty, and jnc was positive that its my network, but i can't find anything wrong with it.  I've added a root user so I could see if I could log in to see whether it was a pam issue, and had no trouble logging",14:54,godzirra,"Anyone have any issues with Gutsy since release?  After a few hours of working, my wireless network stops working and can't reconnect, I can't run anything with sudo, and opening a terminal window won't work.  It worked fine in Feisty, and jnc was positive that its my network, but i can't find anything wrong with it.  I've added a root user so I could see if I could log in to see whether it was a pam issue, and had no trouble logging"
629,"[14:54] <robertfisk> yes , its a tunnel",14:54,robertfisk,"yes , its a tunnel"
630,[14:54] <godzirra> I have no more ideas as to what to test or what is causing the problem.,14:54,godzirra,I have no more ideas as to what to test or what is causing the problem.
631,[14:54] <zombie_monkey> godzirra: the only problem I've had is the Fn combos on my laptop keyboard stoped working except for num lock.,14:54,zombie_monkey,godzirra: the only problem I've had is the Fn combos on my laptop keyboard stoped working except for num lock.
632,[14:54] <vonderer> got a problem: each time I reboot my computer I get fglrx.ko removed from /lib/modules/2.6.22-14-generic/volatile,14:54,vonderer,got a problem: each time I reboot my computer I get fglrx.ko removed from /lib/modules/2.6.22-14-generic/volatile
633,[14:54] <simplyubuntu> hey can anyone give me some tips on how NOT to screw up my gutsy install (again)?,14:54,simplyubuntu,hey can anyone give me some tips on how NOT to screw up my gutsy install (again)?
634,[14:54] <LjL> robertfisk: does doing <unconvertable> telnet localhost portnumber <unconvertable> give you a connection refused?,14:54,LjL> robertfisk: does doing <unconvertable> telnet localhost portnumber <unconvertable,give you a connection refused?
635,[14:54] <robertfisk> yes,14:54,robertfisk,yes
636,[14:55] <martian> simplyubuntu: don't do anything stupid :),14:55,martian,simplyubuntu: don't do anything stupid :)
637,"[14:55] <Mountaingod> martian:No, I click the top-right button, it comes up with all the options (hibernate, etc.), I click shut down, screen goes blank, and that's it. It restarts fine (if I select restart",14:55,Mountaingod,"martian:No, I click the top-right button, it comes up with all the options (hibernate, etc.), I click shut down, screen goes blank, and that's it. It restarts fine (if I select restart"
638,[14:55] <vonderer> so the module does not load and I have to make a new copy or link from ../misc/fglrx.ko,14:55,vonderer,so the module does not load and I have to make a new copy or link from ../misc/fglrx.ko
639,"[14:55] <godzirra> zombie_monkey: Yeah, mine just stpos working.  I can't use sudo, and I can't reconnect to my network, or open another terminal window in X;.",14:55,godzirra,"zombie_monkey: Yeah, mine just stpos working.  I can't use sudo, and I can't reconnect to my network, or open another terminal window in X;."
640,"[14:55] <LjL> robertfisk: then your reverse SSH tunnel simply isn't *up*, it's not x-chat's fault",14:55,LjL,"robertfisk: then your reverse SSH tunnel simply isn't *up*, it's not x-chat's fault"
641,[14:55] <Lion31> how can I install the ntfs-config package... I have searcged for it in the synaptic package manager and havent found a thing,14:55,Lion31,how can I install the ntfs-config package... I have searcged for it in the synaptic package manager and havent found a thing
642,[14:55] <simplyubuntu> martian i tried that with feisty lol,14:55,simplyubuntu,martian i tried that with feisty lol
643,[14:55] <robertfisk> ok . ill do some more checking . im new on ubuntu :)  thanks,14:55,robertfisk,ok . ill do some more checking . im new on ubuntu :)  thanks
644,[14:56] <johnn1> U may want to check the burn..try burning gutsy @ a slower speed to ensure validity.,14:56,johnn1,U may want to check the burn..try burning gutsy @ a slower speed to ensure validity.
645,"[14:56] <auowE> I want to boost my system performance what are the services that I can disable? I turned of dbus and got into trouble, little help is needed.",14:56,auowE,"I want to boost my system performance what are the services that I can disable? I turned of dbus and got into trouble, little help is needed."
646,[14:56] <Lion31> I need access to my ntfs and fat32 partitions,14:56,Lion31,I need access to my ntfs and fat32 partitions
647,[14:56] <zombie_monkey> i guess it doesn't make much sense to upgrade early if you're not prepared to fix any problem that may come up,14:56,zombie_monkey,i guess it doesn't make much sense to upgrade early if you're not prepared to fix any problem that may come up
648,[14:56] <simplyubuntu> but the story is that i installed gutsy once perfectly (after a failed upgrade with the alternate cd) and screwed that up too...,14:56,simplyubuntu,but the story is that i installed gutsy once perfectly (after a failed upgrade with the alternate cd) and screwed that up too...
649,[14:56] <jrib> !ntfs > Lion31 (read the private message from ubotu),14:56,jrib> !ntfs ,Lion31 (read the private message from ubotu)
650,[14:56] <tech0007> Lion31: make sure your repos are complete,14:56,tech0007,Lion31: make sure your repos are complete
651,[14:56] <johnn1> loo,14:56,johnn1,loo
652,"[14:56] <martian> simplyubuntu: try harder ;) ... no, really... here's a good idea. Next time you decide to reinstall the OS, make a separate partition that mounts to /home and that way IF you DO screw things up, your personal settings and files will not be gone",14:56,martian,"simplyubuntu: try harder ;) ... no, really... here's a good idea. Next time you decide to reinstall the OS, make a separate partition that mounts to /home and that way IF you DO screw things up, your personal settings and files will not be gone"
653,[14:56] <fairway_> what media player comes close to foobar2000 ?,14:56,fairway_,what media player comes close to foobar2000 ?
654,"[14:56] <vonderer> got a problem: each time I reboot my computer I get fglrx.ko removed from /lib/modules/2.6.22-14-generic/volatile, so the module does not load and I have to make a new copy or link from ../misc/fglrx.ko",14:56,vonderer,"got a problem: each time I reboot my computer I get fglrx.ko removed from /lib/modules/2.6.22-14-generic/volatile, so the module does not load and I have to make a new copy or link from ../misc/fglrx.ko"
655,"[14:56] <jamesfoster> Does fullscreen mode in OpenOffice.org Calc work for anyone in Gutsy? (window appears behind panels for me, just wondering whether the behaviour is specific to accelerated xorg or my hardware)",14:56,jamesfoster,"Does fullscreen mode in OpenOffice.org Calc work for anyone in Gutsy? (window appears behind panels for me, just wondering whether the behaviour is specific to accelerated xorg or my hardware)"
656,[14:57] <tuntun> simplyubuntu: how did you screw it up?,14:57,tuntun,simplyubuntu: how did you screw it up?
657,[14:57] <simplyubuntu> i know (that measure was already taken ;)... luckily),14:57,simplyubuntu,i know (that measure was already taken ;)... luckily)
658,[14:57] <jrib> jamesfoster: works here (just plain metacity),14:57,jrib,jamesfoster: works here (just plain metacity)
659,[14:57] <tuntun> anyone had a netsplit lately?,14:57,tuntun,anyone had a netsplit lately?
660,[14:58] <simplyubuntu> tuntun what i did was that i copied my package selections list from feisty to gutsy... following !cloning on this channel,14:58,simplyubuntu,tuntun what i did was that i copied my package selections list from feisty to gutsy... following !cloning on this channel
661,"[14:58] <martian> fairway_: I've heard people really like 'listen', but amarok and others are similar I think",14:58,martian,"fairway_: I've heard people really like 'listen', but amarok and others are similar I think"
662,"[14:58] <Lion31> hm... this pidgin is ok, couse I can do a lot of things... but this irc client ... lets  just say I have to get used to it :)",14:58,Lion31,"hm... this pidgin is ok, couse I can do a lot of things... but this irc client ... lets  just say I have to get used to it :)"
663,"[14:58] <TheGateKeeper> has linux got anything like ghost that would let ghost a hdd, partitions and all?",14:58,TheGateKeeper,"has linux got anything like ghost that would let ghost a hdd, partitions and all?"
664,"[14:58] <zombie_monkey> fairway_: hah, i'm wondering about that myself and I hear this questiona ll the time... I just installed Quod Libet which is supposedly somewhat close",14:58,zombie_monkey,"fairway_: hah, i'm wondering about that myself and I hear this questiona ll the time... I just installed Quod Libet which is supposedly somewhat close"
665,[14:58] <jrib> TheGateKeeper: partimage comes to mind,14:58,jrib,TheGateKeeper: partimage comes to mind
666,"[14:58] <vonderer> got a problem: each time I reboot my computer I get fglrx.ko removed from /lib/modules/2.6.22-14-generic/volatile, so the module does not load and I have to make a new copy or link from ../misc/fglrx.ko",14:58,vonderer,"got a problem: each time I reboot my computer I get fglrx.ko removed from /lib/modules/2.6.22-14-generic/volatile, so the module does not load and I have to make a new copy or link from ../misc/fglrx.ko"
667,[14:58] <jrib> TheGateKeeper: or dd I guess,14:58,jrib,TheGateKeeper: or dd I guess
668,[14:58] <tuntun> simplyubuntu: why not do a clean install?,14:58,tuntun,simplyubuntu: why not do a clean install?
669,"[14:58] <simplyubuntu> but before i updated it and installed all my old pkgs, i copied all the debs from the old /var/cache/apt/archives to the new one...",14:58,simplyubuntu,"but before i updated it and installed all my old pkgs, i copied all the debs from the old /var/cache/apt/archives to the new one..."
670,[14:59] <fairway_> yes i know,14:59,fairway_,yes i know
671,"[14:59] <TheGateKeeper> jrib: ok thanks, I have heard of both of them",14:59,TheGateKeeper,"jrib: ok thanks, I have heard of both of them"
672,[14:59] <fairway_> though mythbuntu looks interesting for a MCE,14:59,fairway_,though mythbuntu looks interesting for a MCE
673,[14:59] <kkathman> whats the gnome config tool called ?,14:59,kkathman,whats the gnome config tool called ?
674,[14:59] <simplyubuntu> because its a pain for me to download all the packages again... which i would have had to do ANYWAY since im installing a new release,14:59,simplyubuntu,because its a pain for me to download all the packages again... which i would have had to do ANYWAY since im installing a new release
675,[14:59] <jrib> kkathman: config for what?,14:59,jrib,kkathman: config for what?
676,[14:59] <bmt2> hello to all,14:59,bmt2,hello to all
677,"[14:59] <tuntun> kkatham:""gconf-editor""",14:59,tuntun,"kkatham:""gconf-editor"""
678,[15:00] <simplyubuntu> lol apparently that didnt get through me thick head...,15:00,simplyubuntu,lol apparently that didnt get through me thick head...
679,[15:00] <TheGateKeeper> jrib: I guess you need partimage on a live cd,15:00,TheGateKeeper,jrib: I guess you need partimage on a live cd
680,"[15:00] <kkathman> jrib - general gnome settings - i.e. icon padding, etc",15:00,kkathman,"jrib - general gnome settings - i.e. icon padding, etc"
681,"[15:00] <tuntun> kkathman:""gconf-editor""",15:00,tuntun,"kkathman:""gconf-editor"""
682,[15:00] <bmt2> how can i find out where my cdrom is located.....because i do not see it at /dev/cdrom or /dev/cdrom0,15:00,bmt2,how can i find out where my cdrom is located.....because i do not see it at /dev/cdrom or /dev/cdrom0
683,[15:00] <TheGateKeeper> jrib: anyway thanks :),15:00,TheGateKeeper,jrib: anyway thanks :)
684,"[15:00] <auowE> ok, I've another small doubt.  in the system monitor when I summed up all the processes memory it is nearly 40MB, but in resources it showing 200MB as used memory.  how can I recover the RAM?",15:00,auowE,"ok, I've another small doubt.  in the system monitor when I summed up all the processes memory it is nearly 40MB, but in resources it showing 200MB as used memory.  how can I recover the RAM?"
685,[15:00] <kkathman> but isnt there a gnome-config  something also?,15:00,kkathman,but isnt there a gnome-config  something also?
686,[15:00] <simplyubuntu> bmt2 are you trying to cd to those directories>,15:00,simplyubuntu> bmt2 are you trying to cd to those directories,bmt2 are you trying to cd to those directories>
687,[15:00] <bmt2> simplyubuntu: yes,15:00,bmt2,simplyubuntu: yes
688,[15:01] <jrib> kkathman: gnome-control-center?,15:01,jrib,kkathman: gnome-control-center?
689,"[15:01] <dcnstrct> I just did a fresh install of gutsy gibbon, installed rails, mongrel, mysql-server, and",15:01,dcnstrct,"I just did a fresh install of gutsy gibbon, installed rails, mongrel, mysql-server, and"
690,[15:01] <dcnstrct> mysql-client.  I installed the msyql gem.  For some reason whenever I type rake db:migrate,15:01,dcnstrct,mysql-client.  I installed the msyql gem.  For some reason whenever I type rake db:migrate
691,[15:01] <dcnstrct> (or any other rails command that would use the db) I get this msg: Client does not support,15:01,dcnstrct,(or any other rails command that would use the db) I get this msg: Client does not support
692,[15:01] <kkathman> jrib ahh that might be it,15:01,kkathman,jrib ahh that might be it
693,[15:01] <dcnstrct> authentication protocol requested by server; consider upgrading MySQL client  :  what causes this ? thnx,15:01,dcnstrct,authentication protocol requested by server; consider upgrading MySQL client  :  what causes this ? thnx
694,"[15:02] <jrib> dcnstrct: try to keep what you say on a single line, or else the channel becomes too busy",15:02,jrib,"dcnstrct: try to keep what you say on a single line, or else the channel becomes too busy"
695,"[15:02] <vonderer> got a problem: each time I reboot my computer I get fglrx.ko removed from /lib/modules/2.6.22-14-generic/volatile, so the module does not load and I have to make a new copy or link from ../misc/fglrx.ko",15:02,vonderer,"got a problem: each time I reboot my computer I get fglrx.ko removed from /lib/modules/2.6.22-14-generic/volatile, so the module does not load and I have to make a new copy or link from ../misc/fglrx.ko"
696,[15:02] <simplyubuntu> bmt2 thats not what youre supposed to do that... those are symbolic links to those devices (hence /dev) and they must be mounted to another directory before you can cd to them,15:02,simplyubuntu,bmt2 thats not what youre supposed to do that... those are symbolic links to those devices (hence /dev) and they must be mounted to another directory before you can cd to them
697,[15:02] <DanielC> Will Gusty Gibbon run slower than Dapper Drake on a 2.6 Ghz computer with 1.4 Gb RAM?,15:02,DanielC,Will Gusty Gibbon run slower than Dapper Drake on a 2.6 Ghz computer with 1.4 Gb RAM?
698,[15:02] <simplyubuntu> try cd'ing to /cdrom,15:02,simplyubuntu,try cd'ing to /cdrom
699,"[15:02] <dcnstrct> jrib, noted. sorry about htat",15:02,dcnstrct,"jrib, noted. sorry about htat"
700,[15:02] <bmt2> simplyubuntu: ok,15:02,bmt2,simplyubuntu: ok
701,[15:02] <noelferreira> my keyboard layout changes to default (US) everytime i reboot. How can i have it starting in (pt)?,15:02,noelferreira,my keyboard layout changes to default (US) everytime i reboot. How can i have it starting in (pt)?
702,"[15:02] <lumien> Its beginning to look like there isn't a ""remote assistance"" utility in linux to access a windows box",15:02,lumien,"Its beginning to look like there isn't a ""remote assistance"" utility in linux to access a windows box"
703,[15:02] <taggig> how do i remove the /media disks from my desktop,15:02,taggig,how do i remove the /media disks from my desktop
704,"[15:02] <tuntun> DanielC: No, it more efficient actually.",15:02,tuntun,"DanielC: No, it more efficient actually."
705,[15:02] <tech0007> Do i need to install samba and smbfs if i want to access windows shares?,15:02,tech0007,Do i need to install samba and smbfs if i want to access windows shares?
706,[15:03] <DanielC> tuntun: Great. Thanks.,15:03,DanielC,tuntun: Great. Thanks.
707,[15:03] <simplyubuntu> tuntun now im on my third try... crossed fingers and all.. i usually learm my lesson by the third failiure :P,15:03,simplyubuntu,tuntun now im on my third try... crossed fingers and all.. i usually learm my lesson by the third failiure :P
708,[15:03] <bmt2> simplyubuntu: i am getting nothing,15:03,bmt2,simplyubuntu: i am getting nothing
709,"[15:03] <fairway_> under ubuntu i would like to have a fullscreen application for playing music (flacs, mp3s) videos (avis) etc. for a media center pc",15:03,fairway_,"under ubuntu i would like to have a fullscreen application for playing music (flacs, mp3s) videos (avis) etc. for a media center pc"
710,[15:03] <fairway_> what app is the way to go?,15:03,fairway_,what app is the way to go?
711,[15:03] <jrib> lumien: don't know much about it but is applications -> internet -> terminal server client not what you want?,15:03,jrib> lumien: don't know much about it but is applications -> internet -,terminal server client not what you want?
712,"[15:03] <godzirra> Anyone have any issues with Gutsy like this?  After a few hours of working, my wireless network stops working and can't reconnect, I can't run anything with sudo, and opening a terminal window in X won't work.  I had no issues with Feisty, and jnc was positive that its my network, but i can't find anything wrong with it.  I've added a root user so I could see if I could log in to see whether it was a pam issue, and had no trouble logg",15:03,godzirra,"Anyone have any issues with Gutsy like this?  After a few hours of working, my wireless network stops working and can't reconnect, I can't run anything with sudo, and opening a terminal window in X won't work.  I had no issues with Feisty, and jnc was positive that its my network, but i can't find anything wrong with it.  I've added a root user so I could see if I could log in to see whether it was a pam issue, and had no trouble logg"
713,[15:03] <DanielC> tuntun: Why is it faster? Gnome improvements?,15:03,DanielC,tuntun: Why is it faster? Gnome improvements?
714,[15:03] <jrib> !icons > taggig (read the private message from ubotu),15:03,jrib> !icons ,taggig (read the private message from ubotu)
715,"[15:03] <vonderer> got a problem: each time I reboot my computer I get fglrx.ko removed from /lib/modules/2.6.22-14-generic/volatile, so the module does not load and I have to make a new copy or link from ../misc/fglrx.ko",15:03,vonderer,"got a problem: each time I reboot my computer I get fglrx.ko removed from /lib/modules/2.6.22-14-generic/volatile, so the module does not load and I have to make a new copy or link from ../misc/fglrx.ko"
716,"[15:04] <tuntun> DanielC: more efficient code, and it literally uses less electricity too! :)",15:04,tuntun,"DanielC: more efficient code, and it literally uses less electricity too! :)"
717,[15:04] <Jonni> mo,15:04,Jonni,mo
718,[15:04] <simplyubuntu> try this bmt2- sudo mount /dev/cdrom /foo/moo,15:04,simplyubuntu,try this bmt2- sudo mount /dev/cdrom /foo/moo
719,[15:04] <minimec> fairway_: I think listen has a mode called partymode which is fullscreen,15:04,minimec,fairway_: I think listen has a mode called partymode which is fullscreen
720,[15:04] <taggig> ty jrib,15:04,taggig,ty jrib
721,[15:04] <fairway_> thx,15:04,fairway_,thx
722,[15:04] <Lion31> how do I access the root in the terminal? what should I write?,15:04,Lion31,how do I access the root in the terminal? what should I write?
723,[15:04] <DanielC> tuntun: :-)  thanks,15:04,DanielC,tuntun: :-)  thanks
724,[15:04] <jrib> !root > Lion31 (read the private message from ubotu),15:04,jrib> !root ,Lion31 (read the private message from ubotu)
725,[15:05] <tuntun> simplyubuntu: why don't you do a clean install?,15:05,tuntun,simplyubuntu: why don't you do a clean install?
726,[15:05] <simplyubuntu> '/foo/moo' being where you want to cd to acces the drive,15:05,simplyubuntu,'/foo/moo' being where you want to cd to acces the drive
727,[15:05] <simplyubuntu> i am... for the second time lol,15:05,simplyubuntu,i am... for the second time lol
728,[15:05] <bmt2> simplyubuntu: tell me that ' mount point /foo/moo does not exist',15:05,bmt2,simplyubuntu: tell me that ' mount point /foo/moo does not exist'
729,[15:05] <fly> ubuntu,15:05,fly,ubuntu
730,[15:05] <tuntun> simplyubuntu: so what goes wrong them?,15:05,tuntun,simplyubuntu: so what goes wrong them?
731,[15:06] <Alp`> did anybody compare thunderbird and evolution? i wonder which one is better,15:06,Alp`,did anybody compare thunderbird and evolution? i wonder which one is better
732,[15:06] <simplyubuntu> you need to enter a valid dir instead of foo/moo... those are just variables,15:06,simplyubuntu,you need to enter a valid dir instead of foo/moo... those are just variables
733,[15:06] <Lion31> jrib: I am not trying to guess the pass I already know it! I just want to acess the roo.. so I can enter my pass,15:06,Lion31,jrib: I am not trying to guess the pass I already know it! I just want to acess the roo.. so I can enter my pass
734,[15:06] <PecisDarbs> what  is package name for that niffy Xorg configuration tool? displayconfig-gtk?,15:06,PecisDarbs,what  is package name for that niffy Xorg configuration tool? displayconfig-gtk?
735,[15:06] <tech0007> Do i need to install samba and smbfs if i want to access windows shares?,15:06,tech0007,Do i need to install samba and smbfs if i want to access windows shares?
736,[15:06] <jrib> Lion31: did you read the page that ubotu linked you to?  it tells you how,15:06,jrib,Lion31: did you read the page that ubotu linked you to?  it tells you how
737,[15:06] <martian> Lion31: then do: su -,15:06,martian,Lion31: then do: su -
738,[15:06] <bmt2> simplyubuntu: so if i make a dir called 'test' at /...then i could mount /dev/cdrom to that (/test) ?,15:06,bmt2,simplyubuntu: so if i make a dir called 'test' at /...then i could mount /dev/cdrom to that (/test) ?
739,[15:07] <noelferreira> my keyboard layout changes to default (US) everytime i reboot. How can i have it starting in (pt)?,15:07,noelferreira,my keyboard layout changes to default (US) everytime i reboot. How can i have it starting in (pt)?
740,[15:07] <Blinny> Setting up dovecot IMAP server - with stock config dovecot complains of invalid configuration - Is there an ubuntu-specific HOWTO for setting this up?,15:07,Blinny,Setting up dovecot IMAP server - with stock config dovecot complains of invalid configuration - Is there an ubuntu-specific HOWTO for setting this up?
741,[15:07] <fairway_> minimec: where can i see listen's website?,15:07,fairway_,minimec: where can i see listen's website?
742,[15:07] <Lion31> jrib: no it only told be I must be crazy trying to guess the pass,15:07,Lion31,jrib: no it only told be I must be crazy trying to guess the pass
743,"[15:07] <simplyubuntu> well tuntun... the 1st time, i tried upgrading - failed. imean the pc worked one time and then i rebooted, and pfft",15:07,simplyubuntu,"well tuntun... the 1st time, i tried upgrading - failed. imean the pc worked one time and then i rebooted, and pfft"
744,[15:07] <jrib> !root | Lion31,15:07,jrib,!root | Lion31
745,"[15:07] <ubotu> Lion31: Do not try to guess the root password, that is impossible. Instead, realise the truth.. there is no root password. Then you will see that it is sudo that grants you access and not the root password. Look at https://help.ubuntu.com/community/RootSudo",15:07,ubotu,"Lion31: Do not try to guess the root password, that is impossible. Instead, realise the truth.. there is no root password. Then you will see that it is sudo that grants you access and not the root password. Look at https://help.ubuntu.com/community/RootSudo"
746,[15:07] <simplyubuntu> bmt2sure,15:07,simplyubuntu,bmt2sure
747,[15:07] <arcticblue> I got a question about the UPnP server built into mythtv.  Anyone here know anything about that?,15:07,arcticblue,I got a question about the UPnP server built into mythtv.  Anyone here know anything about that?
748,[15:07] <RobNyc> !ipv6,15:07,RobNyc,!ipv6
749,[15:07] <ubotu> To disable ipv6 read https://help.ubuntu.com/community/WebBrowsingSlowIPv6IPv4,15:07,ubotu,To disable ipv6 read https://help.ubuntu.com/community/WebBrowsingSlowIPv6IPv4
750,[15:07] <Lion31> martian: thanks,15:07,Lion31,martian: thanks
751,"[15:08] <jrib> Lion31: there is a link there, last thing he says",15:08,jrib,"Lion31: there is a link there, last thing he says"
