,raw,timestamp,user,message
0,[23:09] <ActionParsnip> Proxypoke: use:   sudo add-apt-repository ppa:ubuntu-x-swat/x-updates,23:09,ActionParsnip,Proxypoke: use:   sudo add-apt-repository ppa:ubuntu-x-swat/x-updates
1,"[23:09] <pupy> yes it does, ah ok, let me find it",23:09,pupy,"yes it does, ah ok, let me find it"
2,[23:09] <bonhoffer> is there a simple way to see if it is fat32 or osx-file system,23:09,bonhoffer,is there a simple way to see if it is fat32 or osx-file system
3,[23:09] <ActionParsnip> Proxypoke: read the whole page,23:09,ActionParsnip,Proxypoke: read the whole page
4,[23:09] <bonhoffer> my macbook wasn't picking it up,23:09,bonhoffer,my macbook wasn't picking it up
5,[23:09] <bonhoffer> it is mounted,23:09,bonhoffer,it is mounted
6,[23:09] <ActionParsnip> pupy: ok then use network manager to connect to a network,23:09,ActionParsnip,pupy: ok then use network manager to connect to a network
7,[23:10] <Proxypoke> the first screenshots gave the impression of a gui guide,23:10,Proxypoke,the first screenshots gave the impression of a gui guide
8,"[23:10] <pupy> yes I got it, is that icon on the top bar, thanks",23:10,pupy,"yes I got it, is that icon on the top bar, thanks"
9,[23:10] <Proxypoke> my bad,23:10,Proxypoke,my bad
10,"[23:10] <ooxi> ActionParsnip, did compile the download, didn't work eigther :-(",23:10,ooxi,"ActionParsnip, did compile the download, didn't work eigther :-("
11,[23:11] <ActionParsnip> Proxypoke: cli is much quicker rather than having to mess with software centre,23:11,ActionParsnip,Proxypoke: cli is much quicker rather than having to mess with software centre
12,[23:11] <Proxypoke> yeah,23:11,Proxypoke,yeah
13,"[23:11] <ActionParsnip> ooxi: dang, you can always use ndiswrapper + windows driver",23:11,ActionParsnip,"ooxi: dang, you can always use ndiswrapper + windows driver"
14,[23:11] <ooxi> hmm,23:11,ooxi,hmm
15,"[23:11] <Proxypoke> besides that, it's kinda difficult to use USC or synaptic while stuck in CLI mode ;p",23:11,Proxypoke,"besides that, it's kinda difficult to use USC or synaptic while stuck in CLI mode ;p"
16,"[23:11] <Paddy_NI> Hi people, I am trying to turn my netbook into a wireless access point and I have absolutely no idea what I am doing... can anyone help ?",23:11,Paddy_NI,"Hi people, I am trying to turn my netbook into a wireless access point and I have absolutely no idea what I am doing... can anyone help ?"
17,[23:12] <ActionParsnip> !ics,23:12,ActionParsnip,!ics
18,[23:12] <ubottu> If you want to share the internet connection of your Ubuntu machine with other machines in the network see https://help.ubuntu.com/community/InternetConnectionSharing - You may also use !firestarter: http://www.fs-security.com/docs/connection-sharing.php,23:12,ubottu,If you want to share the internet connection of your Ubuntu machine with other machines in the network see https://help.ubuntu.com/community/InternetConnectionSharing - You may also use !firestarter: http://www.fs-security.com/docs/connection-sharing.php
19,[23:12] <kdub> nyan cat,23:12,kdub,nyan cat
20,[23:13] <ActionParsnip> Proxypoke: cli ftw :D,23:13,ActionParsnip,Proxypoke: cli ftw :D
21,[23:13] <Paddy_NI> ActionParsnip: That is ICS it is not turning my laptop into a wireless access point :),23:13,Paddy_NI,ActionParsnip: That is ICS it is not turning my laptop into a wireless access point :)
22,[23:13] <Paddy_NI> s/laptop/netbook,23:13,Paddy_NI,s/laptop/netbook
23,[23:14] <ActionParsnip> Paddy_NI: sure it is,23:14,ActionParsnip,Paddy_NI: sure it is
24,[23:14] <Paddy_NI> hmm,23:14,Paddy_NI,hmm
25,[23:14] <Paddy_NI> ActionParsnip: Umm.. aint there steps to see if my netbook wifi can actually broadcast an AP,23:14,Paddy_NI,ActionParsnip: Umm.. aint there steps to see if my netbook wifi can actually broadcast an AP
26,"[23:14] <ActionParsnip> Paddy_NI: ""Internet Connection Sharing (ICS) provides the ability for one computer to share its Internet connection with another computer. To do this, a computer with an Internet connection must be configured to function as an Internet gateway""",23:14,ActionParsnip,"Paddy_NI: ""Internet Connection Sharing (ICS) provides the ability for one computer to share its Internet connection with another computer. To do this, a computer with an Internet connection must be configured to function as an Internet gateway"""
27,[23:14] <Paddy_NI> Yes,23:14,Paddy_NI,Yes
28,[23:15] <Paddy_NI> but that is not precisely the same thing,23:15,Paddy_NI,but that is not precisely the same thing
29,[23:15] <ActionParsnip> Paddy_NI: I COPIED that from the first link...,23:15,ActionParsnip,Paddy_NI: I COPIED that from the first link...
30,[23:15] <Paddy_NI> read that page already mate,23:15,Paddy_NI,read that page already mate
31,[23:15] <Paddy_NI> one of the first things I did,23:15,Paddy_NI,one of the first things I did
32,[23:15] <ActionParsnip> Paddy_NI: it tells you how to setup the system essentially as a wireless router,23:15,ActionParsnip,Paddy_NI: it tells you how to setup the system essentially as a wireless router
33,"[23:15] <Hoptimist> Paddy_NI, You just want you comp to act as a wireless router? or?",23:15,Hoptimist,"Paddy_NI, You just want you comp to act as a wireless router? or?"
34,[23:16] <Paddy_NI> I want my laptop which is connected to the internet via usb dongle to share its internet with my phone or whatever,23:16,Paddy_NI,I want my laptop which is connected to the internet via usb dongle to share its internet with my phone or whatever
35,[23:16] <Paddy_NI> Will my card even be able to do that,23:16,Paddy_NI,Will my card even be able to do that
36,[23:16] <Paddy_NI> like reverse tethering,23:16,Paddy_NI,like reverse tethering
37,[23:16] <linuxthefish> Can someone tell me how to quit a frozen application on ubuntu server?,23:16,linuxthefish,Can someone tell me how to quit a frozen application on ubuntu server?
38,[23:17] <linuxthefish> anyone?,23:17,linuxthefish,anyone?
39,"[23:17] <zcat[1]> trying to forward a port using iptables, but the server it's forwarded to sees the connection as coming from the firewall not the outside 'real' ip.. what am I doing wrong?",23:17,zcat[1],"trying to forward a port using iptables, but the server it's forwarded to sees the connection as coming from the firewall not the outside 'real' ip.. what am I doing wrong?"
40,[23:17] <linuxthefish> fuck you!!,23:17,linuxthefish,fuck you!!
41,[23:17] <ActionParsnip> linuxthefish: ps -ef  | grep something    then run:   sudo kill -9 PID,23:17,ActionParsnip,linuxthefish: ps -ef  | grep something    then run:   sudo kill -9 PID
42,[23:18] <jmwpc> if he had only waited,23:18,jmwpc,if he had only waited
43,[23:18] <MK`> Is there a chatroom for X windows in general on this network I can be pointed to?,23:18,MK`,Is there a chatroom for X windows in general on this network I can be pointed to?
44,[23:18] <ActionParsnip> jmwpc: the smartest nes have the most patience,23:18,ActionParsnip,jmwpc: the smartest nes have the most patience
45,[23:18] <ActionParsnip> Paddy_NI: ah so the phone gets the web via your system,23:18,ActionParsnip,Paddy_NI: ah so the phone gets the web via your system
46,"[23:18] <pupy> sorry guys, one more thing, I want to install moodle, so I do sudo apt-get install moodle",23:18,pupy,"sorry guys, one more thing, I want to install moodle, so I do sudo apt-get install moodle"
47,"[23:18] <Hoptimist> Paddy_NI, I'm not sure about using the wireless card, but if you have bluetooth connection then its doable",23:18,Hoptimist,"Paddy_NI, I'm not sure about using the wireless card, but if you have bluetooth connection then its doable"
48,[23:18] <Paddy_NI> ActionParsnip: Yep :),23:18,Paddy_NI,ActionParsnip: Yep :)
49,[23:19] <Paddy_NI> Hoptimist: My phone has wifi my laptop has wifi,23:19,Paddy_NI,Hoptimist: My phone has wifi my laptop has wifi
50,=== secoif_ is now known as secoif,,,
51,[23:19] <Paddy_NI> basically the phone should connect to a wifi network.. correct,23:19,Paddy_NI,basically the phone should connect to a wifi network.. correct
52,"[23:19] <pupy> but i says it can't find the package, again, some app to use? or do I have to populate apt.list (or something like that) and run apt-get update?",23:19,pupy,"but i says it can't find the package, again, some app to use? or do I have to populate apt.list (or something like that) and run apt-get update?"
53,[23:19] <Paddy_NI> also my mate is bringing his mac over to do some work,23:19,Paddy_NI,also my mate is bringing his mac over to do some work
54,[23:20] <william__> can anyone help me with split command .. split -l 10 file.txt newfile  : puts splits into named file but with no extension.. I would like the file extensions to be .txt ???,23:20,william__,can anyone help me with split command .. split -l 10 file.txt newfile  : puts splits into named file but with no extension.. I would like the file extensions to be .txt ???
55,[23:20] <kdub> william__: just rename it to have .txt at the end. linux doesnt treat file extensions any differently,23:20,kdub,william__: just rename it to have .txt at the end. linux doesnt treat file extensions any differently
56,"[23:20] <jmwpc> ActionParsnip: I'm a noob still, but I have learned so much just leaving this channel open during the work day. It's a great resource... if you can be a little patient that is :)",23:20,jmwpc,"ActionParsnip: I'm a noob still, but I have learned so much just leaving this channel open during the work day. It's a great resource... if you can be a little patient that is :)"
57,[23:20] <ActionParsnip> Paddy_NI: so your phone and your friends mac want to use the laptop as a wireless ateway to the web,23:20,ActionParsnip,Paddy_NI: so your phone and your friends mac want to use the laptop as a wireless ateway to the web
58,[23:20] <Paddy_NI> ActionParsnip: Yeah,23:20,Paddy_NI,ActionParsnip: Yeah
59,[23:21] <ActionParsnip> Paddy_NI: then thats EXACTLY what the iCS page details,23:21,ActionParsnip,Paddy_NI: then thats EXACTLY what the iCS page details
60,[23:21] <Paddy_NI> lol,23:21,Paddy_NI,lol
61,[23:21] <sysop3> hi if I plug the same firewire drive into two ubuntu machines at the same time will both computer be able to access the drive??,23:21,sysop3,hi if I plug the same firewire drive into two ubuntu machines at the same time will both computer be able to access the drive??
62,[23:21] <william__> kdub i did that but then the extension was file.atxt file.btxt etc,23:21,william__,kdub i did that but then the extension was file.atxt file.btxt etc
63,[23:21] <Paddy_NI> ActionParsnip: I am an idiot,23:21,Paddy_NI,ActionParsnip: I am an idiot
64,[23:21] <ActionParsnip> Paddy_NI: https://help.ubuntu.com/community/Router,23:21,ActionParsnip,Paddy_NI: https://help.ubuntu.com/community/Router
65,[23:22] <Catarthes> hey people! hope I can share with you a software I'm doing: http://www.youtube.com/watch?v=P9IOxd3H4AM,23:22,Catarthes,hey people! hope I can share with you a software I'm doing: http://www.youtube.com/watch?v=P9IOxd3H4AM
66,[23:22] <Catarthes> it's no joke,23:22,Catarthes,it's no joke
67,[23:22] <Paddy_NI> ActionParsnip: Will it matter that I am using a usb dongle to access the internet?,23:22,Paddy_NI,ActionParsnip: Will it matter that I am using a usb dongle to access the internet?
68,[23:22] <Khisanth> software on youtube ...,23:22,Khisanth,software on youtube ...
69,[23:22] <kdub> william__: the file extension does not matter. the system knows its a text file regardless of what its named. just do 'mv file.atxt filea.txt,23:22,kdub,william__: the file extension does not matter. the system knows its a text file regardless of what its named. just do 'mv file.atxt filea.txt
70,[23:22] <Paddy_NI> !ics > Paddy_NI,23:22,Paddy_NI> !ics ,Paddy_NI
71,"[23:22] <ubottu> Paddy_NI, please see my private message",23:22,ubottu,"Paddy_NI, please see my private message"
72,[23:22] <ActionParsnip> Paddy_NI: it doesn't matter as long as there is an interface name you can do it,23:22,ActionParsnip,Paddy_NI: it doesn't matter as long as there is an interface name you can do it
73,"[23:22] <Catarthes> I began in windows and now made a ubuntu version, I'm looking for help with development",23:22,Catarthes,"I began in windows and now made a ubuntu version, I'm looking for help with development"
74,[23:22] <brightspark> How can I remove old keyboard layouts from the menu that shows up when I click my picture at the login screen?,23:22,brightspark,How can I remove old keyboard layouts from the menu that shows up when I click my picture at the login screen?
75,[23:23] <P05TMAN> Can I upgrade to beta 2 form update manager?,23:23,P05TMAN,Can I upgrade to beta 2 form update manager?
76,[23:23] <Paddy_NI> ActionParsnip: yeah ppp0,23:23,Paddy_NI,ActionParsnip: yeah ppp0
77,"[23:23] <Catarthes> yes Khisanth, software in youtube",23:23,Catarthes,"yes Khisanth, software in youtube"
78,[23:23] <Catarthes> the official page: www.simnation.info,23:23,Catarthes,the official page: www.simnation.info
79,[23:23] <ActionParsnip> Paddy_NI: then its fine you are good to go :),23:23,ActionParsnip,Paddy_NI: then its fine you are good to go :)
80,[23:23] <Paddy_NI> ActionParsnip: :),23:23,Paddy_NI,ActionParsnip: :)
81,[23:24] <william__> kbud i need to do this with thousands of files what do you recomend so that the files are 1.txt 2.txt 3.txt and so on and not manual file naming ?,23:24,william__,kbud i need to do this with thousands of files what do you recomend so that the files are 1.txt 2.txt 3.txt and so on and not manual file naming ?
82,[23:24] <ActionParsnip> Catarthes: doesn't google eart do that stuff?,23:24,ActionParsnip,Catarthes: doesn't google eart do that stuff?
83,"[23:25] <Catarthes> google earth show pictures, I show classes of vegetation",23:25,Catarthes,"google earth show pictures, I show classes of vegetation"
84,[23:25] <Catarthes> is more didatic,23:25,Catarthes,is more didatic
85,[23:25] <Catarthes> as for deforestation,23:25,Catarthes,as for deforestation
86,"[23:25] <maheanuu> I am trying to set up an external hd media player to format the drive and allow my  sis in law to store her videos on it, we deal in all the junk of the world here in the south pacific and have all the TV formats etc along with windoze and the other weird stuff",23:25,maheanuu,"I am trying to set up an external hd media player to format the drive and allow my  sis in law to store her videos on it, we deal in all the junk of the world here in the south pacific and have all the TV formats etc along with windoze and the other weird stuff"
87,"[23:25] <ubuntuguy> Why does the ubuntu battery icon ever show me how much battery my laptop has left, it just says estimating",23:25,ubuntuguy,"Why does the ubuntu battery icon ever show me how much battery my laptop has left, it just says estimating"
88,[23:25] <ubuntuguy> Anyway to finx this?,23:25,ubuntuguy,Anyway to finx this?
89,[23:25] <MK`> Ubuntuguy: when it's plugged in or all the time?,23:25,MK`,Ubuntuguy: when it's plugged in or all the time?
90,[23:25] <ubuntuguy> All the time,23:25,ubuntuguy,All the time
91,"[23:26] <MK`> Hm, I do not know, sorry. Mine does that when it is plugged in but when it is discharging it works properly",23:26,MK`,"Hm, I do not know, sorry. Mine does that when it is plugged in but when it is discharging it works properly"
92,[23:26] <ubuntuguy> k,23:26,ubuntuguy,k
93,[23:27] <Khisanth> william__: the rename command can do mass renames :),23:27,Khisanth,william__: the rename command can do mass renames :)
94,[23:27] <ActionParsnip> Catarthes: ahh i see,23:27,ActionParsnip,Catarthes: ahh i see
95,[23:27] <ActionParsnip> ubuntuguy: which release are you using?,23:27,ActionParsnip,ubuntuguy: which release are you using?
96,[23:28] <kdub> william__: make new folder. run split within that folder. you'll get thousands of files. then you can do ' for i in `ls`; do mv ${i} ${i}.txt; done,23:28,kdub,william__: make new folder. run split within that folder. you'll get thousands of files. then you can do ' for i in `ls`; do mv ${i} ${i}.txt; done
97,[23:28] <ubuntuguy> 10.10,23:28,ubuntuguy,10.10
98,[23:28] <ActionParsnip> ubuntuguy: and what model and make system?,23:28,ActionParsnip,ubuntuguy: and what model and make system?
99,"[23:28] <brightspark> Catarthes, the ibus one isn't in any of the menus",23:28,brightspark,"Catarthes, the ibus one isn't in any of the menus"
100,"[23:28] <ubuntuguy> hp mini 110, 10.10",23:28,ubuntuguy,"hp mini 110, 10.10"
101,[23:28] <ubuntuguy> but it's also happening in 11.04,23:28,ubuntuguy,but it's also happening in 11.04
102,"[23:29] <maheanuu> I cannot get it to change the partition or do a format, I have unmounted the drive, but it tells me that it is busy and is awaiting a job....",23:29,maheanuu,"I cannot get it to change the partition or do a format, I have unmounted the drive, but it tells me that it is busy and is awaiting a job...."
103,"[23:29] <Catarthes> brightspark, you'll have to install it from Ubuntu Software Center",23:29,Catarthes,"brightspark, you'll have to install it from Ubuntu Software Center"
104,[23:30] <william__> ok .. thanks guys .. thanks a HEAP .. I got something to work with now.. where I was lost before.. thank you again for helping me as I did not know where to look,23:30,william__,ok .. thanks guys .. thanks a HEAP .. I got something to work with now.. where I was lost before.. thank you again for helping me as I did not know where to look
105,[23:30] <Catarthes> ActionParsnip what I'm trying to achieve is a economical-ecological simulator,23:30,Catarthes,ActionParsnip what I'm trying to achieve is a economical-ecological simulator
106,[23:30] <ActionParsnip> ubuntuguy: are you currently running natty?,23:30,ActionParsnip,ubuntuguy: are you currently running natty?
107,[23:31] <ubuntuguy> Yes I am,23:31,ubuntuguy,Yes I am
108,[23:31] <brightspark> oh I see it is called keyboard input methods,23:31,brightspark,oh I see it is called keyboard input methods
109,[23:31] <Catarthes> I think I'll have more control over it in c++ than if I build it above Google Earth,23:31,Catarthes,I think I'll have more control over it in c++ than if I build it above Google Earth
110,[23:31] <ActionParsnip> ubuntuguy: then your support is in #ubuntu+1,23:31,ActionParsnip,ubuntuguy: then your support is in #ubuntu+1
111,[23:31] <ubuntuguy> I'm also using 10.10 mind you,23:31,ubuntuguy,I'm also using 10.10 mind you
112,"[23:31] <wavedigit> Catarthes, unix is built on C",23:31,wavedigit,"Catarthes, unix is built on C"
113,[23:31] <ubuntuguy> I want help for 10.10,23:31,ubuntuguy,I want help for 10.10
114,"[23:31] <Catarthes> wavedigit, it would take longer for me to do my app in c, who knows someday?",23:31,Catarthes,"wavedigit, it would take longer for me to do my app in c, who knows someday?"
115,[23:32] <ActionParsnip> ubuntuguy: I suggest you ask in the other chanel but aso try  the boot option: acpi=vendor     may help,23:32,ActionParsnip,ubuntuguy: I suggest you ask in the other chanel but aso try  the boot option: acpi=vendor     may help
116,[23:32] <faryshta> Thunar and nautilus doesn't load thumbnails on videos. What should I do?,23:32,faryshta,Thunar and nautilus doesn't load thumbnails on videos. What should I do?
117,[23:32] <ubuntuguy> k,23:32,ubuntuguy,k
118,"[23:32] <Catarthes> but it's working faster than in windows, even with c++",23:32,Catarthes,"but it's working faster than in windows, even with c++"
119,"[23:32] <maheanuu> Oh, I should have mentioned that I am running 10.10 and it was just upgraded 2 days ago",23:32,maheanuu,"Oh, I should have mentioned that I am running 10.10 and it was just upgraded 2 days ago"
120,"[23:32] <wavedigit> Catarthes, depends on the app, but if you are going to be OS (unix) specific... go with C",23:32,wavedigit,"Catarthes, depends on the app, but if you are going to be OS (unix) specific... go with C"
121,"[23:32] <Catarthes> no, I want to distribute in linux, windows and mac",23:32,Catarthes,"no, I want to distribute in linux, windows and mac"
122,[23:32] <maheanuu> I do NOT have a machine that runs windows available so I cannot use the manual that came with this Media player,23:32,maheanuu,I do NOT have a machine that runs windows available so I cannot use the manual that came with this Media player
123,[23:33] <gnosis> Catarthes: what was your question?,23:33,gnosis,Catarthes: what was your question?
124,[23:33] <ActionParsnip> Catarthes: make a project on launchpad and announce it on the forums and people may join,23:33,ActionParsnip,Catarthes: make a project on launchpad and announce it on the forums and people may join
125,"[23:33] <wavedigit> Catarthes, if portability is an issue, I would suggest Java",23:33,wavedigit,"Catarthes, if portability is an issue, I would suggest Java"
126,"[23:33] <kdub> wavedigit: i'm a c fan too, but c and c++ are both pretty fast, and well supported in linux. i can code faster in C than c++,  but maybe Catarthes is faster with c++",23:33,kdub,"wavedigit: i'm a c fan too, but c and c++ are both pretty fast, and well supported in linux. i can code faster in C than c++,  but maybe Catarthes is faster with c++"
127,[23:33] <Catarthes> actually I'm looking for help from concerned developers,23:33,Catarthes,actually I'm looking for help from concerned developers
128,[23:33] <Catarthes> launchpad? thanks ActionP,23:33,Catarthes,launchpad? thanks ActionP
129,[23:33] <wavedigit> it alll depends,23:33,wavedigit,it alll depends
130,[23:33] <wavedigit> on where you want to go,23:33,wavedigit,on where you want to go
131,[23:33] <wavedigit> and how,23:33,wavedigit,and how
132,"[23:34] <Catarthes> wavedigit, java is too heavy for 3d environments, I think (and the ammounts of data I'll load)",23:34,Catarthes,"wavedigit, java is too heavy for 3d environments, I think (and the ammounts of data I'll load)"
133,[23:34] <wavedigit> minecraft pulled it off though...,23:34,wavedigit,minecraft pulled it off though...
134,[23:34] <ActionParsnip> and runescape,23:34,ActionParsnip,and runescape
135,[23:35] <Catarthes> they're equivalents of sourceforge?,23:35,Catarthes,they're equivalents of sourceforge?
136,"[23:35] <d0lph1n> hi all, it's this server up?? irc.gimp.org",23:35,d0lph1n,"hi all, it's this server up?? irc.gimp.org"
137,[23:35] <faryshta> Thunar and nautilus doesn't load thumbnails on videos. What should I do?,23:35,faryshta,Thunar and nautilus doesn't load thumbnails on videos. What should I do?
138,[23:35] <cfedde> d0lph1n: it seems to be.,23:35,cfedde,d0lph1n: it seems to be.
139,"[23:35] <ActionParsnip> d0lph1n: it pings dead slow, but does reply",23:35,ActionParsnip,"d0lph1n: it pings dead slow, but does reply"
140,[23:35] <Catarthes> is it an advantage to have the same project in two hosts?,23:35,Catarthes,is it an advantage to have the same project in two hosts?
141,[23:36] <cfedde> telnet irc.gimp.org 6666,23:36,cfedde,telnet irc.gimp.org 6666
142,[23:36] <s33kr1> exit,23:36,s33kr1,exit
143,[23:37] <ActionParsnip> faryshta: try closing all nautiluses and run:  mv ~/.thumbnails ~/.thumbnails_old,23:37,ActionParsnip,faryshta: try closing all nautiluses and run:  mv ~/.thumbnails ~/.thumbnails_old
144,"[23:38] <d0lph1n> cfedde, ActionParsnip  can you join to irc?",23:38,d0lph1n,"cfedde, ActionParsnip  can you join to irc?"
145,[23:38] <ActionParsnip> faryshta: then rerun nautilus,23:38,ActionParsnip,faryshta: then rerun nautilus
146,[23:38] <d0lph1n> I cant,23:38,d0lph1n,I cant
147,[23:38] <ActionParsnip> d0lph1n: didn't try,23:38,ActionParsnip,d0lph1n: didn't try
148,"[23:38] <faryshta> ActionParsnip, SIR, YES SIR!",23:38,faryshta,"ActionParsnip, SIR, YES SIR!"
149,[23:38] <alosa> how can I close the 7175 port I don't have a postgresql...,23:38,alosa,how can I close the 7175 port I don't have a postgresql...
150,[23:38] <gnosis> alosa: what's using it?,23:38,gnosis,alosa: what's using it?
151,[23:39] <ActionParsnip> cfedde: irc uses port 6667 usually...,23:39,ActionParsnip,cfedde: irc uses port 6667 usually...
152,[23:39] <alosa> nessus,23:39,alosa,nessus
153,[23:39] <gnosis> alosa: try sudo /etc/init.d/nessusd stop,23:39,gnosis,alosa: try sudo /etc/init.d/nessusd stop
154,[23:40] <MaRk-I> d0lph1n: Connecting to irc.us.gimp.org (130.239.18.157) port 6667,23:40,MaRk-I,d0lph1n: Connecting to irc.us.gimp.org (130.239.18.157) port 6667
155,[23:40] <MaRk-I> connected,23:40,MaRk-I,connected
156,"[23:40] <d0lph1n> MaRk-I, thanks",23:40,d0lph1n,"MaRk-I, thanks"
157,[23:40] <MaRk-I> d0lph1n: yw,23:40,MaRk-I,d0lph1n: yw
158,"[23:40] <ActionParsnip> d0lph1n: yes, i'm on",23:40,ActionParsnip,"d0lph1n: yes, i'm on"
159,[23:41] <maheanuu> Could someone point me to the Ubuntu  newbie channels here in freenode?,23:41,maheanuu,Could someone point me to the Ubuntu  newbie channels here in freenode?
160,[23:41] <alosa> gnosi: sudo: /etc/init.d/nessusd: command not found,23:41,alosa,gnosi: sudo: /etc/init.d/nessusd: command not found
161,[23:41] <kdub> maheanuu: you've found it!@,23:41,kdub,maheanuu: you've found it!@
162,[23:41] <alosa> I dont have nessus now,23:41,alosa,I dont have nessus now
163,"[23:41] <ActionParsnip> maheanuu: here is a good place, ask your questions and we'll try to help",23:41,ActionParsnip,"maheanuu: here is a good place, ask your questions and we'll try to help"
164,"[23:41] <faryshta> ActionParsnip, didn't worked :(",23:41,faryshta,"ActionParsnip, didn't worked :("
165,[23:42] <maheanuu> already did and no answer for the past 3 times I have been here,23:42,maheanuu,already did and no answer for the past 3 times I have been here
166,[23:42] <ActionParsnip> faryshta: do the images have thumbs though?,23:42,ActionParsnip,faryshta: do the images have thumbs though?
167,[23:42] <swatto> Anyone know of a remote control app for ubuntu,23:42,swatto,Anyone know of a remote control app for ubuntu
168,[23:42] <ActionParsnip> swatto: in what sense?,23:42,ActionParsnip,swatto: in what sense?
169,[23:42] <swatto> ActionParsnip: for android,23:42,swatto,ActionParsnip: for android
