,raw,timestamp,user,message
1170,"[02:24] <swatto> mickster84: yep my startup apps dont run, i want Xchat to start on boot but it doesnt it just dont load and neither does any of my other user defined programs..bluetooth etc all load fine though? Other apps work, VLC did work but now it doesnt for some reason",02:24,swatto,"mickster84: yep my startup apps dont run, i want Xchat to start on boot but it doesnt it just dont load and neither does any of my other user defined programs..bluetooth etc all load fine though? Other apps work, VLC did work but now it doesnt for some reason"
1171,[02:24] <Oqm> cheers edbian,02:24,Oqm,cheers edbian
1172,[02:24] <mickster04> oracle_vm: what speeds are you expecting?,02:24,mickster04,oracle_vm: what speeds are you expecting?
1173,"[02:24] <mickster04> swatto: curious, no idea, can you m anually start x-chat? what have you changed recently?",02:24,mickster04,"swatto: curious, no idea, can you m anually start x-chat? what have you changed recently?"
1174,"[02:26] <swatto> mickster84: yep i can manually start it - i havent changed anything as far as im aware, ive tried resetting the startup applications back to defaults but has made no difference, im wondering if it is a profile issue?",02:26,swatto,"mickster84: yep i can manually start it - i havent changed anything as far as im aware, ive tried resetting the startup applications back to defaults but has made no difference, im wondering if it is a profile issue?"
1175,[02:26] <mickster04> !@tab | swatto,02:26,mickster04,!@tab | swatto
1176,"[02:26] <ubottu> swatto: You can use your <tab> key for autocompletion of nicknames in IRC, as well as for completion of filenames and programs on the command line.",02:26,ubottu> swatto: You can use your <tab,"key for autocompletion of nicknames in IRC, as well as for completion of filenames and programs on the command line."
1177,[02:27] <brightspark> How can I remove old keyboard layouts from the menu that shows up when I click my picture at the login screen?,02:27,brightspark,How can I remove old keyboard layouts from the menu that shows up when I click my picture at the login screen?
1178,[02:27] <mickster04> swatto: yeah i dunno...keep asking though...,02:27,mickster04,swatto: yeah i dunno...keep asking though...
1179,[02:27] <swatto> ill make a new user and group to see if that solves it,02:27,swatto,ill make a new user and group to see if that solves it
1180,[02:28] <oracle_vm> mickster04: 15-19MBps,02:28,oracle_vm,mickster04: 15-19MBps
1181,[02:29] <mickster04> oracle_vm: is your port 2.0,02:29,mickster04,oracle_vm: is your port 2.0
1182,[02:30] <oracle_vm> mickster04: yes,02:30,oracle_vm,mickster04: yes
1183,[02:30] <mickster04> oracle_vm: thee are several things that could be causing it.,02:30,mickster04,oracle_vm: thee are several things that could be causing it.
1184,[02:30] <mickster04> oracle_vm: an i dunno how to find out what might be the problem,02:30,mickster04,oracle_vm: an i dunno how to find out what might be the problem
1185,[02:31] <gnosis> oracle_vm: are you transferring lots of small files?,02:31,gnosis,oracle_vm: are you transferring lots of small files?
1186,"[02:31] <obengdako> oracle_vm, i also believe the pipe is long so just use simple dd though you wont have the progress",02:31,obengdako,"oracle_vm, i also believe the pipe is long so just use simple dd though you wont have the progress"
1187,[02:31] <oracle_vm> mickster04: somebody just told me it may be becuase it's a sector to sector copy of a drive that it's slower,02:31,oracle_vm,mickster04: somebody just told me it may be becuase it's a sector to sector copy of a drive that it's slower
1188,[02:31] <obengdako> you can monitor file size,02:31,obengdako,you can monitor file size
1189,[02:31] <oracle_vm> gnosis: no,02:31,oracle_vm,gnosis: no
1190,"[02:32] <gnosis> ah, i just looked back at your orig command, nm",02:32,gnosis,"ah, i just looked back at your orig command, nm"
1191,[02:32] <obengdako> yes that also account it is a raw copy,02:32,obengdako,yes that also account it is a raw copy
1192,"[02:32] <mickster04> oracle_vm: oh yeah, so it'll probably be doing lots of checks or whatever which won't help speed much",02:32,mickster04,"oracle_vm: oh yeah, so it'll probably be doing lots of checks or whatever which won't help speed much"
1193,[02:32] <oracle_vm> obengdako: so raw copies are inherently slower?.. i wouldn;t have thought so for some reason,02:32,oracle_vm,obengdako: so raw copies are inherently slower?.. i wouldn;t have thought so for some reason
1194,[02:33] <obengdako> nope they aren't because they are raw but i also was thinking your pipe | made the process too long,02:33,obengdako,nope they aren't because they are raw but i also was thinking your pipe | made the process too long
1195,[02:34] <firered365> hello,02:34,firered365,hello
1196,[02:34] <lwizardl> how do i make it so I can compress iso disc images via right click menu ?,02:34,lwizardl,how do i make it so I can compress iso disc images via right click menu ?
1197,"[02:34] <oracle_vm> obengdako: I've done dd with much smaller transfer like less than 10Gb ,, I would be antsy about anything larger without any indication of it's prgress",02:34,oracle_vm,"obengdako: I've done dd with much smaller transfer like less than 10Gb ,, I would be antsy about anything larger without any indication of it's prgress"
1198,[02:35] <firered365> I need help installing linux on windows Me,02:35,firered365,I need help installing linux on windows Me
1199,[02:35] <obengdako> just a simple dd if=/dev of=/ would do but the piping for progress might slow it down,02:35,obengdako,just a simple dd if=/dev of=/ would do but the piping for progress might slow it down
1200,"[02:35] <lwizardl> firered365, umm format the hdd to remove that horrible OS and then start the installer",02:35,lwizardl,"firered365, umm format the hdd to remove that horrible OS and then start the installer"
1201,[02:35] <gnosis> firered365: you're shitting me,02:35,gnosis,firered365: you're shitting me
1202,"[02:36] <firered365> Ok, How do I format the hdd",02:36,firered365,"Ok, How do I format the hdd"
1203,"[02:36] <pfifo> Ben64, editing /etc/shadow created problems",02:36,pfifo,"Ben64, editing /etc/shadow created problems"
1204,"[02:36] <lwizardl> firered365, can your computer boot from cd?",02:36,lwizardl,"firered365, can your computer boot from cd?"
1205,[02:36] <gnosis> firered365: do you seriously have windows ME?,02:36,gnosis,firered365: do you seriously have windows ME?
1206,[02:36] <firered365> I tried nothing.,02:36,firered365,I tried nothing.
1207,[02:36] <lwizardl> or do you need a boot floppy,02:36,lwizardl,or do you need a boot floppy
1208,"[02:37] <obengdako> oracle_vm, do you want to mainttain the file structure? is that why you are dd ing or just want to copy contents",02:37,obengdako,"oracle_vm, do you want to mainttain the file structure? is that why you are dd ing or just want to copy contents"
1209,[02:37] <firered365> It has a cd drive,02:37,firered365,It has a cd drive
1210,"[02:37] <lwizardl> firered365, ok put the cd in and reboot the computer does it boot the cd or go back into windows",02:37,lwizardl,"firered365, ok put the cd in and reboot the computer does it boot the cd or go back into windows"
1211,"[02:37] <aroman> hey, I'm in the laptop market and I'm wondering how Ubuntu/Linux handles systems with dual-graphics systems (i.e Intel HD 3000 and an AMD card in the same laptop). Thanks :)",02:37,aroman,"hey, I'm in the laptop market and I'm wondering how Ubuntu/Linux handles systems with dual-graphics systems (i.e Intel HD 3000 and an AMD card in the same laptop). Thanks :)"
1212,"[02:37] <disorient> i'm trying to launch pureftp with arguments, sudo service pure-ftp --trustedgid 1005 start, what is the right way to do this?",02:37,disorient,"i'm trying to launch pureftp with arguments, sudo service pure-ftp --trustedgid 1005 start, what is the right way to do this?"
1213,[02:37] <mickster04> firered365: first you go to ubuntu.com and read the instructions,02:37,mickster04,firered365: first you go to ubuntu.com and read the instructions
1214,[02:38] <gnosis> firered365: have you downloaded an ubuntu iso?,02:38,gnosis,firered365: have you downloaded an ubuntu iso?
1215,[02:38] <mickster04> firered365: have you turned your computer on?,02:38,mickster04,firered365: have you turned your computer on?
1216,[02:38] <firered365> it goes back to windows and yes,02:38,firered365,it goes back to windows and yes
1217,[02:38] <oracle_vm> obengdako: a windows hardrive I had messed up 2 years ago so I'm finally getting around to fixing/recovering the damaged partition.. I want to image it first,02:38,oracle_vm,obengdako: a windows hardrive I had messed up 2 years ago so I'm finally getting around to fixing/recovering the damaged partition.. I want to image it first
1218,[02:38] <test> mickster04: Its swatto - im on a test account and its working fine now - can start VLC too,02:38,test,mickster04: Its swatto - im on a test account and its working fine now - can start VLC too
1219,[02:38] <l3aked4uftw> aroman: if you stay away from nvidia you may be fine,02:38,l3aked4uftw,aroman: if you stay away from nvidia you may be fine
1220,[02:38] <aroman> l3aked4uftw: what do you mean?,02:38,aroman,l3aked4uftw: what do you mean?
1221,[02:38] <mickster04> test: so your profiloe is kaput?,02:38,mickster04,test: so your profiloe is kaput?
1222,[02:38] <l3aked4uftw> aroman: for ati cards there may be a solution with open drivers (same with nvidia if you re lucky),02:38,l3aked4uftw,aroman: for ati cards there may be a solution with open drivers (same with nvidia if you re lucky)
1223,"[02:38] <pfifo> how do i disable notifications, in fact how do i disable EVERYTHING that wants to automatically do anything without my explicitly typing a command on the command line",02:38,pfifo,"how do i disable notifications, in fact how do i disable EVERYTHING that wants to automatically do anything without my explicitly typing a command on the command line"
1224,[02:38] <gnosis> firered365: have you backed up any files you want to keep?,02:38,gnosis,firered365: have you backed up any files you want to keep?
1225,"[02:38] <aroman> l3aked4uftw: oh you mean opensource drivers, as opposed to using proprietary ones?",02:38,aroman,"l3aked4uftw: oh you mean opensource drivers, as opposed to using proprietary ones?"
1226,[02:38] <obengdako> okay okay then i guess you have to do the slow dd for 250GB oracle_vm  sorry,02:38,obengdako,okay okay then i guess you have to do the slow dd for 250GB oracle_vm  sorry
1227,"[02:39] <test> mickster04: yep looks like it, must have messed about so much thats something is screwed",02:39,test,"mickster04: yep looks like it, must have messed about so much thats something is screwed"
1228,[02:39] <aroman> l3aked4uftw: I was under the impression they offered inferior performance.,02:39,aroman,l3aked4uftw: I was under the impression they offered inferior performance.
1229,"[02:39] <l3aked4uftw> aroman: you may want to have a read at ""optimus"" technology for nvidia and ""switchable graphics"" for ati",02:39,l3aked4uftw,"aroman: you may want to have a read at ""optimus"" technology for nvidia and ""switchable graphics"" for ati"
1230,[02:39] <webroasters> hey guys. how can i get onto a mailing list that sends me an email every time a new release of ubuntu comes out? I've been looking all over for that,02:39,webroasters,hey guys. how can i get onto a mailing list that sends me an email every time a new release of ubuntu comes out? I've been looking all over for that
1231,[02:39] <test> mickster04: at least its not an OS reinstall,02:39,test,mickster04: at least its not an OS reinstall
1232,[02:39] <l3aked4uftw> aroman: they may offer inferior performance but they re the only that let you switch,02:39,l3aked4uftw,aroman: they may offer inferior performance but they re the only that let you switch
1233,[02:39] <mickster04> aroman: then the easiest solution is to create a new user with admin privalidges and remove the old one imo,02:39,mickster04,aroman: then the easiest solution is to create a new user with admin privalidges and remove the old one imo
1234,"[02:39] <webroasters> i know 11.04 is coming soon, and I wanted to get an email when it was ready",02:39,webroasters,"i know 11.04 is coming soon, and I wanted to get an email when it was ready"
1235,[02:39] <firered365> Dont want to back up any files,02:39,firered365,Dont want to back up any files
1236,[02:39] <oracle_vm> obengdako: next time i'll go for internal sata,02:39,oracle_vm,obengdako: next time i'll go for internal sata
1237,[02:39] <aroman> mickster04: I think that was a misdirected ping :),02:39,aroman,mickster04: I think that was a misdirected ping :)
1238,[02:39] <mickster04> webroasters: well just set an email to email you on the 28th?,02:39,mickster04,webroasters: well just set an email to email you on the 28th?
1239,[02:39] <SP_0taku> Hello I'm having an issue after updating from server 9.04 to 9.10 and have put the problem @ http://paste.ubuntu.com/594299/ thanks ahead for helping out :),02:39,SP_0taku,Hello I'm having an issue after updating from server 9.04 to 9.10 and have put the problem @ http://paste.ubuntu.com/594299/ thanks ahead for helping out :)
1240,[02:40] <mickster04> aroman: yes ineed,02:40,mickster04,aroman: yes ineed
1241,[02:40] <webroasters> lol. funny,02:40,webroasters,lol. funny
1242,[02:40] <mickster04> aroman: i saw your nick and typed it :p,02:40,mickster04,aroman: i saw your nick and typed it :p
1243,"[02:40] <l3aked4uftw> aroman: dual card = integrated card for low demanding stuff, discrete card for high demanding",02:40,l3aked4uftw,"aroman: dual card = integrated card for low demanding stuff, discrete card for high demanding"
1244,[02:40] <Ben64> webroasters: the schedule is very consistent,02:40,Ben64,webroasters: the schedule is very consistent
1245,[02:40] <mickster04> test then the easiest solution is to create a new user with admin privalidges and remove the old one imo,02:40,mickster04,test then the easiest solution is to create a new user with admin privalidges and remove the old one imo
1246,[02:40] <gnosis> firered365: go into bios and set cd drive as first boot device,02:40,gnosis,firered365: go into bios and set cd drive as first boot device
1247,"[02:40] <obengdako> oracle_vm, hehehe",02:40,obengdako,"oracle_vm, hehehe"
1248,[02:40] <webroasters> right i know,02:40,webroasters,right i know
1249,[02:40] <firered365> How do i do that,02:40,firered365,How do i do that
1250,[02:40] <webroasters> but a newsletter or something would be nice,02:40,webroasters,but a newsletter or something would be nice
1251,"[02:40] <aroman> l3aked4uftw: The switching/optimus system lets the OS decide which card is best for the task at hand, right?",02:40,aroman,"l3aked4uftw: The switching/optimus system lets the OS decide which card is best for the task at hand, right?"
1252,[02:40] <test> mickster04: I need to get some stuff from Home directory though,02:40,test,mickster04: I need to get some stuff from Home directory though
1253,"[02:40] <aroman> l3aked4uftw: like per-application, I thought.",02:40,aroman,"l3aked4uftw: like per-application, I thought."
1254,[02:40] <mickster04> webroasters: a newsletter saying what?,02:40,mickster04,webroasters: a newsletter saying what?
1255,"[02:40] <gnosis> firered365: reboot, it should say how to go into setup, usually F1 or delete",02:40,gnosis,"firered365: reboot, it should say how to go into setup, usually F1 or delete"
1256,[02:41] <SP_0taku> issue is with booting.,02:41,SP_0taku,issue is with booting.
1257,[02:41] <webroasters> nevermind,02:41,webroasters,nevermind
1258,[02:41] <mickster04> test: copy /home/user /home/newuser,02:41,mickster04,test: copy /home/user /home/newuser
1259,[02:41] <webroasters> thanks guys,02:41,webroasters,thanks guys
1260,"[02:41] <l3aked4uftw> aroman: nvidia offers NO support for linux (only open drivers do)  ati offers open drivers which may in a future (not a far one i suppose) work with linux , if you buy a so called dual card equipped laptop it will have that technology and if you have a nvidia you will only use the intel/amd integrated card (not sure amd has a gma-like product)",02:41,l3aked4uftw,"aroman: nvidia offers NO support for linux (only open drivers do)  ati offers open drivers which may in a future (not a far one i suppose) work with linux , if you buy a so called dual card equipped laptop it will have that technology and if you have a nvidia you will only use the intel/amd integrated card (not sure amd has a gma-like product)"
1261,[02:41] <firered365> it doesnt say,02:41,firered365,it doesnt say
1262,"[02:41] <gnosis> firered365: without knowing your bios i can't give exact instructions, but look for boot menu, boot order, soemthing like that",02:41,gnosis,"firered365: without knowing your bios i can't give exact instructions, but look for boot menu, boot order, soemthing like that"
1263,[02:41] <firered365> Ok what is BIOS,02:41,firered365,Ok what is BIOS
1264,[02:41] <milind> i am trying to change the primary display in ubuntu 10.10 to my external gateway 23 inch monitor. I have a ati radeon hd 6250 graphics card and the ati catalyst does not have an option to choose which display to put as my primary display. What should i do?,02:41,milind,i am trying to change the primary display in ubuntu 10.10 to my external gateway 23 inch monitor. I have a ati radeon hd 6250 graphics card and the ati catalyst does not have an option to choose which display to put as my primary display. What should i do?
1265,[02:41] <test> mickster04: how can i create the swatto account again,02:41,test,mickster04: how can i create the swatto account again
1266,[02:42] <pupy> can somebody help me? why wouldn't ubuntu boot windows xp in /dev/sda1?,02:42,pupy,can somebody help me? why wouldn't ubuntu boot windows xp in /dev/sda1?
1267,[02:42] <gnosis> firered365: are you doing this on another comp right now?,02:42,gnosis,firered365: are you doing this on another comp right now?
1268,[02:42] <firered365> yes,02:42,firered365,yes
1269,"[02:42] <l3aked4uftw> aroman: simple example, you boot up your windows system and open paint, here you re using the integrated card, then you get bored and wanna play lets say crysis? it automatically turns on the discrete one, on linux this isnt widely supported yet, and won't be (seems so) from nvidia anyways",02:42,l3aked4uftw,"aroman: simple example, you boot up your windows system and open paint, here you re using the integrated card, then you get bored and wanna play lets say crysis? it automatically turns on the discrete one, on linux this isnt widely supported yet, and won't be (seems so) from nvidia anyways"
1270,[02:42] <pupy> all I get is a cursor blinking,02:42,pupy,all I get is a cursor blinking
1271,"[02:42] <oracle_vm> obengdako: I just checked the chart on wikipedia for usb,sata and thunderbolt transfer speeds.. i for one can;t wait for thunderbolt in everything..",02:42,oracle_vm,"obengdako: I just checked the chart on wikipedia for usb,sata and thunderbolt transfer speeds.. i for one can;t wait for thunderbolt in everything.."
1272,[02:42] <pupy> well ubuntu...grub2,02:42,pupy,well ubuntu...grub2
1273,"[02:42] <aroman> l3aked4uftw: In that situation, is there any dual combo that would work with Linux?",02:42,aroman,"l3aked4uftw: In that situation, is there any dual combo that would work with Linux?"
1274,"[02:43] <gnosis> firered365: when you turn on the computer, before getting to windows, it should show something like ""press F1 to enter setup""",02:43,gnosis,"firered365: when you turn on the computer, before getting to windows, it should show something like ""press F1 to enter setup"""
1275,[02:43] <milind> i am trying to change the primary display in ubuntu 10.10 to my external gateway 23 inch monitor. I have a ati radeon hd 6250 graphics card and the ati catalyst does not have an option to choose which display to put as my primary display. What should i do?,02:43,milind,i am trying to change the primary display in ubuntu 10.10 to my external gateway 23 inch monitor. I have a ati radeon hd 6250 graphics card and the ati catalyst does not have an option to choose which display to put as my primary display. What should i do?
1276,"[02:43] <aroman> Like I'm browsing the web, and then I want to play Nexuiz or something.",02:43,aroman,"Like I'm browsing the web, and then I want to play Nexuiz or something."
1277,[02:43] <firered365> it doesnt say,02:43,firered365,it doesnt say
1278,"[02:43] <obengdako> oracle_vm, really i got to check this thunderbolt out myself",02:43,obengdako,"oracle_vm, really i got to check this thunderbolt out myself"
1279,[02:43] <firered365> press F1 to start,02:43,firered365,press F1 to start
1280,"[02:43] <oracle_vm> obengdako: thunderbolt is 1,250MBps transfer speed..",02:43,oracle_vm,"obengdako: thunderbolt is 1,250MBps transfer speed.."
1281,"[02:43] <l3aked4uftw> aroman: nexuiz should work with gma i think, in the last years i been using only those lol",02:43,l3aked4uftw,"aroman: nexuiz should work with gma i think, in the last years i been using only those lol"
1282,"[02:43] <gnosis> firered365: try just continually pressing F1, F2, and delete while it's booting then",02:43,gnosis,"firered365: try just continually pressing F1, F2, and delete while it's booting then"
1283,[02:43] <oracle_vm> obengdako: http://en.wikipedia.org/wiki/SATA#Comparison_to_other_buses,02:43,oracle_vm,obengdako: http://en.wikipedia.org/wiki/SATA#Comparison_to_other_buses
1284,[02:43] <gnosis> it should go into a very old looking menu screen,02:43,gnosis,it should go into a very old looking menu screen
1285,[02:43] <firered365> Ok thanks,02:43,firered365,Ok thanks
1286,"[02:44] <obengdako> oracle_vm, gosh that is quite fast i mean really fast",02:44,obengdako,"oracle_vm, gosh that is quite fast i mean really fast"
1287,"[02:44] <l3aked4uftw> aroman:  i dont get your first statement, are you buying a laptop or you sell them?",02:44,l3aked4uftw,"aroman:  i dont get your first statement, are you buying a laptop or you sell them?"
1288,[02:44] <aroman> l3aked4uftw: I'm buying :),02:44,aroman,l3aked4uftw: I'm buying :)
1289,[02:45] <l3aked4uftw> aroman: in that case may i ask you what you want to do with it?,02:45,l3aked4uftw,aroman: in that case may i ask you what you want to do with it?
1290,"[02:45] <aroman> and I only have use for Linux, so I want to make sure the hardware works as cleanly as possible with it.",02:45,aroman,"and I only have use for Linux, so I want to make sure the hardware works as cleanly as possible with it."
1291,[02:45] <milind> i am trying to change the primary display in ubuntu 10.10 to my external gateway 23 inch monitor. I have a ati radeon hd 6250 graphics card and the ati catalyst does not have an option to choose which display to put as my primary display. What should i do?,02:45,milind,i am trying to change the primary display in ubuntu 10.10 to my external gateway 23 inch monitor. I have a ati radeon hd 6250 graphics card and the ati catalyst does not have an option to choose which display to put as my primary display. What should i do?
1292,[02:45] <mickster04> gnosis: you have patience :D,02:45,mickster04,gnosis: you have patience :D
1293,[02:45] <aroman> l3aked4uftw: coding and schoolwork.,02:45,aroman,l3aked4uftw: coding and schoolwork.
1294,"[02:46] <l3aked4uftw> aroman: most gma (except 950 or 500 i forgot which one, but very old one) work out of the box with latest versions of ubuntu, nothing required",02:46,l3aked4uftw,"aroman: most gma (except 950 or 500 i forgot which one, but very old one) work out of the box with latest versions of ubuntu, nothing required"
1295,[02:46] <pfifo> how can I spin down my SSD drive to save power?,02:46,pfifo,how can I spin down my SSD drive to save power?
1296,[02:46] <l3aked4uftw> aroman: that means no heavy gaming or uber-hd video in flash or some cpu killer plugin?,02:46,l3aked4uftw,aroman: that means no heavy gaming or uber-hd video in flash or some cpu killer plugin?
1297,[02:46] <aroman> pfifo: LOL,02:46,aroman,pfifo: LOL
1298,"[02:46] <pfifo> aroman, S.M.A.R.T. is trolling me",02:46,pfifo,"aroman, S.M.A.R.T. is trolling me"
1299,[02:46] <gnosis> mickster04: i'm in shock.  can't believe someone still has a computer with winME,02:46,gnosis,mickster04: i'm in shock.  can't believe someone still has a computer with winME
1300,"[02:46] <aroman> l3aked4uftw: I'm sure i'll be using Flash, and I'd like to be able to play 1080p video and stuff",02:46,aroman,"l3aked4uftw: I'm sure i'll be using Flash, and I'd like to be able to play 1080p video and stuff"
1301,"[02:47] <aroman> i""m not looking to do video editing or playing serious games on it",02:47,aroman,"i""m not looking to do video editing or playing serious games on it"
1302,[02:47] <dotblank> One time I was like.. WinME is so old.. it will run so fast on my computer...,02:47,dotblank,One time I was like.. WinME is so old.. it will run so fast on my computer...
1303,[02:47] <mickster04> pfifo: you're funny :D,02:47,mickster04,pfifo: you're funny :D
1304,[02:47] <aroman> pfifo: haha,02:47,aroman,pfifo: haha
1305,[02:47] <dotblank> couldn't be more wrong,02:47,dotblank,couldn't be more wrong
1306,"[02:47] <l3aked4uftw> aroman: if you like i may hint you with something, like model what to search and so on",02:47,l3aked4uftw,"aroman: if you like i may hint you with something, like model what to search and so on"
1307,[02:47] <mickster04> gnosis: i wonder how he heard of ubuntu? telegram?,02:47,mickster04,gnosis: i wonder how he heard of ubuntu? telegram?
1308,[02:47] <aroman> l3aked4uftw: sure,02:47,aroman,l3aked4uftw: sure
1309,[02:47] <pfifo> SMART error 'device is being used outside of design parameters',02:47,pfifo,SMART error 'device is being used outside of design parameters'
