,raw,timestamp,user,message
647,[00:58] <G_Val> edbian: yes man as you can see i have only 2 hd,00:58,G_Val,edbian: yes man as you can see i have only 2 hd
648,[00:59] <G_Val> edbian: sda is ehre my linnux and win os are located,00:59,G_Val,edbian: sda is ehre my linnux and win os are located
649,[00:59] <edbian> G_Val: screen shot me what gparted sees on the harddrive you're trying to edit.  Can you do that?,00:59,edbian,G_Val: screen shot me what gparted sees on the harddrive you're trying to edit.  Can you do that?
650,[00:59] <G_Val> edbian: is where*,00:59,G_Val,edbian: is where*
651,[00:59] <edbian> G_Val: I see that.,00:59,edbian,G_Val: I see that.
652,[00:59] <G_Val> sure but is quite easy ! it says unallocated space xD,00:59,G_Val,sure but is quite easy ! it says unallocated space xD
653,[01:00] <G_Val> edbian: sure but is quite easy ! it says unallocated space xD,01:00,G_Val,edbian: sure but is quite easy ! it says unallocated space xD
654,[01:00] <edbian> G_Val: no picture then.  What does the other drive show in gparted?,01:00,edbian,G_Val: no picture then.  What does the other drive show in gparted?
655,[01:00] <gnosis> phux: *jealousy*  college is fucking expensive in the US,01:00,gnosis,phux: *jealousy*  college is fucking expensive in the US
656,[01:00] <phux> aeon-ltd: what would you say if i tell you that you also get up to 700$ each month(depending on your parents' income) and you gotta pay back at most the half? :P,01:00,phux,aeon-ltd: what would you say if i tell you that you also get up to 700$ each month(depending on your parents' income) and you gotta pay back at most the half? :P
657,[01:01] <G_Val> edbian: the secnd one could be recognized and works greatly,01:01,G_Val,edbian: the secnd one could be recognized and works greatly
658,[01:02] <G_Val> edbian: only  the first one cannot be seen idk why,01:02,G_Val,edbian: only  the first one cannot be seen idk why
659,[01:02] <edbian> G_Val: I think the partition table is messed up.  I'm not really sure.  You should use dd to make a backup or something right now,01:02,edbian,G_Val: I think the partition table is messed up.  I'm not really sure.  You should use dd to make a backup or something right now
660,[01:02] <edbian> G_Val: wait,01:02,edbian,G_Val: wait
661,[01:02] <gnosis> phux: my ex-g/f has >$100k in school loans,01:02,gnosis> phux: my ex-g/f has ,phux: my ex-g/f has >$100k in school loans
662,"[01:02] <phux> gnosis: yeah, i think it's not the best idea to reserve the education for the better earning families",01:02,phux,"gnosis: yeah, i think it's not the best idea to reserve the education for the better earning families"
663,"[01:02] <aeon-ltd> phux: ok there is something seriously wrong with all the other countries in the world, except netherlands & germany",01:02,aeon-ltd,"phux: ok there is something seriously wrong with all the other countries in the world, except netherlands & germany"
664,[01:02] <edbian> !ot,01:02,edbian,!ot
665,"[01:02] <ubottu> #ubuntu is the Ubuntu support channel, for all Ubuntu-related support questions. Please use #ubuntu-offtopic for other topics (though our !guidelines apply there too). Thanks!",01:02,ubottu,"#ubuntu is the Ubuntu support channel, for all Ubuntu-related support questions. Please use #ubuntu-offtopic for other topics (though our !guidelines apply there too). Thanks!"
666,[01:03] <aeon-ltd> edbian: sorry i'll go there now,01:03,aeon-ltd,edbian: sorry i'll go there now
667,[01:03] <edbian> aeon-ltd: no worries! :),01:03,edbian,aeon-ltd: no worries! :)
668,[01:03] <s33kr> any server for random help about linux?,01:03,s33kr,any server for random help about linux?
669,[01:03] <edbian> I just wanna talk about Ubuntu,01:03,edbian,I just wanna talk about Ubuntu
670,[01:03] <edbian> s33kr: There is a linux channel on this server I believe,01:03,edbian,s33kr: There is a linux channel on this server I believe
671,[01:03] <Paddy_NI> s33kr: ##linux perhaps,01:03,Paddy_NI,s33kr: ##linux perhaps
672,"[01:03] <G_Val> edbian: man i check my data on the first HD and there is no issue with that ! Maybe if i can reinstall only the os i am so happy, or i can back up my data from old partition and ""paste"" on the new one ! A secure backup is appreciated also",01:03,G_Val,"edbian: man i check my data on the first HD and there is no issue with that ! Maybe if i can reinstall only the os i am so happy, or i can back up my data from old partition and ""paste"" on the new one ! A secure backup is appreciated also"
673,"[01:04] <phux> abstrakt: yes, but as im still in a single ""development"" environment, ill put it at the bottom of my list",01:04,phux,"abstrakt: yes, but as im still in a single ""development"" environment, ill put it at the bottom of my list"
674,[01:04] <Technicus> Hello . . . how do I find the title of a window?  I am trying to embed konsole on a Gnome desktop.  This is the tutirial I am following: [ http://www.webupd8.org/2009/05/ubuntu-embed-terminal-into-you-desktop.html ].  For it to work I need to know the title of the konsole window that opens.,01:04,Technicus,Hello . . . how do I find the title of a window?  I am trying to embed konsole on a Gnome desktop.  This is the tutirial I am following: [ http://www.webupd8.org/2009/05/ubuntu-embed-terminal-into-you-desktop.html ].  For it to work I need to know the title of the konsole window that opens.
675,[01:04] <edbian> G_Val: I think if you partition again with gparted there will be no issue (besides your data being erased).  What initially caused this problem?,01:04,edbian,G_Val: I think if you partition again with gparted there will be no issue (besides your data being erased).  What initially caused this problem?
676,[01:04] <KINGOFSWORDS> hi,01:04,KINGOFSWORDS,hi
677,[01:04] <edbian> Technicus: The 'title' is what shows up in the title bar (next to the x + and -),01:04,edbian,Technicus: The 'title' is what shows up in the title bar (next to the x + and -)
678,[01:05] <edbian> KINGOFSWORDS: hello :),01:05,edbian,KINGOFSWORDS: hello :)
679,[01:05] <KINGOFSWORDS> i have no titlebar on my windwows....is there anyway of sorting this out without restarting compiz?,01:05,KINGOFSWORDS,i have no titlebar on my windwows....is there anyway of sorting this out without restarting compiz?
680,[01:05] <KINGOFSWORDS> hi edbian,01:05,KINGOFSWORDS,hi edbian
681,[01:05] <G_Val> edbian: i accidentally deleted original patition-table with testdisk...but i immediately restored it,01:05,G_Val,edbian: i accidentally deleted original patition-table with testdisk...but i immediately restored it
682,"[01:05] <edbian> KINGOFSWORDS: go to tty1, run this: compiz --replace&, switch back to graphics",01:05,edbian,"KINGOFSWORDS: go to tty1, run this: compiz --replace&, switch back to graphics"
683,[01:05] <KINGOFSWORDS> is ttyl a cmd or program?,01:05,KINGOFSWORDS,is ttyl a cmd or program?
684,[01:05] <edbian> G_Val: That is probably what gparted is freaking about.  Perhaps it isn't restored or it isn't restored correctly,01:05,edbian,G_Val: That is probably what gparted is freaking about.  Perhaps it isn't restored or it isn't restored correctly
685,[01:06] <edbian> KINGOFSWORDS: press ctrl + alt + F1 to switch to it.  It's a virtual terminal.,01:06,edbian,KINGOFSWORDS: press ctrl + alt + F1 to switch to it.  It's a virtual terminal.
686,[01:06] <edbian> KINGOFSWORDS: you can switch back by ctrl + alt + F7  (graphical),01:06,edbian,KINGOFSWORDS: you can switch back by ctrl + alt + F7  (graphical)
687,[01:06] <G_Val> !time,01:06,G_Val,!time
688,[01:06] <matsur> acicula: got it! iptables -I INPUT 3 -p tcp -m state --state NEW -m tcp --dport 9999 --sport 80 -j ACCEPT just needed to add the sport,01:06,matsur,acicula: got it! iptables -I INPUT 3 -p tcp -m state --state NEW -m tcp --dport 9999 --sport 80 -j ACCEPT just needed to add the sport
689,[01:06] <ubottu> Information about using and setting your computer's clock on Ubuntu can be found at https://help.ubuntu.com/community/UbuntuTime - See https://help.ubuntu.com/10.04/serverguide/C/NTP.html for information on usage of the Network Time Protocol (NTP),01:06,ubottu,Information about using and setting your computer's clock on Ubuntu can be found at https://help.ubuntu.com/community/UbuntuTime - See https://help.ubuntu.com/10.04/serverguide/C/NTP.html for information on usage of the Network Time Protocol (NTP)
690,[01:07] <G_Val> edbian: so should i reinstall all ?,01:07,G_Val,edbian: so should i reinstall all ?
691,[01:07] <acicula> matsur: using DNAT or REDIRECT?,01:07,acicula,matsur: using DNAT or REDIRECT?
692,"[01:07] <edbian> G_Val: If you can.  I""m in over my head now",01:07,edbian,"G_Val: If you can.  I""m in over my head now"
693,[01:07] <matsur> REDIRECT,01:07,matsur,REDIRECT
694,[01:07] <KINGOFSWORDS> ctrl alt F1 just goes to black screen,01:07,KINGOFSWORDS,ctrl alt F1 just goes to black screen
695,[01:07] <jzacsh_> anyone know how to get (or what its called ) smjs (or the spidermonkey javascript shell) in ubuntu?,01:07,jzacsh_,anyone know how to get (or what its called ) smjs (or the spidermonkey javascript shell) in ubuntu?
696,[01:07] <jzacsh_> http://manpages.ubuntu.com/manpages/hardy/man1/smjs.1.html,01:07,jzacsh_,http://manpages.ubuntu.com/manpages/hardy/man1/smjs.1.html
697,[01:07] <G_Val> edbian: how long are u here ?,01:07,G_Val,edbian: how long are u here ?
698,[01:07] <edbian> KINGOFSWORDS: press enter on that screen. There should be a thing to log in.,01:07,edbian,KINGOFSWORDS: press enter on that screen. There should be a thing to log in.
699,[01:07] <edbian> G_Val: what do you mean?,01:07,edbian,G_Val: what do you mean?
700,[01:07] <KINGOFSWORDS> nah theres nothing there ...just a bit of static at top of screen,01:07,KINGOFSWORDS,nah theres nothing there ...just a bit of static at top of screen
701,[01:08] <G_Val> edbian: is there a way to not reinstall all programs after formatting ? something to restore all from old partition's data,01:08,G_Val,edbian: is there a way to not reinstall all programs after formatting ? something to restore all from old partition's data
702,[01:08] <edbian> KINGOFSWORDS: Can you press alt + F2 to launch a command window thingy,01:08,edbian,KINGOFSWORDS: Can you press alt + F2 to launch a command window thingy
703,"[01:08] <matsur> acicula: a little odd... everything i can find online seems to suggest redirect puts stuff onto loopback, but i have a catch all accept everything on lo rule as rule 1 in INPUT and it was not working",01:08,matsur,"acicula: a little odd... everything i can find online seems to suggest redirect puts stuff onto loopback, but i have a catch all accept everything on lo rule as rule 1 in INPUT and it was not working"
704,[01:08] <G_Val> edbian: i mean today,01:08,G_Val,edbian: i mean today
705,[01:08] <edbian> KINGOFSWORDS: I'm betting since you don't have borders that you can't just open a terminal or we'd use that,01:08,edbian,KINGOFSWORDS: I'm betting since you don't have borders that you can't just open a terminal or we'd use that
706,[01:08] <hiexpo> command window thingy     hehe,01:08,hiexpo,command window thingy     hehe
707,[01:09] <KINGOFSWORDS> ctrl alt f2 is messed up too,01:09,KINGOFSWORDS,ctrl alt f2 is messed up too
708,[01:09] <KINGOFSWORDS> but normal terminal is okk,01:09,KINGOFSWORDS,but normal terminal is okk
709,[01:09] <edbian> G_Val: You can use dd to copy from the entire partition to a folder or another partition. (make a backup)  Then partition the disk and put the copies into those partitions.,01:09,edbian,G_Val: You can use dd to copy from the entire partition to a folder or another partition. (make a backup)  Then partition the disk and put the copies into those partitions.
710,[01:09] <edbian> KINGOFSWORDS: ok great.  Can you type in the normal terminal?,01:09,edbian,KINGOFSWORDS: ok great.  Can you type in the normal terminal?
711,[01:09] <mr0wl> Is GNOME 3 available on Natty?,01:09,mr0wl,Is GNOME 3 available on Natty?
712,[01:09] <edbian> hiexpo: :),01:09,edbian,hiexpo: :)
713,[01:09] <KINGOFSWORDS> edbiian just ran ur cmd in normal terminal and worked great ty,01:09,KINGOFSWORDS,edbiian just ran ur cmd in normal terminal and worked great ty
714,"[01:10] <acicula> matsur: yeah, all this does is a more precise match, so dunno",01:10,acicula,"matsur: yeah, all this does is a more precise match, so dunno"
715,[01:10] <edbian> mr0wl: natty is going to use unity instead of gnome3  (but they are similar),01:10,edbian,mr0wl: natty is going to use unity instead of gnome3  (but they are similar)
716,[01:10] <G_Val> edbian: ok but what about my win os ?,01:10,G_Val,edbian: ok but what about my win os ?
717,[01:10] <edbian> KINGOFSWORDS: glad I could help,01:10,edbian,KINGOFSWORDS: glad I could help
718,[01:10] <KINGOFSWORDS> is ctrl alt f1 or f2 the terminal outside of the gui?,01:10,KINGOFSWORDS,is ctrl alt f1 or f2 the terminal outside of the gui?
719,[01:10] <edbian> G_Val: You can do the same thing,01:10,edbian,G_Val: You can do the same thing
720,"[01:10] <acicula> mr0wl: nope, there are ppa's though",01:10,acicula,"mr0wl: nope, there are ppa's though"
721,[01:10] <KINGOFSWORDS> is it a problem that it doesnt work? maybe a graphics driver issue,01:10,KINGOFSWORDS,is it a problem that it doesnt work? maybe a graphics driver issue
722,[01:10] <G_Val> edbian: so many data,01:10,G_Val,edbian: so many data
723,[01:10] <edbian> KINGOFSWORDS: Yes.  There should be 6 virtual terminals on F1 through F6 (F7 is graphical),01:10,edbian,KINGOFSWORDS: Yes.  There should be 6 virtual terminals on F1 through F6 (F7 is graphical)
724,[01:10] <G_Val> edbian: soo *,01:10,G_Val,edbian: soo *
725,[01:10] <KINGOFSWORDS> would update sort that out?,01:10,KINGOFSWORDS,would update sort that out?
726,[01:11] <G_Val> edbian: soo i have to reinstall all O__O,01:11,G_Val,edbian: soo i have to reinstall all O__O
727,[01:11] <mr0wl> The PPAs are for Natty only?,01:11,mr0wl,The PPAs are for Natty only?
728,[01:11] <edbian> KINGOFSWORDS: Sometimes the graphics driver chops it off though.  Try using the auto -thingy on the monitor,01:11,edbian,KINGOFSWORDS: Sometimes the graphics driver chops it off though.  Try using the auto -thingy on the monitor
729,"[01:11] <matsur> acicula: this does a more precise match on 9999 input... previously 9999 was open and connectable, now it appears closed. thats all i was going for, the redirect worked fine before",01:11,matsur,"acicula: this does a more precise match on 9999 input... previously 9999 was open and connectable, now it appears closed. thats all i was going for, the redirect worked fine before"
730,[01:11] <edbian> G_Val: I know.  That's the problem,01:11,edbian,G_Val: I know.  That's the problem
731,[01:11] <acicula> mr0wl: no,01:11,acicula,mr0wl: no
732,[01:11] <edbian> G_Val: You don't have to reinstall.  YOu just have to partition,01:11,edbian,G_Val: You don't have to reinstall.  YOu just have to partition
733,[01:11] <KINGOFSWORDS> auto thingy?,01:11,KINGOFSWORDS,auto thingy?
734,[01:11] <G_Val> edbian: i cannot restore only windows partition table and install onoly linux ? i mean from testdisk,01:11,G_Val,edbian: i cannot restore only windows partition table and install onoly linux ? i mean from testdisk
735,[01:11] <KINGOFSWORDS> oh its laptop,01:11,KINGOFSWORDS,oh its laptop
736,[01:11] <acicula> matsur: ah ok,01:11,acicula,matsur: ah ok
737,[01:11] <mr0wl> K gonna try it out.,01:11,mr0wl,K gonna try it out.
738,[01:11] <KINGOFSWORDS> no auto tune,01:11,KINGOFSWORDS,no auto tune
739,"[01:11] <edbian> KINGOFSWORDS: Oh, then nevermind the laptop monitor probably doesn't have the auto-thingy",01:11,edbian,"KINGOFSWORDS: Oh, then nevermind the laptop monitor probably doesn't have the auto-thingy"
740,[01:11] <mr0wl> Thanks,01:11,mr0wl,Thanks
741,[01:11] <KINGOFSWORDS> yeh,01:11,KINGOFSWORDS,yeh
742,[01:12] <edbian> KINGOFSWORDS: I'm not sure why TTY1 isn't working,01:12,edbian,KINGOFSWORDS: I'm not sure why TTY1 isn't working
743,[01:12] <hiexpo> you needto open that thingy and type out that thangy     omg,01:12,hiexpo,you needto open that thingy and type out that thangy     omg
744,"[01:12] <KNUBBIG> Hi, I booted back into the live cd and tried cfdisk which doesnt work and gparted which again tells me wrong partitions. Any ideas",01:12,KNUBBIG,"Hi, I booted back into the live cd and tried cfdisk which doesnt work and gparted which again tells me wrong partitions. Any ideas"
745,[01:12] <edbian> haha,01:12,edbian,haha
746,"[01:12] <acicula> mr0wl: best follow up in #ubuntu+1, its meant for natty. Also make sure you know how to undo the changes you make as you may runinto some problems",01:12,acicula,"mr0wl: best follow up in #ubuntu+1, its meant for natty. Also make sure you know how to undo the changes you make as you may runinto some problems"
747,[01:12] <edbian> words words words,01:12,edbian,words words words
748,[01:12] <KINGOFSWORDS> ive been in the non gui b4 but think it was on karmic,01:12,KINGOFSWORDS,ive been in the non gui b4 but think it was on karmic
749,[01:12] <swatto> Anyone know how to map the windows key to open terminal? Tried adding through keyboard shortcuts but it wont let me use it?,01:12,swatto,Anyone know how to map the windows key to open terminal? Tried adding through keyboard shortcuts but it wont let me use it?
750,"[01:12] <mr0wl> Ok, will do.",01:12,mr0wl,"Ok, will do."
751,[01:12] <G_Val> edbian: did u understand what i mean ?,01:12,G_Val,edbian: did u understand what i mean ?
752,[01:13] <edbian> KINGOFSWORDS: All versions should have it.  Strange that it isn't working,01:13,edbian,KINGOFSWORDS: All versions should have it.  Strange that it isn't working
753,"[01:13] <edbian> G_Val: no, rephrase it please",01:13,edbian,"G_Val: no, rephrase it please"
754,[01:13] <G_Val> edbian: i cannot restore only windows partition table and install onoly linux ? i mean from testdisk,01:13,G_Val,edbian: i cannot restore only windows partition table and install onoly linux ? i mean from testdisk
755,[01:13] <KINGOFSWORDS> i had real bad problems installing graphics driver so think that has coused a comflict or s'thing,01:13,KINGOFSWORDS,i had real bad problems installing graphics driver so think that has coused a comflict or s'thing
756,"[01:13] <hiexpo> KINGOFSWORDS, is becoming aregular customer here   :)",01:13,hiexpo,"KINGOFSWORDS, is becoming aregular customer here   :)"
757,[01:13] <KINGOFSWORDS> btw is it possible to downgrade wine?,01:13,KINGOFSWORDS,btw is it possible to downgrade wine?
758,[01:14] <hiexpo> !downgrade,01:14,hiexpo,!downgrade
759,[01:14] <ubottu> Attempting to downgrade to an older Ubuntu version is explicitly not supported and may break your system.,01:14,ubottu,Attempting to downgrade to an older Ubuntu version is explicitly not supported and may break your system.
760,[01:14] <KINGOFSWORDS> lol true...this is my linux school =),01:14,KINGOFSWORDS,lol true...this is my linux school =)
761,=== torjehoa is now known as cybrhuman,,,
762,[01:14] <edbian> G_Val: Not exactly re-phrased but.  There is 1 partition table for each harddrive.  Not for each partition or each OS.  It sounds to me like the partition table for that harddrive is messed up or wrong which is why gparted can't see the partitions but fdisk can,01:14,edbian,G_Val: Not exactly re-phrased but.  There is 1 partition table for each harddrive.  Not for each partition or each OS.  It sounds to me like the partition table for that harddrive is messed up or wrong which is why gparted can't see the partitions but fdisk can
763,[01:14] <edbian> KINGOFSWORDS: That is very likely to have caused the problem yes,01:14,edbian,KINGOFSWORDS: That is very likely to have caused the problem yes
764,[01:14] <alosa> CobZo http://mfsbsd.vx.sk/,01:14,alosa,CobZo http://mfsbsd.vx.sk/
765,"[01:14] <Ben64> KINGOFSWORDS: open synaptic, find wine, and it will let you choose version",01:14,Ben64,"KINGOFSWORDS: open synaptic, find wine, and it will let you choose version"
766,[01:14] <KINGOFSWORDS> no not downgraded wine yet....,01:14,KINGOFSWORDS,no not downgraded wine yet....
767,[01:15] <edbian> KINGOFSWORDS: uninstall wine.  Then use synaptic to force install an old version,01:15,edbian,KINGOFSWORDS: uninstall wine.  Then use synaptic to force install an old version
768,"[01:15] <KNUBBIG> G_Val, what is your prob? Sounds similar to mine",01:15,KNUBBIG,"G_Val, what is your prob? Sounds similar to mine"
769,[01:15] <edbian> (it is possible),01:15,edbian,(it is possible)
770,[01:15] <KINGOFSWORDS> yeh i stupdily dled wine 1.3,01:15,KINGOFSWORDS,yeh i stupdily dled wine 1.3
771,[01:15] <G_Val> edbian: yes maybe i can restore the partition table by deleting linux from that,01:15,G_Val,edbian: yes maybe i can restore the partition table by deleting linux from that
772,[01:15] <KINGOFSWORDS> or the newest ver,01:15,KINGOFSWORDS,or the newest ver
773,[01:15] <Ben64> KINGOFSWORDS: whats wrong with 1.3?,01:15,Ben64,KINGOFSWORDS: whats wrong with 1.3?
774,[01:15] <edbian> KINGOFSWORDS: You shouldn't be downloading anything.  use the wine that is in the repos,01:15,edbian,KINGOFSWORDS: You shouldn't be downloading anything.  use the wine that is in the repos
775,[01:15] <hiexpo> or compile it yourself is better,01:15,hiexpo,or compile it yourself is better
776,"[01:15] <G_Val> KNUBBIG: which one ? i can open a blog called ""the issues of ubuntu""",01:15,G_Val,"KNUBBIG: which one ? i can open a blog called ""the issues of ubuntu"""
777,[01:15] <KINGOFSWORDS> will i lose my programs thou if i uninstall or downgrade?,01:15,KINGOFSWORDS,will i lose my programs thou if i uninstall or downgrade?
778,[01:15] <edbian> G_Val: IDK man.  You can try.  I don't know how to manually edit the partition table of a hdd,01:15,edbian,G_Val: IDK man.  You can try.  I don't know how to manually edit the partition table of a hdd
779,"[01:15] <KNUBBIG> G_Val, ;d, the one with the partitions",01:15,KNUBBIG,"G_Val, ;d, the one with the partitions"
780,[01:15] <KINGOFSWORDS> sorry yeh i used synaptic to dl,01:15,KINGOFSWORDS,sorry yeh i used synaptic to dl
781,[01:16] <KINGOFSWORDS> Ben64 isnt 1.3 a beta/testing ver,01:16,KINGOFSWORDS,Ben64 isnt 1.3 a beta/testing ver
782,[01:16] <edbian> KINGOFSWORDS: I am pretty sure you can remove wine.  You shouldn't lose the programs because they aren't part of hte package,01:16,edbian,KINGOFSWORDS: I am pretty sure you can remove wine.  You shouldn't lose the programs because they aren't part of hte package
783,[01:16] <G_Val> KNUBBIG: uhm i cannot boot linux os cause i accidentally deleted a partition-table but i restored immediately,01:16,G_Val,KNUBBIG: uhm i cannot boot linux os cause i accidentally deleted a partition-table but i restored immediately
784,"[01:16] <Ben64> KINGOFSWORDS: its development yeah, but it works fine",01:16,Ben64,"KINGOFSWORDS: its development yeah, but it works fine"
785,[01:16] <G_Val> KNUBBIG: Strangest thing never happen : windows os works great linux doesn't,01:16,G_Val,KNUBBIG: Strangest thing never happen : windows os works great linux doesn't
786,[01:16] <maguey_> What shall modif in my ~/.screenrc in order to be able to open X apps,01:16,maguey_,What shall modif in my ~/.screenrc in order to be able to open X apps
787,[01:16] <KINGOFSWORDS> wine 1.3 kinda hangs and the GUI messes up s'times,01:16,KINGOFSWORDS,wine 1.3 kinda hangs and the GUI messes up s'times
788,[01:17] <swatto> I have added a program to the Startup Applications list but i do not have an autorun directory in my home folder?,01:17,swatto,I have added a program to the Startup Applications list but i do not have an autorun directory in my home folder?
789,[01:17] <G_Val> edbian: i will try in this way i cannot delete windows data i have no enough space,01:17,G_Val,edbian: i will try in this way i cannot delete windows data i have no enough space
790,[01:17] <KINGOFSWORDS> it might be the same in a lower ver thou,01:17,KINGOFSWORDS,it might be the same in a lower ver thou
791,"[01:17] <KNUBBIG> G_Val, okay, my windows also detects partitions correctly and Ubuntu doesnt",01:17,KNUBBIG,"G_Val, okay, my windows also detects partitions correctly and Ubuntu doesnt"
792,[01:17] <edbian> G_Val: ok?,01:17,edbian,G_Val: ok?
793,[01:17] <KINGOFSWORDS> gta san andreas plays great in it thou..so shouldnt complain,01:17,KINGOFSWORDS,gta san andreas plays great in it thou..so shouldnt complain
794,[01:17] <G_Val> KNUBBIG: only fdisk recognize them,01:17,G_Val,KNUBBIG: only fdisk recognize them
795,"[01:18] <KNUBBIG> G_Val, my fdisk partly recognises them, but not completely correct",01:18,KNUBBIG,"G_Val, my fdisk partly recognises them, but not completely correct"
796,[01:18] <G_Val> edbian: ok ehat man sorry ? i am in over my head also,01:18,G_Val,edbian: ok ehat man sorry ? i am in over my head also
797,[01:18] <KNUBBIG> I cant even install Ubuntu :(,01:18,KNUBBIG,I cant even install Ubuntu :(
798,[01:18] <G_Val> edbian: i am trying t find solution by 4 days,01:18,G_Val,edbian: i am trying t find solution by 4 days
799,[01:18] <edbian> G_Val: yeah.  I can't offer advice about what to do :(,01:18,edbian,G_Val: yeah.  I can't offer advice about what to do :(
800,[01:18] <edbian> G_Val: ouch.  Sorry to hear that,01:18,edbian,G_Val: ouch.  Sorry to hear that
801,[01:18] <hiexpo> dev is always better i think but one reason ubuntu don't use dev's is cause the chance of problems and support and ubuntu is aimed at helpingnew users from microft to llinux,01:18,hiexpo,dev is always better i think but one reason ubuntu don't use dev's is cause the chance of problems and support and ubuntu is aimed at helpingnew users from microft to llinux
802,[01:19] <G_Val> KNUBBIG:  yes but before worked great,01:19,G_Val,KNUBBIG:  yes but before worked great
803,[01:19] <edbian> KNUBBIG: what is stopping you?,01:19,edbian,KNUBBIG: what is stopping you?
804,[01:19] <G_Val> edbian: don't worry is normal for teenagers xD,01:19,G_Val,edbian: don't worry is normal for teenagers xD
