,raw,timestamp,user,message
593,"[06:09] <OERIAS> _Kyon_, por favot vayase al canael de #ubunut-es",06:09,OERIAS,"_Kyon_, por favot vayase al canael de #ubunut-es"
594,[06:09] <Takkun> TJ-:now*,06:09,Takkun,TJ-:now*
595,[06:10] <TJ-> Takkun: Where is the ssd_fw_up.img ? You need to 'cd' (change directory) into the directory where that file is,06:10,TJ-,Takkun: Where is the ssd_fw_up.img ? You need to 'cd' (change directory) into the directory where that file is
596,[06:10] <izabera> is there a way to see keyboard shortcuts associations? for some reason ctrl+alt+t is not bringing up a terminal anymore,06:10,izabera,is there a way to see keyboard shortcuts associations? for some reason ctrl+alt+t is not bringing up a terminal anymore
597,[06:10] <izabera> in system / keyboard it's still set correctly,06:10,izabera,in system / keyboard it's still set correctly
598,"[06:10] <TJ-> Takkun: OK, so the ""sudo dd if=..."" command worked ?",06:10,TJ-,"Takkun: OK, so the ""sudo dd if=..."" command worked ?"
599,[06:10] <Takkun> TJ-: sorry correct it works,06:10,Takkun,TJ-: sorry correct it works
600,"[06:11] <coolstar> I have ubuntu running on my system, but the trackpad doesn't appear to be working",06:11,coolstar,"I have ubuntu running on my system, but the trackpad doesn't appear to be working"
601,[06:11] <coolstar> a USB mouse works but I'd want the trackpad to work too,06:11,coolstar,a USB mouse works but I'd want the trackpad to work too
602,[06:11] <coolstar> I have the Acer C720,06:11,coolstar,I have the Acer C720
603,[06:11] <coolstar> (yes it's a chromebook),06:11,coolstar,(yes it's a chromebook)
604,"[06:11] <TJ-> Takkun: OK :) So reboot the system with the USB plugged in, the system should suggest a key you can press to get to the boot menu (often the key is F11 or F12), then select the USB device and boot.",06:11,TJ-,"Takkun: OK :) So reboot the system with the USB plugged in, the system should suggest a key you can press to get to the boot menu (often the key is F11 or F12), then select the USB device and boot."
605,"[06:12] <somsip> coolstar: http://ubuntuforums.org/showthread.php?t=2190187 (first link on a search, and there are others)",06:12,somsip,"coolstar: http://ubuntuforums.org/showthread.php?t=2190187 (first link on a search, and there are others)"
606,"[06:12] <TJ-> Takkun: That'll boot to the FreeDOS operating system which will automatically run the firmware updater, which will first check for the SSD, and if it is supported, it will offer to do the update",06:12,TJ-,"Takkun: That'll boot to the FreeDOS operating system which will automatically run the firmware updater, which will first check for the SSD, and if it is supported, it will offer to do the update"
607,=== dojodgh is now known as dojodgh_,,,
608,[06:13] <Takkun> TJ-: Ur one of those mad geniuses arent you x3 soo cool ^^ give me one sec plz i will do that now x3,06:13,Takkun,TJ-: Ur one of those mad geniuses arent you x3 soo cool ^^ give me one sec plz i will do that now x3
609,[06:14] <Takkun> TJ-: i have ran the usb and it says this pc does not need an updated firmware,06:14,Takkun,TJ-: i have ran the usb and it says this pc does not need an updated firmware
610,"[06:18] <TJ-> Takkun: That's not helpful, but it does suggest that the tool recognised that there is a Toshiba SSD installed, yes?",06:18,TJ-,"Takkun: That's not helpful, but it does suggest that the tool recognised that there is a Toshiba SSD installed, yes?"
611,[06:18] <Takkun> i think it would be safe to assume tht indeed,06:18,Takkun,i think it would be safe to assume tht indeed
612,[06:19] <Takkun> or perhaps it has no relation,06:19,Takkun,or perhaps it has no relation
613,[06:19] <Takkun> :D,06:19,Takkun,:D
614,[06:19] <Takkun> :C,06:19,Takkun,:C
615,[06:19] <TJ-> Takkun: I ran it here and it told me there was no supported SSD in the system,06:19,TJ-,Takkun: I ran it here and it told me there was no supported SSD in the system
616,[06:19] <Takkun> oh,06:19,Takkun,oh
617,"[06:20] <TJ-> Takkun: so it sounds as if it found such a device in your system, checked the firmware version, and found it is already the correct version",06:20,TJ-,"Takkun: so it sounds as if it found such a device in your system, checked the firmware version, and found it is already the correct version"
618,[06:20] <Takkun> okay then yes i think its safe to assume that toshiba would be the brand,06:20,Takkun,okay then yes i think its safe to assume that toshiba would be the brand
619,[06:20] <TJ-> Takkun: This doesn't help you of course... let me hack the files on that image in case it is possible to force it to reinstall the firmware,06:20,TJ-,Takkun: This doesn't help you of course... let me hack the files on that image in case it is possible to force it to reinstall the firmware
620,[06:20] <Takkun> TJ-: one more question,06:20,Takkun,TJ-: one more question
621,[06:21] <Takkun> TJ-: how do i become a godly programmer like u x3,06:21,Takkun,TJ-: how do i become a godly programmer like u x3
622,[06:21] <TJ-> Takkun: spend years and years hacking,06:21,TJ-,Takkun: spend years and years hacking
623,"[06:21] <cfhowlett> Takkun, you must first purify yourself in the waters of Lake Minetonka.",06:21,cfhowlett,"Takkun, you must first purify yourself in the waters of Lake Minetonka."
624,=== Vampire0_ is now known as Vampire0,,,
625,"[06:22] <TJ-> Takkun: You saw the message ""This PC does NOT need an updated Firmware."" I guess?",06:22,TJ-,"Takkun: You saw the message ""This PC does NOT need an updated Firmware."" I guess?"
626,"[06:22] <malkauns_> cfhowlett: no, river ganges",06:22,malkauns_,"cfhowlett: no, river ganges"
627,[06:22] <malkauns_> :P,06:22,malkauns_,:P
628,"[06:22] <cfhowlett> malkauns_, ewwwwwww!",06:22,cfhowlett,"malkauns_, ewwwwwww!"
629,[06:22] <alfonsojon> Does Kubuntu 14.04 use LightDM or KDM?,06:22,alfonsojon,Does Kubuntu 14.04 use LightDM or KDM?
630,"[06:22] <cfhowlett> alfonsojon, kdm",06:22,cfhowlett,"alfonsojon, kdm"
631,[06:22] <alfonsojon> Great,06:22,alfonsojon,Great
632,[06:22] <malkauns_> cfhowlett: LOL,06:22,malkauns_,cfhowlett: LOL
633,[06:22] <Takkun> TJ-:correct,06:22,Takkun,TJ-:correct
634,"[06:22] <cfhowlett> alfonsojon, KDE actually",06:22,cfhowlett,"alfonsojon, KDE actually"
635,[06:22] <malkauns_> alfonsojon: lightdm,06:22,malkauns_,alfonsojon: lightdm
636,[06:23] <malkauns_> oh,06:23,malkauns_,oh
637,[06:23] <malkauns_> Kubuntu,06:23,malkauns_,Kubuntu
638,[06:23] <malkauns_> yea KDE,06:23,malkauns_,yea KDE
639,[06:23]  * rww sighs,06:23,,
640,[06:23]  * malkauns_ goes to bed,06:23,,
641,[06:23] <rww> Kubuntu uses lightdm. KDE's moving away from KDM.,06:23,rww,Kubuntu uses lightdm. KDE's moving away from KDM.
642,=== malkauns_ is now known as malkauns,,,
643,"[06:23] <TJ-> Takkun: did it also show ""Target[FWVer = %s, BinFileName = %s]"" and ""Local[FWVer = %s, BinFileName = %s]"" with the version numbers filled in?",06:23,TJ-,"Takkun: did it also show ""Target[FWVer = %s, BinFileName = %s]"" and ""Local[FWVer = %s, BinFileName = %s]"" with the version numbers filled in?"
644,[06:23] <alfonsojon> Oh. Darn.,06:23,alfonsojon,Oh. Darn.
645,[06:24] <alfonsojon> Is KDM still supported for now?,06:24,alfonsojon,Is KDM still supported for now?
646,[06:24] <Takkun> TJ-: no sir,06:24,Takkun,TJ-: no sir
647,"[06:24] <TJ-> Takkun: OK, that must be part of another option in the program then",06:24,TJ-,"Takkun: OK, that must be part of another option in the program then"
648,"[06:24] <rww> alfonsojon: it's in Ubuntu's repositories, yes",06:24,rww,"alfonsojon: it's in Ubuntu's repositories, yes"
649,[06:24] <alfonsojon> LightDM doesn't behave on my Power Mac,06:24,alfonsojon,LightDM doesn't behave on my Power Mac
650,[06:24] <alfonsojon> Is there an alternative you would suggest?,06:24,alfonsojon,Is there an alternative you would suggest?
651,[06:25] <Takkun> TJ-: do you think its possible that i can call lenovo and call them to replace the ssd?,06:25,Takkun,TJ-: do you think its possible that i can call lenovo and call them to replace the ssd?
652,"[06:25] <cfhowlett> !mac | alfonsojon, the mac ubuntu, ubuntu mac or mac-tel projects would know more.",06:25,cfhowlett,"!mac | alfonsojon, the mac ubuntu, ubuntu mac or mac-tel projects would know more."
653,"[06:25] <ubottu> alfonsojon, the mac ubuntu, ubuntu mac or mac-tel projects would know more.: For help on installing and using Ubuntu on a Mac, see: https://wiki.ubuntu.com/MactelSupportTeam/CommunityHelpPages",06:25,ubottu,"alfonsojon, the mac ubuntu, ubuntu mac or mac-tel projects would know more.: For help on installing and using Ubuntu on a Mac, see: https://wiki.ubuntu.com/MactelSupportTeam/CommunityHelpPages"
654,[06:25] <Takkun> TJ-: perhaps they would agree since its a hardware problem and not a software one,06:25,Takkun,TJ-: perhaps they would agree since its a hardware problem and not a software one
655,[06:25] <rww> doubtful,06:25,rww,doubtful
656,[06:25] <rww> alfonsojon: I'd ask #kubuntu or #kde,06:25,rww,alfonsojon: I'd ask #kubuntu or #kde
657,[06:25] <alfonsojon> That covers Intel Macs,06:25,alfonsojon,That covers Intel Macs
658,"[06:26] <rww> alfonsojon: there's another one some KDE people use, but it's slipping my mind :(",06:26,rww,"alfonsojon: there's another one some KDE people use, but it's slipping my mind :("
659,[06:26] <TJ-> Takkun: Definitely - it has failed in a way that is already known,06:26,TJ-,Takkun: Definitely - it has failed in a way that is already known
660,=== bodhizazen is now known as bodhi_zazen,,,
661,[06:26] <Takkun> TJ-: do you think they will blame it on ubuntu?,06:26,Takkun,TJ-: do you think they will blame it on ubuntu?
662,"[06:26] <cfhowlett> Takkun, everything gets blamed on ubuntu/shuttleworth",06:26,cfhowlett,"Takkun, everything gets blamed on ubuntu/shuttleworth"
663,[06:27] <alfonsojon> cfhowlett: Mactel: Intel Mac,06:27,alfonsojon,cfhowlett: Mactel: Intel Mac
664,[06:27] <Takkun> TJ-:they once told me that installing linux does not void my warranty and that they would still provide me with hardware support but that they would not provide me with nay software support unless i reinstalled windows 8,06:27,Takkun,TJ-:they once told me that installing linux does not void my warranty and that they would still provide me with hardware support but that they would not provide me with nay software support unless i reinstalled windows 8
665,[06:27] <alfonsojon> Takkun: that sounds correct,06:27,alfonsojon,Takkun: that sounds correct
666,"[06:28] <TJ-> Takkun: that is good, Windows isn't needed to sort this afterall",06:28,TJ-,"Takkun: that is good, Windows isn't needed to sort this afterall"
667,"[06:29] <Takkun> TJ-: okay I will call them tomorrow i guess. I was worried thatt they wouldnt agree because i called them earlier today, and they said they wanted to remotely control my computer to check to see if it was perhaps a software problem",06:29,Takkun,"TJ-: okay I will call them tomorrow i guess. I was worried thatt they wouldnt agree because i called them earlier today, and they said they wanted to remotely control my computer to check to see if it was perhaps a software problem"
668,[06:29] <Takkun> TJ-: and i didnt tell them i have linux installed i just said i'd call back later x3,06:29,Takkun,TJ-: and i didnt tell them i have linux installed i just said i'd call back later x3
669,"[06:29] <cfhowlett> Takkun, well that sounds ... ""legit"" ...",06:29,cfhowlett,"Takkun, well that sounds ... ""legit"" ..."
670,=== alienatu is now known as Guest60947,,,
671,[06:30] <Takkun> cfhowlett: wht do you mean,06:30,Takkun,cfhowlett: wht do you mean
672,"[06:30] <cfhowlett> Takkun, remote control of my PC?  I think not ...",06:30,cfhowlett,"Takkun, remote control of my PC?  I think not ..."
673,=== alienatu2 is now known as alienatu,,,
674,[06:31] <Takkun> cfhowlett: xD NSA can already do tht!,06:31,Takkun,cfhowlett: xD NSA can already do tht!
675,[06:31] <Takkun> im glad i dont need to install windows T.T,06:31,Takkun,im glad i dont need to install windows T.T
676,"[06:31] <cfhowlett> Takkun, true.  anyway - on to ubuntu topic!",06:31,cfhowlett,"Takkun, true.  anyway - on to ubuntu topic!"
677,[06:31] <Takkun> i blame this all on windows,06:31,Takkun,i blame this all on windows
678,[06:31] <alfonsojon> Takkun: what is the issue?,06:31,alfonsojon,Takkun: what is the issue?
679,[06:32] <Takkun> alfonsojon: it's a long story T.T i'm going to just ask lenovo to replace my ssd and move on with my life,06:32,Takkun,alfonsojon: it's a long story T.T i'm going to just ask lenovo to replace my ssd and move on with my life
680,[06:32] <alfonsojon> What is the issue?,06:32,alfonsojon,What is the issue?
681,[06:32] <alfonsojon> Bad blocks?,06:32,alfonsojon,Bad blocks?
682,=== Stv is now known as orven,,,
683,[06:32] <Takkun> my ssd does not show up anymore,06:32,Takkun,my ssd does not show up anymore
684,=== sudhir_ is now known as nrange,,,
685,"[06:33] <TJ-> Takkun: One thing to check before talking to Lenovo. In the Firmware Setup, check that Intel Rapid Storage option is disabled",06:33,TJ-,"Takkun: One thing to check before talking to Lenovo. In the Firmware Setup, check that Intel Rapid Storage option is disabled"
686,[06:33] <Takkun> TJ-: yes sir it is disabled ^^,06:33,Takkun,TJ-: yes sir it is disabled ^^
687,[06:34] <TJ-> alfonsojon: There's a known issue with Toshiba SSDs where the firmware gets corrupted and the device isn't seen by the system (firmware or OS). We've checked using the Lenovo/Toshiba SSD firmware updater and the device doesn't need the firmware update,06:34,TJ-,alfonsojon: There's a known issue with Toshiba SSDs where the firmware gets corrupted and the device isn't seen by the system (firmware or OS). We've checked using the Lenovo/Toshiba SSD firmware updater and the device doesn't need the firmware update
688,[06:34] <Psil0Cybin> Reformatted TJ- much better.,06:34,Psil0Cybin,Reformatted TJ- much better.
689,[06:35] <alfonsojon> Never trust Toshiba hard drives,06:35,alfonsojon,Never trust Toshiba hard drives
690,[06:35] <alfonsojon> Never.,06:35,alfonsojon,Never.
691,[06:35] <Psil0Cybin> :o,06:35,Psil0Cybin,:o
692,[06:35] <Psil0Cybin> thanks for the hdups,06:35,Psil0Cybin,thanks for the hdups
693,[06:36] <TJ-> Psil0Cybin: :),06:36,TJ-,Psil0Cybin: :)
694,"[06:36] <Takkun> TJ-: I'm not sure if this question is appropriate for this irc channel, but could you perhaps give me tips to becoming as good as a programmer like you? esp so i can handle linux as well as you?",06:36,Takkun,"TJ-: I'm not sure if this question is appropriate for this irc channel, but could you perhaps give me tips to becoming as good as a programmer like you? esp so i can handle linux as well as you?"
695,"[06:36] <dohzer> Can anyone recommend some software to synchronise files between devices (desktop, laptop, usb thumbdrive, etc)?",06:36,dohzer,"Can anyone recommend some software to synchronise files between devices (desktop, laptop, usb thumbdrive, etc)?"
696,[06:36] <TJ-> Takkun: years of hard hacking with hardware and software,06:36,TJ-,Takkun: years of hard hacking with hardware and software
697,[06:36] <sadistic1heart> hi all,06:36,sadistic1heart,hi all
698,"[06:36] <cfhowlett> Takkun, wide question: allow me to suggest www.fullcirclemagazine.org   download and follow the very many programming tutorials",06:36,cfhowlett,"Takkun, wide question: allow me to suggest www.fullcirclemagazine.org   download and follow the very many programming tutorials"
699,"[06:36] <TJ-> Takkun: never be afraid to tinker and ask ""how?"" and ""what if?""",06:36,TJ-,"Takkun: never be afraid to tinker and ask ""how?"" and ""what if?"""
700,"[06:37] <cfhowlett> Takkun, and ""you break it, you fix it""",06:37,cfhowlett,"Takkun, and ""you break it, you fix it"""
701,[06:38] <sadistic1heart>  any one into BDSM in here????,06:38,sadistic1heart, any one into BDSM in here????
702,"[06:38] <Takkun> cfhowlett: thanks for the link friend ^^, any other good resources to get me started? :)",06:38,Takkun,"cfhowlett: thanks for the link friend ^^, any other good resources to get me started? :)"
703,"[06:38] <cfhowlett> Takkun, http://www.linuxlinks.com/article/20090405061458383/20oftheBestFreeLinuxBooks-Part1.html",06:38,cfhowlett,"Takkun, http://www.linuxlinks.com/article/20090405061458383/20oftheBestFreeLinuxBooks-Part1.html"
704,[06:39] <TJ-> Takkun: I've found this: this is the direct Lenova page for the SSD tools: http://support.lenovo.com/gb/en/downloads/ds034646,06:39,TJ-,Takkun: I've found this: this is the direct Lenova page for the SSD tools: http://support.lenovo.com/gb/en/downloads/ds034646
705,[06:39] <TJ-> Takkun: According to the notes with that it covers more than just Toshiba SSDs,06:39,TJ-,Takkun: According to the notes with that it covers more than just Toshiba SSDs
706,[06:40] <linuxuz3r> anyone knows how to take a screenshot in ubuntu window fullscreen and selection,06:40,linuxuz3r,anyone knows how to take a screenshot in ubuntu window fullscreen and selection
707,"[06:41] <TJ-> Takkun: I'd download the bootable ISO image, use 'dd' to write to your USB flash drive, and then reboot using it and test again... worth trying, if it avoids having to return the PC and get a replacement",06:41,TJ-,"Takkun: I'd download the bootable ISO image, use 'dd' to write to your USB flash drive, and then reboot using it and test again... worth trying, if it avoids having to return the PC and get a replacement"
708,[06:41] <Takkun> TJ-: but thts for thinkpads,06:41,Takkun,TJ-: but thts for thinkpads
709,"[06:42] <Takkun> TJ-: i have an ideapad, does tht make a difference?",06:42,Takkun,"TJ-: i have an ideapad, does tht make a difference?"
710,[06:42] <trijntje> linuxuz3r: just use the screenshot app that is installed by default,06:42,trijntje,linuxuz3r: just use the screenshot app that is installed by default
711,[06:42] <TJ-> Takkun: Well that came up as I was looking at the downloads for the Y510P,06:42,TJ-,Takkun: Well that came up as I was looking at the downloads for the Y510P
712,[06:42] <linuxuz3r> ok,06:42,linuxuz3r,ok
713,[06:43] <linuxuz3r> how about a tool to write with a tablet on the desktop,06:43,linuxuz3r,how about a tool to write with a tablet on the desktop
714,"[06:43] <TJ-> Takkun: the program checks the SSD versions... it won't do anything invasive without asking permission, so there is no harm trying it",06:43,TJ-,"Takkun: the program checks the SSD versions... it won't do anything invasive without asking permission, so there is no harm trying it"
715,[06:43] <Takkun> TJ-:since its an iso is it okay if i use brasero or do i have to use dd,06:43,Takkun,TJ-:since its an iso is it okay if i use brasero or do i have to use dd
716,[06:44] <TJ-> Takkun: 'dd' is quicker - you're writing to a USB,06:44,TJ-,Takkun: 'dd' is quicker - you're writing to a USB
717,"[06:44] <TJ-> Takkun: ""sudo dd if=file.iso of=/dev/sdb bs=1M; sync"" and you're done",06:44,TJ-,"Takkun: ""sudo dd if=file.iso of=/dev/sdb bs=1M; sync"" and you're done"
718,"[06:45] <trijntje> TJ, Takkun, dont run that command unless you are sure /dev/sdb is your usb drive",06:45,trijntje,"TJ, Takkun, dont run that command unless you are sure /dev/sdb is your usb drive"
719,[06:45] <TJ-> trijntje: We know it is already,06:45,TJ-,trijntje: We know it is already
720,"[06:46] <TJ-> Takkun: reading the notes for the ISO, it isn't certain it'll boot from USB... the install notes only talk about writing to a physical optical disk",06:46,TJ-,"Takkun: reading the notes for the ISO, it isn't certain it'll boot from USB... the install notes only talk about writing to a physical optical disk"
721,[06:46] <dotDeb> dd is amazing,06:46,dotDeb,dd is amazing
722,[06:46] <dotDeb> way better than any frontend,06:46,dotDeb,way better than any frontend
723,[06:47] <Takkun> TJ-: i will try the usb jus in case,06:47,Takkun,TJ-: i will try the usb jus in case
724,[06:48] <TJ-> Takkun: Are you 100% sure that Y510P *has* an SSD!? I ask since I'm reading the Leonvo engineers service manual and it shows no SSD nor anywhere for one to fit!,06:48,TJ-,Takkun: Are you 100% sure that Y510P *has* an SSD!? I ask since I'm reading the Leonvo engineers service manual and it shows no SSD nor anywhere for one to fit!
725,"[06:49] <Takkun> TJ-: that might be because i got my y510p when it was on sale, and they were giving the ssd for free",06:49,Takkun,"TJ-: that might be because i got my y510p when it was on sale, and they were giving the ssd for free"
726,[06:49] <Takkun> TJ-: i know for a fact an ssd is there,06:49,Takkun,TJ-: i know for a fact an ssd is there
727,"[06:49] <TJ-> Takkun: I can't see a space inside for it, that's the weird part",06:49,TJ-,"Takkun: I can't see a space inside for it, that's the weird part"
728,[06:49] <Takkun> TJ-:the site even list an option to pay to install an additional ssd,06:49,Takkun,TJ-:the site even list an option to pay to install an additional ssd
729,[06:50] <Takkun> TJ-: i believe its installed in the ultra bay drive,06:50,Takkun,TJ-: i believe its installed in the ultra bay drive
730,"[06:50] <TJ-> Takkun: The only thing mentioned is a 1TB hybrid drive (combined spinning disk with flash cache), 5,400rpm",06:50,TJ-,"Takkun: The only thing mentioned is a 1TB hybrid drive (combined spinning disk with flash cache), 5,400rpm"
731,"[06:50] <TJ-> Takkun: Ahh, found it! 256GB SSD",06:50,TJ-,"Takkun: Ahh, found it! 256GB SSD"
732,[06:52] <Takkun> TJ-: i knew i wasnt going crazy x3,06:52,Takkun,TJ-: i knew i wasnt going crazy x3
733,[06:53] <abhishek__> I want to install ubuntu in blade that will go for production.Please give me tips for partition.I am planning to give /boot swap and / partitions only,06:53,abhishek__,I want to install ubuntu in blade that will go for production.Please give me tips for partition.I am planning to give /boot swap and / partitions only
734,[06:53] <Takkun> TJ-: the usb didnt work going to try on a dvd now,06:53,Takkun,TJ-: the usb didnt work going to try on a dvd now
735,"[06:53] <TJ-> Takkun: No, wait!",06:53,TJ-,"Takkun: No, wait!"
736,[06:54] <Blue1> might want to create a seperate /home partition - makes upgrading software a lot easier,06:54,Blue1,might want to create a seperate /home partition - makes upgrading software a lot easier
737,"[06:54] <TJ-> Takkun: I've just read in the Lenovo support that, and this is very weird, the SSD may not be seen in EFI mode! I don't know how accurate that is, but if the system is booting in EFI mode (as the Ubuntu Live ISO may be doing) that could explain this!",06:54,TJ-,"Takkun: I've just read in the Lenovo support that, and this is very weird, the SSD may not be seen in EFI mode! I don't know how accurate that is, but if the system is booting in EFI mode (as the Ubuntu Live ISO may be doing) that could explain this!"
738,[06:55] <abhishek__> Blue1 thanks should I consider lvm over xfs ?,06:55,abhishek__,Blue1 thanks should I consider lvm over xfs ?
739,[06:55] <Blue1> abhishek__: I use lvm  -,06:55,Blue1,abhishek__: I use lvm  -
740,[06:55] <Takkun> TJ-: i dont believe its booting in efi,06:55,Takkun,TJ-: i dont believe its booting in efi
741,[06:56] <Takkun> TJ-: there was a seperate option to boot into efi mode,06:56,Takkun,TJ-: there was a seperate option to boot into efi mode
742,"[06:56] <Takkun> TJ-: also i have installed the os now, and am sure its not in efi",06:56,Takkun,"TJ-: also i have installed the os now, and am sure its not in efi"
743,"[06:56] <TJ-> Takkun: So, I'd suggest rebooting with the Live ISO and making sure the UEFI firmware has Compatibility Support Module (CSM) enabled and at the manual boot device menu, if there are 2 choices for the Installer device, try to determine which is the CSM BIOS and which the EFI, and choose the BIOS",06:56,TJ-,"Takkun: So, I'd suggest rebooting with the Live ISO and making sure the UEFI firmware has Compatibility Support Module (CSM) enabled and at the manual boot device menu, if there are 2 choices for the Installer device, try to determine which is the CSM BIOS and which the EFI, and choose the BIOS"
744,=== sudhir_ is now known as nrange,,,
745,"[06:56] <TJ-> Takkun: OK... that shoots that idea down then! You can check if it is in EFI mode with ""ls -l /sys/firmware/efi/"" ... that will exist if in EFI mode",06:56,TJ-,"Takkun: OK... that shoots that idea down then! You can check if it is in EFI mode with ""ls -l /sys/firmware/efi/"" ... that will exist if in EFI mode"
746,[06:57] <abhishek__> Blue1 default / partitions will create /home directory . this will not changed at least for five years,06:57,abhishek__,Blue1 default / partitions will create /home directory . this will not changed at least for five years
747,[06:59] <Takkun> TJ-: it says no such file or directory,06:59,Takkun,TJ-: it says no such file or directory
748,[06:59] <Takkun> also i believe the SSD can be see in efi mode because when i had wins 8 on this machine it was able to see it,06:59,Takkun,also i believe the SSD can be see in efi mode because when i had wins 8 on this machine it was able to see it
749,"[07:00] <TJ-> Takkun: So, it is in BIOS mode then. OK, so its back to the ""return to manufacturer"" option I think",07:00,TJ-,"Takkun: So, it is in BIOS mode then. OK, so its back to the ""return to manufacturer"" option I think"
750,"[07:00] <TJ-> Takkun: I'd have expected it could, but it was worth investigating",07:00,TJ-,"Takkun: I'd have expected it could, but it was worth investigating"
751,"[07:00] <Syria> Hi, after using this command ""sudo openvpn --config vpnbook-euro1-tcp80.ovpn"" I get this ""Segmentation fault (core dumped)"" i don't know why!",07:00,Syria,"Hi, after using this command ""sudo openvpn --config vpnbook-euro1-tcp80.ovpn"" I get this ""Segmentation fault (core dumped)"" i don't know why!"
752,"[07:01] <Takkun> TJ-: true :) i guess i'll just call them up then, i hope they arent jerks",07:01,Takkun,"TJ-: true :) i guess i'll just call them up then, i hope they arent jerks"
