,raw,timestamp,user,message
1081,[15:57] <ticket> drmagoo: i didnt find the build-essentials in apt-get,15:57,ticket,drmagoo: i didnt find the build-essentials in apt-get
1082,[15:58] <geirha> ticket: build-essential without an s on the end,15:58,geirha,ticket: build-essential without an s on the end
1083,"[15:59] <sheap> so im doing a tasksel of ""ubuntu-desktop"" and ""xubuntu-desktop"" but theres a package in xubuntu-desktop that's at a higher version than what's needed in ubuntu-desktop and the install is failing",15:59,sheap,"so im doing a tasksel of ""ubuntu-desktop"" and ""xubuntu-desktop"" but theres a package in xubuntu-desktop that's at a higher version than what's needed in ubuntu-desktop and the install is failing"
1084,[15:59] <sheap> any way to fix this?,15:59,sheap,any way to fix this?
1085,"[15:59] <ticket> drmagoo:  ok, it seems to be already there",15:59,ticket,"drmagoo:  ok, it seems to be already there"
1086,[16:00] <ticket> drmagoo:  the error is on nvidia-331-updates,16:00,ticket,drmagoo:  the error is on nvidia-331-updates
1087,[16:01] <drmagoo> ticket: what error do you get ?,16:01,drmagoo,ticket: what error do you get ?
1088,[16:02] <ticket> when i run startx...,16:02,ticket,when i run startx...
1089,[16:02] <ticket> there are some timeouts,16:02,ticket,there are some timeouts
1090,[16:02] <ticket> and the xorg sever refuses the connec,16:02,ticket,and the xorg sever refuses the connec
1091,[16:02] <k1l> ticket: dont run startx,16:02,k1l,ticket: dont run startx
1092,[16:02] <k1l> ticket: start the lightdm,16:02,k1l,ticket: start the lightdm
1093,[16:02] <ticket>  it says /usr/bin/X not found,16:02,ticket, it says /usr/bin/X not found
1094,[16:03] <reisio> maybe you don't have X,16:03,reisio,maybe you don't have X
1095,[16:03] <bubaya> Hi. Does anyone know where to download the EDS data integration addon for thunderbird that comes with some Ubuntu versions?,16:03,bubaya,Hi. Does anyone know where to download the EDS data integration addon for thunderbird that comes with some Ubuntu versions?
1096,[16:03] <ticket> lightdm failed to start,16:03,ticket,lightdm failed to start
1097,"[16:03] <tgm4883> On 14.04, I installed Kubuntu, but then installed Ubuntu-desktop. Everything works fine, but my menu's are a bit difficult to read (see http://ibin.co/1c1MMeOAneJZ ) and I can't find a way to resolve this",16:03,tgm4883,"On 14.04, I installed Kubuntu, but then installed Ubuntu-desktop. Everything works fine, but my menu's are a bit difficult to read (see http://ibin.co/1c1MMeOAneJZ ) and I can't find a way to resolve this"
1098,"[16:03] <ticket> reisio: yes, it has disappeard during the upgrade",16:03,ticket,"reisio: yes, it has disappeard during the upgrade"
1099,[16:03] <reisio> bubaya: for evolution?,16:03,reisio,bubaya: for evolution?
1100,"[16:04] <k1l> ticket: on ubuntu you dont use startx, you start the *dm and that will manage all the X stuff for you",16:04,k1l,"ticket: on ubuntu you dont use startx, you start the *dm and that will manage all the X stuff for you"
1101,"[16:04] <ticket> yes k1l , and the job cant be started despite lightdm being installed",16:04,ticket,"yes k1l , and the job cant be started despite lightdm being installed"
1102,[16:04] <bubaya> reisio: yes. There is a plugin that enables thunderbird to access evolution's contacts.,16:04,bubaya,reisio: yes. There is a plugin that enables thunderbird to access evolution's contacts.
1103,[16:05] <k1l> ticket: what ubuntu is that exactly?,16:05,k1l,ticket: what ubuntu is that exactly?
1104,[16:05] <ticket> 14.04,16:05,ticket,14.04
1105,"[16:05] <bubaya> reisio: but their website https://launchpad.net/thunderbird-eds-extension has no downloads, although I already saw a Ubuntu installation having this addon installed.",16:05,bubaya,"reisio: but their website https://launchpad.net/thunderbird-eds-extension has no downloads, although I already saw a Ubuntu installation having this addon installed."
1106,[16:05] <k1l> ticket: which desktop?,16:05,k1l,ticket: which desktop?
1107,"[16:05] <ticket> previously i had unity, xfce, and kde",16:05,ticket,"previously i had unity, xfce, and kde"
1108,"[16:05] <ticket> and now, nothing :D",16:05,ticket,"and now, nothing :D"
1109,[16:06] <ticket> lets setup ubuntu-desktop,16:06,ticket,lets setup ubuntu-desktop
1110,[16:06] <k1l> is lightdm your actual dm? is it running?,16:06,k1l,is lightdm your actual dm? is it running?
1111,"[16:06] <drmagoo> ticket: try ""apt-get install ubuntu-desktop""",16:06,drmagoo,"ticket: try ""apt-get install ubuntu-desktop"""
1112,[16:06] <k1l> see dmesg what happens,16:06,k1l,see dmesg what happens
1113,[16:06] <ticket> k,16:06,ticket,k
1114,[16:06] <demahum12> Is it true that ubuntu developer summit occurs after every new release?,16:06,demahum12,Is it true that ubuntu developer summit occurs after every new release?
1115,"[16:07] <Marcelunilsson> Hello, i just went from dualboot to a clean ubuntuinstall. The problem im having is that grub is finding some loaders other than the current install on other harddrives. this means i have to wait for grub each boot, i dont want that! how do i make it just boot this installation?",16:07,Marcelunilsson,"Hello, i just went from dualboot to a clean ubuntuinstall. The problem im having is that grub is finding some loaders other than the current install on other harddrives. this means i have to wait for grub each boot, i dont want that! how do i make it just boot this installation?"
1116,[16:08] <wadie> Has anyone tried ARandR? http://www.ubuntugeek.com/arandr-a-simple-visual-front-end-for-xrandr.html,16:08,wadie,Has anyone tried ARandR? http://www.ubuntugeek.com/arandr-a-simple-visual-front-end-for-xrandr.html
1117,[16:08] <ticket> drmagoo: ok and then how do i start the desktop ?,16:08,ticket,drmagoo: ok and then how do i start the desktop ?
1118,[16:08] <drmagoo> ticket: did that install any new packages ?,16:08,drmagoo,ticket: did that install any new packages ?
1119,"[16:08] <ticket> yes, it installed 27Mb of new package",16:08,ticket,"yes, it installed 27Mb of new package"
1120,"[16:09] <drmagoo> ticket: try ""service lightdm restart""",16:09,drmagoo,"ticket: try ""service lightdm restart"""
1121,[16:09] <tgm4883> demahum12: IIRC it happens vUDS happens every 3 months. At least that was what it was doing when they started it,16:09,tgm4883,demahum12: IIRC it happens vUDS happens every 3 months. At least that was what it was doing when they started it
1122,"[16:10] <demahum12> tgm4883, and is there something named ""ubuntu summit"" without ""developer"" or it is the same thing?",16:10,demahum12,"tgm4883, and is there something named ""ubuntu summit"" without ""developer"" or it is the same thing?"
1123,"[16:11] <samthewildone> when running ""top"" I noticed that chromium is eating up a lot cpu power.",16:11,samthewildone,"when running ""top"" I noticed that chromium is eating up a lot cpu power."
1124,[16:11] <tgm4883> demahum12: I believe there are different summits (or maybe I'm thinking of sprints),16:11,tgm4883,demahum12: I believe there are different summits (or maybe I'm thinking of sprints)
1125,"[16:11] <loa> samthewildone, you have many bookmarks?",16:11,loa,"samthewildone, you have many bookmarks?"
1126,[16:11] <drmagoo> ticket: did that work ? or do you still get any errors ?,16:11,drmagoo,ticket: did that work ? or do you still get any errors ?
1127,[16:11] <samthewildone> I only have 3 tabs open with one using either HTML5 or flash for music streaming via soundcloud.,16:11,samthewildone,I only have 3 tabs open with one using either HTML5 or flash for music streaming via soundcloud.
1128,"[16:11] <ticket> yup, i wait for the stuff the download, it is soooo long",16:11,ticket,"yup, i wait for the stuff the download, it is soooo long"
1129,"[16:11] <samthewildone> loa, less than 50",16:11,samthewildone,"loa, less than 50"
1130,"[16:12] <drmagoo> ticket: ok, let me know when its done ;)",16:12,drmagoo,"ticket: ok, let me know when its done ;)"
1131,"[16:12] <tgm4883> demahum12: this is slightly off topic here, can we take this discussion to #ubuntu-offtopic and you can describe what you are thinking of?",16:12,tgm4883,"demahum12: this is slightly off topic here, can we take this discussion to #ubuntu-offtopic and you can describe what you are thinking of?"
1132,"[16:12] <loa> Samopotamus, on in folder ""bookmarks folder""?",16:12,loa,"Samopotamus, on in folder ""bookmarks folder""?"
1133,"[16:12] <demahum12> tgm4883, sure. :)",16:12,demahum12,"tgm4883, sure. :)"
1134,"[16:12] <loa> samthewildone, ^^",16:12,loa,"samthewildone, ^^"
1135,=== Vampire0_ is now known as Vampire0,,,
1136,"[16:12] <loa> if so move them to folder called ""other""",16:12,loa,"if so move them to folder called ""other"""
1137,[16:13] <loa> there is something with bookmarks in 37 version.,16:13,loa,there is something with bookmarks in 37 version.
1138,[16:13] <squinty> Marcelunilsson:  https://help.ubuntu.com/community/Grub2/Setup#Configuring_GRUB_2,16:13,squinty,Marcelunilsson:  https://help.ubuntu.com/community/Grub2/Setup#Configuring_GRUB_2
1139,[16:13] <samthewildone> Oh on my bookmark bar ? I have 8,16:13,samthewildone,Oh on my bookmark bar ? I have 8
1140,[16:14] <samthewildone> in my other bookmarks I have the others,16:14,samthewildone,in my other bookmarks I have the others
1141,"[16:15] <loa> Samopotamus, try to move them",16:15,loa,"Samopotamus, try to move them"
1142,"[16:15] <samthewildone> I still get an error on this > button->setText(tr(""&Quit""));",16:15,samthewildone> I still get an error on this > button-,"button->setText(tr(""&Quit""));"
1143,"[16:15] <loa> Samopotamus, sorry man for this.",16:15,loa,"Samopotamus, sorry man for this."
1144,"[16:15] <loa> samthewildone, it started recently?",16:15,loa,"samthewildone, it started recently?"
1145,[16:15] <samthewildone> opps,16:15,samthewildone,opps
1146,[16:16] <samthewildone> wrong post on last,16:16,samthewildone,wrong post on last
1147,"[16:16] <ticket> drmagoo: ok, ubuntu-desktop installed, lightdm still doesnt want to start",16:16,ticket,"drmagoo: ok, ubuntu-desktop installed, lightdm still doesnt want to start"
1148,[16:16] <ticket> errors were encountered during the nvidia-331-updates execution,16:16,ticket,errors were encountered during the nvidia-331-updates execution
1149,"[16:16] <drmagoo> ticket: try ""dpkg-reconfigure lightdm""",16:16,drmagoo,"ticket: try ""dpkg-reconfigure lightdm"""
1150,[16:16] <ticket> do i purge this nvidia stuff ?,16:16,ticket,do i purge this nvidia stuff ?
1151,"[16:16] <samthewildone> loa, almost all of my bookmarks go into a other folder.",16:16,samthewildone,"loa, almost all of my bookmarks go into a other folder."
1152,[16:16] <loa> try to move them all.,16:16,loa,try to move them all.
1153,[16:16] <ticket> ok,16:16,ticket,ok
1154,[16:17] <ticket> still doesnt want to start the lightdm,16:17,ticket,still doesnt want to start the lightdm
1155,[16:17] <k1l> samthewildone: your flash stuff eats a lot of cpu.,16:17,k1l,samthewildone: your flash stuff eats a lot of cpu.
1156,"[16:17] <drmagoo> ticket: if that doesnt help, try to remove all nvidia-packages installed and just install nvidia-current",16:17,drmagoo,"ticket: if that doesnt help, try to remove all nvidia-packages installed and just install nvidia-current"
1157,[16:17] <VapidWorx> I entered the wrong syntax for .profile and now it's in a login boot. The problem is I can't change boot override so I can get to a command line now as root but it won't let me unmount the file system to edit .profile. Any ideas how to get around this? It's an Asus Zenbook that I removed Windows and added Ubuntu too,16:17,VapidWorx,I entered the wrong syntax for .profile and now it's in a login boot. The problem is I can't change boot override so I can get to a command line now as root but it won't let me unmount the file system to edit .profile. Any ideas how to get around this? It's an Asus Zenbook that I removed Windows and added Ubuntu too
1158,"[16:17] <drmagoo> ticket: and then try a ""dpkg-reconfigure lightdm"" again",16:17,drmagoo,"ticket: and then try a ""dpkg-reconfigure lightdm"" again"
1159,[16:17] <ticket> k lets go,16:17,ticket,k lets go
1160,"[16:17] <k1l> ticket: again: see ""dmesg"" what is going on there. i bet its a drivers issue",16:17,k1l,"ticket: again: see ""dmesg"" what is going on there. i bet its a drivers issue"
1161,"[16:18] <ticket> mkay, removed the nvidia* things",16:18,ticket,"mkay, removed the nvidia* things"
1162,[16:19] <ticket> dmesg returns a lot of things,16:19,ticket,dmesg returns a lot of things
1163,[16:19] <jiohdi> and remember to run nvidia-xconf,16:19,jiohdi,and remember to run nvidia-xconf
1164,[16:19] <ticket> now installing nvidia-current,16:19,ticket,now installing nvidia-current
1165,"[16:20] <drmagoo> ticket: also check if you have the ""linux-headers-generic"" package installed",16:20,drmagoo,"ticket: also check if you have the ""linux-headers-generic"" package installed"
1166,[16:20] <musicalvegan0> hi guys. is there a supported way of installing setroubleshoot server on 14.04? it's not in the repos. I assume it was removed because of apparmor.,16:20,musicalvegan0,hi guys. is there a supported way of installing setroubleshoot server on 14.04? it's not in the repos. I assume it was removed because of apparmor.
1167,[16:20] <ticket> k,16:20,ticket,k
1168,[16:20] <samthewildone> https://drive.google.com/file/d/0B_rZKP9LDqUFeDdrU2Jjbnd2RDQ/edit?usp=sharing,16:20,samthewildone,https://drive.google.com/file/d/0B_rZKP9LDqUFeDdrU2Jjbnd2RDQ/edit?usp=sharing
1169,[16:20] <daniel_> hey guyz,16:20,daniel_,hey guyz
1170,[16:21] <Marcelunilsson> squinty: thx! think i made it work 'reboot',16:21,Marcelunilsson,squinty: thx! think i made it work 'reboot'
1171,[16:21] <ticket> k i didnt had the headers generic,16:21,ticket,k i didnt had the headers generic
1172,[16:21] <ticket> adding it,16:21,ticket,adding it
1173,"[16:22] <drmagoo> ticket: you might need to do a ""dpkg-reconfigure nvidia-current"" after installing it...",16:22,drmagoo,"ticket: you might need to do a ""dpkg-reconfigure nvidia-current"" after installing it..."
1174,[16:22] <ticket> k,16:22,ticket,k
1175,[16:22] <ticket> ok done,16:22,ticket,ok done
1176,"[16:23] <drmagoo> ticket: then try ""service lightdm restart""",16:23,drmagoo,"ticket: then try ""service lightdm restart"""
1177,[16:23] <Marcelunilsson> squinty: it worked ! thxx,16:23,Marcelunilsson,squinty: it worked ! thxx
1178,[16:23] <ticket> stop: unknown instalce: start: Job failed to start,16:23,ticket,stop: unknown instalce: start: Job failed to start
1179,[16:23] <squinty> Marcelunilsson:  good to hear! :),16:23,squinty,Marcelunilsson:  good to hear! :)
1180,[16:23] <ticket> unknown instance,16:23,ticket,unknown instance
1181,[16:24] <samthewildone> Have a look at this > https://drive.google.com/file/d/0B_rZKP9LDqUFSm1Ea05Yc3Bkakk/edit?usp=sharing,16:24,samthewildone> Have a look at this ,https://drive.google.com/file/d/0B_rZKP9LDqUFSm1Ea05Yc3Bkakk/edit?usp=sharing
1182,"[16:24] <drmagoo> ticket: ""dpkg-reconfigure lightdm""",16:24,drmagoo,"ticket: ""dpkg-reconfigure lightdm"""
1183,[16:24] <samthewildone> Shows how many instances of chromium are running.,16:24,samthewildone,Shows how many instances of chromium are running.
1184,[16:24] <samthewildone> I do have hangouts running in the background.,16:24,samthewildone,I do have hangouts running in the background.
1185,[16:24] <daftykins> samthewildone: is there a question that goes with this?,16:24,daftykins,samthewildone: is there a question that goes with this?
1186,"[16:25] <ticket> drmagoo: after reconfiguring, still failing to start",16:25,ticket,"drmagoo: after reconfiguring, still failing to start"
1187,=== PsiOmega is now known as AlphaBeta,,,
1188,"[16:25] <loa> please help me, looks like something goes wring very bad http://pastebin.com/wS0N6La2",16:25,loa,"please help me, looks like something goes wring very bad http://pastebin.com/wS0N6La2"
1189,[16:25] <ticket> maybe i need to reboot,16:25,ticket,maybe i need to reboot
1190,[16:25] <loa> why this happened? why all my packages which i are deleted?,16:25,loa,why this happened? why all my packages which i are deleted?
1191,[16:25] <drmagoo> ticket: what nvidia-packages do you have installed ?,16:25,drmagoo,ticket: what nvidia-packages do you have installed ?
1192,[16:25] <loa> what was that? O_O,16:25,loa,what was that? O_O
1193,[16:25] <loa> bug?,16:25,loa,bug?
1194,[16:25] <daftykins> loa: might be easier to ask in #ubuntu-ru,16:25,daftykins,loa: might be easier to ask in #ubuntu-ru
1195,"[16:26] <ticket> after purgin all nvidia, just the nvidia current,",16:26,ticket,"after purgin all nvidia, just the nvidia current,"
1196,[16:26] <Mayur> guys how can i revert everything that got installed in apt-get upgrade?,16:26,Mayur,guys how can i revert everything that got installed in apt-get upgrade?
1197,[16:26] <VapidWorx> anyone have a suggestion how to get it to boot to liveUSB around boot override?,16:26,VapidWorx,anyone have a suggestion how to get it to boot to liveUSB around boot override?
1198,[16:27] <ticket> drmagoo: just nvidia-current now,16:27,ticket,drmagoo: just nvidia-current now
1199,"[16:27] <samthewildone> daftykins, wanted to know why is chromium taking up so much cpu resources when I hardly have webpages open.",16:27,samthewildone,"daftykins, wanted to know why is chromium taking up so much cpu resources when I hardly have webpages open."
1200,=== eeeeee is now known as eeee,,,
1201,=== eeee is now known as e,,,
1202,[16:27] <samthewildone> this affects the performance of chromium because it hangs sometimes.,16:27,samthewildone,this affects the performance of chromium because it hangs sometimes.
1203,[16:27] <drmagoo> ticket: give me a sec... trying to remeber all the hops I had to go thru to get it to work ;),16:27,drmagoo,ticket: give me a sec... trying to remeber all the hops I had to go thru to get it to work ;)
1204,=== e is now known as eeee,,,
1205,[16:27] <daniel_> hey guys,16:27,daniel_,hey guys
1206,[16:27] <ticket> :),16:27,ticket,:)
1207,[16:28] <daftykins> samthewildone: try a clean profile.,16:28,daftykins,samthewildone: try a clean profile.
1208,"[16:28] <samthewildone> daftykins, sometime pages don't fully scroll and have a delay.",16:28,samthewildone,"daftykins, sometime pages don't fully scroll and have a delay."
1209,"[16:28] <ticket> the fun thing is, i upgraded on my laptop, also having an nvidia card and nothing went wrong",16:28,ticket,"the fun thing is, i upgraded on my laptop, also having an nvidia card and nothing went wrong"
1210,"[16:28] <daniel_> i want to learn core programming an someone is suggesting red hat ahead of ubuntu, whats ur say",16:28,daniel_,"i want to learn core programming an someone is suggesting red hat ahead of ubuntu, whats ur say"
1211,[16:28] <samthewildone> where is my chromium user profile ?,16:28,samthewildone,where is my chromium user profile ?
1212,[16:28] <daftykins> samthewildone: don't know.,16:28,daftykins,samthewildone: don't know.
1213,[16:28] <SchrodingersScat> somewhere in ~ probably,16:28,SchrodingersScat,somewhere in ~ probably
1214,"[16:29] <samthewildone> SchrodingersScat, searched nothing there.",16:29,samthewildone,"SchrodingersScat, searched nothing there."
1215,[16:29] <samthewildone> though I found some stuff @ whereis chromium-browser,16:29,samthewildone,though I found some stuff @ whereis chromium-browser
1216,[16:30] <drmagoo> ticket: which geforce card did you have ?,16:30,drmagoo,ticket: which geforce card did you have ?
1217,[16:31] <loa> is there way to get last deleted packages?,16:31,loa,is there way to get last deleted packages?
1218,[16:31] <ticket> drmagoo: it is a geforce gtx 660 ti,16:31,ticket,drmagoo: it is a geforce gtx 660 ti
1219,[16:31] <loa> log or something,16:31,loa,log or something
1220,[16:31] <trism> samthewildone: ~/.config/chromium/,16:31,trism,samthewildone: ~/.config/chromium/
1221,"[16:31] <creichen> Hi!  I'm trying to re-install grub, but I can't seem to get the on-screen keyboard (onboard or anything like it) to start, which makes that rather difficult.  Is there any clever trick to start OnBoard?  (This is on a utopic-unicorn snapshot from last week.)",16:31,creichen,"Hi!  I'm trying to re-install grub, but I can't seem to get the on-screen keyboard (onboard or anything like it) to start, which makes that rather difficult.  Is there any clever trick to start OnBoard?  (This is on a utopic-unicorn snapshot from last week.)"
1222,[16:31] <loa> need this option badly,16:31,loa,need this option badly
1223,[16:32] <daftykins> !utopic,16:32,daftykins,!utopic
1224,"[16:32] <ubottu> Ubuntu 14.10 (Utopic Unicorn) is the next development release of Ubuntu due for release in October 2014. Support in #ubuntu+1. For more info, see the announcement at http://www.markshuttleworth.com/archives/1363",16:32,ubottu,"Ubuntu 14.10 (Utopic Unicorn) is the next development release of Ubuntu due for release in October 2014. Support in #ubuntu+1. For more info, see the announcement at http://www.markshuttleworth.com/archives/1363"
1225,"[16:32] <daftykins> creichen: that release is not final yet, discussion in #ubuntu+1",16:32,daftykins,"creichen: that release is not final yet, discussion in #ubuntu+1"
1226,"[16:32] <creichen> daftykins: My apologies for spamming the wrong channel, and thanks!",16:32,creichen,"daftykins: My apologies for spamming the wrong channel, and thanks!"
1227,=== owner_ is now known as Guest15125,,,
1228,[16:33] <daftykins> not a problem :),16:33,daftykins,not a problem :)
1229,[16:33] <ticket> drmagoo: i should be able to start the x server even without the nvidia drivers isnt it ?,16:33,ticket,drmagoo: i should be able to start the x server even without the nvidia drivers isnt it ?
1230,[16:33] <Battlecruiser> http://pastebin.com/qzgXehnz,16:33,Battlecruiser,http://pastebin.com/qzgXehnz
1231,[16:33] <Battlecruiser> anyone will help?,16:33,Battlecruiser,anyone will help?
1232,"[16:33] <samthewildone> trism, thanks man",16:33,samthewildone,"trism, thanks man"
1233,"[16:33] <samthewildone> trism, lot of junk in there",16:33,samthewildone,"trism, lot of junk in there"
1234,[16:33] <nullbyte_> what is diference of ubuntu gnome adn ubuntu desktop?,16:33,nullbyte_,what is diference of ubuntu gnome adn ubuntu desktop?
1235,"[16:34] <samthewildone> ah there's the almighty ""crash_reports"" folder",16:34,samthewildone,"ah there's the almighty ""crash_reports"" folder"
1236,"[16:34] <samthewildone> nullbyte_, ubuntu desktop is Unity",16:34,samthewildone,"nullbyte_, ubuntu desktop is Unity"
1237,"[16:34] <samthewildone> nullbyte_, a custom desktop environment.",16:34,samthewildone,"nullbyte_, a custom desktop environment."
1238,[16:35] <daniel_> guyz pls does vb net work on ubuntu?,16:35,daniel_,guyz pls does vb net work on ubuntu?
1239,"[16:35] <samthewildone> nullbyte_, gnome is another desktop environment.",16:35,samthewildone,"nullbyte_, gnome is another desktop environment."
1240,[16:35] <reisio> daniel_: yes,16:35,reisio,daniel_: yes
1241,"[16:35] <samthewildone> nullbyte_, pretty much it comes down to personal preference.",16:35,samthewildone,"nullbyte_, pretty much it comes down to personal preference."
1242,"[16:36] <samthewildone> nullbyte_, though Unity is more cross device (unity phone, tablets)",16:36,samthewildone,"nullbyte_, though Unity is more cross device (unity phone, tablets)"
1243,[16:36] <samthewildone> !unity | nullbyte_,16:36,samthewildone,!unity | nullbyte_
1244,"[16:36] <ubottu> nullbyte_: Unity is the default UI since Ubuntu 11.04.  Unity is a shell for GNOME. see http://unity.ubuntu.com. For a GNOME 2-like experience, see !notunity",16:36,ubottu,"nullbyte_: Unity is the default UI since Ubuntu 11.04.  Unity is a shell for GNOME. see http://unity.ubuntu.com. For a GNOME 2-like experience, see !notunity"
1245,"[16:37] <reisio> that's right, unity, which is a shell for gnome... is more cross device :p",16:37,reisio,"that's right, unity, which is a shell for gnome... is more cross device :p"
1246,[16:38] <drmagoo> ticket: that depends of you X-server is set to use the nvidia drivers,16:38,drmagoo,ticket: that depends of you X-server is set to use the nvidia drivers
1247,"[16:39] <drmagoo> ticket: try to do a ""sudo nvidia-xconfig""",16:39,drmagoo,"ticket: try to do a ""sudo nvidia-xconfig"""
1248,[16:39] <ticket> mmhh,16:39,ticket,mmhh
1249,"[16:40] <drmagoo> ticket: then you should be able to start X again (service lightdm restart""",16:40,drmagoo,"ticket: then you should be able to start X again (service lightdm restart"""
1250,"[16:40] <ticket> unable to parse X.Org version string , backed up file xorg.conf, new X config file written",16:40,ticket,"unable to parse X.Org version string , backed up file xorg.conf, new X config file written"
1251,[16:41] <ticket> still not willing to start lightdm,16:41,ticket,still not willing to start lightdm
1252,[16:41] <ticket> i wait for the apt-get upgrade to finish,16:41,ticket,i wait for the apt-get upgrade to finish
1253,[16:42] <drmagoo> ticket: that's not finished yet ?,16:42,drmagoo,ticket: that's not finished yet ?
1254,"[16:42] <ticket> i ran it some minutes ago, there is 200 Mo to upgrade",16:42,ticket,"i ran it some minutes ago, there is 200 Mo to upgrade"
1255,"[16:43] <drmagoo> ticket: that might be why then, some package still not installed.. wait until all packages are installed and then try again",16:43,drmagoo,"ticket: that might be why then, some package still not installed.. wait until all packages are installed and then try again"
1256,"[16:43]  * samthewildone is away: Currenly I'm away from the keyboard, please wait...",16:43,,
1257,[16:44] <loa> is there something similiar to mock under ubuntu?,16:44,loa,is there something similiar to mock under ubuntu?
