,raw,timestamp,user,message
1049,[09:14] <PechosRey> i can't find it in the runlevels,09:14,PechosRey,i can't find it in the runlevels
1050,"[09:14] <Tachyon`> 'cat', heh, never heard it called that before",09:14,Tachyon`,"'cat', heh, never heard it called that before"
1051,"[09:14] <Psil0Cybin> ObrienDave, be a lover, not a hater..",09:14,Psil0Cybin,"ObrienDave, be a lover, not a hater.."
1052,"[09:15] <Tachyon`> also, isn't that the active ingredient in magic mushrooms?",09:15,Tachyon`,"also, isn't that the active ingredient in magic mushrooms?"
1053,[09:15] <ikonia> Psil0Cybin: I don't understand tha actual problem ?,09:15,ikonia,Psil0Cybin: I don't understand tha actual problem ?
1054,[09:16] <Psil0Cybin> nvm i figured it out i just wanted to disable gnome-keyring daemon,09:16,Psil0Cybin,nvm i figured it out i just wanted to disable gnome-keyring daemon
1055,[09:17] <ikonia> so that's all you had to ask,09:17,ikonia,so that's all you had to ask
1056,"[09:17] <Psil0Cybin> if i chmod it to 0, it stops bugging me.",09:17,Psil0Cybin,"if i chmod it to 0, it stops bugging me."
1057,"[09:17] <ikonia> bad solution but ""ok""",09:17,ikonia,"bad solution but ""ok"""
1058,[09:17] <Psil0Cybin> what do you recommend.,09:17,Psil0Cybin,what do you recommend.
1059,[09:17] <ikonia> disabling the service,09:17,ikonia,disabling the service
1060,[09:17] <anew> somsip i dont understand what to do with the first answer...,09:17,anew,somsip i dont understand what to do with the first answer...
1061,[09:17] <anew> what do i type into the terminal?,09:17,anew,what do i type into the terminal?
1062,[09:18] <Psil0Cybin> in what way ikonia? just kill it every start or boot? or can I physically set it to off?,09:18,Psil0Cybin,in what way ikonia? just kill it every start or boot? or can I physically set it to off?
1063,[09:18] <ikonia> it's called from dbus I think from memory,09:18,ikonia,it's called from dbus I think from memory
1064,[09:18] <ikonia> so disable it within dbus,09:18,ikonia,so disable it within dbus
1065,"[09:18] <ikonia> or just click ""cancel"" when it asks you for your password, it shouldnt ask you again for that session",09:18,ikonia,"or just click ""cancel"" when it asks you for your password, it shouldnt ask you again for that session"
1066,"[09:18] <ObrienDave> Psil0Cybin, i don't hate you, i think you worry too much and waste peoples time on really silly stuff",09:18,ObrienDave,"Psil0Cybin, i don't hate you, i think you worry too much and waste peoples time on really silly stuff"
1067,"[09:19] <ikonia> if you're certain you don't want it ever, just remove the package",09:19,ikonia,"if you're certain you don't want it ever, just remove the package"
1068,"[09:19] <somsip> anew: the input after ""nick@home-sv-1:~$ "" gives the ouput shown underneath it. Do the ones in Problem and Solution. And read the rest",09:19,somsip,"anew: the input after ""nick@home-sv-1:~$ "" gives the ouput shown underneath it. Do the ones in Problem and Solution. And read the rest"
1069,"[09:20] <Psil0Cybin> ikonia, okay, but when I cancel obviously it just says pubkey denied because I did not enter a password. I am worried if I remove the package it might remove other packages I need for a standard Xubuntu install, How can I disable it through dbus perhaps in case it may cause problems later I can enable it..",09:20,Psil0Cybin,"ikonia, okay, but when I cancel obviously it just says pubkey denied because I did not enter a password. I am worried if I remove the package it might remove other packages I need for a standard Xubuntu install, How can I disable it through dbus perhaps in case it may cause problems later I can enable it.."
1070,[09:20] <PechosRey> nobody knows from where the samba service is autostarted in 14.04? the rc.local is empty,09:20,PechosRey,nobody knows from where the samba service is autostarted in 14.04? the rc.local is empty
1071,[09:20] <ikonia> Psil0Cybin I'd just remove it if you're that against it,09:20,ikonia,Psil0Cybin I'd just remove it if you're that against it
1072,[09:20] <Psil0Cybin> okay.,09:20,Psil0Cybin,okay.
1073,"[09:21] <Psil0Cybin> ikonia, it wants to remove software center.",09:21,Psil0Cybin,"ikonia, it wants to remove software center."
1074,[09:21] <ikonia> https://wiki.gnome.org/Projects/GnomeKeyring/Ssh,09:21,ikonia,https://wiki.gnome.org/Projects/GnomeKeyring/Ssh
1075,[09:21] <Psil0Cybin> I think disabling it is a better method should I just google it ( how to disable via dbus? ),09:21,Psil0Cybin,I think disabling it is a better method should I just google it ( how to disable via dbus? )
1076,[09:21] <Psil0Cybin> can I disable via dconf-editor?,09:21,Psil0Cybin,can I disable via dconf-editor?
1077,[09:22] <ikonia> Psil0Cybin: I'd be surprised if software center depended on gnome-ask-pass/keyring,09:22,ikonia,Psil0Cybin: I'd be surprised if software center depended on gnome-ask-pass/keyring
1078,[09:22] <ikonia> ls -la,09:22,ikonia,ls -la
1079,"[09:22] <Psil0Cybin> ikonia, it wanted to remove gnome-keyring, oneconf, python-ubuntu-sso-client software-center ubuntu-sso-client",09:22,Psil0Cybin,"ikonia, it wanted to remove gnome-keyring, oneconf, python-ubuntu-sso-client software-center ubuntu-sso-client"
1080,[09:22] <ikonia> oops,09:22,ikonia,oops
1081,[09:22] <ikonia> surprising,09:22,ikonia,surprising
1082,[09:22] <ikonia> Psil0Cybin: what package did you tell it to remove ?,09:22,ikonia,Psil0Cybin: what package did you tell it to remove ?
1083,[09:23] <Psil0Cybin> gnome-keyring,09:23,Psil0Cybin,gnome-keyring
1084,[09:23] <ikonia> surprising,09:23,ikonia,surprising
1085,"[09:23] <Tachyon`> hi, I've atm got grub2 installed with its loader in the mbr, however, for reasons I need not go into, that's no longer useful, I want to install it to the superblock of the root partition, is that as simple as doing a grub-install /dev/sda6 or is there more to it than that?",09:23,Tachyon`,"hi, I've atm got grub2 installed with its loader in the mbr, however, for reasons I need not go into, that's no longer useful, I want to install it to the superblock of the root partition, is that as simple as doing a grub-install /dev/sda6 or is there more to it than that?"
1086,[09:24] <ikonia> http://askubuntu.com/questions/243397/xubuntu-disable-gnome-keyring worth a glance too,09:24,ikonia,http://askubuntu.com/questions/243397/xubuntu-disable-gnome-keyring worth a glance too
1087,[09:25] <ikonia> le of using a wrapper script http://askubuntu.com/questions/412793/xubuntu-stop-gnome-keyring-daemon-from-impersonating-ssh-agent,09:25,ikonia,le of using a wrapper script http://askubuntu.com/questions/412793/xubuntu-stop-gnome-keyring-daemon-from-impersonating-ssh-agent
1088,"[09:25] <ikonia> this should in my mind by changed at the dbus ""call"" line",09:25,ikonia,"this should in my mind by changed at the dbus ""call"" line"
1089,"[09:25] <menace> hi, i am just installing the netboot 14.10 image, and i had several lvs/vgs on the disk before. It seems i cannot stop the nulling of the disk. is that right? any experience with that?",09:25,menace,"hi, i am just installing the netboot 14.10 image, and i had several lvs/vgs on the disk before. It seems i cannot stop the nulling of the disk. is that right? any experience with that?"
1090,[09:25] <somsip> !14.10 | menace,09:25,somsip,!14.10 | menace
1091,"[09:25] <ubottu> menace: Ubuntu 14.10 (Utopic Unicorn) is the next development release of Ubuntu due for release in October 2014. Support in #ubuntu+1. For more info, see the announcement at http://www.markshuttleworth.com/archives/1363",09:25,ubottu,"menace: Ubuntu 14.10 (Utopic Unicorn) is the next development release of Ubuntu due for release in October 2014. Support in #ubuntu+1. For more info, see the announcement at http://www.markshuttleworth.com/archives/1363"
1092,[09:25] <blubaustin> hello,09:25,blubaustin,hello
1093,[09:26] <blubaustin> Was just wondering one thing can I have a NFS server and client running on the same machine? I am trying to share folders from both machines to each other,09:26,blubaustin,Was just wondering one thing can I have a NFS server and client running on the same machine? I am trying to share folders from both machines to each other
1094,[09:26] <ikonia> blubaustin: yes you can,09:26,ikonia,blubaustin: yes you can
1095,[09:27] <blubaustin> Alright was just wondering since I know with some things a client and server you can only have one or the other not both,09:27,blubaustin,Alright was just wondering since I know with some things a client and server you can only have one or the other not both
1096,[09:27] <ikonia> nfs is fine,09:27,ikonia,nfs is fine
1097,[09:27] <blubaustin> I've never set up a NFS so I was just wondering,09:27,blubaustin,I've never set up a NFS so I was just wondering
1098,[09:27] <blubaustin> So this will be fun ^_^ . I hope at least,09:27,blubaustin,So this will be fun ^_^ . I hope at least
1099,[09:27]  * Tachyon` gives up and just tries it and prepares a lot of cursing in case his system ends up unbootable,09:27,,
1100,=== apodio is now known as nooooooooiz,,,
1101,"[09:28] <menace> *sigh* I know that 14.10 is not released yet.... I don't want to complain, i just ask, if anyone knows this behaviour. if not, i surely will look for a bug, or even open one...",09:28,menace,"*sigh* I know that 14.10 is not released yet.... I don't want to complain, i just ask, if anyone knows this behaviour. if not, i surely will look for a bug, or even open one..."
1102,[09:28] <blubaustin> ikonia Have is it very difficult to setup or is it pretty easy? I'm trying to make it where each user can access their home folder.,09:28,blubaustin,ikonia Have is it very difficult to setup or is it pretty easy? I'm trying to make it where each user can access their home folder.
1103,=== raz1 is now known as Raz1,,,
1104,"[09:29] <cfhowlett> menace, and ALL of that can and should be discussed in #ubuntu+1",09:29,cfhowlett,"menace, and ALL of that can and should be discussed in #ubuntu+1"
1105,[09:29] <somsip> menace: try in 14.10. That's where users of 14.10 are,09:29,somsip,menace: try in 14.10. That's where users of 14.10 are
1106,[09:29] <blubaustin> So if one person is on one computer they can still access files on the other computer,09:29,blubaustin,So if one person is on one computer they can still access files on the other computer
1107,[09:29] <somsip> menace: s/14.10/#ubuntu+1 ...,09:29,somsip,menace: s/14.10/#ubuntu+1 ...
1108,[09:29] <menace> thanks :),09:29,menace,thanks :)
1109,"[09:29] <menace> that's a better place, i agree",09:29,menace,"that's a better place, i agree"
1110,[09:29] <ikonia> blubaustin: doddle,09:29,ikonia,blubaustin: doddle
1111,[09:29] <blubaustin> I do want security though which is whats bothering me with the guide its wanting everyone to access it instead of authentication,09:29,blubaustin,I do want security though which is whats bothering me with the guide its wanting everyone to access it instead of authentication
1112,"[09:30] <Raz1> So, should I ask MIR questions in this channel or 14.10 - or something completely different?",09:30,Raz1,"So, should I ask MIR questions in this channel or 14.10 - or something completely different?"
1113,=== helpme is now known as Guest57281,,,
1114,[09:30] <blubaustin> doddle?,09:30,blubaustin,doddle?
1115,[09:30] <Psil0Cybin> thank you so much ikonia,09:30,Psil0Cybin,thank you so much ikonia
1116,[09:30] <cfhowlett> !mir | razl,09:30,cfhowlett,!mir | razl
1117,"[09:30] <ubottu> razl: Mir is the next-generation display server currently under development by Canonical and Ubuntu. It's slated for inclusion in Ubuntu 14.04. For more information on it, see https://wiki.ubuntu.com/Mir/Spec . For code, see https://launchpad.net/mir",09:30,ubottu,"razl: Mir is the next-generation display server currently under development by Canonical and Ubuntu. It's slated for inclusion in Ubuntu 14.04. For more information on it, see https://wiki.ubuntu.com/Mir/Spec . For code, see https://launchpad.net/mir"
1118,[09:30] <Raz1> cfhowlett: I already read it,09:30,Raz1,cfhowlett: I already read it
1119,"[09:30] <cfhowlett> Raz1, not in 14.04 so ... 14.10 I suppose",09:30,cfhowlett,"Raz1, not in 14.04 so ... 14.10 I suppose"
1120,=== eeeeee is now known as EriC^^,,,
1121,[09:31] <blubaustin> I have ubuntu 14.10 ubottu >_>,09:31,blubaustin> I have ubuntu 14.10 ubottu >_,I have ubuntu 14.10 ubottu >_>
1122,[09:31] <blubaustin> I like gentoo but its to hard for the other users to manage,09:31,blubaustin,I like gentoo but its to hard for the other users to manage
1123,[09:31] <blubaustin> ubuntu*,09:31,blubaustin,ubuntu*
1124,[09:31] <ikonia> why are you using pre-release software ?,09:31,ikonia,why are you using pre-release software ?
1125,[09:31] <Raz1> cfhowlett: All right,09:31,Raz1,cfhowlett: All right
1126,[09:31] <ikonia> blubaustin: doddle = very easy,09:31,ikonia,blubaustin: doddle = very easy
1127,[09:32] <blubaustin> Why not,09:32,blubaustin,Why not
1128,[09:32] <blubaustin> I have backups,09:32,blubaustin,I have backups
1129,"[09:32] <ikonia> blubaustin: because it's pre-release, it breaks it is unstable",09:32,ikonia,"blubaustin: because it's pre-release, it breaks it is unstable"
1130,[09:32] <blubaustin> read above ^,09:32,blubaustin,read above ^
1131,"[09:32] <ikonia> blubaustin: ok, then please join #ubuntu+1 for 14.10 discussion",09:32,ikonia,"blubaustin: ok, then please join #ubuntu+1 for 14.10 discussion"
1132,"[09:32] <cfhowlett> blubaustin, AND it's not supported here so >>> #ubuntu+1 for support please",09:32,"cfhowlett> blubaustin, AND it's not supported here so >>",#ubuntu+1 for support please
1133,"[09:32] <blubaustin> So to me if I can help the team, and other people can its worth it",09:32,blubaustin,"So to me if I can help the team, and other people can its worth it"
1134,[09:32] <ikonia> blubaustin: this channel only suppors the stable release,09:32,ikonia,blubaustin: this channel only suppors the stable release
1135,[09:32] <blubaustin> crap >_>,09:32,blubaustin> crap >_,crap >_>
1136,[09:33] <PechosRey> can someone tell me how the new autostart of services in ubuntu 14.04 works?,09:33,PechosRey,can someone tell me how the new autostart of services in ubuntu 14.04 works?
1137,[09:33] <PechosRey> the rc.local is empty,09:33,PechosRey,the rc.local is empty
1138,[09:34] <PechosRey> my samba autostarts with 14.04 but i can find out where to deactivate the samba service,09:34,PechosRey,my samba autostarts with 14.04 but i can find out where to deactivate the samba service
1139,[09:34] <ikonia> it uses upstart,09:34,ikonia,it uses upstart
1140,[09:34] <ikonia> that's the init system,09:34,ikonia,that's the init system
1141,[09:34] <blubaustin> delete it in the /etc/init.d/,09:34,blubaustin,delete it in the /etc/init.d/
1142,[09:35] <ikonia> rc.local is only for very specific and pretty much obsolete stuff now,09:35,ikonia,rc.local is only for very specific and pretty much obsolete stuff now
1143,[09:35] <ikonia> do not delete it,09:35,ikonia,do not delete it
1144,[09:35] <ikonia> do not delete init scripts,09:35,ikonia,do not delete init scripts
1145,=== Guest95615 is now known as Layke,,,
1146,[09:35] <Raz1> *unless you created them,09:35,Raz1,*unless you created them
1147,[09:35] <blubaustin> or mv it,09:35,blubaustin,or mv it
1148,[09:35] <ikonia> do not move it,09:35,ikonia,do not move it
1149,[09:36] <blubaustin> ?!,09:36,blubaustin,?!
1150,[09:36] <PechosRey> ah great there is a samba autostart script thx a lot,09:36,PechosRey,ah great there is a samba autostart script thx a lot
1151,[09:36] <Raz1> They can be disabled,09:36,Raz1,They can be disabled
1152,[09:36] <ikonia> disable init jobs using upstart,09:36,ikonia,disable init jobs using upstart
1153,[09:36] <ikonia> do not try to get around it,09:36,ikonia,do not try to get around it
1154,[09:36] <blubaustin> yes they can be disabled but I've always moved it or deleted it >_>,09:36,blubaustin> yes they can be disabled but I've always moved it or deleted it >_,yes they can be disabled but I've always moved it or deleted it >_>
1155,[09:36] <blubaustin> <_<,09:36,blubaustin,<_<
1156,[09:36] <ikonia> then you have bad practices,09:36,ikonia,then you have bad practices
1157,[09:36] <ikonia> please don't offer them as solutions,09:36,ikonia,please don't offer them as solutions
1158,[09:37] <PechosRey> where can i find upstart?,09:37,PechosRey,where can i find upstart?
1159,[09:37] <ikonia> PechosRey: it's an init system it's made up of a few components,09:37,ikonia,PechosRey: it's an init system it's made up of a few components
1160,[09:37] <ikonia> !upstart | PechosRey,09:37,ikonia,!upstart | PechosRey
1161,[09:37] <ubottu> PechosRey: Upstart is meant to replace the old Sys V Init system with an event-driven init model.  For more information please see: http://upstart.ubuntu.com/,09:37,ubottu,PechosRey: Upstart is meant to replace the old Sys V Init system with an event-driven init model.  For more information please see: http://upstart.ubuntu.com/
1162,=== Guest57281 is now known as samuraiRM,,,
1163,[09:39] <PechosRey> ah thx a lot i try to disable it using upstart,09:39,PechosRey,ah thx a lot i try to disable it using upstart
1164,=== sudhir_ is now known as nrange,,,
1165,"[09:40] <Psil0Cybin> I just typed in free -m on a fresh install of Xubuntu and it says i have 0 swap 0 used 0 free, so i can assume I have no swap...why is this so, would it no task me to make a swap or make one automatically, if i just did a standard install when it erases everything?",09:40,Psil0Cybin,"I just typed in free -m on a fresh install of Xubuntu and it says i have 0 swap 0 used 0 free, so i can assume I have no swap...why is this so, would it no task me to make a swap or make one automatically, if i just did a standard install when it erases everything?"
1166,"[09:40] <cfhowlett> Psil0Cybin, swap is not automatic",09:40,cfhowlett,"Psil0Cybin, swap is not automatic"
1167,"[09:40] <Raz1> upstart is going to be replaced eventually, by the way",09:40,Raz1,"upstart is going to be replaced eventually, by the way"
1168,[09:40] <cfhowlett> !swap | Psil0Cybin,09:40,cfhowlett,!swap | Psil0Cybin
1169,[09:40] <ubottu> Psil0Cybin: swap is used to move unused programs and data out of main memory to make your system faster. It can also be used as extra memory if you don't have enough. See https://help.ubuntu.com/community/SwapFaq for more info,09:40,ubottu,Psil0Cybin: swap is used to move unused programs and data out of main memory to make your system faster. It can also be used as extra memory if you don't have enough. See https://help.ubuntu.com/community/SwapFaq for more info
1170,[09:41] <Raz1> Psil0Cybin: It just means that your system hasn't needed to page anything yet because you have enough memory,09:41,Raz1,Psil0Cybin: It just means that your system hasn't needed to page anything yet because you have enough memory
1171,"[09:41] <Psil0Cybin> cfhowlett, would it get created automatically, if i need more memory",09:41,Psil0Cybin,"cfhowlett, would it get created automatically, if i need more memory"
1172,[09:41] <Psil0Cybin> even if total says 0?,09:41,Psil0Cybin,even if total says 0?
1173,[09:41] <Raz1> It's just the space used on the swap partition,09:41,Raz1,It's just the space used on the swap partition
1174,[09:41] <PechosRey> it seems samba is not managed with upstart service,09:41,PechosRey,it seems samba is not managed with upstart service
1175,[09:42] <cynicallemon> i dont usually run with swap enabled due to having enough memory,09:42,cynicallemon,i dont usually run with swap enabled due to having enough memory
1176,"[09:42] <cfhowlett> Psil0Cybin, swap IS NOT created unless you choose to do so.  Did you?  If not = no swap.  Read the wiki and add one if you wish12",09:42,cfhowlett,"Psil0Cybin, swap IS NOT created unless you choose to do so.  Did you?  If not = no swap.  Read the wiki and add one if you wish12"
1177,[09:42] <PechosRey> initctl list -> doesn`t list samba processes,09:42,PechosRey> initctl list -,doesn`t list samba processes
1178,[09:42] <Raz1> cynicallemon: It's kind of useful for hibernation though,09:42,Raz1,cynicallemon: It's kind of useful for hibernation though
1179,"[09:42] <Raz1> Psil0Cybin: Oh, sorry. I didn't see the 0 free part",09:42,Raz1,"Psil0Cybin: Oh, sorry. I didn't see the 0 free part"
1180,"[09:42] <Psil0Cybin> i did the whole LVM encrypted / home encrypted, it never gave an option for swap..it just gave me the option to create my own partitions or let the Install do its own thing.",09:42,Psil0Cybin,"i did the whole LVM encrypted / home encrypted, it never gave an option for swap..it just gave me the option to create my own partitions or let the Install do its own thing."
1181,[09:42] <cynicallemon> Raz1: yes maybe for laptops,09:42,cynicallemon,Raz1: yes maybe for laptops
1182,[09:43] <cuddylier> Does anyone know how to apt-get install programs without it prompting for a yes/no? I need it not to for a bash script.,09:43,cuddylier,Does anyone know how to apt-get install programs without it prompting for a yes/no? I need it not to for a bash script.
1183,[09:43] <Psil0Cybin> so i clicked erase all previous partitions and do a fresh install,09:43,Psil0Cybin,so i clicked erase all previous partitions and do a fresh install
1184,[09:43] <Psil0Cybin> so i thought it would create a swap just incase...,09:43,Psil0Cybin,so i thought it would create a swap just incase...
1185,[09:43] <Psil0Cybin> like in 12.04..,09:43,Psil0Cybin,like in 12.04..
1186,"[09:43] <Raz1> cynicallemon: Especiall so, but I use it for desktops aswell in order to keep session state",09:43,Raz1,"cynicallemon: Especiall so, but I use it for desktops aswell in order to keep session state"
1187,"[09:43] <cfhowlett> Psil0Cybin, don't feel bad.  I just installed my 14.04 upgrade and manage to forget to set the swap partition.  It's present from 12.04 but I didn't assign it so = no swap.  Easily fixed thought",09:43,cfhowlett,"Psil0Cybin, don't feel bad.  I just installed my 14.04 upgrade and manage to forget to set the swap partition.  It's present from 12.04 but I didn't assign it so = no swap.  Easily fixed thought"
1188,[09:43] <Raz1> cynicallemon: No real need to shut down your system if you don't have to,09:43,Raz1,cynicallemon: No real need to shut down your system if you don't have to
1189,[09:44] <winem> cuddylier: use -y,09:44,winem,cuddylier: use -y
1190,[09:44] <cuddylier> winem: Thanks,09:44,cuddylier,winem: Thanks
1191,[09:44] <winem> this will automatically answer the question with yes and skips the prompt,09:44,winem,this will automatically answer the question with yes and skips the prompt
1192,[09:44] <devlin> what if it's installed on tablet,09:44,devlin,what if it's installed on tablet
1193,=== Pupeno_ is now known as Pupeno,,,
1194,"[09:44] <Psil0Cybin> cfhowlett, is it easy to create an encrypted swap in 14.04 and link it in? or is that not as easily fixed lol?",09:44,Psil0Cybin,"cfhowlett, is it easy to create an encrypted swap in 14.04 and link it in? or is that not as easily fixed lol?"
1195,"[09:44] <cynicallemon> Raz1: i dont worry about that on laptops anyway as i shut mine down anyway, always have",09:44,cynicallemon,"Raz1: i dont worry about that on laptops anyway as i shut mine down anyway, always have"
1196,[09:45] <smittix> Has anyone experienced boot problems when installing Nvidia drivers?,09:45,smittix,Has anyone experienced boot problems when installing Nvidia drivers?
1197,"[09:45] <cfhowlett> Psil0Cybin, all I can suggest is read the swap wiki.  I just verified that my 12.04 /swap is present, so I' need to boot a USB and then do some mtab/fstab assignments or something.  seems caveman easy ...",09:45,cfhowlett,"Psil0Cybin, all I can suggest is read the swap wiki.  I just verified that my 12.04 /swap is present, so I' need to boot a USB and then do some mtab/fstab assignments or something.  seems caveman easy ..."
1198,[09:46] <Psil0Cybin> Okay ty.,09:46,Psil0Cybin,Okay ty.
1199,[09:46] <ObrienDave> unless you're a caveman,09:46,ObrienDave,unless you're a caveman
1200,[09:46] <ObrienDave> ;P,09:46,ObrienDave,;P
1201,[09:52] <NiNou0013> irc.root-me.org:6667,09:52,NiNou0013,irc.root-me.org:6667
1202,=== stockfish is now known as winb,,,
1203,[09:54] <cuddylier> Does anyone know a fairly easy way to change a single line or a variable in a config file via bash script? All the change config things I can find on Google are extremely complicated and I'm not sure it's what I'm looking for.,09:54,cuddylier,Does anyone know a fairly easy way to change a single line or a variable in a config file via bash script? All the change config things I can find on Google are extremely complicated and I'm not sure it's what I'm looking for.
1204,"[09:55] <irgendwer4711> hello, anyone using Ubuntu 10.04 LTS with openssl/postfix, havin this error in log: ccs received early?",09:55,irgendwer4711,"hello, anyone using Ubuntu 10.04 LTS with openssl/postfix, havin this error in log: ccs received early?"
1205,[09:55] <irgendwer4711> I think openssl update 0.9.8k is damaged,09:55,irgendwer4711,I think openssl update 0.9.8k is damaged
1206,"[09:57] <cfhowlett> irgendwer4711, 10.04 server??",09:57,cfhowlett,"irgendwer4711, 10.04 server??"
1207,[09:58] <irgendwer4711> yes,09:58,irgendwer4711,yes
1208,[09:58] <irgendwer4711> 10.04.04 LTS,09:58,irgendwer4711,10.04.04 LTS
1209,"[09:58] <H4ml3t> cuddylier, can I advice you to use a Perl script?",09:58,H4ml3t,"cuddylier, can I advice you to use a Perl script?"
1210,[09:58] <irgendwer4711> cfhowlett: there seems to be a bug regression with TLS,09:58,irgendwer4711,cfhowlett: there seems to be a bug regression with TLS
1211,[09:58] <H4ml3t> is much more easy,09:58,H4ml3t,is much more easy
1212,[09:59] <cuddylier> H4ml3t Is it similar to bash in terms of simplicity for comands?,09:59,cuddylier,H4ml3t Is it similar to bash in terms of simplicity for comands?
1213,[09:59] <cuddylier> commands*,09:59,cuddylier,commands*
