,raw,timestamp,user,message
0,[02:16] <daftykins> FLCl: can you take a picture with a camera of each of your EFI setup screens and share them online?,02:16,daftykins,FLCl: can you take a picture with a camera of each of your EFI setup screens and share them online?
1,[02:16] <mitchelwb> daftykins: looks like http://paste.ubuntu.com/8041334,02:16,mitchelwb,daftykins: looks like http://paste.ubuntu.com/8041334
2,[02:16] <FLCl> when i enable uefi support,02:16,FLCl,when i enable uefi support
3,[02:16] <daftykins> mitchelwb: and can you confirm the graphics hardware from 'lspci' ?,02:16,daftykins,mitchelwb: and can you confirm the graphics hardware from 'lspci' ?
4,[02:17] <FLCl> I'm sorry what exactly is the EFI setup screen?,02:17,FLCl,I'm sorry what exactly is the EFI setup screen?
5,"[02:17] <Beldar> FLCl, So what are you going to load there to fool them, I think they are on your side basically. Booting a disc or usb is probably a user skill issue.",02:17,Beldar,"FLCl, So what are you going to load there to fool them, I think they are on your side basically. Booting a disc or usb is probably a user skill issue."
6,[02:17] <Beldar> unless it is broken,02:17,Beldar,unless it is broken
7,[02:18] <daftykins> FLCl: the setup screens you go into to configure boot mode etc etc,02:18,daftykins,FLCl: the setup screens you go into to configure boot mode etc etc
8,"[02:18] <kz> sudo: error in /etc/sudo.conf, line 0 while loading plugin `sudoers_policy'",02:18,kz,"sudo: error in /etc/sudo.conf, line 0 while loading plugin `sudoers_policy'"
9,[02:18] <kz> sudo: /usr/lib/sudo/sudoers.so must be only be writeable by owner,02:18,kz,sudo: /usr/lib/sudo/sudoers.so must be only be writeable by owner
10,"[02:18] <kz> sudo: fatal error, unable to load plugins",02:18,kz,"sudo: fatal error, unable to load plugins"
11,"[02:18] <FLCl> Okay Dafty, thank you for the help I will upload now. Give me a few mins.",02:18,FLCl,"Okay Dafty, thank you for the help I will upload now. Give me a few mins."
12,"[02:18] <daftykins> FLCl: possibly your Lenovo has a special button you press when powered off to boot and enter the setup, otherwise it's likely a key like delete, F2, F8, F10, F12... the usual",02:18,daftykins,"FLCl: possibly your Lenovo has a special button you press when powered off to boot and enter the setup, otherwise it's likely a key like delete, F2, F8, F10, F12... the usual"
13,"[02:19] <enjoi> nvm, seems to work fine with firefox, no ,desktop shortcut needed",02:19,enjoi,"nvm, seems to work fine with firefox, no ,desktop shortcut needed"
14,[02:19] <enjoi> woop woop,02:19,enjoi,woop woop
15,"[02:19] <mitchelwb> daftykins: I think the line you're looking for is: 04:00.0 VGA compatible controller: Advanced Micro Devices, Inc. [AMD/ATI] RV770 [Radeon HD 4850/4870]",02:19,mitchelwb,"daftykins: I think the line you're looking for is: 04:00.0 VGA compatible controller: Advanced Micro Devices, Inc. [AMD/ATI] RV770 [Radeon HD 4850/4870]"
16,[02:19] <enjoi> juniper vpn success on ubu 14.04 yayyyyyy,02:19,enjoi,juniper vpn success on ubu 14.04 yayyyyyy
17,[02:19] <Beldar> the manual will say FLCl key,02:19,Beldar,the manual will say FLCl key
18,[02:19] <enjoi> this makes me so so so so happy lol,02:19,enjoi,this makes me so so so so happy lol
19,[02:20] <anonymous9037611> what version?,02:20,anonymous9037611,what version?
20,[02:20] <FLCl> dafty,02:20,FLCl,dafty
21,[02:20] <FLCl> before I upload the pictures I think i should mention thast,02:20,FLCl,before I upload the pictures I think i should mention thast
22,"[02:21] <FLCl> I just noticed that after removing all the os's on this computer, and going into bios and switching to UEFI support only I now have the option to boot into USB",02:21,FLCl,"I just noticed that after removing all the os's on this computer, and going into bios and switching to UEFI support only I now have the option to boot into USB"
23,[02:21] <FLCl> but only USB,02:21,FLCl,but only USB
24,[02:21] <FLCl> nothing else is listed,02:21,FLCl,nothing else is listed
25,"[02:21] <daftykins> mitchelwb: ah-har, you've got an old 4-series card that's only supported by the legacy radeon driver now i believe.",02:21,daftykins,"mitchelwb: ah-har, you've got an old 4-series card that's only supported by the legacy radeon driver now i believe."
26,"[02:21] <antiPoP> Hi,",02:21,antiPoP,"Hi,"
27,"[02:21] <Beldar> FLCl, Hit the tab key after typing dafty to get the nick correct.",02:21,Beldar,"FLCl, Hit the tab key after typing dafty to get the nick correct."
28,[02:21] <hol> enjoi: what version of juniper vpn are you using?,02:21,hol,enjoi: what version of juniper vpn are you using?
29,=== rrrre445534 is now known as the_mighty_bogan,,,
30,[02:22] <daftykins> FLCl: USB in EFI mode?,02:22,daftykins,FLCl: USB in EFI mode?
31,"[02:22] <mitchelwb> daftykins: yeah, I think you're right... And I realized that AFTER I tried to install newer drivers today.  I tried to back it out, but apparently, I took a wrong turn at Albuquerque.",02:22,mitchelwb,"daftykins: yeah, I think you're right... And I realized that AFTER I tried to install newer drivers today.  I tried to back it out, but apparently, I took a wrong turn at Albuquerque."
32,"[02:22] <antiPoP> While updating ubuntu I got a few strange errors, I googled for tehse but I didn't got any info. Is this something I shoudl worry about? Here are the update logs: https://gist.github.com/antiPoP/d97e0d70407fb3255905",02:22,antiPoP,"While updating ubuntu I got a few strange errors, I googled for tehse but I didn't got any info. Is this something I shoudl worry about? Here are the update logs: https://gist.github.com/antiPoP/d97e0d70407fb3255905"
33,[02:22] <FLCl> daftykins:yes sir,02:22,FLCl,daftykins:yes sir
34,[02:23] <FLCl> daftykins: i will be done uploading pictures soon,02:23,FLCl,daftykins: i will be done uploading pictures soon
35,"[02:23] <wahben> Hey Ubuntuers, question: I want a specific service that managed by rc.d to execute as a specific user instead of by root.",02:23,wahben,"Hey Ubuntuers, question: I want a specific service that managed by rc.d to execute as a specific user instead of by root."
36,[02:23] <wahben> how to do?,02:23,wahben,how to do?
37,"[02:23] <daftykins> mitchelwb: whoops :D ok, i'd only be guessing which to install, i'd google for radeon legacy and 14.04 i think to see what you can do. from the log you can see it's failing then trying to use FBDEV, which isn't going to allow 3D and thus doesn't let Unity work",02:23,daftykins,"mitchelwb: whoops :D ok, i'd only be guessing which to install, i'd google for radeon legacy and 14.04 i think to see what you can do. from the log you can see it's failing then trying to use FBDEV, which isn't going to allow 3D and thus doesn't let Unity work"
38,"[02:24] <daftykins> wahben: disable it from rc.d then look if it can be executed as a user, then find the binary and run it",02:24,daftykins,"wahben: disable it from rc.d then look if it can be executed as a user, then find the binary and run it"
39,"[02:24] <wahben> daftykins: .. obviously, but I want it to run as a service when system boots, just not with root",02:24,wahben,"daftykins: .. obviously, but I want it to run as a service when system boots, just not with root"
40,"[02:25] <mitchelwb> daftykins: let me see if I can find it again.  I had it up earlier on my machine, but I'm on a different machine now so I'll have to try and relocate it.",02:25,mitchelwb,"daftykins: let me see if I can find it again.  I had it up earlier on my machine, but I'm on a different machine now so I'll have to try and relocate it."
41,[02:25] <wahben> can't you change user id in init.d script?,02:25,wahben,can't you change user id in init.d script?
42,[02:26] <daftykins> wahben: perhaps a course of action could be suggested why you're trying to do something so ass-backwards :>,02:26,daftykins> wahben: perhaps a course of action could be suggested why you're trying to do something so ass-backwards :,wahben: perhaps a course of action could be suggested why you're trying to do something so ass-backwards :>
43,[02:26] <daftykins> +if you share,02:26,daftykins,+if you share
44,[02:27] <icecube45> HOLY KITTEN!,02:27,icecube45,HOLY KITTEN!
45,[02:27] <icecube45> daftykins: no idea what I did,02:27,icecube45,daftykins: no idea what I did
46,[02:27] <icecube45> guess what's working?,02:27,icecube45,guess what's working?
47,[02:27] <daftykins> world peace!?,02:27,daftykins,world peace!?
48,[02:27] <icecube45> NO!,02:27,icecube45,NO!
49,[02:27] <icecube45> hehe,02:27,icecube45,hehe
50,[02:27] <daftykins> ;) glad to hear it,02:27,daftykins,;) glad to hear it
51,[02:27] <icecube45> streaming,02:27,icecube45,streaming
52,[02:28] <icecube45> i dont even know,02:28,icecube45,i dont even know
53,"[02:28] <wahben> meh.. nevermind, thanks for suggestion though.",02:28,wahben,"meh.. nevermind, thanks for suggestion though."
54,[02:28] <wahben> peace,02:28,wahben,peace
55,[02:28] <icecube45> Actually.. I might know what happened,02:28,icecube45,Actually.. I might know what happened
56,[02:28] <icecube45> added my user to the video group,02:28,icecube45,added my user to the video group
57,[02:28] <icecube45> haha,02:28,icecube45,haha
58,[02:28] <FLCl> daftykins: Hey sorry im taking so long its taking forever to upload. here is one of the pictures tho. This is with legacy support turned on. http://oi62.tinypic.com/2ez49rd.jpg,02:28,FLCl,daftykins: Hey sorry im taking so long its taking forever to upload. here is one of the pictures tho. This is with legacy support turned on. http://oi62.tinypic.com/2ez49rd.jpg
59,[02:29] <FLCl> daftykins: And here is with only uefi http://oi58.tinypic.com/2h4xoj5.jpg,02:29,FLCl,daftykins: And here is with only uefi http://oi58.tinypic.com/2h4xoj5.jpg
60,"[02:29] <daftykins> ah yes that's looking better, in the first",02:29,daftykins,"ah yes that's looking better, in the first"
61,"[02:29] <daftykins> oh, well in both :>",02:29,"daftykins> oh, well in both :","oh, well in both :>"
62,[02:29] <daftykins> FLCl: what's on the USB flash drive right now?,02:29,daftykins,FLCl: what's on the USB flash drive right now?
63,"[02:30] <icecube45> hey daftykins, new question. best way to run scripts upon startup?",02:30,icecube45,"hey daftykins, new question. best way to run scripts upon startup?"
64,[02:30] <daftykins> icecube45: no idea :),02:30,daftykins,icecube45: no idea :)
65,[02:30] <icecube45> good!,02:30,icecube45,good!
66,[02:30] <FLCl> currently the usb contains elementary os,02:30,FLCl,currently the usb contains elementary os
67,[02:30] <_unreal_> hello. ok I can noit shut down this computer with out it feezing and having to force shutdown. 14.04 LTS desktop,02:30,_unreal_,hello. ok I can noit shut down this computer with out it feezing and having to force shutdown. 14.04 LTS desktop
68,[02:30] <FLCl> daftykins: THE USB CONTAINS ELEMENTARY OS,02:30,FLCl,daftykins: THE USB CONTAINS ELEMENTARY OS
69,[02:30] <FLCl> daftykins:sorry for the caps,02:30,FLCl,daftykins:sorry for the caps
70,[02:30] <_unreal_> I know it froze on install on a network card driver error I believe,02:30,_unreal_,I know it froze on install on a network card driver error I believe
71,[02:30] <wafflejock> icecube45: have you typed start up in the lens,02:30,wafflejock,icecube45: have you typed start up in the lens
72,"[02:30] <daftykins> FLCl: zomg caps, my ears! ok, so you want win7 and ubuntu eventually, yes? dualboot?",02:30,daftykins,"FLCl: zomg caps, my ears! ok, so you want win7 and ubuntu eventually, yes? dualboot?"
73,[02:31] <icecube45> whatnow wafflejock?,02:31,icecube45,whatnow wafflejock?
74,[02:31] <wafflejock> icecube45: oh you mean when a streaming server starts?,02:31,wafflejock,icecube45: oh you mean when a streaming server starts?
75,[02:31] <wafflejock> icecube45: just caught the end of that conversation,02:31,wafflejock,icecube45: just caught the end of that conversation
76,"[02:31] <icecube45> no, system startup",02:31,icecube45,"no, system startup"
77,[02:31] <FLCl> daftykins: yes sir ^.^ i would like both installed under efi if possible,02:31,FLCl,daftykins: yes sir ^.^ i would like both installed under efi if possible
78,[02:31] <_unreal_> any way it searchnig any logs? that would give a clue why the  computer is feezing every time I try to shut it down,02:31,_unreal_,any way it searchnig any logs? that would give a clue why the  computer is feezing every time I try to shut it down
79,"[02:31] <wafflejock> icecube45: oh yeah so are you using a desktop environment, Unity, Gnome, KDE?",02:31,wafflejock,"icecube45: oh yeah so are you using a desktop environment, Unity, Gnome, KDE?"
80,[02:31] <daftykins> FLCl: do you have another computer?,02:31,daftykins,FLCl: do you have another computer?
81,[02:31] <icecube45> wafflejock: 14.04 server,02:31,icecube45,wafflejock: 14.04 server
82,"[02:32] <FLCl> daftykins: yes sir, I am on it currently",02:32,FLCl,"daftykins: yes sir, I am on it currently"
83,[02:32] <Panik> hey,02:32,Panik,hey
84,[02:32] <icecube45> so. no to the desktop environment,02:32,icecube45,so. no to the desktop environment
85,"[02:32] <daftykins> FLCl: ah good stuff, so you're going to want to make up that flash drive with win7 SP1 EFI bootable",02:32,daftykins,"FLCl: ah good stuff, so you're going to want to make up that flash drive with win7 SP1 EFI bootable"
86,"[02:32] <icecube45> hey Panik, whadup",02:32,icecube45,"hey Panik, whadup"
87,[02:32] <Panik> if I have to install ndiswrapper and the source pc doesnt have internet access... can i do it via windows then throw it on a usb and vala?,02:32,Panik,if I have to install ndiswrapper and the source pc doesnt have internet access... can i do it via windows then throw it on a usb and vala?
88,[02:32] <_unreal_> also TERMINAL is not giving me a command prompt. its totally blank,02:32,_unreal_,also TERMINAL is not giving me a command prompt. its totally blank
89,"[02:32] <Panik> I mean, I assume i can, just wondering if there is any probelsm with doing it that way",02:32,Panik,"I mean, I assume i can, just wondering if there is any probelsm with doing it that way"
90,"[02:33] <daftykins> FLCl: make sure that on the other setup pages, 'secure boot' is disabled if it is present",02:33,daftykins,"FLCl: make sure that on the other setup pages, 'secure boot' is disabled if it is present"
91,"[02:33] <FLCl> daftykins: Im sorry im rather noobish, how would i make it efi bootable?",02:33,FLCl,"daftykins: Im sorry im rather noobish, how would i make it efi bootable?"
92,[02:33] <wafflejock> icecube45: think you need .bashrc but ubottu has no ifno,02:33,wafflejock,icecube45: think you need .bashrc but ubottu has no ifno
93,[02:33] <wafflejock> info*,02:33,wafflejock,info*
94,[02:33] <icecube45> mm,02:33,icecube45,mm
95,[02:33] <icecube45> Can't I just drop a script into init.d?,02:33,icecube45,Can't I just drop a script into init.d?
96,[02:33] <icecube45> or init,02:33,icecube45,or init
97,[02:34] <wafflejock> icecube45: https://help.ubuntu.com/community/UbuntuBootupHowto,02:34,wafflejock,icecube45: https://help.ubuntu.com/community/UbuntuBootupHowto
98,[02:34] <_unreal_> ?,02:34,_unreal_,?
99,"[02:34] <daftykins> Panik: you can pass the .deb's over, but you should be 100% sure there's no better way before resorting to ndiswrapper",02:34,daftykins,"Panik: you can pass the .deb's over, but you should be 100% sure there's no better way before resorting to ndiswrapper"
100,"[02:34] <FLCl> daftykins: secure boot is currently disabled sir, how should i turn the Windows 7 into efi bootable",02:34,FLCl,"daftykins: secure boot is currently disabled sir, how should i turn the Windows 7 into efi bootable"
101,[02:34] <daftykins> FLCl: see PM,02:34,daftykins,FLCl: see PM
102,"[02:35] <daftykins> as we are drifting into Windows support territory right now, and here be dragons.",02:35,daftykins,"as we are drifting into Windows support territory right now, and here be dragons."
103,[02:35] <Panik> its what my manufactors is suggesting to do,02:35,Panik,its what my manufactors is suggesting to do
104,"[02:36] <daftykins> Panik: really? that's terrible, what wireless device is it?",02:36,daftykins,"Panik: really? that's terrible, what wireless device is it?"
105,[02:36] <mitchelwb> daftykins: I believe this is the correct driver  https://help.ubuntu.com/community/RadeonDriver  But the part about purging fglrx seems to be a sticking point.,02:36,mitchelwb,daftykins: I believe this is the correct driver  https://help.ubuntu.com/community/RadeonDriver  But the part about purging fglrx seems to be a sticking point.
106,"[02:37] <daftykins> mitchelwb: did you attempt to install any AMD driver from their website, or fglrx package when you were updating earlier?",02:37,daftykins,"mitchelwb: did you attempt to install any AMD driver from their website, or fglrx package when you were updating earlier?"
107,[02:37] <wafflejock> icecube45: looks like that document is a bit dated but it links to an up to date guide for the upstart cookbook,02:37,wafflejock,icecube45: looks like that document is a bit dated but it links to an up to date guide for the upstart cookbook
108,"[02:37] <mitchelwb> daftykins: the fglrx one, yes.",02:37,mitchelwb,"daftykins: the fglrx one, yes."
109,=== Guest-9800 is now known as zealotnagah,,,
110,"[02:38] <icecube45> yea, wafflejock I found rc.local",02:38,icecube45,"yea, wafflejock I found rc.local"
111,[02:38] <daftykins> mitchelwb: was that via package or download?,02:38,daftykins,mitchelwb: was that via package or download?
112,"[02:38] <Psil0Cybin> hey guys if i am backing up my home folder and am copying all the files over, do i need to access it as root on the computer to copy it? or can i just copy and paste on to the ext4 thumbdrive.",02:38,Psil0Cybin,"hey guys if i am backing up my home folder and am copying all the files over, do i need to access it as root on the computer to copy it? or can i just copy and paste on to the ext4 thumbdrive."
113,"[02:39] <daftykins> Psil0Cybin: user is fine, but ideally you'd do it from a live session so no files are locked/in use",02:39,daftykins,"Psil0Cybin: user is fine, but ideally you'd do it from a live session so no files are locked/in use"
114,[02:39] <mitchelwb> daftykins: package.  I don't have the url of the page that I got the instructions from now though.,02:39,mitchelwb,daftykins: package.  I don't have the url of the page that I got the instructions from now though.
115,"[02:39] <Psil0Cybin> daftykins, i have an encrypted home directory so i cant do it via live cd..",02:39,Psil0Cybin,"daftykins, i have an encrypted home directory so i cant do it via live cd.."
116,[02:39] <Psil0Cybin> what is the next best method?,02:39,Psil0Cybin,what is the next best method?
117,[02:39] <daftykins> you could if you then unlocked the home in the live session,02:39,daftykins,you could if you then unlocked the home in the live session
118,"[02:40] <daftykins> mitchelwb: ""dpkg -l | grep fgl | pastebinit""",02:40,daftykins,"mitchelwb: ""dpkg -l | grep fgl | pastebinit"""
119,"[02:40] <Psil0Cybin> daftykins, is there a guide on doing that? I am new, never done that before...so I dont want to make mistakes, nor i guess flood this channel; asking for basic help questions",02:40,Psil0Cybin,"daftykins, is there a guide on doing that? I am new, never done that before...so I dont want to make mistakes, nor i guess flood this channel; asking for basic help questions"
120,[02:40] <Psil0Cybin> regarding that issue,02:40,Psil0Cybin,regarding that issue
121,[02:40] <Psil0Cybin> unless its a simple process?,02:40,Psil0Cybin,unless its a simple process?
122,[02:41] <mitchelwb> daftykins: http://paste.ubuntu.com/8041484,02:41,mitchelwb,daftykins: http://paste.ubuntu.com/8041484
123,[02:41] <daftykins> Psil0Cybin: i'm too sane and un-worried about my cat pictures to use encryption,02:41,daftykins,Psil0Cybin: i'm too sane and un-worried about my cat pictures to use encryption
124,"[02:41] <daftykins> mitchelwb: yeah, ""sudo apt-get remove --purge fglrx* "" then - be sure you include that * at the end",02:41,daftykins,"mitchelwb: yeah, ""sudo apt-get remove --purge fglrx* "" then - be sure you include that * at the end"
125,"[02:44] <Nordom> Hello, I installed a package for Xen. And it had a grub file that came with it. Somehow I bugged it and caused my system to crash so I removed the grub using grub customiser. I fixed the issue and now I need that grub back. I dont know what was on the grub I deleted and guides haven't been very helpful on how to set that up. Is there some way I can remove Xen and reinstall it to get it back?",02:44,Nordom,"Hello, I installed a package for Xen. And it had a grub file that came with it. Somehow I bugged it and caused my system to crash so I removed the grub using grub customiser. I fixed the issue and now I need that grub back. I dont know what was on the grub I deleted and guides haven't been very helpful on how to set that up. Is there some way I can remove Xen and reinstall it to get it back?"
126,[02:44] <Nordom> I tried udo apt-get remove xen-hypervisor-amd64 but it didnt seem to remove it,02:44,Nordom,I tried udo apt-get remove xen-hypervisor-amd64 but it didnt seem to remove it
127,[02:44] <daftykins> sudo apt-get install --reinstall <package>,02:44,daftykins> sudo apt-get install --reinstall <package,sudo apt-get install --reinstall <package>
128,[02:44] <Nordom> Daftykins thanks I will try that,02:44,Nordom,Daftykins thanks I will try that
129,"[02:46] <Psil0Cybin> daftykins, lol, so what would i do when i boot the live CD to mount the home directory...its located in the default partition sets, so it does not have a seperate directory or anything funky yet..until I learn how to do these things of course, but....",02:46,Psil0Cybin,"daftykins, lol, so what would i do when i boot the live CD to mount the home directory...its located in the default partition sets, so it does not have a seperate directory or anything funky yet..until I learn how to do these things of course, but...."
130,[02:46] <Psil0Cybin> you suggested i can just mount the home directory and copy it via the live cd?,02:46,Psil0Cybin,you suggested i can just mount the home directory and copy it via the live cd?
131,"[02:46] <TJ-> Psil0Cybin: In the Live ISO environment, ""sudo apt-get install ecryptfs-utils"" and then ""ecryptfs-recover-private /home/$USER"". See ""man ecryptfs-recover-private"" first!",02:46,TJ-,"Psil0Cybin: In the Live ISO environment, ""sudo apt-get install ecryptfs-utils"" and then ""ecryptfs-recover-private /home/$USER"". See ""man ecryptfs-recover-private"" first!"
132,[02:47] <Psil0Cybin> Thank you TJ-.,02:47,Psil0Cybin,Thank you TJ-.
133,"[02:48] <Psil0Cybin> hmmm it keeps saying Collecting Files when I just tried to copy and paste from the home directory onto the thumb drive, sigh..lol",02:48,Psil0Cybin,"hmmm it keeps saying Collecting Files when I just tried to copy and paste from the home directory onto the thumb drive, sigh..lol"
134,[02:48] <mitchelwb> daftykins: I did purged the fglrx (that was a slightly different command from the instructions linked on the driver page) and then did a reinstall of mesa-utils and a reboot and I seem to be back in business!,02:48,mitchelwb,daftykins: I did purged the fglrx (that was a slightly different command from the instructions linked on the driver page) and then did a reinstall of mesa-utils and a reboot and I seem to be back in business!
135,[02:49] <TJ-> Psil0Cybin: Abandon the GUI and embrace the terminal shell  :),02:49,TJ-,Psil0Cybin: Abandon the GUI and embrace the terminal shell  :)
136,"[02:49] <Psil0Cybin> TJ-, nvm it worked now, and i should....I think I need to start compiling my own documents on what i do so I remember all these steps you guys tell me...its all golden!",02:49,Psil0Cybin,"TJ-, nvm it worked now, and i should....I think I need to start compiling my own documents on what i do so I remember all these steps you guys tell me...its all golden!"
137,"[02:50] <evoly> Hello! Why do i get the message ""bash: cowsay: command not found"" if i try to run cowsay as root? Cowsay as normal user works, but not as root... This is not a serious problem but i'm just curious about why this does not work.",02:50,evoly,"Hello! Why do i get the message ""bash: cowsay: command not found"" if i try to run cowsay as root? Cowsay as normal user works, but not as root... This is not a serious problem but i'm just curious about why this does not work."
138,"[02:50] <Psil0Cybin> last question how can i double check that my permissions copied over properly, i guess..just on the home directory type ls -l and then do the same in the terminal of the dir of the backup?",02:50,Psil0Cybin,"last question how can i double check that my permissions copied over properly, i guess..just on the home directory type ls -l and then do the same in the terminal of the dir of the backup?"
139,"[02:51] <Psil0Cybin> yea the GUI is telling me ""Can't copy special file""",02:51,Psil0Cybin,"yea the GUI is telling me ""Can't copy special file"""
140,[02:51] <daftykins> mitchelwb: excellent :D,02:51,daftykins,mitchelwb: excellent :D
141,"[02:51] <TJ-> Psil0Cybin: unless the copy is destined for a file-system that doesn't store POSIX/*nix permissions (such as NTFS or FAT), then permissions should be the same",02:51,TJ-,"Psil0Cybin: unless the copy is destined for a file-system that doesn't store POSIX/*nix permissions (such as NTFS or FAT), then permissions should be the same"
142,[02:52] <Psil0Cybin> okay cool,02:52,Psil0Cybin,okay cool
143,[02:52] <Psil0Cybin> yea i am using ext4. ty,02:52,Psil0Cybin,yea i am using ext4. ty
144,"[02:52] <TJ-> Psil0Cybin: ""Special files"" are usually things like FIFO pipes",02:52,TJ-,"Psil0Cybin: ""Special files"" are usually things like FIFO pipes"
145,[02:52] <Psil0Cybin> so i should be fine correct...it looked like a gnome thing anyway..,02:52,Psil0Cybin,so i should be fine correct...it looked like a gnome thing anyway..
