,raw,timestamp,user,message,file_ind
634,[15:27] <scorpion> How do I get propietary drivers on newer kernel?,15:27,scorpion, How do I get propietary drivers on newer kernel?,634
635,[15:27] <scorpion> I have a Radeon HD 7570,15:27,scorpion, I have a Radeon HD 7570,635
636,[15:27] <scorpion> ddr5 1gig,15:27,scorpion, ddr5 1gig,636
637,"[15:27] <tgm4883> scorpion: generally you don't need them, they are either supported by Radeon or AMDGPU",15:27,tgm4883," scorpion: generally you don't need them, they are either supported by Radeon or AMDGPU",637
638,"[15:27] <ioria> scorpion, sy, how can you install fglrx on zesty ?",15:27,ioria," scorpion, sy, how can you install fglrx on zesty ?",638
639,[15:27] <nacc> scorpion: you don't.,15:27,nacc, scorpion: you don't.,639
640,[15:28] <scorpion> I was only able to install fglrx on 14.04.1,15:28,scorpion, I was only able to install fglrx on 14.04.1,640
641,[15:28] <Seveas> nacc: is amdgpu foss or proprietary? Or where can I read more about this? :),15:28,Seveas, nacc: is amdgpu foss or proprietary? Or where can I read more about this? :),641
642,"[15:28] <nacc> Seveas: amdgpu is open, in the kernel",15:28,nacc," Seveas: amdgpu is open, in the kernel",642
643,[15:28] <nacc> Seveas: i believe amdgpu-pro is the proprietary equiv. but i'm no tsure,15:28,nacc, Seveas: i believe amdgpu-pro is the proprietary equiv. but i'm no tsure,643
644,"[15:28] <nacc> scorpion: yes, you can only install it on 14.04",15:28,nacc," scorpion: yes, you can only install it on 14.04",644
645,[15:28] <nacc> scorpion: if you want fglrx stay on 14.04,15:28,nacc, scorpion: if you want fglrx stay on 14.04,645
646,"[15:29] <tgm4883> amdgpu-pro is the proprietary one, although I think it just adds some features not generally needed for 3d acceleration",15:29,tgm4883," amdgpu-pro is the proprietary one, although I think it just adds some features not generally needed for 3d acceleration",646
647,[15:29] <scorpion> does the Radeon Driver provide better performance than fglrx?,15:29,scorpion, does the Radeon Driver provide better performance than fglrx?,647
648,"[15:29] <nacc> scorpion: if your hardware is working, there is no reason to use 14.04.5 v. 14.04.1 afaict",15:29,nacc," scorpion: if your hardware is working, there is no reason to use 14.04.5 v. 14.04.1 afaict",648
649,"[15:29] <tgm4883> scorpion: being the FGLRX doesn't exist anymore, yes?",15:29,tgm4883," scorpion: being the FGLRX doesn't exist anymore, yes?",649
650,[15:29] <Seveas> scorpion: did you see https://help.ubuntu.com/community/AMDGPU-PRO-Driver ?,15:29,Seveas, scorpion: did you see https://help.ubuntu.com/community/AMDGPU-PRO-Driver ?,650
651,[15:29] <nacc> scorpion: seems unlikely,15:29,nacc, scorpion: seems unlikely,651
652,[15:29] <scorpion> fglrx does exist lol,15:29,scorpion, fglrx does exist lol,652
653,"[15:30] <nacc> scorpion: no, it doesn't, not on 16.04+",15:30,nacc," scorpion: no, it doesn't, not on 16.04+",653
654,[15:30] <scorpion> i guess its just not being developed any more,15:30,scorpion, i guess its just not being developed any more,654
655,[15:30] <nacc> scorpion: it exists *for* 14.04,15:30,nacc, scorpion: it exists *for* 14.04,655
656,[15:30] <scorpion> is the open source driver gonna be able to provide any 3d performance for my card?,15:30,scorpion, is the open source driver gonna be able to provide any 3d performance for my card?,656
657,[15:31] <scorpion> sorry to ask so many questions but its not often i find people that know what they are talking about lol,15:31,scorpion, sorry to ask so many questions but its not often i find people that know what they are talking about lol,657
658,"[15:31] <nacc> scorpion: depends on the card. I believe older hardware is less well supported, but i'm not sure",15:31,nacc," scorpion: depends on the card. I believe older hardware is less well supported, but i'm not sure",658
659,"[15:31] <ioria> scorpion, yes",15:31,ioria," scorpion, yes",659
660,[15:31] <Seveas> scorpion: best way to find that out is to try it and see,15:31,Seveas, scorpion: best way to find that out is to try it and see,660
661,"[15:31] <ioria> scorpion, https://help.ubuntu.com/community/RadeonDriver",15:31,ioria," scorpion, https://help.ubuntu.com/community/RadeonDriver",661
662,"[15:32] <scorpion> i only have a 8800 GT,   an 8800 GTX , and an AMD HD 7570 ddr5",15:32,scorpion," i only have a 8800 GT,   an 8800 GTX , and an AMD HD 7570 ddr5",662
663,[15:32] <scorpion> so I don't have many choices for video card to make a light steam gaming pc,15:32,scorpion, so I don't have many choices for video card to make a light steam gaming pc,663
664,"[15:32] <Seveas> according to what I find with google, the amdgpu-pro driver (proprietary replacement for fglrx) supports the 7570",15:32,Seveas," according to what I find with google, the amdgpu-pro driver (proprietary replacement for fglrx) supports the 7570",664
665,[15:32] <Seveas> and the 8800,15:32,Seveas, and the 8800,665
666,[15:32] <Seveas> http://news.softpedia.com/news/amdgpu-pro-16-60-linux-driver-finally-adds-amd-radeon-hd-7xxx-8xxx-support-512280.shtml,15:32,Seveas, http://news.softpedia.com/news/amdgpu-pro-16-60-linux-driver-finally-adds-amd-radeon-hd-7xxx-8xxx-support-512280.shtml,666
667,[15:33] <scorpion> oh wait I have nvidia 610 as well muahah,15:33,scorpion, oh wait I have nvidia 610 as well muahah,667
668,[15:33] <scorpion> gt 610,15:33,scorpion, gt 610,668
669,"[15:33] <ioria> scorpion, ah",15:33,ioria," scorpion, ah",669
670,"[15:33] <Xtreme> hello, Got a odd and challenging question. Kinda betting you guys never faced this one before.",15:33,Xtreme," hello, Got a odd and challenging question. Kinda betting you guys never faced this one before.",670
671,[15:33] <scorpion> i have an ati x800 aswell,15:33,scorpion, i have an ati x800 aswell,671
672,[15:34] <scorpion> whats up Xtreme?,15:34,scorpion, whats up Xtreme?,672
673,"[15:34] <Xtreme> I want to set up two login passwords for my user account. No, not ""wither one or another"", but both. Like 2fa but with password",15:34,Xtreme," I want to set up two login passwords for my user account. No, not ""wither one or another"", but both. Like 2fa but with password",673
674,[15:34] <scorpion> hmmmmmmmm,15:34,scorpion, hmmmmmmmm,674
675,[15:34] <Seveas> Xtreme: I have in fact implemented such a thing the other day....,15:34,Seveas, Xtreme: I have in fact implemented such a thing the other day....,675
676,"[15:34] <Xtreme> Like, you login with password a, then it asks again, where you have to enter password b.",15:34,Xtreme," Like, you login with password a, then it asks again, where you have to enter password b.",676
677,[15:34] <scorpion> giving your best friend access to your porn collection?,15:34,scorpion, giving your best friend access to your porn collection?,677
678,"[15:34] <plshelps> need help to setup my keyboard after user remove, apreciatcha!",15:34,plshelps," need help to setup my keyboard after user remove, apreciatcha!",678
679,"[15:34] <Seveas> Xtreme: so, you lost your bet :)",15:34,Seveas," Xtreme: so, you lost your bet :)",679
680,"[15:34] <ChaiTRex> scorpion: No, both are required to log in, not either.",15:34,ChaiTRex," scorpion: No, both are required to log in, not either.",680
681,"[15:34] <Xtreme> scorpion, exactly the opposite.",15:34,Xtreme," scorpion, exactly the opposite.",681
682,[15:35] <scorpion> what are you trying to do because I bet there is a better solution you haven't thought of yet Xtreme,15:35,scorpion, what are you trying to do because I bet there is a better solution you haven't thought of yet Xtreme,682
683,"[15:35] <pynki> Xtreme: easy. just reimplement ""login""",15:35,pynki," Xtreme: easy. just reimplement ""login""",683
684,"[15:35] <Xtreme> scorpion, its a + b",15:35,Xtreme," scorpion, its a + b",684
685,"[15:35] <Xtreme> Seveas, i am happy and sad.",15:35,Xtreme," Seveas, i am happy and sad.",685
686,[15:35] <Xtreme> How you did that?,15:35,Xtreme, How you did that?,686
687,[15:35] <Seveas> pam magic,15:35,Seveas, pam magic,687
688,"[15:35] <Xtreme> pynki, explain please",15:35,Xtreme," pynki, explain please",688
689,[15:36] <Seveas> Xtreme: have you ever played with pam configurations?,15:36,Seveas, Xtreme: have you ever played with pam configurations?,689
690,[15:36] <scorpion> you guys should check out Jitsi,15:36,scorpion, you guys should check out Jitsi,690
691,"[15:36] <Xtreme> Seveas, yeah.",15:36,Xtreme," Seveas, yeah.",691
692,[15:36] <Xtreme> Implemented 2fa with the same. but google authenticator.,15:36,Xtreme, Implemented 2fa with the same. but google authenticator.,692
693,[15:36] <ChaiTRex> Jitsi was ugly last time I saw it.,15:36,ChaiTRex, Jitsi was ugly last time I saw it.,693
694,"[15:36] <scorpion> it lets you give a small url to people that you can goto to share your screen, whiteboard, and skype like functionalitym, with NO LOGINS",15:36,scorpion," it lets you give a small url to people that you can goto to share your screen, whiteboard, and skype like functionalitym, with NO LOGINS",694
695,[15:36] <Xtreme> was tinkering it a bit so it only asks for few things and not for others.,15:36,Xtreme, was tinkering it a bit so it only asks for few things and not for others.,695
696,=== jamie_2 is now known as jamie_1,,,,696
697,[15:37] <scorpion> jitsi is amazing now,15:37,scorpion, jitsi is amazing now,697
698,[15:37] <Seveas> Xtreme: good. Then I'll just say pam_extrausers :) have a required on pam_unix and (for select users on pam_extrausers),15:37,Seveas, Xtreme: good. Then I'll just say pam_extrausers :) have a required on pam_unix and (for select users on pam_extrausers),698
699,"[15:37] <scorpion> and being able to put it on your own webserver, or even host with your linux box, is freaking awesome",15:37,scorpion," and being able to put it on your own webserver, or even host with your linux box, is freaking awesome",699
700,"[15:37] <riidom> how can I figure out where evince is installed, please? I need to point another application towards it",15:37,riidom," how can I figure out where evince is installed, please? I need to point another application towards it",700
701,[15:37] <scorpion> jitsi did alot of bug fixes and stablization over the last year,15:37,scorpion, jitsi did alot of bug fixes and stablization over the last year,701
702,"[15:37] <s_kilk> I've got this weird issue that's started in the last few days (16.04), the gnome keyring doesn't unlock on login anymore. Meaning ssh, chromium etc, will prompt for keyring unlock on first use. Anyone any idea why that would be?",15:37,s_kilk," I've got this weird issue that's started in the last few days (16.04), the gnome keyring doesn't unlock on login anymore. Meaning ssh, chromium etc, will prompt for keyring unlock on first use. Anyone any idea why that would be?",702
703,"[15:38] <Xtreme> Seveas, thank you. Looking into it.",15:38,Xtreme," Seveas, thank you. Looking into it.",703
704,[15:38] <Seveas> Xtreme: I'll leave the problem of how to populate /var/lib/extrausers/ as an exercise for the reader...,15:38,Seveas, Xtreme: I'll leave the problem of how to populate /var/lib/extrausers/ as an exercise for the reader...,704
705,[15:38] <ChaiTRex> riidom: Run `which evince`,15:38,ChaiTRex, riidom: Run `which evince`,705
706,"[15:38] <pynki> Xtreme, https://github.com/shadow-maint/shadow this should be the source code for user login - just add your needs",15:38,pynki," Xtreme, https://github.com/shadow-maint/shadow this should be the source code for user login - just add your needs",706
707,"[15:38] <scorpion> okay guys.    power users, whats your partition scheme for installing??  which directories do you give their own partition on the HDD and how big?",15:38,scorpion," okay guys.    power users, whats your partition scheme for installing??  which directories do you give their own partition on the HDD and how big?",707
708,[15:38] <Xtreme> But just to make sure we both understood each other correctly. we are talking about a + b and not a or b.,15:38,Xtreme, But just to make sure we both understood each other correctly. we are talking about a + b and not a or b.,708
709,[15:38] <riidom> ty ChaiTRex,15:38,riidom, ty ChaiTRex,709
710,"[15:38] <Xtreme> pynki, taking a look at it as well.",15:38,Xtreme," pynki, taking a look at it as well.",710
711,[15:38] <Seveas> pynki: that's entirely unnecessary. pam lets you do this without any code modifications.,15:38,Seveas, pynki: that's entirely unnecessary. pam lets you do this without any code modifications.,711
712,[15:38] <ChaiTRex> scorpion: One big partition and a small one for swap.,15:38,ChaiTRex, scorpion: One big partition and a small one for swap.,712
713,[15:39] <scorpion> really?,15:39,scorpion, really?,713
714,[15:39] <scorpion> no /boot  no /tmp,15:39,scorpion, no /boot  no /tmp,714
715,[15:39] <tgm4883> scorpion: don't poll the channel,15:39,tgm4883, scorpion: don't poll the channel,715
716,"[15:39] <ChaiTRex> scorpion: That way, there's no worries about filling one of many up and having to resize.",15:39,ChaiTRex," scorpion: That way, there's no worries about filling one of many up and having to resize.",716
717,[15:39] <Seveas> !poll,15:39,Seveas, !poll,717
718,[15:39] <scorpion> what about /var,15:39,scorpion, what about /var,718
719,[15:39] <ChaiTRex> scorpion: I have /tmp in RAM.,15:39,ChaiTRex, scorpion: I have /tmp in RAM.,719
720,[15:39] <tgm4883> scorpion: one / one SWAP,15:39,tgm4883, scorpion: one / one SWAP,720
721,[15:39] <scorpion> ohhhh I was wondering how to do that,15:39,scorpion, ohhhh I was wondering how to do that,721
722,[15:39] <Seveas> scorpion: there is no such thing as an optimal partition scheme. Depends on the use case.,15:39,Seveas, scorpion: there is no such thing as an optimal partition scheme. Depends on the use case.,722
723,[15:39] <scorpion> i heard about that,15:39,scorpion, i heard about that,723
724,"[15:39] <ChaiTRex> scorpion: Ahh, yes, for UEFI, I have /boot/efi or something on a separate partition.",15:39,ChaiTRex," scorpion: Ahh, yes, for UEFI, I have /boot/efi or something on a separate partition.",724
725,"[15:39] <ioria> scorpion, have you already tried that  HD 7570 on zesty ?",15:39,ioria," scorpion, have you already tried that  HD 7570 on zesty ?",725
726,"[15:40] <scorpion> sorry to poll, but NO one i've ever met in real life uses linux so when I find you guys im going to ask questions",15:40,scorpion," sorry to poll, but NO one i've ever met in real life uses linux so when I find you guys im going to ask questions",726
727,[15:40] <Seveas> e.g. I have everything except /boot as encrypted lvm. But on most of my servers I don't.,15:40,Seveas, e.g. I have everything except /boot as encrypted lvm. But on most of my servers I don't.,727
728,"[15:40] <ChaiTRex> scorpion: If you have a lot of RAM, `tmpfs /tmp tmpfs defaults,noatime,nosuid,nodev,mode=1777 0 0` in /etc/fstab",15:40,ChaiTRex," scorpion: If you have a lot of RAM, `tmpfs /tmp tmpfs defaults,noatime,nosuid,nodev,mode=1777 0 0` in /etc/fstab",728
729,"[15:40] <Xtreme> Seveas, I hope the answer to my question is yes. Now if i understood extrausers correctly, the steps are.",15:40,Xtreme," Seveas, I hope the answer to my question is yes. Now if i understood extrausers correctly, the steps are.",729
730,"[15:40] <ChaiTRex> scorpion: Then, boot to single user mode, erase everything in /tmp (don't delete /tmp itself, though).",15:40,ChaiTRex," scorpion: Then, boot to single user mode, erase everything in /tmp (don't delete /tmp itself, though).",730
731,[15:40] <scorpion> does that mean that ALL temp files in the whole system get funneled through that ram disk?,15:40,scorpion, does that mean that ALL temp files in the whole system get funneled through that ram disk?,731
732,[15:41] <Xtreme> 1: create /var/lib/extrausers/passwd and /var/lib/extrausers/shadow and copy set up second password there.,15:41,Xtreme, 1: create /var/lib/extrausers/passwd and /var/lib/extrausers/shadow and copy set up second password there.,732
733,"[15:41] <ChaiTRex> scorpion: No, most things don't use /tmp. Like browser caches are in ~/.cache.",15:41,ChaiTRex," scorpion: No, most things don't use /tmp. Like browser caches are in ~/.cache.",733
734,[15:41] <Xtreme> 2: modify my pam.d/x file and set it up as another authenticator parameter,15:41,Xtreme, 2: modify my pam.d/x file and set it up as another authenticator parameter,734
735,[15:41] <Xtreme> right?,15:41,Xtreme, right?,735
736,[15:41] <Seveas> correct,15:41,Seveas, correct,736
737,[15:41] <ChaiTRex> scorpion: /tmp isn't used all that much these days.,15:41,ChaiTRex, scorpion: /tmp isn't used all that much these days.,737
738,[15:42] <scorpion> okay then maybe what I'm thinking of is maybe making a partition on my ssd that acts as a buffer for my spinny hd,15:42,scorpion, okay then maybe what I'm thinking of is maybe making a partition on my ssd that acts as a buffer for my spinny hd,738
739,[15:42] <mikecmpbll> how can i start a user service (systemd) as root?,15:42,mikecmpbll, how can i start a user service (systemd) as root?,739
740,[15:42] <scorpion> would that offer any performanfce benifit?,15:42,scorpion, would that offer any performanfce benifit?,740
741,"[15:42] <Seveas> I'd do something like: auth required pam_unix.so ; auth [success=ok, default=ignore] pam_succeed_if.so use_uid uid > 1000; auth required pam_extrausers.so",15:42,Seveas, 1000; auth required pam_extrausers.so,741
742,[15:42] <ChaiTRex> mikecmpbll: Usually `sudo service whatever start`,15:42,ChaiTRex, mikecmpbll: Usually `sudo service whatever start`,742
743,[15:42] <Seveas> Xtreme: that way the extra passowrd only applies to 'normal' users and you have root as an escape hatch if you screw up :),15:42,Seveas, Xtreme: that way the extra passowrd only applies to 'normal' users and you have root as an escape hatch if you screw up :),743
744,"[15:43] <ChaiTRex> scorpion: Yes, if the caching is done well. I'm not sure how to set that up, though.",15:43,ChaiTRex," scorpion: Yes, if the caching is done well. I'm not sure how to set that up, though.",744
745,"[15:43] <mikecmpbll> ChaiTRex : says not found. i can use `systemctl --user ...` as the user, but when i `sudo su` to root, i can't interact with it",15:43,mikecmpbll," ChaiTRex : says not found. i can use `systemctl --user ...` as the user, but when i `sudo su` to root, i can't interact with it",745
746,[15:43] <Xtreme> But that you will do in common auth,15:43,Xtreme, But that you will do in common auth,746
747,"[15:44] <ChaiTRex> mikecmpbll: Sorry, not sure then.",15:44,ChaiTRex," mikecmpbll: Sorry, not sure then.",747
748,[15:44] <Xtreme> which sudo will also inherit.,15:44,Xtreme, which sudo will also inherit.,748
749,"[15:44] <Seveas> Xtreme: depends on where you want this. Could be in common-auth, could be in sshd...",15:44,Seveas," Xtreme: depends on where you want this. Could be in common-auth, could be in sshd...",749
750,"[15:44] <Xtreme> so maybe, i should do that for mdm & login",15:44,Xtreme," so maybe, i should do that for mdm & login",750
751,[15:44] <Seveas> I generally only care about sshd when I do this kind of config,15:44,Seveas, I generally only care about sshd when I do this kind of config,751
752,"[15:45] <mikecmpbll> if i try sudo su - deploy -c 'systemctl --user ...' i get ""Failed to connect to bus: No such file or directory""",15:45,mikecmpbll," if i try sudo su - deploy -c 'systemctl --user ...' i get ""Failed to connect to bus: No such file or directory""",752
753,"[15:45] <Xtreme> btw, i think my root login is disabled. How can i be 100% sure about it?",15:45,Xtreme," btw, i think my root login is disabled. How can i be 100% sure about it?",753
754,[15:45] <Seveas> try logging in as root :),15:45,Seveas, try logging in as root :),754
755,[15:45] <Xtreme> lol,15:45,Xtreme, lol,755
756,[15:45] <scorpion> man it seems like left 4 dead 2 stutters no matter whether I play it on my 16 core Ryzen 1700x or my 4 core q9450 core 2 quad,15:45,scorpion, man it seems like left 4 dead 2 stutters no matter whether I play it on my 16 core Ryzen 1700x or my 4 core q9450 core 2 quad,756
757,[15:46] <scorpion> whether i use rx 480 or this crappy hd 7570.   stutters on literally every os and hardware I have,15:46,scorpion, whether i use rx 480 or this crappy hd 7570.   stutters on literally every os and hardware I have,757
758,"[15:46] <ChaiTRex> Xtreme: sudo cat /etc/shadow, see if the `root` line starts with `root:!`",15:46,ChaiTRex," Xtreme: sudo cat /etc/shadow, see if the `root` line starts with `root:!`",758
759,"[15:47] <akik> mikecmpbll: maybe compare the ""env"" when the user service works and when it doesn't (sudo su - user)",15:47,akik," mikecmpbll: maybe compare the ""env"" when the user service works and when it doesn't (sudo su - user)",759
760,"[15:47] <Xtreme> ChaiTRex, yes there is. and Yes, its not disabled.. Will removing that line disable login completely?",15:47,Xtreme," ChaiTRex, yes there is. and Yes, its not disabled.. Will removing that line disable login completely?",760
761,"[15:47] <mikecmpbll> akik : good idea, thanks i'll check that out",15:47,mikecmpbll," akik : good idea, thanks i'll check that out",761
762,[15:47] <ChaiTRex> Xtreme: Do not remove that line. The system depends on it.,15:47,ChaiTRex, Xtreme: Do not remove that line. The system depends on it.,762
763,[15:47] <Xtreme> LOL. good i asked,15:47,Xtreme, LOL. good i asked,763
764,[15:47] <Xtreme> :D,15:47,Xtreme, :D,764
765,[15:48] <ChaiTRex> Xtreme: The ! means it's disabled.,15:48,ChaiTRex, Xtreme: The ! means it's disabled.,765
766,"[15:48] <Xtreme> scorpion, isnt that 8 core cpu?",15:48,Xtreme," scorpion, isnt that 8 core cpu?",766
767,[15:48] <ChaiTRex> Xtreme: According to `man passwd`.,15:48,ChaiTRex, Xtreme: According to `man passwd`.,767
768,[15:48] <ChaiTRex> Xtreme: See the `-l` option there.,15:48,ChaiTRex, Xtreme: See the `-l` option there.,768
769,"[15:48] <Xtreme> aah okay. so yes, it has that line, but it doesnt have !",15:48,Xtreme," aah okay. so yes, it has that line, but it doesnt have !",769
770,"[15:49] <ChaiTRex> Xtreme: Without the !, the account is enabled.",15:49,ChaiTRex," Xtreme: Without the !, the account is enabled.",770
771,=== virtualriot is now known as sweetheart,,,,771
772,[15:49] <Xtreme> okay. so adding ! first.,15:49,Xtreme, okay. so adding ! first.,772
773,[15:49] <Seveas> Xtreme: does it look like this: root:$6$U42VdWnf$u499wMz4......,15:49,Seveas, Xtreme: does it look like this: root:$6$U42VdWnf$u499wMz4......,773
774,[15:49] <ChaiTRex> Xtreme: You can use `sudo passwd -l root` to lock it.,15:49,ChaiTRex, Xtreme: You can use `sudo passwd -l root` to lock it.,774
775,[15:49] <Seveas> don't manually edit the file please,15:49,Seveas, don't manually edit the file please,775
776,[15:49] <ChaiTRex> Xtreme: Don't edit /etc/shadow directly.,15:49,ChaiTRex, Xtreme: Don't edit /etc/shadow directly.,776
777,[15:50] <Seveas> too easy to make mistake :),15:50,Seveas, too easy to make mistake :),777
778,"[15:50] <ChaiTRex> Xtreme: If you screw up, it can screw things up.",15:50,ChaiTRex," Xtreme: If you screw up, it can screw things up.",778
779,[15:50] <Xtreme> okay :) Thanks. I used the passwd -l,15:50,Xtreme, okay :) Thanks. I used the passwd -l,779
780,[15:50] <undil> hiiiy,15:50,undil, hiiiy,780
781,[15:50] <ChaiTRex> Xtreme: Is there now a !?,15:50,ChaiTRex, Xtreme: Is there now a !?,781
782,"[15:51] <Xtreme> Seveas, yes it was that way first. ChaiTRex Yup, now it has !",15:51,Xtreme," Seveas, yes it was that way first. ChaiTRex Yup, now it has !",782
783,"[15:51] <ChaiTRex> Xtreme: OK, you're good now :)",15:51,ChaiTRex," Xtreme: OK, you're good now :)",783
784,[15:51] <tgm4883> scorpion: I don't recall stuttering issues when I was playing that on my older boxes. I recall having many issues on 16.04 with my RX480 (which I got rid of) so you might try 17.04 with it now,15:51,tgm4883, scorpion: I don't recall stuttering issues when I was playing that on my older boxes. I recall having many issues on 16.04 with my RX480 (which I got rid of) so you might try 17.04 with it now,784
785,"[15:51] <Xtreme> and i like the ""This option disables a password by changing it to a value which matches no possible encrypted value"" part.",15:51,Xtreme," and i like the ""This option disables a password by changing it to a value which matches no possible encrypted value"" part.",785
786,[15:51] <tgm4883> or you could just stop buying AMD,15:51,tgm4883, or you could just stop buying AMD,786
787,[15:51] <Xtreme> interesting,15:51,Xtreme, interesting,787
788,"[15:52] <Xtreme> tgm4883, AMD is not BAD.",15:52,Xtreme," tgm4883, AMD is not BAD.",788
789,[15:52] <scorpion> @tgm4883  What driver were you using for the rx 480,15:52,scorpion, @tgm4883  What driver were you using for the rx 480,789
790,[15:52] <Seveas> merely evil,15:52,Seveas, merely evil,790
791,[15:52] <tgm4883> scorpion: I tried both AMDGPU and AMDGPU-PRO,15:52,tgm4883, scorpion: I tried both AMDGPU and AMDGPU-PRO,791
792,[15:52] <scorpion> AMD at least makes an attempt to be part of the linux and open source community,15:52,scorpion, AMD at least makes an attempt to be part of the linux and open source community,792
793,"[15:53] <tgm4883> Xtreme: in theory, no they aren't.",15:53,tgm4883," Xtreme: in theory, no they aren't.",793
794,[15:53] <scorpion> nvidia doesn't care for us at all,15:53,scorpion, nvidia doesn't care for us at all,794
795,[15:53] <Xtreme> I have around 12 AMD FX8 systems. and they beat the other Intel systems any given time. (got around 16 intel systems),15:53,Xtreme, I have around 12 AMD FX8 systems. and they beat the other Intel systems any given time. (got around 16 intel systems),795
796,=== zwischenzug2 is now known as zwischenzug,,,,796
