,raw,timestamp,user,message,file_ind
315,[13:52] <acresearch> pynki: so what are the differences  (in general),13:52,acresearch, pynki: so what are the differences  (in general),315
316,"[13:53] <pynki> acresearch, the software you install come from different places/people",13:53,pynki," acresearch, the software you install come from different places/people",316
317,"[13:54] <pynki> like pizza, kinda the same everywhere...",13:54,pynki," like pizza, kinda the same everywhere...",317
318,"[13:54] <acresearch> pynki: yeh i get that, but in term of performance, i mean i have a server and i have ubuntu on it, but there are many different options including debian, i chose ubuntu becuase i know ubuntu, why would someone choose debian or another distro in a server environment",13:54,acresearch," pynki: yeh i get that, but in term of performance, i mean i have a server and i have ubuntu on it, but there are many different options including debian, i chose ubuntu becuase i know ubuntu, why would someone choose debian or another distro in a server environment",318
319,[13:55] <Sparrow__> speed,13:55,Sparrow__, speed,319
320,[13:55] <pynki> ideology,13:55,pynki, ideology,320
321,=== zzz is now known as Guest58375,,,,321
322,[13:56] <pynki> the firefox name is trademarked... you wont find it in debian,13:56,pynki, the firefox name is trademarked... you wont find it in debian,322
323,[13:56] <pynki> just to give an example,13:56,pynki, just to give an example,323
324,"[13:56] <ducasse> acresearch: personal preference, which ecosystem they know better",13:56,ducasse," acresearch: personal preference, which ecosystem they know better",324
325,[13:56] <ducasse> just to give another,13:56,ducasse, just to give another,325
326,[13:56] <acresearch> ducasse: hmmm,13:56,acresearch, ducasse: hmmm,326
327,"[13:57] <pynki> ubuntu server brings a lot of stuff you wont need. a headless debian install is way ""cleaner"" in my eyes",13:57,pynki," ubuntu server brings a lot of stuff you wont need. a headless debian install is way ""cleaner"" in my eyes",327
328,[13:58] <acresearch> pynki: oh,13:58,acresearch, pynki: oh,328
329,"[13:58] <BluesKaj> well, most users don't do headless",13:58,BluesKaj," well, most users don't do headless",329
330,[13:58] <acresearch> but it still has this issue with su and sudo and you cannot install propriety software correct?,13:58,acresearch, but it still has this issue with su and sudo and you cannot install propriety software correct?,330
331,"[13:58] <marcarrelus> Hi, VLC 2.2.4 should have by default a HEVC decoder, right? I'm trying to play a h265 video but VLC just results in a black screen. I used ppa:strukturag/libde265 in the past, but it seems that there is no support anymore for later releases (I'm on zesty).",13:58,marcarrelus," Hi, VLC 2.2.4 should have by default a HEVC decoder, right? I'm trying to play a h265 video but VLC just results in a black screen. I used ppa:strukturag/libde265 in the past, but it seems that there is no support anymore for later releases (I'm on zesty).",331
332,"[13:59] <captainfixerpc14> acresearch,  Debian has root account enabled by default, but can be configured to use sudo",13:59,captainfixerpc14," acresearch,  Debian has root account enabled by default, but can be configured to use sudo",332
333,"[13:59] <pynki> acresearch, you can install whatever you want on a debian system. they will not bring packets for software that is non-free of any kind",13:59,pynki," acresearch, you can install whatever you want on a debian system. they will not bring packets for software that is non-free of any kind",333
334,[14:00] <acresearch> pynki: i see,14:00,acresearch, pynki: i see,334
335,[14:00] <acresearch> i think i undertsand now :-),14:00,acresearch, i think i undertsand now :-),335
336,[14:00] <Sparrow__> !su,14:00,Sparrow__, !su,336
337,"[14:00] <ubottu> sudo is a command to run command-line programs with superuser privileges (""root"") (also see !cli). Look at https://help.ubuntu.com/community/RootSudo for more information. For graphical applications see !pkexec (for older releases: !gksu and !kdesudo). If you're unable to execute commands with sudo see: http://www.psychocats.net/ubuntu/fixsudo",14:00,ubottu," sudo is a command to run command-line programs with superuser privileges (""root"") (also see !cli). Look at https://help.ubuntu.com/community/RootSudo for more information. For graphical applications see !pkexec (for older releases: !gksu and !kdesudo). If you're unable to execute commands with sudo see: http://www.psychocats.net/ubuntu/fixsudo",337
338,[14:01] <Sparrow__> That was for my own benefit guys,14:01,Sparrow__, That was for my own benefit guys,338
339,"[14:01] <ducasse> marcarrelus: vlc plays h265 just fine here on 17.04, i've not done anything other than installing it afaicr",14:01,ducasse," marcarrelus: vlc plays h265 just fine here on 17.04, i've not done anything other than installing it afaicr",339
340,"[14:01] <marcarrelus> aha, Gnome videos can decode it. iirc this uses gstreamer under the hood, so I guess there the plugins are correctly installed.",14:01,marcarrelus," aha, Gnome videos can decode it. iirc this uses gstreamer under the hood, so I guess there the plugins are correctly installed.",340
341,"[14:02] <marcarrelus> perhaps there is something special about the stream. It is related to a video course, so I wouldn't be surprised about it. Thanks :)",14:02,marcarrelus," perhaps there is something special about the stream. It is related to a video course, so I wouldn't be surprised about it. Thanks :)",341
342,"[14:03] <BluesKaj> marcarrelus,  make sure you have libde265-0 installed",14:03,BluesKaj," marcarrelus,  make sure you have libde265-0 installed",342
343,[14:03] <Alby_Fox> If I wanted to change the default behavior of the alt+tab function in the default wm of ubuntu 16.04 is there a straightforward path to doing so?,14:03,Alby_Fox, If I wanted to change the default behavior of the alt+tab function in the default wm of ubuntu 16.04 is there a straightforward path to doing so?,343
344,[14:03] <pynki> is there a reason to keep the ~/Desktop folder in a fluxbox install?,14:03,pynki, is there a reason to keep the ~/Desktop folder in a fluxbox install?,344
345,[14:04] <Georgies> Hello. For some reason I cannot apt-get update now on my Ubuntu Server yakkety,14:04,Georgies, Hello. For some reason I cannot apt-get update now on my Ubuntu Server yakkety,345
346,"[14:04] <marcarrelus> BluesKaj: already installed, but thanks. I can continue with gnome videos, so no problem anymore :)",14:04,marcarrelus," BluesKaj: already installed, but thanks. I can continue with gnome videos, so no problem anymore :)",346
347,[14:05] <Georgies> http://paste.ubuntu.com/24543037/ is my issue,14:05,Georgies, http://paste.ubuntu.com/24543037/ is my issue,347
348,[14:06] <Georgies> I believe it's 16.10,14:06,Georgies, I believe it's 16.10,348
349,"[14:06] <ducasse> pynki: i can't think of any, i nuked mine ages ago with no ill effects so far :)",14:06,ducasse," pynki: i can't think of any, i nuked mine ages ago with no ill effects so far :)",349
350,[14:07]  * pynki nukes Desktop folders,14:07,,,350
351,"[14:08] <ducasse> pynki: if you want to execute .desktop files and/or get the xdg autostart stuff, check out 'dex'",14:08,ducasse," pynki: if you want to execute .desktop files and/or get the xdg autostart stuff, check out 'dex'",351
352,[14:09] <ducasse> (rofi is also good for running .desktop stuff),14:09,ducasse, (rofi is also good for running .desktop stuff),352
353,"[14:09] <LampLovin> just joined the channel, but how does rofi compare to alfred for macos?",14:09,LampLovin," just joined the channel, but how does rofi compare to alfred for macos?",353
354,"[14:10] <ducasse> LampLovin: rofi is a pretty bare-bones launcher, but very extensible",14:10,ducasse," LampLovin: rofi is a pretty bare-bones launcher, but very extensible",354
355,"[14:10] <LampLovin> so it's more on par with spotlight? i know, lots of mac references, but that's what i'm used to",14:10,LampLovin," so it's more on par with spotlight? i know, lots of mac references, but that's what i'm used to",355
356,"[14:10] <pynki> ducasse, no need of fancy stuff. just a desktop to put a terminator window with a specific layout as ""background"" and i am fine...",14:10,pynki," ducasse, no need of fancy stuff. just a desktop to put a terminator window with a specific layout as ""background"" and i am fine...",356
357,"[14:11] <mikhael_k33hl> I've installed Ubuntu on an encrypted partition (LUKS/LVM2), is there any other things I need to configure after the GUI installation? or is everything gets taken care of?",14:11,mikhael_k33hl," I've installed Ubuntu on an encrypted partition (LUKS/LVM2), is there any other things I need to configure after the GUI installation? or is everything gets taken care of?",357
358,"[14:12] <pynki> ducasse, and a, in my case shft+space, keycombo to get the menu ;)",14:12,pynki," ducasse, and a, in my case shft+space, keycombo to get the menu ;)",358
359,"[14:12] <ducasse> LampLovin: don't have a mac, so no clue really.",14:12,ducasse," LampLovin: don't have a mac, so no clue really.",359
360,"[14:13] <pynki> mikhael_k33hl, the standard encryption from the installer?",14:13,pynki," mikhael_k33hl, the standard encryption from the installer?",360
361,[14:13] <ducasse> pynki: rofi is my menu :),14:13,ducasse, pynki: rofi is my menu :),361
362,[14:13] <mikhael_k33hl> pynki: Nope I did it via terminal cryptsetuyp,14:13,mikhael_k33hl, pynki: Nope I did it via terminal cryptsetuyp,362
363,"[14:13] <LampLovin> ducasse: no problem, thanks",14:13,LampLovin," ducasse: no problem, thanks",363
364,[14:15] <Georgies> Can someone help my issue out/,14:15,Georgies, Can someone help my issue out/,364
365,"[14:15] <ducasse> LampLovin: it's just a simple way to run commands, .desktop files, open ssh connections or select windows by default, but you can make it do a lot more with scripts",14:15,ducasse," LampLovin: it's just a simple way to run commands, .desktop files, open ssh connections or select windows by default, but you can make it do a lot more with scripts",365
366,[14:15] <Georgies> http://paste.ubuntu.com/24543037/ is my issue,14:15,Georgies, http://paste.ubuntu.com/24543037/ is my issue,366
367,[14:15] <ducasse> Georgies: has this been happening for long?,14:15,ducasse, Georgies: has this been happening for long?,367
368,[14:15] <Georgies> No,14:15,Georgies, No,368
369,[14:15] <Georgies> Just happened this morning,14:15,Georgies, Just happened this morning,369
370,[14:16] <Georgies> When I woke up I noticed it,14:16,Georgies, When I woke up I noticed it,370
371,[14:16] <Georgies> Yesterday it worked fine,14:16,Georgies, Yesterday it worked fine,371
372,[14:16] <Georgies> Could it just be my dns servers?,14:16,Georgies, Could it just be my dns servers?,372
373,"[14:16] <pynki> Georgies, can ping the ip?",14:16,pynki," Georgies, can ping the ip?",373
374,"[14:17] <pynki> sure you can, sorry, gettin a 404..",14:17,pynki," sure you can, sorry, gettin a 404..",374
375,[14:17] <Georgies> PING ppa.launchpad.net (91.189.95.83) 56(84) bytes of data. 64 bytes from haetae.canonical.com (91.189.95.83): icmp_seq=1 ttl=54 time=16.1 ms,14:17,Georgies, PING ppa.launchpad.net (91.189.95.83) 56(84) bytes of data. 64 bytes from haetae.canonical.com (91.189.95.83): icmp_seq=1 ttl=54 time=16.1 ms,375
376,[14:17] <Georgies> So yes,14:17,Georgies, So yes,376
377,[14:17] <Georgies> Hmm,14:17,Georgies, Hmm,377
378,[14:18] <pynki> and the release fiel is there :/,14:18,pynki, and the release fiel is there :/,378
379,[14:18] <pynki> apt-get clean @Georgies,14:18,pynki, apt-get clean @Georgies,379
380,[14:18] <pynki> thatchanges anything?,14:18,pynki, thatchanges anything?,380
381,[14:18] <Georgies> Let me try it,14:18,Georgies, Let me try it,381
382,[14:19] <Georgies> Changed nothing,14:19,Georgies, Changed nothing,382
383,[14:19] <Georgies> :(,14:19,Georgies, :(,383
384,[14:19] <Georgies> I did apt-get update after,14:19,Georgies, I did apt-get update after,384
385,"[14:19] <ducasse> Georgies: it looks a lot like a temporary error, i've seen similar things before",14:19,ducasse," Georgies: it looks a lot like a temporary error, i've seen similar things before",385
386,"[14:19] <pynki> Gerogies, where are you located?",14:19,pynki," Gerogies, where are you located?",386
387,[14:19] <Georgies> EU,14:19,Georgies, EU,387
388,[14:19] <pynki> i have these issues here in china alot,14:19,pynki, i have these issues here in china alot,388
389,[14:20] <Georgies> Oh. I see,14:20,Georgies, Oh. I see,389
390,[14:20] <pynki> free EU or some like UK?,14:20,pynki, free EU or some like UK?,390
391,[14:20] <pynki> as soon as they start tampering with conenctions....,14:20,pynki, as soon as they start tampering with conenctions....,391
392,[14:21] <Georgies> Oh you mean the government is trying to tamper with my connection?,14:21,Georgies, Oh you mean the government is trying to tamper with my connection?,392
393,[14:21] <Georgies> That's unlikely since its UK based,14:21,Georgies, That's unlikely since its UK based,393
394,[14:21] <Georgies> I wouldn't see why the UK would do that,14:21,Georgies, I wouldn't see why the UK would do that,394
395,[14:21] <compdoc> how would you know?,14:21,compdoc, how would you know?,395
396,[14:22] <Georgies> True,14:22,Georgies, True,396
397,[14:22] <Georgies> But they are communists,14:22,Georgies, But they are communists,397
398,[14:22] <Georgies> :>,14:22,Georgies,,398
399,[14:22] <ikonia> they would have to have a pretty good reason to do so,14:22,ikonia, they would have to have a pretty good reason to do so,399
400,[14:22] <Georgies> aren't*,14:22,Georgies, aren't*,400
401,"[14:22] <marcarrelus> ah, shame you guys are leaving :p",14:22,marcarrelus," ah, shame you guys are leaving :p",401
402,[14:22] <Georgies> Well we just host game servers,14:22,Georgies, Well we just host game servers,402
403,[14:22] <Georgies> so.,14:22,Georgies, so.,403
404,"[14:22] <ikonia> the UK has to have a certain level of approval to interact with someones internet, which is logged and recorded",14:22,ikonia," the UK has to have a certain level of approval to interact with someones internet, which is logged and recorded",404
405,"[14:22] <Georgies> Again, we do game servers",14:22,Georgies," Again, we do game servers",405
406,[14:22] <Georgies> Minecraft at that,14:22,Georgies, Minecraft at that,406
407,[14:23] <Georgies> I doubt the UK is interested in a Minecraft Network,14:23,Georgies, I doubt the UK is interested in a Minecraft Network,407
408,[14:23] <Georgies> Just sayn,14:23,Georgies, Just sayn,408
409,[14:23] <marcarrelus> national security is very important,14:23,marcarrelus, national security is very important,409
410,[14:23] <Georgies> xD,14:23,Georgies, xD,410
411,[14:23] <marcarrelus> terrorists organizing themself through minecraft are a known issue,14:23,marcarrelus, terrorists organizing themself through minecraft are a known issue,411
412,"[14:23] <Georgies> Totes agree with that, forgot Minecraft is a matter of National Security",14:23,Georgies," Totes agree with that, forgot Minecraft is a matter of National Security",412
413,[14:23] <mikhael_k33hl> EriC^^: got an error saying Grub failed to install at /target/,14:23,mikhael_k33hl, EriC^^: got an error saying Grub failed to install at /target/,413
414,"[14:23] <xplora1a> Georgies, can you get to launchpad.net with a browser?",14:23,xplora1a," Georgies, can you get to launchpad.net with a browser?",414
415,[14:23] <Georgies> You guy's are funny,14:23,Georgies, You guy's are funny,415
416,[14:23] <Georgies> Yes,14:23,Georgies, Yes,416
417,[14:24] <Georgies> On my local pc,14:24,Georgies, On my local pc,417
418,[14:24] <Georgies> Let me try curl,14:24,Georgies, Let me try curl,418
419,[14:24] <sansay> ##pagespeed,14:24,sansay, ##pagespeed,419
420,[14:24] <sansay> sorry about that,14:24,sansay, sorry about that,420
421,"[14:24] <Georgies> Great, curl isnt installed since it's a minimal server install",14:24,Georgies," Great, curl isnt installed since it's a minimal server install",421
422,[14:24] <Georgies> wget <3,14:24,Georgies, wget <3,422
423,[14:25] <Georgies> interesting,14:25,Georgies, interesting,423
424,[14:25] <Georgies> My host machine is altering it,14:25,Georgies, My host machine is altering it,424
425,[14:25] <Georgies> Sorry for your time,14:25,Georgies, Sorry for your time,425
426,[14:25] <Georgies> I figured it out,14:25,Georgies, I figured it out,426
427,[14:25] <Georgies> <_>,14:25,Georgies,,427
428,[14:25] <Georgies> lolz,14:25,Georgies, lolz,428
429,[14:26] <looq> hello,14:26,looq, hello,429
430,"[14:27] <xplora1a> Georgies, what was the problem?",14:27,xplora1a," Georgies, what was the problem?",430
431,"[14:31] <sansay> hey guys, after  compiling a binary from source how to i install it into nginx system?",14:31,sansay," hey guys, after  compiling a binary from source how to i install it into nginx system?",431
432,[14:31] <sansay> ubuntu system**,14:31,sansay, ubuntu system**,432
433,[14:31] <ikonia> install it into ?,14:31,ikonia, install it into ?,433
434,[14:31] <ikonia> nginx is a web server.....,14:31,ikonia, nginx is a web server.....,434
435,"[14:32] <pynki> what do you mean with ""install into""",14:32,pynki," what do you mean with ""install into""",435
436,[14:32] <marcarrelus> sansay: start with telling which kind of binary? is it a web service?,14:32,marcarrelus, sansay: start with telling which kind of binary? is it a web service?,436
437,"[14:32] <sansay> okay so i compiled nginx from source, and did make install",14:32,sansay," okay so i compiled nginx from source, and did make install",437
438,"[14:33] <sansay> when i type ""nginx"" in the command line it says you can install nginx using the following command",14:33,sansay," when i type ""nginx"" in the command line it says you can install nginx using the following command",438
439,[14:33] <sansay> The program 'nginx' can be found in the following packages:  * nginx-core,14:33,sansay, The program 'nginx' can be found in the following packages:  * nginx-core,439
440,[14:33] <marcarrelus> is there a specific reason that you would want to compile it from source?,14:33,marcarrelus, is there a specific reason that you would want to compile it from source?,440
441,[14:33] <pynki> ln -s /where/ever/it/is/installed/to/nginx /bin/nginx,14:33,pynki, ln -s /where/ever/it/is/installed/to/nginx /bin/nginx,441
442,[14:33] <sansay> ya i need to add pagespeed module to it,14:33,sansay, ya i need to add pagespeed module to it,442
443,[14:34] <sansay> ah,14:34,sansay, ah,443
444,[14:34] <sansay> any idea how to figure out where it installed,14:34,sansay, any idea how to figure out where it installed,444
445,[14:34] <ikonia> sansay: you compiled it - you should know where you put it,14:34,ikonia, sansay: you compiled it - you should know where you put it,445
446,[14:34] <pynki> apt-get install locate && updatedb && locate nginx,14:34,pynki, apt-get install locate && updatedb && locate nginx,446
447,[14:34] <ikonia> it really sounds like you shouldn't be doing this,14:34,ikonia, it really sounds like you shouldn't be doing this,447
448,"[14:34] <ikonia> no, that won't work",14:34,ikonia," no, that won't work",448
449,[14:34] <ikonia> it will only work if you've put it in the search path locations,14:34,ikonia, it will only work if you've put it in the search path locations,449
450,[14:34] <sansay> ah i see,14:34,sansay, ah i see,450
451,[14:35] <sansay> so it would be in the folder where it was compiled? in objs ?,14:35,sansay, so it would be in the folder where it was compiled? in objs ?,451
452,[14:35] <ikonia> sansay: depends on how you compiled it,14:35,ikonia, sansay: depends on how you compiled it,452
453,[14:35] <ikonia> sansay: have you actually looked if you can make the module you want work with the ubuntu install ?,14:35,ikonia, sansay: have you actually looked if you can make the module you want work with the ubuntu install ?,453
454,[14:35] <marcarrelus> sansay: just as a side-note. Apache can be much more convenient when plugins are needed. No need for manually compiling,14:35,marcarrelus, sansay: just as a side-note. Apache can be much more convenient when plugins are needed. No need for manually compiling,454
455,[14:36] <sansay> https://modpagespeed.com/doc/build_ngx_pagespeed_from_source,14:36,sansay, https://modpagespeed.com/doc/build_ngx_pagespeed_from_source,455
456,[14:36] <sansay> just from the official source seems thats how they do it,14:36,sansay, just from the official source seems thats how they do it,456
457,=== czesmir_ is now known as czesmir,,,,457
458,[14:36] <ikonia> sansay: it really sounds as if this isn't something you should be doing with your current understanding,14:36,ikonia, sansay: it really sounds as if this isn't something you should be doing with your current understanding,458
459,"[14:36] <Sparrow__> sansay, You know that nginx 1.10 ? is in our repos",14:36,Sparrow__," sansay, You know that nginx 1.10 ? is in our repos",459
460,"[14:37] <marcarrelus> Sparrow__, I guess he specifically wants this plugin.",14:37,marcarrelus," Sparrow__, I guess he specifically wants this plugin.",460
461,[14:37] <ikonia> sansay: I think the build options don't contain the modes he wants,14:37,ikonia, sansay: I think the build options don't contain the modes he wants,461
462,"[14:37] <sansay> ya i need pagespeed, otherwise i would install from the package manager",14:37,sansay," ya i need pagespeed, otherwise i would install from the package manager",462
463,[14:38] <sansay> is compiling from source that complicated that i shouldnt even bother?,14:38,sansay, is compiling from source that complicated that i shouldnt even bother?,463
464,"[14:38] <ioria> sansay, you can add that module also building the   official ubuntu source : https://www.howtoforge.com/tutorial/how-to-install-nginx-and-google-pagespeed-on-ubuntu-16-04/",14:38,ioria," sansay, you can add that module also building the   official ubuntu source : https://www.howtoforge.com/tutorial/how-to-install-nginx-and-google-pagespeed-on-ubuntu-16-04/",464
465,[14:38] <ikonia> sansay: I'd certainly question it with your current understanding,14:38,ikonia, sansay: I'd certainly question it with your current understanding,465
466,[14:40] <sansay> after i run make install is there a way to undo that?,14:40,sansay, after i run make install is there a way to undo that?,466
467,[14:40] <ikonia> some packages have make uninstall,14:40,ikonia, some packages have make uninstall,467
468,[14:40] <tezogmix> which version of ubuntu would you think would run ok for firefox browsing with some html5 (e.g. youtube) on an 32-bit intel core duo 1gb ram laptop?,14:40,tezogmix, which version of ubuntu would you think would run ok for firefox browsing with some html5 (e.g. youtube) on an 32-bit intel core duo 1gb ram laptop?,468
469,[14:40] <ikonia> tezogmix: xubuntu or lubuntu,14:40,ikonia, tezogmix: xubuntu or lubuntu,469
470,"[14:41] <sansay> ah ty, this one does not",14:41,sansay," ah ty, this one does not",470
471,[14:41] <pynki> https://www.howtoforge.com/tutorial/how-to-install-nginx-and-google-pagespeed-on-ubuntu-16-04/ maybe this way is better than,14:41,pynki, https://www.howtoforge.com/tutorial/how-to-install-nginx-and-google-pagespeed-on-ubuntu-16-04/ maybe this way is better than,471
472,"[14:41] <Sparrow__> tezogmix, 32 Bit... really",14:41,Sparrow__," tezogmix, 32 Bit... really",472
473,[14:41] <pynki> @sansay,14:41,pynki, @sansay,473
474,"[14:41] <sansay> thanks, im following that now",14:41,sansay," thanks, im following that now",474
475,[14:42] <sansay> do you know what will happen with the current rogue nginx install?,14:42,sansay, do you know what will happen with the current rogue nginx install?,475
476,[14:42] <pynki> it will idle until next reinstall,14:42,pynki, it will idle until next reinstall,476
477,[14:42] <sansay> kk,14:42,sansay, kk,477
478,[14:42] <pynki> perhaps catch some dust,14:42,pynki, perhaps catch some dust,478
479,"[14:42] <tezogmix> thanks ikonia , will either run alright from a 16gb usb drive for the above purpose with the max 4gb persistence enabled? like from the pendrivelinux/UUI? currently, the laptop only has 40gb hdd and has windows 7 on it.",14:42,tezogmix," thanks ikonia , will either run alright from a 16gb usb drive for the above purpose with the max 4gb persistence enabled? like from the pendrivelinux/UUI? currently, the laptop only has 40gb hdd and has windows 7 on it.",479
480,[14:42] <sansay> lol maybe ill wipe the server and start over after,14:42,sansay, lol maybe ill wipe the server and start over after,480
481,[14:42] <ioria> God knows,14:42,ioria, God knows,481
482,[14:42] <sansay> once i figure out how to get this setup proper,14:42,sansay, once i figure out how to get this setup proper,482
483,"[14:43] <ikonia> tezogmix: I personally don't like running from pendrives, so I'd give you an personal opinion rather than what you want",14:43,ikonia," tezogmix: I personally don't like running from pendrives, so I'd give you an personal opinion rather than what you want",483
484,"[14:44] <Sparrow__> ikonia, Do you know when we are losing 32 bit support. Soon I think.",14:44,Sparrow__," ikonia, Do you know when we are losing 32 bit support. Soon I think.",484
485,"[14:45] <ikonia> Sparrow__: I don't to be honest,",14:45,ikonia," Sparrow__: I don't to be honest,",485
486,"[14:45] <tezogmix> understand ikonia , wasn't using it to run any other software/downloading... Sparrow__ is that for all versions of ubuntu? rumored eta? Some of the LTS looks to be for a few more years.",14:45,tezogmix," understand ikonia , wasn't using it to run any other software/downloading... Sparrow__ is that for all versions of ubuntu? rumored eta? Some of the LTS looks to be for a few more years.",486
